,date,body,score
0,2019-11-30 20:09:05+00:00,"Se nao mandaram vc parar as poucos vc ja deveria estar na dose minima e ter pouco tempo de uso.  Senao teria sentido abstinencia tao severa quanto de heroina. 

Mesmo na dose minima um psiquiatra cauteloso receitaria para vc intercarlar doses. Nao espere isso no sus.

&amp;#x200B;

Algumas leituras:

[https://jornal.usp.br/atualidades/entenda-mais-sobre-a-sindrome-de-abstinencia-por-antidepressivos/](https://jornal.usp.br/atualidades/entenda-mais-sobre-a-sindrome-de-abstinencia-por-antidepressivos/)

\&gt;""Para evitar que o quadro se repita, é necessário que as doses diárias sejam diminuídas gradativamente no decorrer de quatro a seis semanas, até que a interrupção completa possa ser realizada com segurança.""

[https://gauchazh.clicrbs.com.br/saude/noticia/2018/04/a-severa-crise-de-abstinencia-que-pode-atingir-quem-para-de-tomar-antidepressivos-cjg5cbcmz015w01qlua8httbo.html](https://gauchazh.clicrbs.com.br/saude/noticia/2018/04/a-severa-crise-de-abstinencia-que-pode-atingir-quem-para-de-tomar-antidepressivos-cjg5cbcmz015w01qlua8httbo.html)

&amp;#x200B;

&amp;#x200B;

&amp;#x200B;

Quanto a antidepressivos nao serem heroina, isso eu nao sei dizer. Vc parece ter mais conhecimento sobre o assunto que eu. Atualmente sei que os SSRIs são muito usados em tratamentos de depressao logo sao os ""antidepressivos"" da moda. Mas quem sabe no futuro a opioides ganhem esse posto, ja estao estudando o assunto.

[https://www.nytimes.com/2016/06/05/opinion/sunday/are-opioids-the-next-antidepressant.html](https://www.nytimes.com/2016/06/05/opinion/sunday/are-opioids-the-next-antidepressant.html)

&amp;#x200B;

Falow!",1
1,2019-11-30 18:19:57+00:00,Dyprax &amp; Norphine - Don't Fear Death,1
2,2019-11-30 18:19:30+00:00,"Very true, pretty much anything that isn't coming straight from pharmacy to hand is potentially suspect.  Even good, reliable dealers can themselves be duped and accidentally distribute fentantyl-based counterfit pills (not even speaking of something like heroin that just looks like powder)

If you can't use testing strips or don't care all that much, a bioassay is the least you can do.  Take a tiny tiny amount, then a slightly bigger, and so on till you're satisfied you're reacting to the a dose of the substance as expected.  Really any new drug, even reliable ones, should be tested this way - a drug allergy can kill you just as easily as an OD (and usually in a far more painful way.)  Thankfully most allergies are rare, but these fake drugs sure aren't",1
3,2019-11-30 17:29:00+00:00,"I quit cold Turkey from taking oxycodon for 3 years, it was for back pain. Stay strong. I'm coming on close to a month free no desire to go back. I honestly feel better then I have then the 3 years I was on it.",1
4,2019-11-30 15:04:44+00:00,"Es un tema muy polémico, por eso en parte EEUU invadió Afganistan, sabia muy bien que el trabajo de los talibanes de erradicar la amapola estaba causando un estrago tremendo en la economía de los paises desarrollados (Afganistan produce cerca del 70% de la amapola de Asia y Europa siendo el principal proveedor de materia prima para la heroina del mundo). Los talibanes habian logrado erradicar los cultivos, hoy en dia triplicaron su producción.

Digo polémico porque lo que ellos producen destruye familias y personas, sus adictos jamas logran recuperarse completamente convirtiendose en esclavos de ese producto. Por otro lado, es innegable que hoy en día es el medio de sustento de decenas de miles de familias bolivianas, por eso Evo, por presión de los sindicatos, autorizó la quema de parte de la amazonia boliviana para incrementar las tierras de cultivo de coca. Es el mismo caso Colombiano, los pequeños agricultores migraron de sembrar papas y platanos a sembrar coca, lo que elevó su calidad de vida, pero las bandas del crimen organizado los están matando para tomar sus tierras. 

En conclusión, nada que provenga de la ilegalidad termina bien, si lo que produces causa destrucción y tristeza en la sociedad, atente a las consecuencias.",1
5,2019-11-30 09:25:51+00:00,"Yeah that was catalan, he shouted ""aneu enrere aneu enrere"" after the shots, it means ""go back go back"" (in plural).

Un Heroi",1
6,2019-11-30 02:20:01+00:00,"&gt; tem gente que morre de uma parada chamada ""cold turkey "" e que isso é o corpo morrendo por um choque súbito de ausência de heroína.

Cold Turkey nao eh um choque subto de ausencia de heroina. Cold Turkey é o ato de cessar abruptamente o consumo de uma droga.

Os resultados podem variar dependendo da substância e do tempo e frequencia com que ela foi consumida.

Por isso as doses de anti-depressivos vao sendo diminuidas ao longo de semanas quando o paciente encerra seu tratamento. Nenhum psiquiatra faria a la ""cold turkey"".",1
7,2019-11-30 01:44:30+00:00,"&gt; In alte tari se suge pula la greu si se vand copii pentru un sfert de gram de heroina.

Ce te face sa crezi ca aici nu se face?

Si ce ai cu suptul pulii?",1
8,2019-11-30 01:41:27+00:00,"In alte tari se suge pula la greu si se vand copii pentru un sfert de gram de heroina... da tie ti rusine ca la noi sarakimea bea alcool colorat pentru ca e mai ieftin fiind exemptat de la acciza timbru pe alcool.

Actrita Demi Moore o scos recent o carte in care povesteste cum masa dependenta de droguri o vanduto la unu sa futa pe 500 de dolari cand ea avea 15 ani :)

 Nu mai mancati atata cacat antiromanesc din import ca e penibil... Gunoiul uman de la noi e jucarie pe langa ce dospeste ""afara"".",1
9,2019-11-30 00:37:03+00:00,"Selling drugs online isn't harmful, unless you that one dutch guy who sent out fetanyl instead of cocaine and killed like 13 people in the US.",1
10,2019-11-30 00:35:21+00:00,"Buy the expensive ones with high bio availability, they absorb way better and dont make you shit your brains out haha.
Taking some immodium and eating tons of fiber works great if you want to up your dosages.
I am on oxycodon right now and took like 1500mg of magnesium today and didn’t have any uncomfortable bm related side effects like you would normally have at this dose of mag citrate. Idk if it’s placebo but I feel like the twitching improved. 

I wish i could relax for once :(",1
11,2019-11-30 00:15:42+00:00,Even without the fentynyl I know several people who relapsed after a long break and ODed their tolerance had gone down but they are using the same dose they used to.,1
12,2019-11-30 00:02:10+00:00,"para falar a verdade, nem sei se tem o que entender nesse filme

sua 'mensagem' é tão vaga que as pessoas podem encaixar o que quiserem nele

inclusive do palhaço psicopata ser um heroi",1
13,2019-11-29 22:50:04+00:00,Done that with Oxycotin and no coc,1
14,2019-11-29 20:11:41+00:00,"&gt; Social programs are long proven to be a net boon to everyone. To deny this is to deny facts

To what extent?

UBIs that keep getting cancelled because they create unemployment?

Or socialist breadlines?

&gt; Meth and heroin are later addition and affect all poor now, but I wouldn't say it equalizes to the level that all drug convictions fuel crime and affect black communities.

When the solution to the problem is ""don't do pot"" you aren't going to get me sympathetic. Don't do meth, heroin, cocaine, or fetanyl either.

&gt; This bisected walking routes in cities, making finding jobs more difficult and pushing black families out of formerly (more) reasonable city housing locations

Sounds more like a side effect than intentional government oppression. ""If we put the highway *here* it will make walking to the Krispy Kreme and k-mart harder! Mwahaha!""

&gt; If your elected officials aren't supporting direct action against these issues then they are supporting gun control

Why I love Trump: fix the economy, more jobs, lowered unemployment across all races",1
15,2019-11-29 18:24:52+00:00,"I don’t know if anyone feels that that they are evil, I mean even Hitler thought he was doing what was right. And had he won I’m sure that he would be viewed as a heroI think everyone wants to be the hero of their own story. For example Vlad the Impaler. Most people would see him as terrible or possibly evil  for the things he did, however in many parts of Romania he is to this day seen as a hero for his part in keeping the Ottoman Empire out of the kingdom of Wallachia.",1
16,2019-11-29 16:38:13+00:00,"Being a cop is just wrangling the random fetanyl-tards and handling the chimpouts of basketball americans.  Why the unemployed children of white middle class dorks hate them is a mystery to me, especially since communism is by definition totalitarian.",1
17,2019-11-29 14:22:00+00:00,"He sent aid to HK despite Chineese threats.

He declared trade war on China to weaken their economy.

He increased border security to prevent 50 tons of fentanol that China sent to US through Mexican border from wiping out US population.",1
18,2019-11-29 13:49:14+00:00,"Não tenho problemas com uma donzela virginal indefesa ou outra, ou outros clichês, se bem usados, mas o  Patrick Rothfuss cria um Gary Stu que faz todas as mulheres abaixarem as calcinhas assim que o veem, aí não dá.

É mais ou menos o msm problema do Espadachim de Carvão, o livro tem só duas mulheres, sendo q uma só existe pra ser é interesse romantico do protagonista e a outra pra ser salva pelo heroi (apesar de ser uma capitã pirata!), depois de ficar com os peitos de fora",1
19,2019-11-29 13:34:32+00:00,"I never knew that that was the distinction between legalization and decriminalization.

I think I favor decriminalization if that's the difference. Nobody needs a whole kilo of coke but if you have a little sniff here and there who cares.

The thing I struggle with is then like... How's this stuff get made? An ounce at a time, as needed? That won't cut it. You need your grow ops and government sanctioned naked crack kitchens to supply the stuff otherwise you wind up with ""Oops! All Fetanyl"".",1
20,2019-11-29 13:26:28+00:00,"&gt;tenia un laboratorio de heroina

Es curioso que esté en libertad entonces. Si eso era cierto, se le condenaría en su día y, si está en la calle, será que ya habrá pagado su pena.


&gt;la izquierda lameculos musulmana

Había oído llamar a la izquierda comunista, chavista o etarra, pero musulmana no. Misdieses por tu capacidad de reinventar la izquierda.

&gt;Se os van a comer con patatas los moros a los rojos.

Si la izquierda fuera musulmana, digo yo que no se los comerán con patatas, los auparan a hombros, no? En qué quedamos?

&gt;deberia estar en una carcel de Tanger y no en España habiendo cobrado 300.000 euros en ayudas

Según tu opinión. Y por qué no puede haber cobrado ayudas? Que los ha cobrado su fundación y no ella. El PP o Vox cobran por tener representación y no decimos que los cobra Casado o Abascal. Y de todas formas, si ha cumplido su pena, a priori debería volver a la sociedad con pleno derecho, no crees?

&gt;Que luego os quejais los rojos de que no hay dinero para vosotros. Normal.

Y la culpa es de los moros? Claro hombre",1
21,2019-11-29 12:59:21+00:00,O heroi é aquele que suja a espada de sangue,1
22,2019-11-29 11:32:00+00:00,"It’s not me who resigns him to relapse or determines it, but this thing is life or death and he’s far along enough in this to not need anyone to coddle him. I think any professional would argue he needs to be on a good high blocking dose for a while before even tapering to a lower dose, if at all, and then assess years down the road if coming off is a good idea

I can’t help but say it when i see it because I’ve been there and many of my friends have too and most are no longer alive...this reeks of imminent relapse. 28 days is the length of a trip to rehab and we all know how effective that is for a seasoned iv herojn addict. At least with a 28 day rehab you can be kept safe until you’re follow out of withdrawal and have your head on a little better. OP is setting himself up and I don’t think he needs to hear otherwise",1
23,2019-11-29 06:58:10+00:00,"Jajjaja no podemos saber que es la misma, la hija de puta tenia un laboratorio de heroina con su cuñado, los detienen y le mete tres tiros el cuñado por ajuste de cuentas. Pero ahora se convierte en un referente moral para la izquierda lameculos musulmana y hay que decir que no es. Se os van a comer con patatas los moros a los rojos. Esperemos que no nos hundais a todos con vosotros y vuestro buenrollismo mongoloide. Esa harpia deberia estar en una carcel de Tanger y no en España habiendo cobrado 300.000 euros en ayudas. Que luego os quejais los rojos de que no hay dinero para vosotros. Normal.",1
24,2019-11-28 23:50:08+00:00,"im from atl, if i went and was crying and screaming (like fr crying and shit) i'd get morphone where the hell you from",1
25,2019-11-28 23:22:50+00:00,lol im an orphin,1
26,2019-11-28 19:29:42+00:00,"I have no empathy for those who choose to purchase WMD's, guns without serial numbers, plan to purchase and distribute fetanyl, or fall for fake work plots to circumvent rules to get themselves ahead of those who agree on abiding by the laws. These aren't people fleeing violence or unstable homes, separated from their children, etc. These are people who circumvented laws to take money for themselves, masquerading as students.",1
27,2019-11-28 15:28:10+00:00,"Firstly, I should say that given that I’m not intimately acquainted with OP’s web app, it’s possible that a polymorphic relationship might not be the best, but I do feel like it would be worth exploring, hence why I mentioned it.

&amp;#x200B;

Thankfully it’s super simple to implement a polymorphic relationship in Laravel. The products table only needs two fields to make this work: products\_type and product\_id. Now, these columns do not be to named this way, and can be named anything, and the product\_id would be a  different column that the actual primary key. The product\_type would hold the model name of the specific product (say, 'App\\Strain') and the product\_id would be the actual primary key id of that product in the Strains table. That's all you need for the database side.

For the model side you would just implement a method that returns the relationship. For example, the Strains model would have a method that would return `$this-&gt;morphOne('App\Product', 'products')` and then you get access to the attributes of the products table as with any other relationship: 

`$strain-&gt;product-&gt;name` 

or

`$strain-&gt;product-&gt;price` 

assuming the relationship is named product.

You could even have getter methods on the strain models to make the code more understandable, and only query the relationship under the hood. Say

    
    public function getNameAttribute()
    {
        return $this-&gt;product-&gt;name;
    }
    
    /*Then somewhere else, like a controller*/
    
    $strain-&gt;name

The inverse of the relationship would simply use the morphTo method, rather than morphOne.

The Laravel documentation has a few more examples and explanations. I'll leave you with a link in case you are interested. [https://laravel.com/docs/6.x/eloquent-relationships#polymorphic-relationships](https://laravel.com/docs/6.x/eloquent-relationships#polymorphic-relationships)",1
28,2019-11-28 13:59:04+00:00,"So I actually read the article and if you would have I bet you would have not posted it.

Reading it, it makes a couple of assumptions.

1) that because men also want to care for children because of an increase of oxycotin, is a fallacy to assume it means that it has any bearing on instinct and maternal instinct.  The thought that you assumed that I was implying that a man doesn't care about his offspring is quite humorous to me. 

2) It actually confirms my position that women worked as part of a group through the vast majority of our history (tribal/huntergatherer) where the women were responsible for taking care of the children.  This is what I mean by being instinctual and natural aka reality for women.  

3) I also think in many ways were kind of agreeing and circling each other.  I think that women are instinctually and evolutionary bred to take care of children and have a immensely strong maternal instinct because they were bred that way through evolution over human history.

You're argument is that it is social construction because its what women have been doing throughout human history. I think its kind of a parrallel argument here, I think that it could be both to be honest.  Its evolutionary (supported throughout biology and the animal kingdom) but it could also be reinforced by social structure because it is the natural order of the human species.",1
29,2019-11-28 07:22:52+00:00,"My uncle Joe was a biker and he had died a few weeks earlier of a heroin/fetanyl overdose so the whole family came down from Vegas to Ohio to get together, cashing in on the guilt of uncle Joe's death. My grandma was a trainwreck. My mom had set up a shrine in the kitchen for her brother. It was his box of ashes along with his biker vest and bandana and gloves and shades. A few pictures and a beer. Grandma hardly left it the entire weekend she stayed with us. All she did was get blackout drunk and cry about her baby boy. Well, my brother Kevin and I came up with a plan. Kevin is about as close to looking like Uncle Joe as you can get without saying ""Spitting Image"". So, we had 4 or 5 hits of festival acid left from our trip to Nelson's Ledges that year, saving them up to look at this awesome Christmas Lights display in our town, but instead, we dosed Grandma. Bout an hour later she started tripping real fucking hard and Kevin put on all of Uncle Joe's stuff. He sat with Grandma and talked to her, and I'm telling you the truth when I say that she had no idea that he wasn't Uncle Joe. She let out every bit of pain and anguish she'd been feeling and Kevin just told her over and over ""It's okay Mom. It's not your fault. I'm safe and happy and I'm with Jesus now."" Shit like that. Well, it got bad around the time my parents woke up, because the acid was so strong that Grandma was still tripping balls come Thanksgiving morning. Left unattended she had tried to make the dinner all on her own and in every way possible she had ruined the food. It wasn't difficult for our parents to figure out that we had dosed Grandma. I was 22 at the time, and my dad was in his late 40's, but he beat the fuck out of me like I was 12. The cops ended up getting called and my aunt had to hide my grandma because nobody wanted any of us to go to jail. We were able to smooth it over and the cops left us with a warning, but my jaw was so sore that I couldn't eat. Dad cracked one of my ribs too, so breathing hurt like a bitch. Needless to say, it was a terrible Thanksgiving. Grandma woke up after a long nap and made us cinnamon sugar toast tho, so that was nice.",1
30,2019-11-28 05:55:10+00:00,Def talking about done not morphone,1
31,2019-11-28 04:26:11+00:00,"&gt; aflição que estou sentindo

Se você não tem um trabalho que lida com morte e sofrimento todo dia, acho que o choque e aflição são os sentimentos esperados. Mas fica tranquilo, OP. Se a polícia, ambulância ou bombeiros já estiverem no local, não há nada melhor que você pode fazer além de não se envolver em riscos (""pagar de heroi""). Nesses casos é melhor acionar a polícia/bombeiro e ir embora (a menos que você tenha sido o responsável pela morte).",1
32,2019-11-27 21:00:06+00:00,"porque ele é burro. por isso que a policia mata e morre pra caralho, porque gosta de fazer esse tipo de merda. por exemplo, invadir uma favela a troco de nada só com uma guarnição.

ai um cara desse morre e chamam de heroi. puta que pariu, ha um limite entre heroismo e burrice. ninguem é o superhomem",1
33,2019-11-27 19:44:39+00:00,Sip sip sippen on orphin tears,1
34,2019-11-27 18:52:39+00:00,"Vos decis BIA? Haaggh es exsctamente lo mismo que Soy Lune y antes de ella que Violeta.

Son todo lo mismo. Y encima el estereotipo que hace disney latinoamerica es horrible. La gordita con aptitudes siempre es timida y/o media insoportable. El androgino nunca es TAN androgino y es casi siempre Emo o Rebelde. La malvada es Rubia de ojos celestes hija de ricos. O morocha de ojos negros y ultra profesional fria y pragmatica.

La heroina resulta ser un ave de espiritu libre que quiere ser pintora/bailarina y Resulta que es ree buens cantante. Y aunqur la serie empieza con ella queriendo ser Hokage, termins siendo cantante en un campeonato de baile y/o canto.

Ni empezemos a hablsr de los secundarios.
El asistente imbecil chupamedias. El mayordomo/asistente personal/rol de servidumbre que se exaspera por todo y solo sirve para mostrar que hacer bien las cosas te deja imbecil.
Los padres que siemore son lo mismo.
Madre mala que oculta algo.
Padre ocupado que es medio imbecil por que no se da cuenta de nada y esta usando el telefono como si fuera 1992.
Abuelos buena onda medios locos.",1
35,2019-11-27 18:20:34+00:00,"Yeah, they were on to something. I am a Christian, so that definitely affects the way I view things. Not going to hide that. But sex is the most intimate and powerful and beautiful relational encounter between people that God created. And you're 100% right - overdoing and diluting its power is a big mistake. It's also very serious. Science has shown that your oxycotins merge with someone when you have sex - you'll never be able to 100% move on from that person if you have sex, and you want to be fully freed up to love your spouse. In the words of uncle Ben - ""with great power comes great responsibility."" Christians don't think sex is bad (unless they've gone pretty far away from the Bible) just that it's so powerful and beautiful that it needs to be safeguarded",1
36,2019-11-27 17:12:58+00:00,"vlw cara, eu nao ia conseguir fugir, eram 6 moleques de bike, eles iam me pegar de qualquer jeito

sempre que vc estiver numa situaçao assim, se for uma pessoa normal, nao tente dar uma de heroi, a vida real e diferente de um filme, a vida eh so uma",1
