,date,body,score
233,2019-06-16 00:59:21+00:00,"It should be free if we are allowed to grow our own.

&amp;#x200B;

The thought of these companies profiting from nature makes me feel sick, seeing as they have lobbied to keep natural medicines that the public have known about for centuries suppressed  in order to sell a daily pill over a one-time (or a few sessions) solution to major mental health issues like depression, addiction, anxiety, PTSD, denationalization type disorders etc.

&amp;#x200B;

Weed has always been harmless. The reports of psychosis are from people that have over done it, or more to the point, been buying strains that were too high THC to CBD ratio.

&amp;#x200B;

I used to really enjoy weed to relax, but that was 20 years ago. I stopped abruptly because I was buying from dealers who themselves didn't know what the hell they were buying. All the kids wanted to get 'monged out', couch locked and high as hell.. whereas I wanted a mellow unwind.

&amp;#x200B;

It would be years until I even knew was CBD was - its the other major component of weed that, while not psychoactive in itself, regulates the THC and balances out the crazy symptoms to make it more what weed should be.. 

&amp;#x200B;

But it was bred out to make room for more THC. In the end, I don't think thats what people wanted - a drug that feels like having your brain blown apart. 

&amp;#x200B;

I'd get back into it if it became legal in the UK and I could actually pick what strain I wanted.

&amp;#x200B;

As for shrooms.. without experience or a trip sitter/guide.. eating a bunch of hallucinogenic mushrooms without planning ahead or trying to go about your daily routine is utterly irresponsible and totally nuts. But from 4-6 hours as opposed to LSD's 12-24 hr trip, its much more manageable and a wonderful introuduction to the magic of it all. Dangerous? NOPE. Healthy - I've never felt better for the 2-3 weeks the afterglow of a wonderful, stimulating, visually gorgeous and inspiring trip left me feeling.

&amp;#x200B;

The first 10 minutes at the peak of the trip I was in tears that I couldn't share my experience with anyone or that \*this\* was deemed illegal because of how beautiful it all was. It made life come to life and I'll never forget that. Despite being the best thing I ever did, I had no desire to repeat it. It was like - this is enough, I've learned what I came for and I'd just be chasing what I already know.

&amp;#x200B;

Ketamine, while definitely more abused and way more complicated in terms of looking after someone losing their mind after doing a touch too much. I still feel that it had huge potential.. 

&amp;#x200B;

And what do you know.. instant treatment resistant depression cure.

&amp;#x200B;

Definitely one for supervision, but hey, lumping EVERY SINGLE drug that exists (or WILL EVER EXIST OR BE INVENTED) is an actual law that the UK passed in May 2016. Anything psychoactive (ie.. changes the way you feel) is now illegal.

&amp;#x200B;

Um.. what?

&amp;#x200B;

Nanny state much? And that law came about because of the whack-a-mole tactics they tried to play with the dealers inventing replacements for banned synthetic THC compounds that were safe to begin with, then evolved into Spice and actual addictive and dangerous version of it - so in order to stop harmless weed, which should be legal anyway, they created a worse problem, then in order to 'win' decided to use the nuclear option and ban everything.

&amp;#x200B;

How'd you think that turned out..

&amp;#x200B;

600% increase in emergency room visits the same weekend due to  turning everyone to street drugs to get their fix after creating Spice addicts and taking away everyones fix that they helped invent anyway.

&amp;#x200B;

The so-called War on Drugs  was lost over 100 years ago when prohibition was enforced. It didn't work then and it won't ever work. Banning alcohol.. see how well that worked. I mean - so many words and phrases we use today come from that era because of the profound impact it had on the world.. It also produced some of the wealthiest criminal gangs and individual crime lords of all time which also became the bloodiest ongoing street battles of all time.

&amp;#x200B;

It never stopped, its just shifted focus. With alcohol legal came the heroi nand cocaine markets and we all know the bigggeste guy in history. Escobar factored $20,000 a month for rubber bands to hold the stacks of cash together - and 10% of total yearly earnings that couldn't be saved as there was no way of getting it processed fast enough to avoid it either rotting or being eaten by rats. At his peak he was making $160,000,000 per day (no, that a typo) and he figured it was quicker and easier to just crash the plane smuggling the drugs and buy a new one instead of going through any more hassle.

&amp;#x200B;

All drug money flows out of whichever country it is siphoned from and not into the economy of these struggling countries - but into the pockets of usually one man. 

&amp;#x200B;

It's a complete violation and disruption to the entire system, yet somehow, that is preferable to legalizing smoking grass. .  


It's UTTER madness. These days you've got organised cartels that run entire countries on fear, intimidation and the promise money to the desperate. You've got deafly cuts like Fentanyl straight up murdering people because its cheaper to produce anything decent - where profit is the bottom like.

&amp;#x200B;

Sorry for the ranty history lesson.. its just that, if I don't put it into perspective, its all wrong. We should have the choice to excercise our free will over any substances - of ehich we are not truthfully educated about. It's all bad,  n",1
234,2019-06-16 00:05:36+00:00,"Como alguém já comentou aqui, não parece que o destaque da Globo ao VazaJato seja pífio, mas pelo contrário é praticamente a única que investe tudo (em todos meios do grupo) a por todos esforços em ""criminalizar"" o evento focando na vítima que o ""heroi"" passou a ser, e nenhuma criminalização do ""conluio"" e atos ilegais dos agentes da lei! Acho que a Globo sabe que está vulnerabilidade, e que têm que desacreditar o VazaJato, antes que os fatos que a podem por como sócia comecem a vazar! Por isto jogará um tudo ou nada, até mesmo se chegando mais ao Bozo, e aos heróis caídos, para não ficar super exposta, como seguramente deve estar no caso todo. Temo pelo Greenwald, pois já vimos que a Globo pode sair do caso da Fifa e a CBF, e também do desaparecimento do processo da dívida dela com o Estado... e nada aconteceu! 

Uma coisa interessante, e que até poderia merecer um Megathread aqui, seria ver como o que a Globo pauta a nível nacional, como repercute na imprensa local de cada sub-Redditors distribuídos no Brasil afora. Será que a narrativa vendida pela Globo prevalecerá, ou será inócua a ""propaganda"" da Globo, dessa vez? Quem viver verá!",2
235,2019-06-15 20:38:25+00:00,"/uj

First of all, this is r/drugscirclejerk.

Second of all, this post is supposed to showcase this kind of ""I TOTALLY get BLASTED off eating raw weed dude!"" shit.

Third of all, Xanax is hydrophobic, and snorting it *actually* does pretty much nothing. Gabapentin isn't very soluble in water either. It's soluble at 4490mg/L of water. Why don't you comment on that shit too?

Fourth of all, boofing an entire extended release oxycodone pill won't do anything. You gotta turn it into powder, preferably dissolved in water.

Fifth of all, intranasal Vyvanse does work. It's just not any more effective, faster onset, or more bioavailable than oral use (96.4% BA orally). It is hydrophilic, and can be absorbed through any mucus membranes.

The ""it isn't intranasally active, it only has effects if you use it orally"" myth is partially because this is somewhat true with some drugs, and partially because of the horrible, despicable behavior of the companies and government when it comes to the marketing.

Oral use makes the drug go right through the liver to metabolize the drug.

Edible weed/decarboxylated cannabis, when smoked, snorted, used bucally/sublingually, boofed, or absorbed through any other mucus membrane, will not be converted into 11-hydroxy-Δ9-Tetrahydrocannabinol, because it doesn't go right to the liver like foods and orally used drugs. 

Dextromethorphan (DXM) won't be converted into Dextrorphan (DXO) unless it goes through the liver (oral use). This is because it is metabolized in the liver.

However, Lisdexamphetamine (Vyvanse) is not just converted in the liver. It is metabolized into L-lysine + dextroamphetamine by protease enzymes in red blood cells using hydrolysis.

The myth of ""it can't be used intranasally"" comes from the dangerously misleading, downright deceitful, abusive, and manipulative marketing strategy.

The producers of Vyvanse did the same thing that the producers of morphones and codones did. 

They are marketing Vyvanse as some ""**abuse-resistant, only orally active, very effective, safe for young children, suitable for long-term use, unsnortable, PERFECT, NEW, NOVEL MOLECULE, NEVER SEEN BEFORE, WITH NEW, UNIQUE EFFECTS, VERY DIFFERENT FROM ANY OTHER ADHD MEDICATION, VERY SAFE, IMPOSSIBLE TO MISUSE, NON-DEPENDENCE-CAUSING, NON-ADDICTIVE COMPOUND!**"", when in reality it's literally just L-lysine plus Dextroamphetamine, which is then split into L-lysine and Dextroamphetamine by protease enzymes in red blood cells by hydrolysis.

They even try to hide the fact that it's an amphetamine. They say it's a new drug that has much different, much safer, much less recreational effects, when literally ALL of its effects come from the Dextroamphetamine it's converted into.

I wouldn't be surprised at all if there's a whole ""Vyvanse/Amphetamine epidemic"" soon, like the ""opioid epidemic"".

I'd just like to say ***THERE IS NOTHING WRONG WITH ANY OPIOIDS OR AMPHETAMINES! THE MARKETING IS THE PROBLEM HERE, AS WITH OXYCONTIN/OXYCODONE, VICODIN/HYDROCODONE, OPANA/OXYMORPHONE, AND  DILAUDID/HYDROMORPHONE!***

Opioids and amphetamines can be used very safely, but people are misled because of the bullshit claims the companies make.

I hope that the same shit that happened with the opioid ""crisis"" (people blaming the drugs instead of the companies) doesn't happen with Vyvanse and shit.

Vyvanse should be treated much like Dextroamphetamine, not like some ""abuse-resistant, non abusable drug, with just as effective potential but less euphoric and much safer than Adderall and Dexedrine!""

/j

UH yea you can doofus my cousin snort it all the time and he says the high is really good like and stuff like it's better and stronger, have u never snort anything???",1
236,2019-06-15 19:02:28+00:00,"Cămătari , contrabanda cu țigări, trafic de heroina",2
237,2019-06-15 18:33:08+00:00,obrigado pela critica e principalmente por continuar o trabalho de nosso heroi caido PepeHands,2
238,2019-06-15 18:26:32+00:00,"Agree. But the government needs something to attack and it can't be Marijuana anymore. So now they tally up heroin deaths and fetanyl deaths and say they're percocet deaths.. So then chronic pain patients can't get their meds cuz dRuGs. And yes people do abuse them, however chronic pain patients typically do no because they're scared they won't get their med refills if they do. Also, people abuse just about everything.. Soda, foods especially sugar, exercise, TV, internet etc. Why do pain patients have to suffer? I can't wait until our generation gets in office and shit goes libertarian.",1
239,2019-06-15 15:08:53+00:00,"So at my clinic they send the tests off to a lab, they don’t use dip sticks, and they say 99% of the time people only test for fetanyl, absolutely zero heroin. I haven’t seen any tar around here for years. I’m in Cincinnati by the way.",1
240,2019-06-15 08:04:16+00:00,Pda bolje nek krepa od heroina/cuge neg da zivi u istini.,2
241,2019-06-15 04:19:04+00:00,"Ah yes the gateway drug chart, I believe it goes:

Oreos → Applebee’s →Not using the serious tag → Cigarettes → Not using the serious tag → Alcohol → Not using the serious tag → Marijuana → Cheetos → Meth → Tide Pods → NASCAR → Florida → Beastiality → Necrophilia → Dancing with the Stars → Not using the serious tag → Live PD → Heroin → fentonyl → death",2
242,2019-06-14 23:24:10+00:00,"De poder decírselo podés, pero es como que le recomendes a alguien drogarse con heroina si sabe los riesgos que conlleva (o sea, un consejo de mierda porque puede tener consecuencias desastrosas). Sobre lo otro estas sacando una conclusión a partir de tu experiencia personal, la cual tiene pocas posibilidades de coincidir con la realidad (a no ser que hayas cogido con 16000 argentinas aproximadamente)",11
243,2019-06-14 22:30:08+00:00,"Because it is a very, very big part of todays society, and knowledge of it being spread literally saves lives. The difference between somebody dying as they're overdosing and not could be some shit I tell you. It is important to have knowledge of drugs of any kind. What about this. One day you have to get a surgery and your doctor prescribes you oxycotin. Do you not want to know what it is going to do to you? This is a very specific thing that is really useful to know. And you can't say ""thats different from this"" because it isn't chemically different from a lot of recreational opioids, infact it is a pretty common one itself. I have helped people from serious injurt just because I knew how to handle what they were on. I have detured people away from deadly combinations because I know what would happen. I have known people that took a drug 1 time and it changed their life and I know people that took many drugs and it changed their life in an entirely different way. Knowledge of what the pharmaceutical industry is doing to people under their noses is something that I want people to know about, along with a lot of the benefits of people not being ignorant to any sort of drug.",2
244,2019-06-14 18:59:35+00:00,"I’m saying they were told there had been a breakthrough in the medical science that allowed the manufacturer to create a product that had a much much much lower risk of addiction when taken regularly by patients. That information appeared to be backed up and confirmed by the FDA who approved the product for the manufacturer specified use. The approval from the FDA gave the doctors confidence to believe what the literature they’d been provided said. After all, this is the system in place for this very reason. The FDA approval is like a rubber stamp saying that the product does what it says. What is often forgotten is that it actually only means the product does it better than the placebo alternative would. However, that doesn’t negate the fact that it has shown to do what the manufacturer claims. 


This next part is entirely my opinion. While based on facts, I do not claim to know exactly what caused the opioid crisis or the true catalyst of it. 

The biggest problem, in my opinion, was that Perdue was able to get their product through the FDA in about 9 months, when most products take several years of study before approval. The short time spent in this process wouldn’t have allowed for accurate studies that would have shown the potential for addiction was clearly still there. A lot of the approval hung on the longer time release technology, which went from 4 hour to 12 hours and also the failure of the FDA to anticipate the craftiness of drug addicts.  They didn’t believe that people would crush and snort these pills. Why they thought that, I have no fucking idea. But at the start, they only placed a warning on the product to not crush and inject. It was the proliferation of insufflation that really allowed Oxycotin abuse to spread among the more casual users and fuel the fire that has resulted in the opioid crisis.",3
245,2019-06-14 17:41:16+00:00,"Yeah. I would say patenting is the main reason 

Just like they can take bupropion HCL and naltrexone HCL (both off patent) and repackage it as “contrave” a great new weight loss drug that’s $300+ without insurance 

They think they’re pretty slick at big pharma. Well actually they are. Fun fact: OxyContin was made bc the patent for MSContin (extended release morphine) was about to run out and Purdue needed another cash cow. 

Also, I thought the sugary part was so it would appeal to kids more (just guessing) like how when I was a kid I loved Advil bc it had a sugar coating 

Additionally, the sugar has an opposite effect on snorting it for me. I love the sugary drip of the Teva formula. I used to chew them even and kind of like it",1
246,2019-06-14 16:36:11+00:00,"Se por algum motivo ele estiver solto em 2022, ja sabemos quem vai ganhar.

Vai ser o heroi injusticado.",1
247,2019-06-14 16:33:53+00:00,"Ah, os quadrinhos de super-heroi nos anos 90...",3
248,2019-06-14 16:18:36+00:00,"I took oxycotin 20mg and got no euthoria. next day i snorted another 25mg and still none. was boring. even xans felt better

only effect I noticed was tiredness. why is this???",2
249,2019-06-14 15:49:01+00:00,"The most likely scenario is she had drugs, wanted to get high in the woods and oded. It notes she was into zoology and marine biology. The woods is a peaceful place to get high. I bet dollars to donuts there was some fentanol in that last hit.",7
250,2019-06-14 15:45:31+00:00,The fentonyl incident was within the last couple of months,2
251,2019-06-14 12:59:04+00:00,"A lot of good posts here describing the wide range of issues plaguing WV, lack of opportunities, brain drain, opioid crisis caused by oxycotin being pushed on coal miners and others, a topography that makes the area difficult to navigate and build infrastructure in, etc.  Generational poverty is a big thing, and hard for some people to overcome.  

&amp;#x200B;

I worked in the KY, OH, and WV tri-state area for a few years.  People who have the ability to achieve and overcome typically leave for better opportunities.  Family is the only thing that would keep them in the area, and while they could make a better living for themselves than most in the area, they could make a much better living elsewhere.   Kids who leave the area for college rarely look back.  I got my job experience working there, and moved away as soon as I could.  I have made some friends where I moved to who grew up in the area.  They like the area, but they couldn't be working as good a job as they have, or be doing as well if they had stayed.",1
252,2019-06-14 12:48:31+00:00,"The reason that there is so much restriction around the use of the word r*rals is that people so, so often go from fun to making opiod jokes. The reason that fentonyl got put in automod was an afternoon of 'funny jokes' about it.",1
253,2019-06-14 07:53:56+00:00,"It shouldn't affect the healing process itself but it can affect the pain reception. 
I shoot morphine pills, but this bigger ones 200 mg with wax within it. It's easier to prepare them, but it shouldn't be a big problem with 15 mg:
Crush pills in powder on the clean surface.
Prepare sterile needles, syringes, spoon etc.
Put powder on the spoon and pour water on it. 1 ml per 60 mg of morpine powdered pills.
Cook it up, but don't boil it, just slightly heat. 
Wait few minutes - the cooler the better for you. Draw it through your filters and bang it. Voila!:)

And for people who are gonna down vote me: I prefer tell him how to do it properly and reduce harm, because he will probably do it either way.",1
254,2019-06-14 04:49:07+00:00,"2 years ago I stole pills from a very good friend. 

&amp;#x200B;

There was no disconnection there, they hadn't passed away, they weren't someone I hardly new: they were my very alive close friend. and I didn't care about them at all in that moment, only the drugs they had and an opprotunity to steal them. Then whe confronted I tried to blame it on another good friend. I learned that I am capable of being a major piece of shit. 

&amp;#x200B;

I still live with deep regret and shame, and I lost many friends in our group because of what I did. People I still miss. 

&amp;#x200B;

but...there is a big but to my story, as there is a big but to yours  

&amp;#x200B;

You've seen where this path goes. Just as I did two years ago. You know that if you continue to deny the truth about your situation and disagree with the voice inside of your head saying ""enough"", you will end up alone, scared, and full of regret. If not dead or institutionalized. 

&amp;#x200B;

The path of cleanliness is not an easy one. I'm almost certain you will still struggle, most addicts do. It's easy to say ""enough"" after you've done (or thought) something you regret. In those moments it's \*easy\* to self actualize change. The struggle comes 6 months down the road, a year down the road, 5 years down the road. With the aid of time,  It's easy to forget what the addict inside of you is capable of.

&amp;#x200B;

What happens when you're at a new friends house, a year after this post and you notice an old bottle of perocet sitting on their bathroom sink? Surely it won't hurt anyone to take a few, it's expired,They're not gonna use it. Right? 

&amp;#x200B;

Wrong. You're hurting yourself. You're hurting your future relationships by setting this precedent. You're hurting the good deeds that you are capable of. 

&amp;#x200B;

This path you wish to follow requires strength, diligence, and a constant self awareness of the monster that is deep down in the both of us. Your tools to fight the monster is your community, your wonderful and creative human mind, those who love you, the beauty that surrounds us in this complicated and vivid world. Realize that, and equip yourself with it. 

&amp;#x200B;

Despite my warnings though, just remember that you got this. You have the power inside of you to make this change happen and realize the goodness inside of you. 

&amp;#x200B;

While this battle is not one meant to be fought alone, it starts with you.",7
255,2019-06-14 02:33:19+00:00,"I'm a teacher. 

How do we honestly expect adolescent human beings to sit still and listen to us when they won't listen to their parents, but instead to trashbags like Cari B, Logan Paul, and those goons who take fentynyl for fun and have garbage rap that seems to get the kids bumpin' and being all depressed?

It's a joke. 

We need to try harder as teachers. that's the best we can do.",3
256,2019-06-14 01:58:43+00:00,hes right fentayl killed lil peep,-1
257,2019-06-14 01:27:00+00:00,"It really just depends on the pharmacy. I work for a privately owned pharmacy and we are the contract pharmacy for 2 hospices so we always have a ton of pain medicines. And yes oxycodone (the stonger ingredient in perocet) is stronger than hydrocodone.

A lot of pharmacies will tell you they don't carry something because it causes less drama that just saying we won't fill this for you. I know in Texas a pharmacist can use their ""professional judgement"" to not fill a Rx. If we see you've been to multiple doctors for multiple opioids, we will just tell you we don't stock whatever it is.

The only thing I could imagine about your friend is there has been several different prescription medications across the whole spectrum of medications that there have been shortages on. It's an every day battle we have been fighting for the last year or so.",1
258,2019-06-14 01:26:36+00:00,"I was at my friend's house getting ready for a date. It was my first date in two years since leaving my abusive ex and needless to say my nerves were shot. Our mutual friend had set us up and we (me, me date, my friend, and,her boyfriend) were all going to go to a local autumn festival before going to a party being held at her brother's house. I ended up giving myself a migraine in the hours before my date from anxiety. Not wanting to cancel as it was my first time mustering the courage to go out again in so long, my friend (who has fibromyalgia) cut in half one of her oxycotins and gave it to me. Well, I found out the hard way that opiates and me don't mix. I ended up puking 8 times over the coarse of the day. But he, being an absolute gentleman, took great care of me and was very very understanding. He even went so far as to walk with me to a secluded spot and holding my hair back without the slightest complaint. We went out a few more times before mutually deciding we weren't right to be in a relationship but we still remained friends for quite some time. It was literally the most embarassing day of my life but it reminded me that there was still good people in the world, which was exactly what I needed at the time. :)",1
259,2019-06-14 00:03:04+00:00,"I just don't like hearing it called ""fentanol""",0
260,2019-06-13 23:22:42+00:00,"I dont have access to fetanyl, but id prolly do it if i could pal",1
261,2019-06-13 22:56:20+00:00,Apenas zerbit poderá salvalo do perigo.SERA QUE NOSSO HEROI VAI CONSEGUIR?,1
262,2019-06-13 09:04:38+00:00,"Nu e nebunia alegerilor, sunt in sevraj de la heroina",1
