,date,body,score
0,2019-06-30 18:57:09+00:00,"100 pills is not 100 scripts. 

My dad got prescribed morphine and oxycotin for nerve pain (after a botched surgery, but I digress) and he took probably close to 50 pills per day. 

Shit, the VA was FedExing morphine and oxy to our house. ""Dad's pills"" would be sitting between the storm and front doors when I would get home from school. I think the opioid epidemic could've started at my house...

He did that for some years until he couldn't do it anymore and kicked the opioids. Now he smokes weed to deal with the pain. Cannabis changed his life.",5
1,2019-06-30 18:35:33+00:00,I do flee markets on weekends from Boston to Maine even Antiq shops do good,1
2,2019-06-30 16:29:06+00:00,My heroi,1
3,2019-06-30 15:06:49+00:00,Yes and especially very common where I grew up at . The fentanayl has claimed countless people and is being added in coke &amp; heroin,1
4,2019-06-30 05:36:58+00:00,"Disagree that these are people we want. If they are unwilling to follow laws to get here then they are unwilling to follow laws once here. We do not owe amnesty and aid to every person who wants it, let alone criminals.

Remember ""bean lady""? She was on video (as you made the case for) and also the face of the recent caravan through Mexico.

Well, now she is in jail for assault with a deadly weapon: 
https://www.breitbart.com/border/2019/03/30/caravan-migrant-from-viral-video-arrested-on-assault-charges/

https://www.sinembargo.mx/30-03-2019/3558671

https://www.youtube.com/watch?v=SnKCnjSaQOw

""I want them integrated in our communities to bring a bit of that courage to all of us; in our military, for they will undoubtedly be the last to flee from a challenge"" - yet they can't even take on cartels or work within their government to change? Why are they not in their own military or police if this is the argument you're making? This is ludicrous on its face.

""and in our nation, for they certainly fight for the right to be free, and can undoubtedly be described as the brave. "" - based on what? We have actually seen the opposite here, especially in countries with high Muslim populations practicing Sharia law which is not compatible with US western values of free speech and expression:

https://www.pewforum.org/2013/04/30/the-worlds-muslims-religion-politics-society-overview/

See: ""there are some countries in which *substantial* minorities think violence against civilians is at least sometimes justified. This view is particularly widespread among Muslims in the Palestinian territories (40%), Afghanistan (39%), Egypt (29%) and Bangladesh (26%)."" - this is 1 in 4 or 2 in 5 depending. 

83% of Pakistanis support stoning adulterers 78% of Pakistanis support killing apostates http://www.realcourage.org/2009/08/pakistan-78-percent-call-for-apostate-deaths/

FPO (2014): 43% of Islamic teachers in Austria openly advocate Sharia law over democracy. http://rt.com/news/208387-austria-islam-kindergarten-muslim/

33% of Muslim-Americans say that Sharia should be supreme to the US Constitution (43% disagree). http://www.centerforsecuritypolicy.org/wp-content/uploads/2015/06/150612-CSP-Polling-Company-Nationwide-Online-Survey-of-Muslims-Topline-Poll-Data.pdf

The Polling Company CSP Poll (2015): 51% of Muslim-Americans say that Muslims should have the choice of being judged by Sharia courts rather than courts of the United States (39% disagree). 

http://www.centerforsecuritypolicy.org/wp-content/uploads/2015/06/150612-CSP-Polling-Company-Nationwide-Online-Survey-of-Muslims-Topline-Poll-Data.pdf

So no, not every person fleeing a country is automatically a good person either - there's no way of knowing if they are trying to get in and create an attack, and without tracking them we can't tell their background until it is too late.

""Disease they have proven resilient to, over the march of several months, though I can't think of anywhere better to go than the US if they are intent of treating a disease."" - it's not them I am worried about, I am worried about our US citizens. They are the host and carrying the diseases. This is letting in a trojan horse. Are you not aware that typhus, typhoid and other diseases thought to be wiped out in the middle ages have been returning to major cities brought through unchecked illegal immigration?

https://www.cdc.gov/plague/maps/index.html &lt; where most of illegal immigration occurs (liberal areas) have plague outbreaks

https://www.independentsentinel.com/lapd-officers-get-typhus-in-dem-run-medieval-california/

https://komonews.com/news/local/paradise-lost-homeless-in-los-angeles

""Crime is more profitable than that, they can drive into the nation under the bed of an F150, those drugs aren't going to wait for years of processing, they have addictions to feed now."" - I'm not sure what you're arguing for here. Are you saying this is a good thing? The opioid crisis affects real people and real Americans who are dying at record high rates. Additionally, a grain of phentanol can kill you and enough in the water supply can kill a city: 

https://www.illegalaliencrimereport.com/illegal-alien-caught-with-enough-fentanyl-to-kill-one-million-people/

https://www.witn.com/video?vid=509238742

https://www.breitbart.com/border/2019/06/17/mexican-feds-dea-raid-industrial-scale-fentanyl-lab-in-border-state/

There's a thousand more stories I can post of this but my point is that with unchecked illegal immigrants coming in (yes, mainly through Mexico) there's no way to know what they are bringing whether tons of drugs that can hook and kill millions or diseases. There's a reason for checkpoints and for inspections to protect our citizens and legal immigrants who came here following the laws.

Again, why do we care more about people coming here illegally and willing to break our laws rather than our own citizens who need help? 

I'm glad that we are at least both willing to agree that our country is awesome enough that people are trying to get here, however, and that you're not just calling the USA an evil country.

Not sure if either of our minds will be changed. 
I used to be a liberal but the more I looked into policies I realized that results matter much more than feeling good but being ineffective.",1
5,2019-06-30 04:40:05+00:00,"I let my wife know exactly what I was when we met. Fortunately. 

Unfortunately, I didn’t ever tell her how bad things were though. That was a mistake.

She thought I was a MScontin 30 every now and then. Not 6 times a day. I tell my wife now when I take “Junk Jubilee”. She gives me the money, and holds the pills to keep me in check. Timelock safes are awesome. 

We are both prescribed LARGE benzos scripts as well, including a couple legitimate scripts for pain. I never mix anymore because the goal is to live to get high another day. Hence, timelock safe. A junkies best friend/worst enemy.",1
6,2019-06-30 04:32:49+00:00,Fetanyl is what people use to lace drugs to incapacitate or kill someone one most of the time known as drugging someone for sex(Cosby),0
7,2019-06-30 03:57:49+00:00,I see an addiction therapist and she said that there has definitely been weed laced with Fetanyl.  Some people (dealers) are really stupid and don’t think it all the way through and just think they’re making their shit stronger or better or something?,1
8,2019-06-30 03:31:58+00:00,"I take those and pour the beads out on my tray (I love my glass plate tapered up at the ends) and fold em between a piece of copy paper, get em all into the crease, and rub em with the flat part of my knife until the crunching stops. 

The next part is important. Youll have a powder mix plus plastic shells, you wanna kinda play with the powder until you can scrape away most of the containment beads. Eat those, blow away at the rest! 

Same technique as Adderall/Focalin/Dexedrine XR etc.

Happy and safe nods! Those are far superior to MSContin.",3
9,2019-06-30 02:17:00+00:00,I would love to try this.  I've been on Morhine for over thirty years and to think something natural might take my pain away is almost unbelieveble.  My pain management agreement would not allow me to try this without running the risk of losing my morphine.,1
10,2019-06-30 02:15:27+00:00,The Curries and Rices will have some incel problems: Mayos will get some breathing room from all of them sex patting for bobs and vagene. Think we're good until the ice caps melt and we're forced to migrate to fentayl lands.,9
11,2019-06-30 00:42:53+00:00,Yeah it’s dramatized fetanyl is definitely a reach but can’t say I’ve never seen the second one but it’s probably not normal to see it as the show portrayed it oh and let’s not forget Nate nearly killing somebody and no one knowing probably unlikely,1
12,2019-06-29 21:34:36+00:00,"The nobles in Erid Dania are split between Athairi and Danian lineages (though there's been a lot of intermarrying over the centuries, particularly amongst the nobility where such marriages have political advantage, so in some ways the distinction is almost moot amongst the nobles--which chauvinists on either side would undoubtedly point out). The nominally Athairi lineages hold An-Athair, Har An-Athair, Dain An-Athair, Heer, and Abeuth; Danian lineages hold Erid More, Uthmark, and Blackstone (and the Erid Kingship, along with the city of Westmark, which is mostly Danian); so they are about even, with an edge going to the Danians with the royal seat. Orphin, the so-called Bull of An-Athair, could be considered the unofficial ""king"" of the Athairi, a sort of first-among-equals sort of thing; he's the guy the Athairi lords and knights look to first to set the tone and a response. There is certainly some occasional tension between the two peoples, much of it centered on the question of practicing the Old Religion, but the Erid King, Eolred, has been careful to cultivate the Athairi lords as loyal vassals and has signaled to his Patriarch and the temple hierarchy that he is not interested in enforcing Divine King laws regarding idolatry and heresy. The closest recent breaking point was during the witch burnings that claimed Artesia's mother, when the Athairi lords felt King Eolred did not sufficiently protest the actions of Inquisitors from Therapoli (who led the witch burnings) to the High King and the Patriarch of Therapoli (the Patriarch of Erid Dania also came in for considerable criticism for lending some aid to the Therapolites in seeming defiance of the Erid King's preferences). But that has dropped to a simmer in the years since. Under normal circumstances discreet worship of the Old Religion is tolerated (in the woods it's pretty open). Some of this was covered in the Witch's Price adventure in the RPG (look for the side bar ""Orresto's Suspicions"" which describes an exception to that general rule, in the High Priest Efruse and his agents, who work to uncover and punish worshippers of the Old Religion). Under normal circumstances Eolred is far more likely to have problems with the city of Westmark, which routinely exerts its prerogatives as a Free City in defiance of his requests for taxes, than he does with the Athairi lords.",3
13,2019-06-29 21:13:52+00:00,"&gt; doctors scarcely give out pain killers stronger than Ibuprofen.

Well, there's good reason for that and it's the opioid crisis.   
Personally though I'm in constant pain (always somewhere, legs, back, head) since I was a child.. I've had oxycotin for my wisdom teeth extraction and it did nothing for the pain (though it made me feel-good enough to ignore it)",1
14,2019-06-29 21:02:12+00:00," Pressionado pela [divulgação de mensagens da época em que atuava na Operação Lava Jato](https://www1.folha.uol.com.br/poder/2019/06/entenda-vazamento-de-conversa-entre-moro-e-deltan-e-impacto-para-a-lava-jato.shtml), o ministro Sergio Moro (Justiça) recebeu afago do governador João Doria (PSDB), que [entregou a ele a principal honraria do estado de São Paulo](https://www1.folha.uol.com.br/poder/2019/06/moro-reclama-de-ataques-e-fala-em-revanchismo-ao-receber-premio-de-doria.shtml) nesta sexta-feira (28).

 Ao receber a Ordem do Mérito, o ex-juiz reclamou dos ""vários ataques"" que vem sofrendo e criticou ""um certo revanchismo"", referindo-se aos questionamentos à sua imparcialidade no julgamento de processos como o do ex-presidente Lula (PT).

 O gesto de Doria contrasta com a postura ambígua do presidente Jair Bolsonaro (PSL), que [demorou quatro dias para se pronunciar em defesa de Moro](https://www1.folha.uol.com.br/poder/2019/06/bolsonaro-quebra-silencio-sobre-moro-minimiza-mensagens-e-diz-que-legado-dele-nao-tem-preco.shtml) quando as primeiras mensagens foram publicadas e, depois, [disse que ""não existe confiança 100%""](https://www1.folha.uol.com.br/poder/2019/06/nao-existe-confianca-100-afirma-bolsonaro-sobre-moro.shtml).

 O tucano [é apontado como candidato à Presidência em 2022](https://www1.folha.uol.com.br/poder/2019/03/por-2022-doria-aposta-em-estilo-mais-discreto-em-comeco-de-governo.shtml), condição que foi reforçada nos últimos dias por declarações do atual ocupante do Planalto. Na cerimônia desta sexta, o governador não mencionou Bolsonaro, encerrando uma semana de desgaste na relação dos dois, por causa do[ imbróglio sobre a possível saída da Fórmula 1 de São Paulo](https://www1.folha.uol.com.br/esporte/2019/06/entenda-a-disputa-entre-rio-de-janeiro-e-sao-paulo-pela-f-1.shtml).

 Durante seu discurso no Palácio dos Bandeirantes, Moro classificou como ""um falso escândalo"" o episódio das [mensagens divulgadas inicialmente pelo site The Intercept Brasil](https://www1.folha.uol.com.br/poder/2019/06/site-publica-mensagens-que-mostram-colaboracao-entre-moro-e-deltan-na-lava-jato.shtml). As conversas mostram proximidade entre o então juiz e procuradores do Ministério Público Federal que integravam a força-tarefa.

 Ele agradeceu à mulher, [Rosangela Moro](https://www1.folha.uol.com.br/poder/2017/12/1942120-mulher-de-moro-conta-com-ajuda-do-juiz-em-projeto-a-favor-de-apaes.shtml), que o acompanhava na solenidade, pelo suporte ao longo do período em que atuou na operação e agora, como ministro. ""Não tem sido muito fácil"", desabafou.

 ""Nas últimas três semanas, [tenho sofrido vários ataques](https://www1.folha.uol.com.br/poder/2019/06/associacao-de-juizes-arquiva-representacao-que-pedia-exclusao-de-moro.shtml). Achei que a Operação Lava Jato tinha ficado para trás, mas um certo revanchismo às vezes reaparece"", disse o ministro, aludindo às conversas que vieram à tona em 9 de junho.

 Em sua fala, o membro da equipe de Bolsonaro também expressou gratidão ao presidente e afirmou que o superior ""tem prestado o seu apoio"" desde o início da crise provocada pelos vazamentos. Bolsonaro [repete que o ex-juiz é um patrimônio nacional](https://www1.folha.uol.com.br/poder/2019/06/bolsonaro-diz-que-moro-e-patrimonio-nacional-e-que-nao-viu-nada-anormal-em-mensagens.shtml).

 Cercado de membros do governo e parlamentares, Doria usou o evento para exaltar Moro como símbolo do combate à corrupção, agradeceu pela contribuição dele na [transferência de líderes do PCC (Primeiro Comando da Capital) para presídios federais](https://www1.folha.uol.com.br/cotidiano/2019/02/transferencia-de-presos-do-pcc-inclui-medidas-para-evitar-reacao-diz-doria.shtml) —a justificativa oficial para a homenagem— e atacou Lula.

 ""O Brasil precisa de mais Moros e menos Lulas"", discursou Doria, sob aplausos.

 Doria anunciou a intenção de dar a medalha a Moro no dia 14, [durante um jantar em sua homenagem no Rio de Janeiro](https://www1.folha.uol.com.br/poder/2019/06/reduto-da-campanha-de-bolsonaro-vira-palanque-presidencial-para-doria.shtml). A decisão foi oficializada em um decreto assinado por ele três dias depois.

 Provável candidato à sucessão de Bolsonaro, o governador se apressou em fazer um aceno a Moro para reforçar o elo com seus potenciais eleitores em uma disputa nacional, na avaliação de aliados do tucano ouvidos pela **Folha**.

 O entendimento é o de que o apoiador de Doria é fundamentalmente antipetista e, por consequência, favorável ao [trabalho de Moro e da Lava Jato](https://www1.folha.uol.com.br/poder/2019/06/dialogos-entre-moro-e-lava-jato-tem-caminho-improvavel-para-autenticidade-entenda.shtml). Desde quando era prefeito da capital, o tucano busca antagonizar com o PT.

 Outro possível ganho embutido na aproximação é a nacionalização de sua imagem, lembram correligionários do tucano. Estar bem na foto com aquele que [detém a aura de herói](https://www1.folha.uol.com.br/colunas/nelsondesa/2019/06/no-centro-de-escandalo-moro-vira-heroi-entre-aspas-para-wp.shtml) para uma parcela dos brasileiros pode se reverter em voto lá na frente.

 A tentativa de expandir sua imagem, ampliando a influência para além das fronteiras paulistas, pôde ser vista também no discurso que Doria fez ao entregar a comenda a Moro. Mais de uma vez, ele fez referência em sua fala ""aos brasileiros de São Paulo"".

 Tanto aliados quanto opositores não tiveram dúvida de que o gesto desta sexta é parte do cálculo político do tucano de olho em 2022. Ele frisou que a decisão foi um agradecimento a Moro pela parceria no episódio do PCC e um reconhecimento ao trabalho dele no combate ao crime.

 Publicamente, Doria desconversa quando questionado sobre o plano de tentar a Presidência.

 Nos últimos dias, Bolsonaro contribuiu para antecipar o calendário da sucessão. Ele [afirmou não descartar disputar a reeleição](https://www1.folha.uol.com.br/poder/2019/06/la-na-frente-todos-votarao-em-mim-diz-bolsonaro-ao-indicar-disputa-pela-reeleicao.shtml) e passou a [dizer abertamente que vê Doria como candidato](https://www1.folha.uol.com.br/esporte/2019/06/bolsonaro-diz-que-ha-99-chance-de-f-1-ir-para-o-rio-de-janeiro.shtml).

 Uma dessas manifestações foi feita em meio ao debate sobre a migração do GP Brasil de F-1 para o Rio, ideia que desagrada ao governador paulista.

 Doria [reagiu com ironia à fala do presidente](https://www1.folha.uol.com.br/esporte/2019/06/doria-ironiza-f-1-no-rio-e-diz-so-de-cavalo-se-chega-a-deodoro.shtml) de que havia 99% de chances de a prova ser transferida para o Rio. Disse que ""só a cavalo"" é possível chegar a Deodoro, circuito que passaria a sediar a prova.

 Pessoas próximas ao tucano minimizam o impacto da rusga e dizem que o estresse entre os dois é momentâneo, por envolver uma disputa na qual ambos estão empenhados. Ninguém arrisca palpite, contudo, sobre o prazo de validade da [dobradinha ""BolsoDoria""](https://www1.folha.uol.com.br/poder/2018/10/dobradinha-bolsodoria-impulsiona-vitoria-de-tucano-no-governo-de-sp.shtml), que pautou o segundo turno de 2018 no estado.

 ### PT na mira

 Moro foi admitido no grau de grã-cruz (o mais elevado) da [Ordem do Ipiranga, honraria que foi criada em 1969](https://www1.folha.uol.com.br/poder/2019/06/doria-dara-a-moro-medalha-que-ja-foi-entregue-a-citados-na-lava-jato.shtml). O título é usado por ocupantes do Bandeirantes para reverenciar artistas, políticos, empresários e personalidades que tenham prestado ""serviços de excepcional relevância"" ao estado e ao Brasil.

 Moro recebeu a faixa e a medalha que simbolizam o prêmio e posou para imagens segurando a mão do governador.

 Deputados do PT na Assembleia Legislativa [entraram com um projeto para tentar cassar a homenagem](https://painel.blogfolha.uol.com.br/2019/06/28/pt-quer-cassar-medalha-entregue-por-doria-a-moro/), argumentando que a condecoração a Moro não se encaixa nas regras previstas para a concessão da honraria. O pedido ainda não foi votado.

 Durante o evento desta sexta, Doria disparou várias vezes contra o partido do ex-presidente Lula.

 ""Não foi uma batalha pessoal de um contra o outro. Se houve uma causa na prisão de Lula, foi a causa da verdade contra a mentira. E, para o bem do Brasil, venceu a verdade, venceu o Brasil, venceu Sergio Moro"", disse.

 ""Se não fosse este homem, liderando um grupo de patriotas, com juízes, com desembargadores, com promotores, nós não teríamos a Lava Jato no Brasil, e não teríamos trancafiados em prisões aqueles que usurparam, roubaram e enganaram os brasileiros"", afirmou o governador.

 Ele disse também que ""o início de um esquema criminoso começou em São Paulo"" e recordou, sem citar Lula, que ""o tríplex"" e ""o sítio"" ficam no estado. O ex-presidente [foi condenado em processos relacionados aos dois imóveis, em Guarujá e em Atibaia](https://www1.folha.uol.com.br/poder/2019/02/alem-do-caso-do-sitio-lula-e-reu-em-outras-7-acoes-penais.shtml).

 ""Graças à Lava Jato, o Brasil está recuperando mais de R$ 13 bilhões desviados pela corrupção de governos petistas, de corrupção de governos do PT. É preciso deixar claro e consignado que foram governos petistas que contribuíram para assaltar os cofres públicos e roubar a consciência de brasileiros"", afirmou Doria.",1
15,2019-06-29 19:48:06+00:00,"You can give people  a few different drugs that make them more open to suggestion and let down their guard just enough to say something they shouldn't have. It won't work in this case like you said though, only in interrogation environments.

Alcohol has probably been used to trick people since day one of getting drunk. Morphene has been used, opiates make most people pretty stupid/suggestable. Theres also LSD but that still leaves some people too stimulated to slip, some people can remain lucid on doses so high they can't see straight.  Its a not a stimulant but it definitely does the opposite of make you groggy.
What you really want is a tranquilizer, specifically a dopamine antagonist like quetiapine. You can take high doses of this and be conscious the whole time but your cognitive ability is like fax machine at that point and you can't really move. So theres no truth serum to be sure but when administered alongside regular torture sessions you can accomplish a goal. 

Lol without getting too into whether or not this kind of interrogation is effective in the first place, from personal experience, it is very difficult to empathize with someone in order to tell then what they want to hear.",2
16,2019-06-29 19:41:10+00:00,"Too many psyches to list

Too many benzos to list

Hydrocodone, oxycodone, codeine, morhine, heroin, all of it

Weed, dxm, ketamine, nitrous, meth and friends, ect",1
17,2019-06-29 18:05:46+00:00,"Its also the same sex hormone that causes pleasure and a woman to give birth which is why during sec if a woman experiences too much pleasure they can get contractions, as oxycotin is the hormone that triggers that.

Ancient Egyptians used honey and yogurt as a way to kill sperm and it’s just as effective as modern day medicine given that mixing that together creates a chemical reaction that makes lactic acid, the hormone that makes breast milk, however in modern medicine lactic acid is used as a spermicide. Most sperm die from either mucus lining in the womans cagina or the acidic climate and others just get lost. Even then on average only about 4% of sperm can actually swim in the first place. The rest are all malformed duds. Men can get a sperm count which can determine if they are infertile or not (basically the higher the percentage the more fertile they are). However given pee is also highly acidic, it can also be used as a spermicide. Pee is actually sterile which is why when you puss in cups at the hospital you don’t have to sterilize. The reason pee is sterile is because ABSOLUTELY NOTHING can survive there. So for an unethical pro life tip you can piss in a girl if you forgot your condom to not get her pregnant. r/UPLT",6
18,2019-06-29 17:10:02+00:00,Desse jeito vai ser promovido a heroi nacional!,1
19,2019-06-29 16:24:16+00:00,Yeah make sure you know the dealer because fetanyl is some nasty shit,2
20,2019-06-29 16:21:14+00:00,que nao é heroi.,1
21,2019-06-29 14:28:15+00:00,"Ok so after giving it some thought I would keep:

1) **One broad-spectrum antibiotic for controlled use in hospitals only** (to reduce chance of bacteria developing resistance). Without antibiotics our death rates would skyrocket

&amp;#x200B;

2) **Ketamine because it's a very safe anesthetic** which, unlike (basically) all others, doesn't cause respiratory depression and bloodpressure to drop. It's actually used in almost all age categories due to this safety profile, and it's a major medication in warzones because you can put someone to sleep without the need of a respiratory machine. Also there have been good results of ketamine in the treatment of depression. 

&amp;#x200B;

3) **Oxycodon** (+ acetaminophen, is a combination pill allowed?) because of combatting pain in a home setting

4) **A group of antidepressive medications**, for which I have to go with **SSRI's** since that's often the first step and can be used in multiple disorders like:

\-Depression

\-Generalized anxiety disorder

\-Obsessive-compulsive disorder

\-Eating disorders

\-Stroke recovery

\-Premature ejaculation (ejaculatio praecox)

&amp;#x200B;

5) **Benzodiazepine like Diazepam** for anti-anxiety, sedation for patients in respiratory distress, use in agitated patients or for example to stop an ongoing epileptic state. Also to combat alcohol withdrawal (delirium tremens).

&amp;#x200B;

&amp;#x200B;

Recreational drugs:

1) **MDMA** because it's amazing if you do it at a special event like a big rave. Makes you MDMA-ble to shine!

2) An **amphetamine** for productivity (or atleast keep caffeïne)

3) **Weed** because it's fun and has some health benefits aswell in a lot of situations

4) **Alcohol** because I love me a nice beer on a hot day or a glass of wine at a nice dinner

5) Some **psychedelic** because it's a very unique and sometimes insightful experience.",2
