,date,body,score
60,2019-11-25 20:50:48+00:00,"&gt;Stupid Shinmy is intended.

Since she planned out the whole thing by herself, it's hard to see her as being that stupid. Of course, she did ask for Seija to help, and Okina was giving it a push, but she's still the mastermind here.

&gt;I think that the whole ISC thing was not so serious in the end. If they had truly wanted to capture such a large threat they wouldn't have used spell cards.

The fact still is that people care enough about trying to capture Seija (even if it's just for the bounty), and actively try to capture her; and it is still true that banned spell cards were allowed. They care enough about capturing Seija before, for whatever reason even if it's just the bounty, then why not now?

&gt;Eirin was an attendee to the firework festival, not a planner. How was she going to know ahead of time that Shinmy and her gang were going to ruin it? Even if she did know, would she stop such trouble on her volition?

The event planners (Reimu and co.) didn't know either. However, Shinmyoumaru were sending out a lot of invitation (or just talk to a lot of people) in advace, so while her plans might be a bit underground, it's not exactly in secret. It's not hard to see how either Yukari or Eirin would have got wind of it. Yukari had her spies and not to mention she's extremely likely to be on the look out for problems in general, and she also believed that the moon had spies too. I think it's much more likely that Yukari got wind of it early and ask Eirin for help, because of the communication problem below...

&gt;Yukari could have almost instantaneously communicated with Eirin directly or indirectly through her gaps. The letter to the moon is stated to have been explicitly delivered to Sagume by a youkai (either Ran or Yukari herself), so it was not sent days or weeks in advance.

The problem is, passage to the moon is difficult. The Lunarian know about the Kaian passage and do have problems with earthling impurity, so that one should be under strict guard. Yukari's gap need specific condition to work, and that still doesn't let you into the capital. Unless it's a Lunarian approved personnel, it should be very difficult to get in. Youkai is especially easy to detect due to their impurity, so it's not like they can just sneak in. And why would it be a youkai who bear the letter? If Sagume frequently visit earth enough, she could have established a more secure communication channel with Eirin, perhaps using a letter bearer that had been approved somehow using some other pretext that let them come to earth; and that approved letter bearer is not going to be a youkai. This indicates that Eirin lack any fast and easy communication with Sagume. And why not use those wave-based technology for communication but letter? That must mean the Lunarian do monitor those form of communication and that they would have problems with Sagume contacting Eirin, so Sagume can't just use them for contact.

Then you have to consider Sagume's motivation. Why would she acted on it right away, when she doesn't even know what's going on? She would have taken time to mull it over. And let's say she decided right away, she still need to somehow get an excuse to just visit earth. She couldn't have been visited earth regularly as part of her official duty (see: communication channel above), so maybe she had some duty that require her to come to earth occasionally, which mean she would still need to make up some excuse to go. And then she need to ditch her escort somehow, or maybe they're in the know; but it's hard to believe they are just common moon rabbits who are known to gossip, too risky. All of that, in a matter of minutes to hours, with all that risks, to do something she didn't even understand (at the time). Then there might be a need to send back a confirmation that she would come (since they knew Sagume is coming). Add in all that, and that means the whole things must have taken days. They definitely knew it in advance.

Then next is Eirin's motivation. For some very small incidence like this, why would Eirin ask Sagume for help? Eirin surely know the difficulty and risk for getting a letter to Sagume, and then the difficulty and risk for Sagume to come. Why would Eirin put Sagume under such risk? Why would Eirin use her personal connection to her allies so carelessly? Eirin might be scared of Yukari, but only somewhat, in the sense the Yukari was able to outsmart Eirin. Eirin still have superior technology and knowledge. Eirin is only scared of Yukari in the same way people are scared of pickpocket: they can cause serious trouble if you let your guard down, but they can't actually coerce you into doing anything.

Not to mention, Sagume is far from the only way to avoid a disaster. The easiest method is to just put a stop to the whole thing (as mentioned, they must have known in advance). Let's say if they don't want to put a stop to it, for some unknown reason. At the minimum, they could have increased security, for example, say, by telling Reimu and co. about it in advance, and having someone block off the underground passage. And put a stop on the whole party crashing before it gains momentum and become chaos. The only reason they even let the party crashing gain momentum is because they knew Sagume is coming, otherwise they could have put a stop to it right at the start.",1
61,2019-11-25 19:40:09+00:00,"Oh then definitely Frey. Then pull for Omni.Sortishia, Morphea and Alfana",1
62,2019-11-25 18:59:59+00:00,"Država određuje mnogo toga i nijedan građanin nije potpuno slobodan. Incest je nešto kategorički loše i treba biti zabranjen, formalno i po zakonu. Isto kao i jebanje koza, konzumiranje heroina i sl.",1
63,2019-11-25 18:44:55+00:00,Lo que tiene la heroina en vena,1
64,2019-11-25 18:05:53+00:00,Who's buying branded Oxycotin?,1
65,2019-11-25 17:34:11+00:00,"Star Wars Episode VII

Decades!!! After the Galactic Empire is thwarted, the galaxy breaks off into multiple factions, none of which are inherently evil, and the galaxy falls into general disorder. Border skirmishes and piracy plague the many parts of the galaxy as its everyone is trying to get a slice of that sweet space pie.

Insert strong female lead, you can even call her Rey ffs, stereotypical orphin working as a pilot for some space pirates. Her crew is working a job, trying to rob some shit, getting that sweet space pie from some noble man in some lame part of the galaxy.

But wait, this slice of pie was more heavily guarded than they thought. Most of her crew died in the attempt, but because of the fucking force (plot armor **cough cough**) she was merely imprisoned.

In prison, she meets the noble man, but wait it's another woman! A young, arrogant piece of work (who will later show herself as a soft soul, hardening herself for survival in a world of cut throat politics). She also meets Finn (I guess), who is working as a guard for our noble bitch. He attempts to treat her well but she lived that pirate life and don't need no one helping her, so she says ""get bent bruv""

**BOOM** the noble space manor has been attacked by mysterious forces and... Holy shit?!? That dude has a lightsaber. Oh dang our protagonists are in trouble now!! But wait! The force, again, carries our flawed heroes to safety... Rey, Finn and our noble lady escape with Finn's ass kicking moves, Rey's slick space drifting and Noble Lady's ability to make good decisions in a pinch and keep the other two grounded.

They proceed to be chased, which gives us the character friction conflict that will strain, but ultimately strengthen their relationship.

That's about all I got, but essentially the dude with the lightsaber is an assassin hired by another noble or something. This movie would largely be a kick start to what could be an expanding story. Finn and the Noble lady would probably couple up, and Rey and the assassin would eventually be forced to temporarily work together, form a bond but inevitably fight a final battle after a well built, moral conflict with one another.",1
66,2019-11-25 15:51:29+00:00,"Unburdened ridiculous Obama regulations, NAFTA reform (meh), record-low black and hispanic unemployment, prison reform work, wages rose 3.5% and median income, poverty rates record low, more black small-business entrepreneurs record high, female small-business growth record high, stock records met 3 new highest points ever, federal agencies dropped 10 billion in regulatory costs, funded Perkins CTE for vocational and career education paths, streamlined federal permitting processes eliminating bureaucratic waste in government,  Right-to-Try legislation allowing health care options for terminally ill patients,  FDA set new records for generic drug approvals in 2017 saving consumers nearly $10 billion, improved national suicide hotlines,  cut Obamacare’s individual mandate penalty,  repealed Obamacare’s Independent Payment Advisory Board AKA the “death panels"", overturned Obama administration’s last minute regulation prohibiting states rights from defunding abortion facilities,  executive order ensuring religious organizations not forced to choose between violating religious beliefs by Obamacare’s contraceptive mandate, fighting the opiod crisis by revoking registrations for dr. feelgood prescribers, launched national public awareness campaign and funding, indictments against chinese fetanyl distribution, circuit courts judges and supreme court justice nominations,  operation 'cross country XI' to combat human trafficking rescuing 90+ children and arresting 120+ human traffickers, got funding for finalized construction replacing border barriers and started new construction, pushed ICE’s Homeland Security Investigations division arresting 800+ MS-13 members and associates in 2017 an 83 percent increase from the prior year, 228 illegal aliens affiliated with MS-13 in 2017, removed over 300k illegal immigrants (76,000 with dangerous drug offenses, 48,000 with assault offenses, 11,000 with weapons offenses, 5,000 with sexual assault offenses, 2,000 with kidnapping offenses, 1,800 with homicide offenses), moved the US embassy to Jerusalem - which 4 prior presidents promised to do, met with and negotiated with North Korea resulting in a temporary cease of missile testing and return of soldiers remains, expelled dozens of russian intelligence agents, sanctions against russian oligarchs, banned russian spyware kaspersky labs software from US government computers, 2028 summer olympics in los angeles, launched the formation of space force (IDC if you are a whiny ass progressive, this is great stuff), fixing VA by telehealth services, walk-in-clinics, and same-day urgent primary and mental health care, imported veterans’ electronic medical records to the same system used by the Department of Defense - a decades old priority that multiple presidents ignored, created a White House VA Hotline to help veterans and principally staffed it with veterans and direct family members of veterans, the list literally goes on and on.  Compared to previous presidents workload, Trump out-works them every fucking day.  Sorry!  Put aside your partisan bias and look at the good work being done, even when you may not agree exactly with the guy FFS.",1
67,2019-11-25 12:08:56+00:00,"Isso mesmo, Guaido! Aposto que na foto que ele tirou com grupos de traficantes paramilitares da Colômbia, ele só tava juto com eles pra dizer umas  boas verdades como esta. ""Vocês estão aqui livres, mas não são inocentes não!"" E aí a galera descontextualizou pra sujar a imagem do nosso heroi!",1
68,2019-11-25 11:43:50+00:00,"Perocet makes me hallucinate pretty vividly. When I had my wisdom teeth out I was seeing sharks pouring out of triangles and portals to other realities.
When I was first started on Oxcarbazepine, I was so ataxic I couldn't walk in a straight line for the first few days. I keep bumping into walls and triping on my own feet.  I opted to sit on the floor for those few days because I kept feeling like I was going to fall out of chairs.",1
69,2019-11-25 10:15:05+00:00,"Well my guy you might need to go back in the comments a read it carefully. An i have a home girl that had to forms of cancer. An the drip cured her. An its ways to get around the getting high property. An Especially paranoia or being paranoid. An using a higher dose of cbd before the thc. Thats the purpose of it being more strains Now with more cbd propertys. An hybrids
. But back to the morphin \ oxycodone or oxycotin.. A chemo is poison. Its a low dosage of mustered gas. Now give me the stats on which is better cause all those other drugs an gases have killed over thousands of. An no one in this earth has dead from herbs. ✌",1
70,2019-11-24 23:03:48+00:00,Scary shit. So thankful this wasn't a thing during oxycotin express.,3
71,2019-11-24 21:57:08+00:00,"Ask your derm about Clobetasol.  It's a strong steroid cream but if the Morphea patch isn't in flare-up,  you can use the Clobetasol twice a week instead if twice a day.  My patch is on my right thigh/hip. I do regular sun exposure for 10-15 min a day as often as possible but the Clobetasol helps lighten &amp; soften. I've heard it's used on the underground for ppl who want to lighten their skin color also. It helps me with my patch, which grows bigger when having a flare. I switch between Tacrolomis (maintenance) &amp; Clobetasol (elephant tranquilizer potent) depending in severity.  Even when not in flare, I use the Clobetasol (very little bit) &amp; Tacrolomis once a week each. But remember,  it's a steroid, so it's strong. Get medical advice on that. It's a prescription obviously.",1
72,2019-11-24 20:37:03+00:00,"I have chronically low Vit D &amp; have since pre Morphea. I have to take HIGH doses of D3 (with coconut oil for absorption). I mean 10,000 it's DAILY and I hover at the low end of normal (23). The critical thing is actual ABSORPTION. 

I find a very little sun direct (10 minutes) on my plaques (with sunscreen) makes them softer. I tried this after reading about it on a Morphea site. 

I have a gene mutation I found when doing 23 &amp; me that showed I don't  absorb Folic Acid. So when on methotrexate,  you're supposed to take folic acid for your liver but my body couldn't convert it to what was needed tio be absorbed.  I take Methyl folate now (folic acid already converted into what your body can absorb) &amp; my liver function panel is WAY better. Gene mutation is called MTHFR.  Please get checked if you take Methotrecate. Your doctor can do a test to verify if tou have the mutation. It's very common.",2
73,2019-11-24 17:14:33+00:00,Nobody gets just probation for selling lbs of fetanyl dumbass,1
74,2019-11-24 15:43:33+00:00,I think they’ll just use Joshua Orphin and use makeup to make him look older tbh,1
75,2019-11-24 15:42:00+00:00,"Looks like it may have been a little morphea. That is a classic site and pattern for it. 

Luckily seems like it burned out on its own and didn’t cause much of a problem. 

Could also be a segmental capillary malformation...but it would have been there earlier than 5th grade. 

Best bet is to use a green tinted makeup/foundation. Green covers red really nice sort of neutralizing it and effectively looking tan.

A special laser can destroy the red color of you want to go the next step.",1
76,2019-11-24 15:33:52+00:00,"Fali mi heroina, ono.",1
77,2019-11-24 14:54:36+00:00,"*dont do drugs ofcourse or at least never combine as I do*

People shouldnt really mix BDO with ethanol since the alcohol will be broken off by your liver first, leaving BDO circulating in your blood/body for a long time (you DO NOT want that with BDO) and the BDO will be as good as ineffective till your liver had delt with the alcohol. With all downsides to it (damage from toxicity, dosing to much BD or to fast so it all hits u after the drank etc) and its a waste of both drugs AND your health and time.

I personally like cocaïne, mdma, a benzo, oxycodon or phenibut as combo. I smoke weed 24/7 too and that goes with anything tbh. 

Alcohol can be really nice with GHB/GBL tho, in not to high doses (but that's a whole diff route thn alcohol).",1
78,2019-11-24 05:18:20+00:00,Fetanyl scares the fucking shit out of me.,1
79,2019-11-24 03:39:08+00:00,fetanyl,1
80,2019-11-24 03:24:32+00:00,"For me (when I had no tolerance) taken orally it lasted as long as the high from percs or norco. 30-60 minutes of a decent buzz and an afterglow for a few hours. 

Before I had a tolerance I was a major lightweight for opioids, and MScontin 30 and 60mg used to be my absolute favourite. ~8 hours of feeling amazing, Even better after smoking some bud. To be young again lol.",1
81,2019-11-24 01:40:20+00:00,"Same. I've always been interested in pharmacology in general, but I learned a fair amount about opioids being an addict, as well. I've done a fair amount of fentanyl, and oxymorphone a few times. Opana is oxymorphone, right? Or is that *hydro*morphone? I can't remember... It's been a while, lol. Probably best not to think too much about it anyway.",1
82,2019-11-23 23:55:00+00:00,"Weed can be degenerate, just like alcohol or pain killers.

Enjoying a glass of wine with dinner is not bad, blacking out at a bar is.

Taking pain killers after surgery isn't bad, getting addicted to fetanyl and then heroin is.

Smoking a joint in your home on the weekend isn't bad, engaging in stoner culture and being high all the time is.",1
83,2019-11-23 22:28:30+00:00,Hope you're doing a little better at the moment.  I know I'm late to this post.  My brother was a year younger than me and passed away from heroin/fentnyl at the end of August.  It's so confusing between anger and grief.  It's been really hard on me this past week.  I think it's finally sinking in.  I hope you and your family are doing ok.,1
84,2019-11-23 21:20:08+00:00,"You are very fortunate. I only dream of having dreams like that and I kind of used to. I still think I dream in color when I do dream but not so vivid any more. Sadly, my vivid awesome dreams that I had a lot were when I was taking morphine er (generic Mscontin). I also was taking Percoset as break thru pain relief but not before bed cause that would keep me awake but it was still in my system. 
 I would dream about my mom and my grandmother a lot ,they've passed away long ago so I miss those. I had some awesome dreams. Maybe I wasn't all the way asleep, who knows. I would have dreams where everybody in my dream was dead except for me and my brother and sometimes my sister. I miss my dreams so much!",1
85,2019-11-23 20:56:59+00:00,its the fetanyl,1
86,2019-11-23 17:51:57+00:00,Rowley has snorted sixteen lines of crushed fetanyl pills and fucking died.,1
87,2019-11-23 15:57:26+00:00,Thank you. I will do that. We have morphine on hand in case of emergency. I will talk to the nurses when they get here to bathe her today. The morophine seems to be ideal as it doesn't take so long and she won't have to pay in her feces so long.,1
88,2019-11-23 14:46:47+00:00,It was good.. Then came fentenyl. :-(,1
89,2019-11-23 13:50:52+00:00,"é, eu felizmente sei como é isso. Meu pai era assim. Foi uma mãe, um pai, um amigo e tudo mais pras filhas. Ele andava de roupas bem largadas pelas filhas dele. Foi um heroi. Porém ele partiu, como eu disse no relato.

É muito dolorido. Melhorei com terapia. Mas ainda é um longo processo.

Obrigada por notar minha força e me lembrar disso. As vezes a gente esquece disso e se sente meio merda.

Se vc quiser ficarei feliz em ter um amigo pra conversar

bjo e obrigada de coração por tudo",1
90,2019-11-23 11:28:56+00:00,and 6-Mam is a morphine metabolyte. thats what they look for in drug tests to determine if you used heroin or different opiates.  I know for 100 % sure it converts to morphone. I've read that on countless pages. an easy google search would verify that for you,1
91,2019-11-23 09:47:41+00:00,"Buy oxycodone,oxycotin,syrups,actavis

get connected with 420  5183360448",1
92,2019-11-23 06:15:08+00:00,"It should be 100 feet taller. It disgusts me that it’s even debatable that we protect our borders. There should be no argument! Chinese fetanyl pours across, they’re trafficking child sex slaves, and it’s fucking up wages. This affects every American. Even tar illegals here already should be for the fucking wall!",1
93,2019-11-23 05:51:54+00:00,"Lmao good for them. Hows this a security thing tho? Maybe im just ignorant but as looks as theyre clean and safe (not full of fentantyl) i dont see a big problem. 

Also dont just downvote me if you disagree, id love to know why",1
94,2019-11-23 00:29:31+00:00,"I know a paramedic who was fired for stealing fentayl from a fire dept job and a flight medic that they found passed out in a work bathroom from a benzo OD both got fired, they both managed to get their license back eventually but it’s on a very strict basis. They have random drug test he has to call a number once a week to see if they have to go take one like probation and next to their license on the state website that information is actions against their licenses . So it is possible. What you should have done is before taking the test if you knew you were going to fail is told your employer you have a substance abuse issue BEFORE taking the test and see if you could has gotten into a diversion program. Self admitting could have saved you maybe. I don’t know what state you live in but on our recertification paperwork there is always questions about substance abuse. It’s not impossible but you will def have some hurdles to go through.  In my state emt and paramedics are under two different state boards. It’s a lot easier to lose a emt certification than a paramedic license.",1
95,2019-11-22 23:52:59+00:00,"Such as? Also dw, I've already tried overdosing on tramadol and oxycodon, realised overdosing is hopeless, I just want to sleep tbh.",1
96,2019-11-22 23:34:50+00:00,"I remember the when I woke up from a 2 hour surgery. As an experienced phlebotomist and knowledged patient in a specific vein in my arms that LOOKS great but nobody should absolutely ever use (it infiltrates into a massive, golfball-softball-sized hematoma every time it's VP'd), I got into a mild arguement with the anesthesiologist before procedure to *not use that vein*, even though she was pretty much drooling at it and I told her my antecubital veins were fantastic and to use those and why.

Me, making a *very big mistake* and I don't know exactly how I fell for this but I still beat myself up for it because I should have known *way* better, let the nurses talk me into taking anxiety medication orally not thinking anything about why.

Things got blurry, I remember them taking me into OR, and going to sleep, then waking up. The nurse told me everything went well except for a minor complication. I ask and she tells me my anesthesia IV infiltrated into my muscle, causing inflation in my arm that would clear up after 8 hours-ish. I lift my arm, see a massive hematoma trail going down it from the bad nono do not touch vein, and am unable to bend my elbow. Then I realize what's really wrong.

**My whole arm looks like a Shrek arm.**

I was so distracted by morphene, post-surgery pain, etc that I can't even process the behemoth arm in front of me, but I do notice that the IV is neatly placed in my other arm in an antecubital vein.

Was way too drugged to be upset about that at the time but was not pleased after I started coming back to.",1
97,2019-11-22 22:23:32+00:00,at least the orphin looks happy,1
98,2019-11-22 19:02:21+00:00,"""Court documents show she was driven and a perfectionist"" in obtaining and distributing the highest grade fetanyl for her fans.",1
99,2019-11-22 15:11:29+00:00,Nem todo heroi usa capa,1
100,2019-11-22 13:50:42+00:00,"&gt; I've used everything except the hard stuff.  
&gt;  
&gt; When bad things happen I turn to coke and perocet-38 pills.

&amp;#x200B;

You are already doing hard stuff. You´re still aware that the path your goin down is wrong. You still have time to turn around.",1
101,2019-11-22 12:53:30+00:00,4 years for trying to distribute 400 grams of fentnyl is not nearly enough. Fuck her.,1
