,date,body,score
0,2019-07-31 16:29:52+00:00,"Pensando bem, talvez nem foi nepotismo, foi só um pai querendo dar o melhor pro seu filho, que exemplo de homem, heroi nacional",1
1,2019-07-31 16:09:07+00:00,"Tbh, I told the nurses of my stomach issues with NSAIDs, but because it wasn't in my chart they wouldn't give me anything else. I don't have an official diagnosis of GERD, (fear of getting scoped), but I've learned over the years what my triggers are, and 100% of the time I've taken a NSAID, I'd get horrible chest pains. I had no issues with the prescribed Oxycodine and Tylenol though. 

Also, sorry, I accidentally deleted my original comment when I was trying to move my 2nd comment in the proper place. It's been one of those days!",2
2,2019-07-31 15:58:09+00:00,"Fentonyl should not be taken along with right shot forwards, as the side effects of said combination are unknown.",1
3,2019-07-31 15:38:20+00:00,"They gave me oxycotin... I only took it the first two days. 

Then it was Tylenol and ibuprofen.",2
4,2019-07-31 14:36:59+00:00,"the thing people struggle to realize is fetanyl and heroin arent mutually exclusive. that shit is being cut into everything (fake zans, coke etc)",1
5,2019-07-31 14:34:13+00:00,"I did a semester research project on the heroin epidemic in college and thing I found out is that a  vast majority of OD’s are actually from fentantyl, just some heroin fun facts for everyone on this Wednesday morning",1
6,2019-07-31 14:12:24+00:00,be a real shame if your next bag of blow was cut with fetanyl. real shame,1
7,2019-07-31 14:00:06+00:00,"This is the excuse that one of my ex friends used to sell fentonyl, which killed a few people. ""if I didn't do it someone else would""

Its a shit excuse. Shouldn't world leaders lead by example?",1
8,2019-07-31 12:34:20+00:00,"To be fair it probably isn't. Getting laced with fetanyl all the time these days, no way of telling either. Probably the worst RNG you could get.",1
9,2019-07-31 12:21:09+00:00,"Yeah but I was thinking more like meth,herioin,and coke that can put you out a lot faster but I agree alchohol can also be dangerous a lot.",1
10,2019-07-31 07:44:25+00:00,"My dad died of tramatic brain injury after colliding with a minivan turning in an intersection...neither bike nor van were going that fast.  Both bike and van were in the wrong.  My cousin was also in a coma for a few days after falling from her bike onto the sidewalk while attempting to go no handed.

So I always wear a helmet.  Freak accident for my dad after decades of riding.

But I just had a bike accident too.

As a guy who just broke his collar bone, shoulder blade, ribs, and ruined my helmet and only slightly damaged handlebar tape...my only complaint is the helmet didn't protect the rest of my upper body.  

We need collarbone /shoulder helmets too. 

Depending on your weight and speed, a severe bike accident can be as simple as an unseen rabbit running in front of you, and the amount of energy your body absorbs quickly can do a lot of damage depending on how you land.  In my case my head hit the edge of the asphalt path while my shoulder planted in the hard dirt just off the path.  16 mph to 0 right quick.  

Cost so far:  $20 handlebar tap, $80 helmet, $30 underarmor shirt, $25 gloves, $2200++ ambulance/fentanal charge, $14,000++ trama care (with desensitized nurses who like to torment those with broken ribs), lots of follow up xrays and CT scans, and I still may need surgery even more tramatic to by body than the original accident and who knows how much that will cost.

And I know how to fall, can ride wheelies, still can ride a unicycle with overinflated tire, and skateboard. I used to ride bmx without a helmet for years as a child/teenage, commuted on road bike as 15-16 year old from crystal to dinkytown (no helmet), crashed many times jumping BMX with only minor road rash, took big air jumps, etc.  I even had a motorcycle crash at 17 on highway 100 and I did not hit my head (but I was wearing a helmet as it was law).  I was in wrestling, could run and dive over fences as a kid, and I thought I knew how roll out of a fall to prevent collarbone fractures.

Well, I thought I knew how to roll out of a fall.  But this accident came out of nowhere on a slight downhill bike path that was not very heavily used, on a beautiful day with my heartrate at a very reasonable 140 bpm (I routinely push it to 160-170 bpm). 

At least I don't have tramatic brain injury but judging by the helmet, I would have liklely cracked my skull.

I estimate 2800 joules of energy were disappated very quickly (.1 seconds?) in my helmet, shoulder, dirt, and tar path edge.  My shoulder dug in when I landed, which probably saved some road rash but cost many fractures.  My bike is practically unscathed.

In comparison, a .45 bullet has about 1600 joules of energy when fired.

E=1/2 *mass*velocity^2.

So let's say you weigh 190 lbs, or 86 kg, and you fall unexpectedly headfirst into an immovable object, say a curb, lamppost, or similar.  How fast do you need to be going to disappate the same amount of energy as if you were shot by a 0.45?  Answer:  13.6 mph.  

I weigh 109 kg. and was doing about 16 mph.  For comparison, some of the rural hills I take I can reach speeds of 40 mph easily.  With those specs we are talking over 17000 joules, as that v^2 term above has a big impact on energy.

I have also foolishly done 30 mph down gravel hills, so fast you have little steering control, which is thrilling but in hindsight not smart

P.S.  Once my fractures heal, I am thinking of switching from a roadbikeish gravel bike to a fat bike, for increased drag and slower speeds, since I mostly bike for summer time calorie burn, and I have a family to support...cannot die yet, and the only exercise I enjoy is riding a bike.",1
11,2019-07-31 06:11:04+00:00,"A mongoloid man with stunted height can always just breed some XFs.

Meanwhile pinkoid and wakadan manlets have no choice but fetanyl.",1
12,2019-07-31 04:39:26+00:00,I have an old script of perocet 20's but usually when I do them I get some 80s s a pal and split it up and snort all day. Usually test the 80's cause once I bought a bad mbox 30 and thought I was gonna die,1
13,2019-07-30 22:05:37+00:00,"&gt; First philanthropy isn't wrong but it's often a band-aid and not nearly effective as government intervention can be at bringing in money do deal with social issues. Both can be overly buracratic and ineffectual at times but in terms of writing big checks the government almost always wins.

Am I just supposed to take your word on this?  The linked article convincingly argues that, per dollar, Bill Gates has done much more than any government in terms of saving lives.  To which government could Gates have donated X billion dollars to save millions of lives?

&gt; Second for the very rich giving large amounts of money to philanthropy often gives tax incentives which serve to make it so that the less overall money goes toward solving these problems.

Bill Gates and Jeff Bezos aren't giving away billions for ""tax incentives"".

&gt; Third and finally that some of the large philanthropic donors are individuals or leaders of companies which actually cause widespread societal harm. The Sackler family of Perdue Pharma and oxycotin fame are a very good example of how charitable giving can be used to buy public support despite costing society and taxpayers billions of dollars to solve the problems caused by their companies.

It's not clear that the Sacklers were only able to do harm *because* they donated money.",1
14,2019-07-30 21:25:04+00:00,My doctor gave me fentanayl for my wisdom tooth removal. I was really happy. Eric looks like he feels no pain at all.,1
15,2019-07-30 20:19:30+00:00,The town of Springfield (the one Matt Groening is from) was until recently a total (as opposed to partial) dumpster with a huge herioin/meth problem.  We called it Spring-tucky.,1
16,2019-07-30 18:42:52+00:00,"Double Agent Fentonyl is going to end up back in NSH while him and Poile laugh it up... Or maybe he might go to another central team and do the same. Who knows. At least there is some interesting news for the Wild until they hire a try-hard GM who will attempt an on the fly rebuild to make us back to a barely miss/make the playoffs team again. Fentonyl was shit, but he was the shit we needed to finally tank. Although, a tank would mean gathering picks for players which Fenton is allergic to draft picks.",1
17,2019-07-30 18:33:51+00:00,"Upravo to, osim ovog zadnjeg. Kakvi crni intervjui. Pozovu te u slučaju da kasniš (i to rijetko) 2-3 mjeseca na biro, pa da čisto znaš da će te skinuti ako se ne javiš u narednih par dana. Ima ona narodna što kaže: ""Lakše se skinuti sa heroina nego sa biroa""",1
18,2019-07-30 18:28:41+00:00,I am getting my hopes up for one of the guys on Hockey Central at Noon.  Doug or Burkie or even Jeff Marek would be better than Fentonyl.  At the very least they would be light-years better at PR.,1
19,2019-07-30 18:19:54+00:00,"why some people say then that kratom boost their opioid experience. are they wrong.\`? but sometimes I feel the same if I take kratom before using real opioids it is not as strong and most a kratom high and no real opioid high. for example I am nodding off solo nearly every time but wit kratom solo not as often.

another question do you prefer kratom over things like codeine, tramadol, oxycodon, hydromorphon, morpjm",1
20,2019-07-30 17:42:13+00:00,"I've seen some people calling him Fentonyl, so I guess Leipold just gave the Wild a shot of Narcan",1
21,2019-07-30 16:14:14+00:00,"First philanthropy isn't wrong but it's often a band-aid and not nearly effective as government intervention can be at bringing in money do deal with social issues. Both can be overly buracrqtic and ineffectual at times but in terms of writing big checks the government almost always wins.

Second for the very rich giving large amounts of money to philanthropy often gives tax incentives which serve to make it so that the less overall money goes toward solving these problems. 

Third and finally that some of the large philanthropic donors are individuals or leaders of companies which actually cause widespread societal harm. The Sackler family of Perdue Pharma and oxycotin fame are a very good example of how charitable giving can be used to buy public support despite costing society and taxpayers billions of dollars to solve the problems caused by their companies.",1
22,2019-07-30 15:19:26+00:00,That’s all the fetanyl talking,1
23,2019-07-30 11:07:53+00:00,"heroi nacional , obrigado, vi que ela possui alguns videos no pornhub, vou estudar anatomia hoje a noite kk.",1
24,2019-07-30 06:20:58+00:00,"Well, just so you know. Perscription drugs are illegal to posses without a perscription. Meaning they are traded all the time in the illegal drug market. You can't really make the distinction, unless you name the specific drugs.  


Take Xannax for example. It's a perscription drug, but it is traded heavily on the black market as well.  


Same thing goes for Oxycodine. Yes Oxy is perscribed for pain by doctors, but also, my friend just bought some from the black market. and Oxy does ruin lives all the time, because it is heavily addictive, and you can overdose (it's literally just weaker heorin)",1
25,2019-07-30 06:16:58+00:00,"E marketing. Ar trebui si covrigariile la covrigii cu mac sa le zica ""COVRIG CU HEROINA (nu e drog!)""",1
26,2019-07-30 06:02:13+00:00,"Luckiy, Morality and Ethics don't have to be enforced on others, you just follow them yourself.  


Further to that. I would not consider all drug use to be substance abuse. I am sure my weed consumption would fall under what you call substance abuse, but is the guy who is taking his perscritpion medication for depression partaking in substance abuse? how about the guy who has oxycodine because of a broken collar-bone? I see that as drug use, but not substance abuse.",1
27,2019-07-30 05:15:49+00:00,"They border us. They will be attacked first because water will be one of the most important resources. A few minutes into it their power and internet resources will be shut down, reeking havoc. Arial sorties will soften up the major population centers. Then we march in and take control of the water. Wait a bit as CO gets softened up by it's neighbors, then push on and take them over. At that point we can wait for winter as our cyber attacks shut down all infrastructure. Let winter do it's thing while we cavort about in lovely weather, then move in and mop up in the spring. Then wait for hurricane season to wipe out large sections of the SE, and strike when they are at their weakest. They'll already be highly weakened due to fighting their neighbors. Flood survivor states with meth and fentenyl we import from Mexico and China.

Terms of surrender: surrender to us and you get free Netflix for a year, along with a complementary ounce of Humboldt's finest, legal under our constitution. Job done.",1
28,2019-07-30 04:59:13+00:00,"Mentiroso.

Por que vc nao cita dados dos numeros records de mortes por overdose de heroina, crack e outras merdas?",1
29,2019-07-30 04:23:38+00:00,"Yeah i have noticed, usually .5-.6 of really fire fetanyl dope (snorting) will have me feeling right and i just ran through a gram of the same stuff and boy i feel good but I usually never do that much in one night, usually ill do a gram the whole day and night",1
30,2019-07-30 03:16:52+00:00,"&gt;  They of course addressed the issues with Jar Jar and the kid but they pointed the finger at the director and producers not the actors themselves.

I have a weird time with Jar Jar because a lot of what makes him annoying is literally his voice, which was 100% a creation of Best. I feel like people want to absolve him somehow of Jar Jar, but that voice and the way he walks and stuff like that are all him. I don't blame him for taking the job, it should have been anyone elses job to tell George that what he was doing was annoying to most everyone else, but still Best is definitely a significant part of what makes Jar Jar so fucking awful. It's like the people who designed Fentinyl, I'm sure they were just doing their job and maybe had noble intentions, but that shit has killed a lot of people, so it's hard not to be mad at them.",1
31,2019-07-30 01:44:21+00:00,Gas is so 40s.  What do you think the government is going to do with all the fentanyal it confiscates?  And it takes such a little amount.,1
32,2019-07-29 16:58:04+00:00,"One thing I noticed a long time ago while browsing TheFirearmBlog which occasionally has collections of pictures of seized homemade guns, usually from South Africa, Brazil, and Australia, is that the homebrew firearms in areas with almost complete gun control were almost always compact shotguns or SMGs.

&amp;#x200B;

There appear to be three main reasons for this:

The biggest reason is that these are often the simplest arms to produce. Our semi-automatic rifles are actually pretty complex, more complex than a smaller full-auto-only gun, the higher-pressure rifle cartridges need more exact materials and machining tolerances to be safe in the gun, the higher pressures also require ways of delaying or slowing the action while pressures drop, and restricting fire to semi-auto usually requires extra parts in the trigger called a disconnector. On the other hand, the open-bolt direct-blowback SMG is the first fully-automatic weapon to be widely issued to basic infantry for a reason. It has the fewest parts of any automatic, timing is much easier than a higher pressure gun, can be made with cheap or poor quality materials without beating itself apart, and could be made on basic machine tools as early as 1915. While most troops were still using bolt-actions in 1945 in WWII, SMGs were starting to see mass production and adoption as early as 1920 after the world saw the MP18 in WWI in large part due to their simplicity in design and manufacture. SMGs are also generally more controllable, simpler to maintain, and easier to train conscripts on, and extremely effective in urban combat where their disadvantage in range matters least.

&amp;#x200B;

Ammo availability appears to play a part but I don't know enough on the ammo controls in these countries to take that apart.

&amp;#x200B;

The other is the Iron Law of Prohibition: the government is trying to ban something to ""keep people safe"" but smugglers are incentivized to try to try to make the product smaller to be easier to smuggle, but also more potent to be able to satisfy the customer with a smaller product once smuggled. Examples of this are bootleggers carrying mostly spirits rather than beer during the prohibition and modern drug runners bringing in fentenyl during the current opioid crisis.

Related to guns, this means someone trying to smuggle, create for sale to gangsters or smugglers, or to illegally carry a firearm will want to produce or procure the most firepower in the smallest footprint: a submachine gun, or a ""sawn-off"" shotgun. So while a citizen who can legally get his hands on a larger, less concealable and slower firing gun will settle for the larger gun even if he wants something more compact; the criminal is incentivized to go the complete other way. In the US, a criminal will usually settle for the same weapons available to and stolen from the populace rather than figuring out his own supply , even if they are less advantageous to him in terms of firepower, ease of untrained use, and compactness. In countries with complete gun control, the Iron Law of Prohibition seems to rule and the weapons most favored by black market manufacturers are those the urban politicians are usually most fearing in the hands of gangsters and other potential urban fighters: the SMG and short barreled shotgun.",1
33,2019-07-29 16:57:48+00:00,"One thing I noticed a long time ago while browsing TheFirearmBlog which occasionally has collections of pictures of seized homemade guns, usually from South Africa, Brazil, and Australia, is that the homebrew firearms in areas with almost complete gun control were almost always compact shotguns or SMGs.

&amp;#x200B;

There appear to be three main reasons for this:

The biggest reason is that these are often the simplest arms to produce. Our semi-automatic rifles are actually pretty complex, more complex than a smaller full-auto-only gun, the higher-pressure rifle cartridges need more exact materials and machining tolerances to be safe in the gun, the higher pressures also require ways of delaying or slowing the action while pressures drop, and restricting fire to semi-auto usually requires extra parts in the trigger called a disconnector. On the other hand, the open-bolt direct-blowback SMG is the first fully-automatic weapon to be widely issued to basic infantry for a reason. It has the fewest parts of any automatic, timing is much easier than a higher pressure gun, can be made with cheap or poor quality materials without beating itself apart, and could be made on basic machine tools as early as 1915. While most troops were still using bolt-actions in 1945 in WWII, SMGs were starting to see mass production and adoption as early as 1920 after the world saw the MP18 in WWI in large part due to their simplicity in design and manufacture. SMGs are also generally more controllable, simpler to maintain, and easier to train conscripts on, and extremely effective in urban combat where their disadvantage in range matters least.

&amp;#x200B;

Ammo availability appears to play a part but I don't know enough on the ammo controls in these countries to take that apart.

&amp;#x200B;

The other is the Iron Law of Prohibition: the government is trying to ban something to ""keep people safe"" but smugglers are incentivized to try to try to make the product smaller to be easier to smuggle, but also more potent to be able to satisfy the customer with a smaller product once smuggled. Examples of this are bootleggers carrying mostly spirits rather than beer during the prohibition and modern drug runners bringing in fentenyl during the current opioid crisis.

Related to guns, this means someone trying to smuggle, create for sale to gangsters or smugglers, or to illegally carry a firearm will want to produce or procure the most firepower in the smallest footprint: a submachine gun, or a ""sawn-off"" shotgun. So while a citizen who can legally get his hands on a larger, less concealable and slower firing gun will settle for the larger gun even if he wants something more compact; the criminal is incentivized to go the complete other way. In the US, a criminal will usually settle for the same weapons available to and stolen from the populace rather than figuring out his own supply , even if they are less advantageous to him in terms of firepower, ease of untrained use, and compactness. In countries with complete gun control, the Iron Law of Prohibition seems to rule and the weapons most favored by black market manufacturers are those the urban politicians are usually most fearing in the hands of gangsters and other potential urban fighters: the SMG and short barreled shotgun.",1
34,2019-07-29 13:11:26+00:00,"Have you looked into having a DNA test done to determine what medications work best for you? I had one done 5 years ago, I have full body Complex Regional Pain Syndrome, and none of the pain meds my docs were giving me were working. I'd get relief for 20-30 min and then I'd be at max pain levels all over again. I was on HEAVY pain meds, fentanyl and oxycotin for one, but still in agony. 

I'd heard in one of my support groups that your doctor can test your DNA and see what medications will work for you. I asked my doctor to give me the test and she happily agreed. When we got the results back, it turned out that I hyper metabolize a lot of the more commonly prescribed pain medications. After a tweaking my meds a bit, I had relief I hadn't felt since pre CRPS. I'm still in pain every day, but at least its mostly bearable now. 

I know its not the same thing, but I have my medical marijuana card and have been trying different strains/combinations, but medical marijuana wasn't the magic cure that I hoped it would be. It helps sometimes, if I get REALLY high, but I have a kid, so being really high just isn't an option 99% of the time.

Bonus: The test doesn't just cover pain killers, it covers a large spectrum of medications, so you'll have a lot of extra info should you ever need it.",1
35,2019-07-29 12:28:40+00:00,"Heroine, morphene, methadrone and ""the Bacon"".",1
36,2019-07-29 08:00:17+00:00,"hey don't forget r/Addictedtotheneedle! a new sub for fans of IV use of any drug. Fun, needle pics, and lots of questions were being asked on how to do x or Y.   


Good harm reduction discussion going on. Anyones os er;vp,r.

Someone asked if they could shoot an a perocet..... I'm working hared on gathering some ""how to get off safely"" type of PDF. We really need an IV user's easy to read PDF for that sub and I'm working on it and can use anyone.",1
37,2019-07-29 06:18:53+00:00,"Man. I lost my childhood friend of 20+ years last October to a heroin OD. Fetanyl is making it even MORE dangerous. Best of luck to you man, I know you can do it!",1
38,2019-07-29 04:37:14+00:00,"Not necessarily. While I'm definitely not a supporter of D.A.R.E. people do in fact give out drugs for free. It's not some shady guy on the street approaching though. I have quite an extensive history with drugs of all sorts. The first time I smoked weed, it was free. The first time I got Norco from someone who wasn't a doctor, it was free. First time I did coke, it was free. First time I tried oxycontin, it was free. The only time I smoke fentinyl was free (offered by a guy who sold me H for a bit until he got clean).Lady who then started selling me her oxycontin, let me smoke her meth, for free. She then would offer me a hit off her pipe anytime I came over. For free. I think I've only paid for meth twice ever (it wasn't my doc, opiates were). I've personally given out opiates for free. So no, people don't just offer strangers free drugs, but there are definitely drugs I would have never tried had they not been given to me for free the first time. I wasn't putting myself in great situations, but free drugs often found me, and it has a cascading effect.

For the record, I'm a month short of being clean off opiates a full year after about ten years of use (thanks kratom), and I haven't touched meth in over a year and a half.",1
39,2019-07-29 03:50:34+00:00,"Rule 1: stay away from my fucking Percocets
Rule 2: do you have any fucking percoets?",1
