,date,body,score
276,2019-11-09 10:10:42+00:00,"Ok tek sad sam shvatio da ne pise na slici, ali nitko nece vuce ""lajne"" heroina u klubu (naravno uvijek postoje iznimke). Znaci pricamo o **kokainu** (moguce i da je speed/neki amfetamin).

Heroin je druga klasa droge (opioid) dok su kokain i amfetamini stimulanti.

Kad smo vec kod trenutne opioidne krize u SAD-u, ona je vecinom postala popularna dolaskom fentanyla na crno trziste (fentanyl=**100 puta** jaci od morfina) i njegovih analoga npr. carfentanil (**10000 jaci** od morfina). Doza fentanyla se mjeri u **micro**gramima, pa mislim da mozes razumjeti zasto je postao tako popularan i zasto se jako lagano predozirati s njim.

Dileri (jer crno trziste naravno nije regulirano) mijesaju fentanyl/carfentanil s heroinom i drugim opioidima kako bi prodali ""jaci"" opioid. S obzirom na to da je dozirati njih tesko i nepredvidljivo (smjese nisu homogene, znaci ako si pomjesas ne mora znacit da ces uvijek dobiti 90% heroina i 10% fentanyla) predoziranja, a onda i smrti su ucestale.

E sad da je heroin dostupan (najbolje legalan), ne bi bilo toliko potrebe za fentanylom i analozima i bilo bi puno manje stradalih. Za one koji su upali u ralje narkomanije i ovisnosti bi jos uvijek postojala sansa da se vrate, no nazalost za one koji su se predozirali zbog nastale situacije vise nema povratka.

Necu ulaziti dublje kako su se ljudi u americi uopce navukli na takve droge ali: 

*What the U.S. Surgeon General dubbed ""The Opioid Crisis"" likely began with over-prescription of opioids in the 1990s, which led to them becoming the most prescribed class of medications in the United States. Opioids initiated for post surgery or pain management are one of the leading causes of opioid misuse, where approximately 6% of people continued opioid use after trauma or surgery.*

*Between 1991 and 2011, painkiller prescriptions in the U.S. tripled from 76 million to 219 million per year, and as of 2016 more than 289 million prescriptions were written for opioid drugs per year.*

Zanimljivo je kako ljudima stav o drogi jako negativan, ali ako ti slucajno to doktor prepise odmah se stav promjeni i mislis da mozes uzimati koliko hoces. Ja smatram da je glavni razlog za takvo ponasanje manjak edukacije sto proizlazi iz toga jer su droge stigmatizirane.

I za kraj kad si vec spomenuo svicarsku, zanimljiv nacin kako oni rjesavaju problem:  [https://www.northcarolinahealthnews.org/2019/01/21/switzerland-couldnt-stop-drug-users-so-it-started-supporting-them/](https://www.northcarolinahealthnews.org/2019/01/21/switzerland-couldnt-stop-drug-users-so-it-started-supporting-them/)",1
277,2019-11-09 09:03:08+00:00,"I am a patient of cluster headache, migraine, tension headaches and a few other forms. 

In Germany it is very rare to get access to THC-medical products which I recently got. I talked to my doctor about the positive effects I had with vaporizing THC from a save but Jon medical source which helped me a lot.

Therefore I was prescribed an THC oil with the name of Dronabinol 2,5%. I have totally different results than vaporizing. My muscles relax but my headaches increase to an insane level for a very long time and even my Oxycodon, ibuprofen and/or triptanes can't take the pain away. I'm so disappointed that the oil is resulting in such a different effect. I also have a lot of stomach problems with it.
I know that there are hundreds of different types of THC/CBD plants. How could one make sure that the process of harvesting and creating the oil doesn't change the effectiveness every time I get a new sample? How are the strains picked for medical purposes? What is the future of THC oil for people like me? s plants which vary from plant to",1
278,2019-11-09 08:08:57+00:00,"First of all thank you so much for your sweet words

Btw I’m 19 atm, and I’m turning 20 this months. 
I totally get it that a Injurie like this needs some time, but my cartilage damage is/was really bad. And cartilage is not regenerating, thats why my pain is not getting away (that’s what the doc told me). 

About the opiats, yeah my doctor wasn’t even a big fan of giving me 30mg of oxy. (Im from Germany and Oxycodon/Naloxon retard, is the only Oxycodon I will get, Retard means that it lasts the whole day) 

In Germany you get physical training on prescription, but per prescription it’s only 6 times. So i had 5 prescription and then my doctor said „Yeah I see it’s not getting better Naw no more physical training for you“ like what the fuck, after that it was a little better with my pain, but only for like 2 hours it’s weird lol. 

Oh I’m over my ex girlfriend, but that was just part of the story because at that point it was a huge deal for me. 

I just feel bad without oxy, my bones hurt, everything itches, I feel tired. Those are all withdrawal symptoms.

And weed, it helps me with the pain. My doctor even said that weed is the next step, but he said in the next sentence, but I’m not giving it to you lol",1
279,2019-11-09 05:33:49+00:00,"No. It's a scheduled 2 drug. It's classified the same as fetanyl, morphine, and meth. It's straight up felony possession if you only have one. Hell, it's a felony to have a half of one. I'm sure possession with intent to distribute is a worse felony, but having it for yourself without a prescription is a felony regardless.",1
280,2019-11-09 04:05:57+00:00,"gutnic whud epiguanine firmest meriquinoidal cuminseed antiq sorbus unmanifested ungulp

:---/-//----/:

01100111 01110101 01110100 01101110 01101001 01100011 00100000 01110111 01101000 01110101 01100100 00100000 01100101 01110000 01101001 01100111 01110101 01100001 01101110 01101001 01101110 01100101 00100000 01100110 01101001 01110010 01101101 01100101 01110011 01110100 00100000 01101101 01100101 01110010 01101001 01110001 01110101 01101001 01101110 01101111 01101001 01100100 01100001 01101100 00100000 01100011 01110101 01101101 01101001 01101110 01110011 01100101 01100101 01100100 00100000 01100001 01101110 01110100 01101001 01110001 00100000 01110011 01101111 01110010 01100010 01110101 01110011 00100000 01110101 01101110 01101101 01100001 01101110 01101001 01100110 01100101 01110011 01110100 01100101 01100100 00100000 01110101 01101110 01100111 01110101 01101100 01110000",1
281,2019-11-09 03:25:23+00:00,"What would be a reccomend doses for

M 
140lb
6ft
Never did suboxone
moderate tolerance to oxycodone/mscontin",1
282,2019-11-08 22:52:50+00:00,"Does anyone seriously think that the drug cartels who have openly bragged they can smuggle [anything](https://www.washingtontimes.com/news/2017/aug/20/mexican-drug-cartels-using-drones-to-smuggle-heroi/), [anywhere]( https://www.cbsnews.com/news/submarine-carrying-165-million-in-cocaine-captured-by-coast-guard-drug-bust-2019-09-24/) are dependent on American gun stores for their guns? The media tried to run this shitty story for Obama. it failed then, and with exposure to the truth, it will fail now. They are smuggling drugs using submarines for chrissake. Who in their right mind would think they are desparate to get American semi automatic hardware when they can get all the real military grade full auto rifles, RPG's and anything else they want.",1
283,2019-11-08 20:44:32+00:00,Plot twist: Bozonaro é o heroi do pais pois pretende conquistar a direita cega e aos poucos mostrar como são alienados. N é possivel que no dia que o Lula é solto o cara sinceramente me fala que só foi eleito pq ele foi preso,1
284,2019-11-08 19:14:04+00:00,Toda empreendedora fuma heroina,1
285,2019-11-08 18:16:28+00:00,"&gt; you will need different models for each question ""type""

Yes, I have the app set up that way so I should be set on that front. Thank you!

&gt; Essentially you'll add a type column to your performances table that gives the model name.

That's what I called tableName if I'm not mistaken. I can rename it to table_name, I guess for convention's sake? Thanks again for taking the time to help.

&gt;return $this-&gt;morphs('questionable');

This is the part that stumps me. Is this the [morphOne](https://laravel.com/docs/6.x/eloquent-relationships#one-to-one-polymorphic-relations) relationship?  What is questionable? How do I reference it?",1
286,2019-11-08 16:41:36+00:00,E ainda tem gente chamando de heroi,1
287,2019-11-08 14:13:30+00:00,I mean fentenyl needs to be controlled but I'm sure if there wasn't a black market for weed they wouldnt have had 50 pounds of it and may have never graduated to moving fent,1
288,2019-11-08 10:39:05+00:00,"Esse gênio é do Ceará, ele é um anti heroi? existem pecados que não tem sistema nervoso. &gt; Da um tempo em outras tarefas e que nem esse, so que agora não existe demais.",1
289,2019-11-08 05:45:17+00:00,"Opioid naive ppl probably get high off it at microdose levels. 2mg is equal to 90%+ mu-receptor occupancy &amp; very little agonism. Been on Suboxone for 10 years. This year had chronic pain issues from L4/L5 disc protrusion, secondary leg pains etc. Been prescribed Lyrica, valium, mobic. Went interstate in July &amp; Dr there said go on tramadol instead of Suboxone for better pain relief but wouldn't prescribe to avoid lawsuit (my big dumb mouth said ""I'm on Suboxone"" before I realized it!). Returned home and my Dr says ""he doesn't know his opioids"". Cut a long story short. Three weeks ago tapered down the subs to use again. Immediate pain relief, obviously. But smoking only. SUBOXONE IS NOT A PAIN KILLER! Have returned to dosing after massive hit to finances but 90% pain reduction and lingering cravings. I was getting so depressed living with pain for so many months. Everything was impossible. Earlier this year I saw a nightmarish YouTube interview of a US pain expert asserting those on buprenorphine going into surgery should be kept on it because of its pain killing value. I hope that view is not widely shared in the medical community. I don't think it is. My Dr once said they've got meds to breakthrough Suboxone if needed. Fentinyl no doubt. So I don't think it's seriously considered a painkiller. At best it keeps withdrawals away and has some antidepressant value.",1
290,2019-11-08 03:18:47+00:00,"num pais onde a lei vale cada vez menos e o poder dos politicos vale cada vez mais o cara joga a letra de ""quem sabe não podem dar um jeitinho de tirar os filhos do gleen"" esse é o ""heroi"" mas claro ele fez\ como todo bom channer e fingiu q era só brincadeirinha",1
291,2019-11-08 02:02:13+00:00,I’m scared to be on it and also feel like I have no other options. Maybe I’ll go through the gauntlet of other opoids before I resort to Buprenorphine. I wish I knew for sure what to do. The only 3 I’ve used are oxycodone morphene and oxymorohone. Maybe diladud or something like was suggested by my provider.  I’m just going to probably get kicked out at this point if I don’t find something soon. I’m creating problems at my clinic cause I keep coming back and changing my meds.,1
292,2019-11-08 01:39:38+00:00,Grabbin heroi- I mean adrenaline,1
293,2019-11-08 01:33:01+00:00,mas ele voltaria com um cara que acha que o joker é um anti heroi? existem pecados que não podem ser perdoados.,2
294,2019-11-08 01:02:10+00:00,"Don’t get addicted. I used opioids like this for over 15 years and never got “addicted” per se ..unless you are dealing with true chronic pain, wait. Fuck it. This game induces chronic pain. It Makes me want to do Fetanyl",1
295,2019-11-07 19:03:45+00:00,"Anyone here read Christopher Hilton's book(s) on Senna? I'm reading ""The Life of Senna,"" by Tom Rubython, and it's kind of crap, frankly. It's about half race results, stats, and photos by page length, which isn't in and of itself a bad thing, but the biographical text is also almost exclusively race events - Senna's 1985-1987 relationship that included a marriage engagement somehow didn't make the cut. Hilton wrote quite a lot about Senna, but he's described by Amazon reviewers as clearly being a big fan, though, so I'm worried about white washing. ""Ayrton Senna: O Heroi Revelado"" looks good, but I haven't seen an English translation.",2
296,2019-11-07 18:31:47+00:00,"I have Pectus Excavatum too! It was around 1 inch too deep and I did need a surgery for it to be corrected.I only found out about around 2 years ago, maybe less. I'll break things down into 3 parts: Before surgery, during, after (at the hospital and a little bit at home), and if it was worth it-

Before surgury -
First of all I, i f I hear what I define as bad news, I feel immediately sick, so when I had a doctor tell me and my parents I needed a surgery, I got a huge hot flash and just about threw up right in the little appointment room or whatever you call it. My parents and doctor gave me a choice to have this surgery, which I was surprised since it's a big life decision and I was a teen (still am) so I didn't think I'd have a say. 
I was really, REALLY scared for this, not fond of the thought of having my chest opened up. Also I've never had been to a hospital or had any major medical thing happen in my life since my birth. Even an hour before surgery I was worried... I was piss my pants scared.

During surgery-
Well I remember the doctors laying me in a bed telling me to undress and all of that. It made me uncomfortable since I was in front of my parents, but after that the stuck me with an IV. Not soon later, they were wheeling me into the operating room. I felt like I was M.Shadows from A7X in their ""Nightmare"" music video, so that was dope. Then when we arrived at the room, I remember having a conversation with a surgeon, i forgot what about. Before I knew it o woke up in my little hospital room. It took less than 2 hours! 

After surgery-
So I remember being suprized at the little amount of pain I woke up with. (I was on oxycotin or however you spell it) I remember looking at my stitches as thinking ""this is pretty f***ing metal, heck yeah"". But then I go lower and.... There is a little TUBE IN MY UREATHRA!!!! I didn't even know how the hell they put anything down that thingy! This tube was at least like half a centimeter in diameter, so pretty big for a teenage pp hole. The nurses and surgeon checked up on my every few hours or so, they were more than nice (I rate 6/5 stars). I did feel really bad for them though, collecting bags of my urine that was hooked up to the tube. I apologized everytime to whoever came in to clean it out. Oh god, did that hurt when they had to remove that rubber tube. They just pulled out my delicate weenee. Anyway, i think on my 2nd day in the hospital an occupational therapist came in to help me move my limbs without being in immense pain, and on the 3rd she was helping me practice walking up stairs. On the 4th day I was ready to go home, but they said I need to poop once before I left. "" no big deal"" I thought. Boy was I wrong. The constipation was so bad, I'd almost would rather have another tube pulled out my Wang. I finally was able to dump on the 5th day, I went home and that was that.
I think one of the worst parts after Pectus Excavatum is sleeping. You're not allowed to sleep on oh chest for I think 4 weeks after surgery, and I normally sleep on my stomach with my head to my side. When they sent me home, they send me with A TON of painkillers. I didn't even use half by the time I decided I didn't want to take them anymore. I'm glad, I had a speedy recovery and not alot of pain at all (which is why I stopped taking the painkillers).
Now, about 5 months after the surgery, I still experience some pain, but not alot. Every few times a day I feel that my left sides hurt decently if I turn my torso a certain way, but other than that I'm cool

Was it worth it?-
Uhhh, HELL YES! First of all, now I'm not as nervous or timid about surgery's and other medical procedures. Also exercising is SO much Easier. (For people with Pectus Excavatum, it is hard to exercise because the cave in of you chest pushes against the heart and lungs). The thing is that for me, this costed my parents 60,000 DOLLARS!!! but my parents had good insurance so it's cool. (Just adding this fact in because it is NOT cheap). These are just a few things, but I'm in class now so I can't type much more lmao.

(I would like to finally say that everything I just wrote is the SHORT VERSION, so sorry if it seems like alot of reading, but I can go into more detail if you want C:)",1
297,2019-11-07 17:00:19+00:00,"Two kids in Morgantown, WV overdosed on black market carts because they contained traces of heroin and fetanyl. I wouldn’t repurpose it either.",1
298,2019-11-07 16:46:31+00:00,Clearly it's a morphone.,1
299,2019-11-07 10:07:46+00:00,"For everything. Have you noticed Portugal and Switzerland no longer have this problem?

Those dealers only exist because of the War on Drugs. Without it, there would be no black market, no violent gangs smuggling and dealing. There would be no fentanyl in Bayer's heroin brand dimorphine, and if there was, you'd have a fifteen foot long CVS receipt to prove it and sue.

This officer was killed by prohibition. It's a failed policy and doubling down will only make it better, not worse.

End the War on Drugs.",1
300,2019-11-07 05:03:28+00:00,"yet, even heroin is still used as a pain killer in some places legally, you'll find it being called ""diamorphene""",1
301,2019-11-07 03:41:39+00:00,"&gt; e nem de uma forma normal, ele morreu de cancer.

Se você parar pra pensar morrer de cancer é a forma mais normal que um super heroi poderia morrer. Bom mais normal que ser coberto por adamantium derretido ou virar pó porque o Apocalipse roxo estalou os dedos.",1
302,2019-11-07 01:54:47+00:00,Fentynyl is expensive. I dont see how cutting product is economical.,1
303,2019-11-07 01:53:54+00:00,"Barrios e Luan se viraram e abriu o buraco. Embora o Luan tenha sido heroi aquele ano, participou desse gol",1
304,2019-11-07 01:44:38+00:00,"I don't know how true that really is.  MDMA is not a drug you should take at home.  It is useful, but it is dangerous.  But so are all the opiates and derivatives.  I don't think DARE/WoD exaggerated the dangers, but it definitely killed the possibilities of positives from these drugs.  Hell even heroin is useful in a clinical settings, the UK uses it as a pain killer in some cancers.  They call it Dimorphine, but it is still chemically the same as heroin.  

While I'm excited to see all the possibilities on these therapies, I'm definitely against allowing these chemicals out of the med centers and into the streets.",1
305,2019-11-07 00:43:30+00:00,"Acts 10:1 doesn't purport to be written in that time frame, and other historians such as  E Mary Smallwood  have suggested that parts are not in chronological order. The Pauline epistles themselves are not in chronological order, rather in order of length, so this would not be surprising. Other suggestions have been the soldier living away from his family.

In Acts 21:38, we hear of a Roman soldier asking Paul if he was that Egyptian, not the Acts declaring Paul to be that man. I don't see a problem here, the Roman soldier may have been mistaken. A quote from Barnes' Notes on the Bible suggests that according to Josephus, the Jewish leader hailed from the Jewish community in Egypt. I have not read Josephus myself to verify the references in the commentary, but here it is for your benefit:

&gt; Art not thou that Egyptian? - That Egyptian was probably a Jew who  resided in Egypt. Josephus has given an account of this Egyptian which  strikingly accords with the statement here recorded by Luke. See  Josephus, Antiq., book 20, chapter 8, section 6, and Jewish Wars, book  2, chapter 13, section 5. The account which he gives is, that this  Egyptian, whose name he does not mention, came from Egypt to Jerusalem,  and said that he was a prophet, and advised the multitude of the common  people to go with him to the Mount of Olives. He said further that he  would show them from thence how the walls of Jerusalem would fall down:  and he promised them that he would procure for them an entrance through  those walls when they were fallen down. Josephus adds (Jewish Wars) that  he got together 30,000 men that were deluded by him; ""these he led  round about from the wilderness to the mount which was called the Mount  of Olives, and was ready to break into Jerusalem by force from that  place. But Felix, who was apprised of his movements, marched against him  with the Roman soldiers, and defeated him, and killed 400 of them, and  took 200 alive. But the Egyptian escaped himself out of the fight, but  did not appear anymore."" It was natural that the Roman tribune should  suppose that Paul was this Egyptian, and that his return had produced  this commotion and excitement among the people. 

Finally, any issue between Paul's representations in his early ministry and his writings at the tail end of his ministry should not be concerning. Paul extols us to be all things to all people (1 Corinthians 9:19-23). If his language and persuasion are different, that is to be expected from Paul. If he actually contradicts a teaching (e.g. says that circumcision is good in one breath and bad in another) that would be more concerning.",1
306,2019-11-06 20:56:34+00:00,Todo heroi tem sua origem,1
307,2019-11-06 17:48:58+00:00,"Thank you so much for sharing your experience and yes my sweetheart boyfriend is driving me so they said they can give me fetanyl as long as I have a driver. They also inject my cervix with a local anesthetic, I just hope it’s fast and that I don’t feel too much pain.",1
308,2019-11-06 17:44:03+00:00,"Anyone here read Christopher Hilton's book(s) on Senna? I'm reading ""The Life of Senna,"" by Tom Rubython, and it's kind of crap, frankly. It's about half race results and photos by page length, which isn't in and of itself a bad thing, but the biographical text is also almost exclusively race events - Senna's 1985-1987 relationship that included a marriage engagement somehow didn't make the cut. Hilton wrote quite a lot about Senna, but he's described by Amazon reviewers as clearly being a big fan, though, so I'm worried about white washing. ""Ayrton Senna: O Heroi Revelado"" looks good, but I haven't seen an English translation.",1
309,2019-11-06 17:38:17+00:00,"When I first read the post, I saw he was smoking Fentanyl.  This is why I said that titration is almost impossible using street pharms, because of the lack of consistency in product.  I am in the Southeast as well and NOTHING is easy to get here.  I am from a Southwestern state, originally, and was transferred to the SE by my then employer.  I came here with documentation, CT scans, Neurologist's reports, MA's reports (I work with an MA to verify I'm not psychologically addicted) and not one Dr. here would help me.  I had to go to the Methadone Clinic here for almost a year until I found a Doc.  I was hoping there would be a chance he could find MSContin, Oxycontin, something like that so he could titrate that way.  Im sorry if I came off as drug privileged.",1
310,2019-11-06 17:11:48+00:00,"GRABBIN HEROI-

err I mean adrenaline",1
311,2019-11-06 16:53:03+00:00,"This is typical shit dude, your showing how fake you are. Purdue Pharma, the makers of oxycotin were found guilty of bribing doctors to push oxycotin, exasperating the opoid crisis. And they are still in court over a settlement. This is one example of wrongdoing in the pharmaceutical sector.

 [https://www.pbs.org/newshour/health/jury-says-drug-firm-founder-guilty-of-bribing-doctors-to-push-opioid](https://www.pbs.org/newshour/health/jury-says-drug-firm-founder-guilty-of-bribing-doctors-to-push-opioid) 

 [https://www.wbur.org/commonhealth/2019/10/08/sacklers-purdue-oxycontin-denied-motion-dismiss](https://www.wbur.org/commonhealth/2019/10/08/sacklers-purdue-oxycontin-denied-motion-dismiss)",1
312,2019-11-06 16:37:48+00:00,So we should legalize Fetanyl and Meth is what you're saying.,1
313,2019-11-06 16:02:19+00:00,Heroi- I  mean Adrenaline here \*injects self\*,1
314,2019-11-06 14:37:59+00:00,"""yes, I have this cold that just won't go away so the doctor prescribed Viagra and oxycodon""",1
315,2019-11-06 10:37:22+00:00,"I shared 3-MeO-PCP, 3-MeO-PCE, 3-Ho-PCP and 3-Ho-PCE with both a male and female in their early 30s for experimental pain management. The female suffering from chronic back pain and the male suffering from nerve pain. Both being prescribed Oxycodon by a professional related to these issues.

Both reported 3-Ho-PCP as most effective out of those 4 for reducing pain as were they reported 3-MeO-PCE as least effective for pain management altough they both seemed positive towards 3-MeO-PCE as a substance on its own.

Related to mania it probably isn't advisable to use any of the mentioned substances on a frequent basis but the results are very interessting to me nonetheless.

I personaly experienced 3-Ho-PCP as very similair to 3-MeO-PCP with a slightly different ring to it. The hypothesis that 3-MeO-PCP has inactive metabolites  that require similair enzymes for breakdown could have some merit to it wich is could be relevant regarding half-life. It is perhaps part of the reason people tend to recommend a minimum of a 3 days in between 3-MeO-PCP use.",1
316,2019-11-06 09:40:44+00:00,My guess is these junkies are starting to run out of oxycotin.,1
