,date,body,score
293,2019-06-11 14:55:03+00:00,"All of the estimates you keep listing are from 2016/2016 bud. You're still failing to realize that the number coming has INCREASED SIGNIFICANTLY since these estimates were made and **THEY DO NOT ACCOUNT FOR THAT**. The estimates are only accurate if we the number coming in stayed consistent with 2015-2016 but thats not the case. We're on track to doubling that. Which means the ""estimates"" would be higher than they were.   
  
&gt; If you think their estimates are wrong, feel free to write a paper disproving their math and get published. If not, you're just hollering ""fake news,"" and we're all sick of hearing it.  
  
It's simple bud. If the average number of apprehensions has been around 400k-500k and their estimates are around 11M. Year to date we have had about **675K apprehensions ** which is WAY HIGHER THAN BEFORE WHICH MEANS THEIR ESTIMATES DO NOT ACCOUNT FOR THAT INCREASE.   
  
I build predictive models and do this type of analysis daily. You're making assumptions without knowing what you're actually saying. Your hypothesis was true until this year.  
  
 &gt;  They pay taxes, unlike Trump. Yes, I know that the right-wing idiot machine says they don't, but they are taxed through payroll taxes, and pay $12 billion more in SS taxes than they collect, and they are ineligible for most tax benefits (except emergency medicaid).  
  
Do you truly believe all **illegal immigrants** pay taxes? lmao It's literally **illegal** for them to work a job bud.  
  
https://www.fairus.org/issue/publications-resources/fiscal-burden-illegal-immigration-united-states-taxpayers  
  
In 2017, the total cost of illegal immigration for the United States – at the federal, state, and local levels – was approximately **$116 billion.**  
  
Evidence shows that the tax payments made by **illegal aliens fail to cover the costs of the many services they consume.**  
  
A large percentage of illegal aliens who work in the underground economy frequently **avoid paying any income tax at all.**  
  
Many illegal aliens actually receive a net cash profit through refundable tax credit programs.  
  
It's better to be an illegal immigrant than a US citizen. You're literally suggesting that you want to pay billions to anyone that is able to illegally cross our border and avoid the legal process instead of those billions going to US citizens....... We have millions of people in poverty yet you want to just give our money away to illegal immigrants....... Thats the crisis and thats why you all sound so dumb supporting it.  
  
&gt; they don't vote. They can't.  
  
Jesus, you guys are delusional.  
  
https://www.fairus.org/issue/societal-impact/noncitizens-voting-violations-and-us-elections  
  
If we take the mean of these three estimates -- 7.25 percent -- and apply it to just the 22 million non-citizen residents currently in the United States, then **approximately 1.6 million non-citizens vote every year.** According to the high and low estimates here, that number could be as high as 2.9 million (at 13 percent of 22 million), or as low as 528,000 (2.4 percent of 22 million). Both are unacceptably high numbers.  
  
So by supporting illegal immigration you supporting putting illegal immigrants before US citizens, your taxes go to them and they're actually getting rewarded for getting across our border. You're giving priority to **illegal** immigrants over **legal** immigrants.  
  
Now let's look at all the other stuff that you try to ignore -  
https://www.cbp.gov/newsroom/stats/cbp-enforcement-statistics  
  
About 10K criminals apprehended a year. How many of these do we not catch?  
  
Average per year -
50K lbs of cocaine  
5k lbs of heroin 
40K lbs of fetanyl  
  
If you didn't know, you encourage that too because that comes with allowing anyone to cross our borders without going through the legal process or through border security. Plus all the cartel members than you're suggesting should be allowed to freely cross our border.  
  
You're encouraging [all these people dying at the border](https://www.statista.com/statistics/455890/immigrant-deaths-near-the-southwest-border-in-the-us/)  
  
You're supporting and encouraging [all these crimes](https://www.illegalaliencrimereport.com/)  
  
 CHARGE: ILLEGAL ALIEN BROTHERS, WOMAN HAVE BEEN RAPING CHILDREN FOR 15 YEARS  
  
MORE THAN 500 POUNDS OF MEXICAN METHAMPHETAMINE SEIZED IN ARIZONA  
  
 ILLEGAL ALIEN KILLED THREE TEENAGERS IN DRUNKEN CRASH IN OREGON ‘SANCTUARY CITY’  
  
PREVIOUSLY DEPORTED: A RAPIST AND A CHILD MOLESTER WERE RE-ARRESTED IN CALIFORNIA  
  
ILLEGAL ALIEN COLLECTED $20K IN WELFARE BENEFITS USING STOLEN SOCIAL SECURITY NUMBER  
  
ILLEGAL ALIEN BROKE INTO APARTMENT, SEXUALLY ASSAULTED 5-YEAR-OLD GIRL  
  
POLICE: ILLEGAL ALIEN BRUTALLY RAPED WOMAN INSIDE UTAH SPA  
  
PREVIOUSLY ARRESTED ILLEGAL ALIEN KILLS TWO PEOPLE IN DRUNKEN CRASH, GETS ONLY 12-YEAR SENTENCE  
  
CHARGE: ILLEGAL ALIENS GANG-RAPED 13-YEAR-OLD GIRL IN NORTH CAROLINA  
  
**That's only from june of this year...........**  
  
You can try to ignore all that evidence as much as you want but by supporting illegal immigration you're encouraging all of those things to continue happening. Those crimes are the tip of the ice berg. I can post tons of articles related to children being kidnapped, sold, trafficked to people so they can take advantage of our aslyum loopholes. That's why we have 11K unaccompanied children trying to cross the border.  
  
In statistics terms, all of your views and opinions are on the **assumption** that ALL illegal immigrants are good people which the data proves your assumption is not true. You want to reward anyone that can illegally cross our border and give them better benefits than you receive. Can you explain your reasoning for that? I don't understand that at all.  
  
How the fuck do you support all that man? That's some fucked up shit honestly. You can't deny it either as much as you want too or justify it. No amount of good people justifies all the other people that get hurt by allowing mass illegal immigration.",1
294,2019-06-11 11:52:34+00:00,"holy fuck this comment.

&gt;One of the killer comments I was told from them is when he was in the final stages and basically morphined up, it's a good time to get a few things off your chest that need to be said or you'll carry them to the grave too. If you think when you're dying people are going to be nice to you if you've been a cunt your entire life then you've got another thing coming. I let rip and I don't regret it. I can live my life happier now I've said it.

[link](https://np.reddit.com/r/unitedkingdom/comments/bza5xt/the_daily_mail_and_other_british_rightwing/eqr5218/)

That's one of the most disgusting things I've ever read, and I've spent over a decade on 4chan.


Fuck that is absolutely disgusting.",34
295,2019-06-11 10:26:56+00:00,"O Snowden nunca foi um heroi é até a minha vó sabia que os Estados Unidos espiam até mesmo passarinho, porque eles tem que ter um plano para tudo. Vamos ser honestos, era só uma questão de tempo até o Brasil do PT se virar contra os Estados Unidos.",0
296,2019-06-11 00:04:18+00:00,"well yeah do it a little at a time, read the bottle first and take a pain-relieving dose, bearing in mind it's three times stronger

I am opiate-naive and I did the same with three bottles of expired oromorph, do you really think you could put a fatal amount of oromorph in your anal cavity?",-7
297,2019-06-10 19:36:04+00:00,"This exeperince made me so paranoid about doctors. I don’t know if someone is trying to get money out or me or legit trying to help. It sucks. 

I found a local density’s that’s good but holy shot are there insane dentist out there. Had one try to prescribe me oxycotin because I complained about grinding teeth at night.",1
298,2019-06-10 19:34:56+00:00,"Umm no? Other drugs cost more than weed and would just not make economic sense to mix them with weed. Coke isn't really smokeable so it wouldn't even get people addicted. Trace amounts of coke also won't get you addicted. Also, people who smoke weed will definitely know if they aren't smoking weed. You can cut heroin with fenanyl because it has the same effect.",1
299,2019-06-10 18:28:36+00:00,"[Resumo do meteoro sobre a situação atual: Sergio Moro, o heroi dos tolos.](https://www.youtube.com/watch?v=tQJ1FJEVpkU)",9
300,2019-06-10 18:18:08+00:00,"I noticed fent and oxy/hydro-morphone has more of a rush to it, while some other kinds of heroin (tar) sometimes creep with a slow on-set even when IVing.",2
301,2019-06-10 18:11:03+00:00,As long as you don't take away my fetanyl I don't care.,3
302,2019-06-10 17:39:45+00:00,Ayup same with black tar heroin also morphene is just what power rangers do when they morph,3
303,2019-06-10 16:30:45+00:00,We could be twins. Was diagnosed at 11 with morphea. At about your current age I saw a different derm and they said my case looks more like atrophoderma of pasini and pierini. It's been a couple more years and I'm probably going to get a 3rd opinion as a new spot has appeared.,2
304,2019-06-10 15:46:03+00:00,"Didn’t know the company that made LSD, Sandoz, make oxycodon now",2
305,2019-06-10 12:23:00+00:00,"Photo by [Antiq](https://catalog.antiquorum.swiss/en/lots/rolex-lot-213-360)[uorum](http://archive.is/hK8zj). The estimate range for this watch was $80k-135k when it went to auction in 2009, but it went unsold.

This straight second hand isn't some incorrect replacement part; that's actually how it should be. Not all 6541's had the lightning hand...but almost.  I have one book that mentions early straight-hand Milgausses, and other than that this is the only pic of a non-lightning 6541 I can find.",3
306,2019-06-10 05:32:51+00:00,everybody gonna have. A fetanyl ove,1
307,2019-06-10 03:12:34+00:00,"I get migraines from opioids, especially hydrocodone/morphone, heroin and fent. Really helped me quit for good. Nothing like a relapse followed by lying in bed for 10 hours holding a tear soaked pillow over my head.

My advice, not that you asked for it, would be to walk away. Fuck, even find another destructive drug to waste your time and fill the void with.",3
308,2019-06-10 01:14:25+00:00,"I don’t know why you are being downvoted: I asked the exact same question. I have done heroin. I used to be an addict, but I’ve gotten sober now. To say that anytime you do heroin could be your last is being alarmist. Heroin is a surprisingly sneaky drug because it doesn’t screw you up that bad. You can go to work on it, it doesn’t give you hangovers, honestly you feel great. So you start doing it a little more and a little more till you reach the point where you get sick when you don’t have it. But it’s not like playing Russian roulette every time you do it. I’ve done it countless times and never come close to overdosing. Been plenty dope sick when it ran out though. Now what is dangerous is people selling fentynyl as heroin and then people dose as they would with heroin and die. This is where most of these overdose sprees come from. Legalization would fix this because people would know exactly what they are getting and it would be regulated.",7
309,2019-06-10 00:14:50+00:00,Just switch the heroin with some pure fentenyl and collect the insurance money.  Nobody will be any wiser and you can find the kids a new mommy who gives a shit.,47
310,2019-06-09 22:41:00+00:00,"I'd also like to add another point to the pro-legalisation column: regulation would prevent cocaine manufacturers and distributors from cutting their cocaine with fentantyl to lower costs, which leads to a lot of overdoses. 

 My intuition says cocaine is a lot more alluring than you suggest, but I'm also the kind of guy who buys motrin from three pharmacies so I don't look suspicious. Maybe my intuition is a little screwy on that point? I'm looking at the data from Portugal, as you suggested—an increase from ~1-2% in usage after posession was decriminalized. That's not a lot.



You raise a lot of good points and I'm reconsidering my stance.  I'm guessing that the best way to prevent serious harm is by providing economic stimulus to low-income areas, not by a Sessionite policing policy (which was always cover for stop-and-frisk anyway).",6
311,2019-06-09 20:31:50+00:00,FR. I got this feeling I hadn’t had since I was morphined in the hospital,3
312,2019-06-09 20:21:24+00:00,"Were you dating this girl? She clearly meant a lot to you for you to go to this extreme. Your life does have an impact but you just cant see it now. So many people care about you. Aparently some people care if you die just because you are human, ill admit i am not one of those people because im weird BUT do you really think being dead would help anyone? It will only cause pain to those who know you and those who dont.

I was talking to someone 2 days ago on here. Nice guy but felt like shit. I talked to him from sunset to sunrise. He told me he was in hospital for an overdose. He then told me that he just took enough morphene to kill him. The last i heard from him was that he knew the doctors would be along soon and that he would be fine. I barely knew him but the thought that he could be dead has worried me non stop. He was an awesome dude and idk if he is getting better or going 6 feet under. Now imagine this but its your family, or the girl. Try and imagine how much pain they would be in. How little they would understand. 

The best thing you can do is not die. Tomorow is a new day, and something cool might happen, if not tomorrow the day after, or the day after that. 

You have nothing to loose, so please stick around.",1
313,2019-06-09 20:12:39+00:00,Oxycotin is a drug.,27
314,2019-06-09 19:08:07+00:00,Lolz yeah i used to get hard on myself. Now i just accept it. I jstack cash and stay high on oxy morphone or codone all day and that's the life i live.,10
315,2019-06-09 18:23:49+00:00,Heroina en este economia? Alguna vez trataron de comprar heroina? Si las flores ya estan carisimas...,3
316,2019-06-09 17:26:21+00:00,"In 2011, the first year we kept stats on overdoses, there were 6 deaths.  Last year there were over 600.  Oxycotin was discontinued in 2012.  We didnt want people abusing oxycotin, so we made an alternative that was more expensive and couldn't be cut.   The largest contribution to the increase in overdose deaths is the discontinuation of oxycotin.  

When oxycotin was discontinued, users looked for a way to keep getting high and dealers looked for an alternative product to sell since you could no longer get a cuttable product from a pharmacy.  At the same time, governments cracked down on doctors and less oxy was prescribed (about 48% less from 2012 to 2016).  This resulted in fentanyl being used as a replacement.  

I'm 100% on board with supervised consumption sites only because they save taxpayer money.  We have shown that previous governments actions on this file have actually made the problem much much worse.   Overdose deaths have increased over 10,000% since 2011. 

Generally speaking, conservatives aren't going to be supportive of taxpayer dollars to help junkies get high.  Especially when those dollars are used to fund clinics that bring inevitably increased crime and drug use in the immediate are.  If we want to get through to those that dont support the sites, we need to make a financial argument, not an emotional appeal.  People are going to be apprehensive about a safe consumption in their community, especially outside of metro areas.   Even though I completly support the sites, I sure wouldnt want one in my community. 

I have family and friends who struggle with addiction.  I don't know the solution, and I don't think anyone does.   The cycle will continue until we figure out how to prevent people from using for the first time.  It is nearly impossible to stop using these types of drugs once they have started.",1
317,2019-06-09 16:08:30+00:00,"I think what this person's also asking is: Is the Fetanyl there because of the cross-contamination of the same person manufacturing the drugs and not sterilizing equipment, or are they *intentionally* adding Fetanyl filler because it's cheaper or more accessible and blends in with the heroin, causing a riskier, but higher high for the users to want to come back to? This is my guess. 

(I'm also assuming Fetanyl is cheaper/ more accessible? And if yes, why is it? )",3
318,2019-06-09 15:18:26+00:00,"Serotonin, Dopamin, Noradrenalin, Oxycotin, Vasopressin und viele mehr, vorwiegend Opioide - auch die Glucokortikoide sind erhört. Die meisten Katecholamine steigen nach dem Climax nur 15% an, Oxytozin hingegen 20-360% für bis zu 10 Minuten nach der Ejakulation. Die neuroendokrinologischen und neuropharmakologischen Vorgänge sind aber derart komplex, dass die genauen Vorgänge auch heutzutage nur teilweise und oberflächlich verstanden sind.",1
319,2019-06-09 13:36:22+00:00,"Bej magji si heroi yt Harry Potter kur jam me motren tende. Sot do provojm anal me shkopin tim magjik ne “kapen” e saj. I’ll bring duct tape, so you dont have to hear us in her room. 😀",1
320,2019-06-09 13:28:54+00:00,"You have some serious misunderstandings.

Every time it rains in Vancouver the rainwater from all of Vancouver's natural drainage streams which were covered over and diverted to make parking lots gets mixed into Vancouver's raw sewage system. Every drop of oil on the street from poor as fuck Vancouverite suburb commuters shitty-ass unmaintained vehicles 'cause they can barely afford to pay their million-dollar McMortgage gets mixed in with all Chinese skuzz in China-town who are dumping their deep fryer grease into the sewer with all of the pesticides that Kitsilano hipsters put on their lawn.

This mix of raw sewage, grease, pesticides, used paint, rat poison, used fentynyl needles, cigarette butts, plastic water bottles, used condoms and dog poop gets washed into English Bay completely untreated every time it rains in Vancouver and the sewers overflow. Basically 5 days a week.

BC's Coast is being destroyed because Vancouverites are filthy disgusting pigs who wallow in their own filth and refuse to clean up their homeless drug-addicts and tent cities and fix the problem with urban sprawl, not because double-hulled compartmentalized tankers with redundant safety features escorted by tug-boats guided by a professional Vancouver Harbour Pilot are spilling oil.",-10
321,2019-06-09 12:23:08+00:00,"mac miller also OD'ed on fetanyl. Right after his death he announced his ""tribute"" album, despite really having any ties to him. the little shit will do anything to stay relevant. He backpedaled and removed

still wouldn't wish death upon him. Benzos, drugs, and fame during your teenage years would fuck up anyone. Still a garbage human being though",3
322,2019-06-09 12:09:17+00:00,Misscariges. Even with morphene. I think I kept the whole ward up :/,3
323,2019-06-09 06:31:39+00:00,"I was given two shots of fetanyl when they placed a chest tube in the ER after a pneumothorax (collapsed lung). One right before the procedure, after the lidocaine, and another one right after.

They didn't double me up though, they brought in two syringes of the stuff (along with about 8 lidocaine syringes) and scheduled the dose that way, about ten minutes apart.",1
324,2019-06-09 03:57:15+00:00,"The following comment by morphene-io was *[openly](https://snew.github.io/r/CryptoCurrency/about/log)* greylisted.

The original comment can be found(in censored form) at this link:

np.reddit.com/r/ CryptoCurrency/comments/bxximi/-/eqabm5b?context=4

The original comment's content was as follows:

---

&gt; You can also find us on Discord at https://discord.gg/V9an5ur or Telegram https://t.me/morphene_chat",1
325,2019-06-09 03:48:43+00:00,Is fentanal cheaper than heroin?,1
326,2019-06-09 01:58:10+00:00,"its not tho. as someone ""in the know"" shit these days is nothing like it was 10 years ago.

Its not the heroin thats killer. Its the ""heroin"" thats actually fentonyl/carefentonyl.

These are relitively new drugs. Back when I went thru this shit, none of that shit existed. straight up, if I went thru the shit I did then, now, I would prolly be dead!

I stay in the scene as a non user because I am willing to use my knoledge to help others dose safely. The fact of the matter is your not going to stop people from using, but I feel I can help to give addicts the time they need to come to the realization they actually do need help.

Very few addicts live a long life. Iether they die of OD, or they shake their addiction. I intend to save as many people from ODing as possible.

The fact of the matter is no addict is proud of their habits. but that is what makes it an addiction. it literally overrides/hotwires your brains reward systems. a lot of non users think its just a pleasure thing, but its so much more. Once your on it, you psysically cant stop without going thru, at the minimum, 2 week long withdrawls which make you feel worse then any flu you've had. You can't sleep for weeks on end, and you know that all you have to do is just a tiny bit more and you can finally sleep again. It is a nightmare to deal with. It took me almost 5 years to ween myself off, and I only used for a lil over a year.",1
327,2019-06-08 23:00:54+00:00,"Filme de heroi é super mainstream, é praticamente o único gênero que dá dimdim fácil. Os de nicho que estão morrendo.",3
328,2019-06-08 22:53:48+00:00,"i sold percs and oxycotin to everyone. in order for me to avoid searches i would meet them outside the school before school &amp; they would do them before school started. i only allowed u to buy as much as u can handle in school.

i was caught after a kid paid me with a stolen check.",1
329,2019-06-08 20:37:49+00:00,That’s why there’s been an uptick in “heroin” overdoses. It’s being cut with Fentany.,6433
330,2019-06-08 18:52:16+00:00,"Nu merita nimic. Merita oamenii care trafica droguri grele, care profita de dependentele nocive care ii distrug efectiv pe cei care le consuma. Heroina, cocaina etc. Cand or muri oameni de supradoze de marijuana atunci o sa ""merite"" OP bulau.",3
331,2019-06-08 16:53:38+00:00,"Porque não faria sentido? 

Se Macri é hoje considerado socialista, antes era muito diferente. Veja esse exemplo ilustrativo

https://www.gazetadopovo.com.br/rodrigo-constantino/artigos/o-liberalismo-e-o-heroi-o-socialismo-e-o-vilao/

Nada impede que o Bozo seja considerado assim no futuro. É uma questão de conveniência.",1
332,2019-06-08 16:06:37+00:00,"We're these doctor friends anesthesiologists? Do they realize that fentanyl is not a myocardial depressant in the least? The only way a patient would die from dose even larger than this is if they were not intubated and being mechanically ventilated. Basically would be a herojn overdose. You would basically stop breathing. I give doses over 500mcg routinely in orthopedic surgeries and the patient wakes up in an hour or so just fine. It's not like a large dose of potassium which stops your heart or taking 500 Tylenol pills which kills your liver and then you die.

Obviously fentanyl without life support and you're a goner but not otherwise.",1
333,2019-06-08 14:03:26+00:00,"resumindo: coloque todos os seus herois no nivel 87 entao compre creme anti-morte e coloque todos com ""acessorios"" de dano, vexx:192% de dano, 200 de dano em unidades atordoadas, ataca 120% mais rapido. Os demais vc usa: 72%de dano para todos, 200 de dano em unidades atordoadas, ataca 120% mais rapido(1 pra cada heroi)  


deixe seus herois matarem os chefes até onde der, quando nao for possivel nas ultimas fases use destruição. (lembre-se que são 9 itens de destruição, nao use antes da fase 3442)",1
334,2019-06-08 06:58:21+00:00,All the best boys! 6SIR is having mono intake for your PTP catch at School 4,2
335,2019-06-08 04:09:20+00:00,"Lmao! If i can choose how i’m going to die, i’d 1000% do a decent size shot of heroin/fetynal followed by a ridiculously large shot of herojn/fetynal! Literally feel bliss for about 3 seconds before nodding out and never waking up!",2
336,2019-06-08 03:42:37+00:00,"Esta noicia nao tem nenhum comentario lá no site da g1(pelo menos nao antes desse meu comentario).
Entao alguem precisava ser o heroi e criar um para esta noticia.

Não precisam agradecer. Só fiz o meu trablho nobres cidadãos!!",4
337,2019-06-08 02:53:57+00:00,would 90 15mg morphine sulphate and 100 2mg hydro-morphone do the trick?,1
338,2019-06-07 23:00:21+00:00,"&gt;It is actually a 'Jeffy'. Who could be scared of a Jeffy? ""Well, it's weed, mostly. Got a bit of opium in it, some heroin, crunched up E (ecstasy), Clorox, Methadone, Subutex, Morphone, and Peyote... plus some stuff that's unidentifiable, and I think a little bit of Angel Dust if I'm not mistaken.""

It's a quote from the movie ""Get Him to the Greek"". Not outstanding, but that scene is hilarious.",1
339,2019-06-07 22:35:31+00:00,"Welcome to the heartland. The home of burning rivers, losing seasons, and tomatoes. So many fucking tomatoes. The perfect blend of affluence and alternate lifestyle; from farmers to frat boys; lake rats and city slickers. The curators of middle American style, locutions of near perfect American English. The capital of trafficking, fentanol, and Buckeye pride. Smoking is accepted, marijuana dejected, and drinking respected. An expanse of sun, and ice; often within hours of one another. The elbow of the north coast. 

Oh sweet Ohio...",8
340,2019-06-07 21:55:15+00:00,"Surgery premeds be like - IV midaz + fentantyl. If the anaesthesiologist is a mad lad, nitrous oxide too.",3
341,2019-06-07 17:17:20+00:00,"HEROI!

SQN!!",1
342,2019-06-07 16:22:25+00:00,❤️ extra fetanyl does the trick. Apparently I was a lightweight during the retrieval!,1
