,date,body,score
105,2019-07-24 22:40:09+00:00,"Thank you everyone for the information and recommendations, there have been so many responses I can't respond individually to each one but I appreciate them all. I'v always enjoyed getting my information and recommendation from other actual users but as i'm still relatively new to the scene (Only tried LSD starting about a year ago) I am going to take the advise the majority of you are giving me which is to wait a month or a few months before my next roll. I know at heart my desire for more is a mental desire to experience that level of connection and openness once again, it was a unique and wonderful thing but i'm happy to wait rather than risk ruining it forever. 

&amp;#x200B;

I'l get my testing kit soon, give it a test, and if it's not cut with Fetanyl (if people even do that with Molly) then i'l give it another go in a month, maybe a month and a half depending on how schedules line up but 30 days at the earliest which will be a month and a half since my last usage. If I do it within 30 days il have to back off for 90 because I know i'd be desiring it again immediately.

&amp;#x200B;

Thank you all again for your kind offers of information and recommendations. I will use them along with my research to be sure I never lose the effects of this drug, something that provide such a strong connection to the world and others is too good of a tool to let go to waste by using it too often.",1
106,2019-07-24 15:40:55+00:00,"Altas teorias da conspiração. Verdevaldo virou um heroi ""terceirizado"" para muita gente que tem vergonha de vestir abertamente a camisa do ""lula livre"".",1
107,2019-07-24 15:21:05+00:00,Jim Jordan a HeroI was just waiting for his moment.what a Hero🤗🤗,1
108,2019-07-24 15:18:43+00:00,"Not me but a close friend had shattered his knee cap and was given 160mg oxy. 80mg hydro, unsure amount of morphene and a LOT of hydromorphone, all IV. He was having the time of his life.",1
109,2019-07-24 14:45:11+00:00,"Could just be lazy. Also the cause of death for patients with illnesses like cancer are often listed as ""natural"" or specifically their illness instead of ""morphime overdose"" which is the true cause of death of most hospice patients.",1
110,2019-07-24 12:21:33+00:00,"Concordo completamente. Nao me opus ao Maxi, sempre foi caceteiro em campo, mas nunca o vi fazer merda fora de campo. Agora o Coentrao e um arruaceiro e ja teve inumeros episodios deploraveis, incluindo contra o nosso clube. Enfim, ja diz o outro: ou morres um heroi, ou vives o suficiente para te veres tornar o vilao.",1
111,2019-07-24 07:18:13+00:00,"
Que chistoso que me dices ignorante cuando sabias TU como se logro controlar la adicción a las heroina tan fuerte que se vivía en portugal?

Dando a los adictos heroina pura. Y me imagino que te preguntaras como no se hicieron más adictos y murieron.

Bueno, la gente buscaba heroina en todos lados, en la calle donde la heroina contenía mucha mierda. Y una vez se controlo a los pacientes adictos mejoraron mucho 

https://www.cbc.ca/news2/interactives/portugal-heroin-decriminalization/

El chiste es que el aborto tiene que ser igual, controlado, visto por expertos en materia, dar el servicio en vez de decir no, matas a un bebé, cuando la joven está en riesgo por dar a luz tan joven. 

El aborto, si lo prohíbe hermano, nunca lo desaparecerá, es como cuando los estados unidos prohibieron el alcohol y la gente tomaba moonshine que no estaba regulado y literal los dejaba ciegos y morían más personas por ingesta de un producto malo. 

Igual el aborto, nunca lo vas a parar. Desde los greco romanos ya se practicaba y hasta estos días. 

https://en.m.wikipedia.org/wiki/History_of_abortion

Conoce tu historia hermano. Me llamas ignorante pero sólo prácticas esa idea sin saber que nunca vamos a parar los abortos, y solo incrementamos el dolor, muertes, complicaciones y demás para mujeres y niños. 

Me dices ignorante sin saber realmente las consecuencias de traer a un niño a este mundo 

Me dices ignorante cuando traer un bebé que padres no pueden mantener, estoy seguro de que tu no te harás responsable de todos los bebés nacido que nunca se quisieron y los padres los pueden abandonar por no tener el dinero o responsabilidad para cuidar un niño. 

O te harás responsable del que todos los niños sumidos en la pobreza tengan educación digna, un hogar, comida y no sean explotados laboral mente (me imagino que has visto a niños vendiendo dulces en el metro) o sexualmente. 

Puedes asegurarte de que millones de niños no sólo nazcan, sino tengan una vida digna y segura aquí en México? 

Me llamas ignorante sin saber de qué este tema se trata MUCHO MÁS ALLÁ DE DAR A LUZ. 

SE TRATA DE QUÉ LOS NIÑOS DE ESTE PAÍS TENGAN UNA VIDA LLENA DE FELICIDAD, DESDE QUE NACEN HASTA SER ADULTOS CON OPORTUNIDADES, Y NO DE VIOLENCIA Y MALA EDUCACIÓN COMO SE ESTÁ VIVIENDO AHORA EN MÉXICO",1
112,2019-07-24 07:14:56+00:00,"seriously though test it, I had a good friend OD from coke that was laced with fentenyl",1
113,2019-07-24 03:17:24+00:00,"o cara salva a mulher e mata o bebe, grande heroi hein pqp",0
114,2019-07-24 01:54:40+00:00,"My dad blew a .3 after not drinking for 12 hours. Withdrawal was starting already at that point. I wonder what his daily level was... Hes dead too, I guess from booze, he doed at 64, heart quit suddenly. Could have justa s easily been fetanyl, who knows. Doesn’t matter.",1
115,2019-07-24 01:22:04+00:00,"Não conheço o suficiente do trabalho da Melanie Joy mas não sou grande fã da abordagem do Tobias. Esconder o feio só vai servir para que as pessoas nunca realmente percebem o porquê do veganismo, é possível ser direto e ao mesmo tempo respeito agora ""come queijo se quiseres e sê vegan(ish)"" é dar cigarros a viciados em heroina.",2
116,2019-07-24 00:26:06+00:00,"give it some time, they aren't xr, oxycodon xr would be like an oxycontin, its a 5 milli perc. If you've drank a whole lot you really won't feel the effects as much.

also keep in mind they have acetominophen in them (tylenol) not good to mix that with booze, bad on the liver

If you get nothing off of it, then wait until you are sober, and take 2",2
117,2019-07-24 00:17:00+00:00,"I'm gunna go ahead and call BS on this one. Even if they did every test possible to diagnose a kidney stone (urine, ultrasound, CT) I'd be surprised if you broke $5-6k. 

I went in for a kidney stone (knew what it was from my symptoms but I wanted drugs and didn't care what it cost me). They did a urine test and a bed side ultrasound along with a couple doses of fentinyl . Cost me $1800.",2
118,2019-07-23 23:34:41+00:00,Heroin isn't metabolized into morphine when injected it's metabolized into other things? And if the end goal of opiates is to break down to morphine how does hydrocodone/morphone and oxycodone work?,0
119,2019-07-23 22:55:31+00:00,"Opiates (Codeine, Morphone etc) are natural (components of opium). 
Opioids (Oxycodone, Fentanyl, Buprenorphine, Naloxone etc) traditionally refers to synthetically made drugs in the same class, so kinda the opposite of what you say here.

Although these days it’s commonplace for people to use opioid as a general term covering both (we can thank the media for that).",14
120,2019-07-23 22:19:06+00:00,"I really don't have knowledge here, just that my pain management doctor put me on the dose of Suboxone that was equivalent to the Oxyconton and Dilaudid I was taking. We don't have any plans to taper me off my current dose but I may ask him next appointment if he's aware of the 2mg limit, thanks!",1
121,2019-07-23 22:07:26+00:00,este homen é um heroi,1
122,2019-07-23 17:07:46+00:00,Morphea is a type of scleroderma. My official diagnosis from the dermatologist said Scleroderma. It's a confusing disease! Most people with it have skin involvement which is the morphea but some will have internal involvement too.,1
123,2019-07-23 16:24:34+00:00,"Me hace bastante gracia que uno de los comentarios con más votos sea este tan decadente, que parece que me estoy quitando de la heroina o intentando superar la muerte de alguien, aún así muchas gracias por los ánimos jajajaj.
Un abrazo!",4
124,2019-07-23 12:59:04+00:00,Diego é meu heroi,24
125,2019-07-23 12:57:17+00:00,"Leyendo comentarios abajo veo que la gente comenta desde sus propias experiencias, lo cual me parece lo mejor en tu caso ya que no estamos en un entorno clinico. Yo te voy a dar varias opiniones,  como fumadora y  como clinica, y tambien debo decirte que mis opiniones difieren con cada paciente, opino que lo que le va bien a una persona puede ser veneno para otra, y me explico como ha hecho todo el mundo poniendome yo de ejemplo. 

&amp;#x200B;

Por ejemplo con el cafe. Como sociedad, el cafe esta super aceptado y no se si habras escuchado alguna vez que tambien es una droga, lo es. Yo soy una persona extremadamente tranquila, a mi el cafe no me hace nada, y cuando tomaba mas de lo normal (mas de una taza) me daba unas taquicardias locas. Joder hace 2 meses tuve que mandar a un paciente a urgencias con taquicardias tambien porque se bebio dos redbulls de medio litro mezclado con su medicacion normal. Diras que coño me esta contando de red bulls y de cafes, con esto te quiero decir que hasta las sustancias que consideramos inocuas llegan a ser perjudiciales en grandes cantidades o cuando no se controla. Joder, sabes que es la potomania? Ha habido muertes por esto tambien, adiccion a beber agua, a tal grado que te jodes los riñones. Esto lo enlazo con el cannabis, dices que fumas felizmente, yo tambien fumo felizmente, trato un desorden hormonal que tengo con el, evito el dolor asociado, y tambien evito tomar pastillas. No se me olvida que es una droga tambien, pero en mi caso entre lo malo escogi lo menos malo, como cuando vas a votar.

&amp;#x200B;

El cannabis es un mundo, se puede tener una vida totalmente funcional mientras se fuma. He visto muy de cerca los beneficios en epilepsia, esclerosis multiple y dolor congenito, y son para tirar cohetes literalmente, sobrepasan con matricula de honor a cualquier tratamiento actual. No hay tratamiento medico para las migrañas, pero el CBD esta haciendo maravillas por ejemplo, tambien como antineoplasico y paliando las nauseas despues de la quimio.

 Lo que yo si veo muy a menudo es gente culpando al cannabis o a la droga de eleccion (videojuegos, movil etc) por todos sus problemas. He nombrado ""drogas"" con dependencia psicologica pero no fisica.  Yo podria quedarme en casa fumando y no ir a currar, o podria haberme quedado fumando y no ir a la facultad o a estudiar, lo que no voy a hacer es culpar a una droga bastante inocua dejame decirte (ya que no hay dependencia fisica como en la heroina por ejemplo) por dejarme llevar en placeres hedonistas. Reconozco que el cannabis favorece el hedonismo, abandonarte a placeres y no hacer nada, es muy relajante y por eso funciona tan bien en ansiedad (otra vez en bajos niveles, proporciones 1.1 de thc y cbd, mas thc que cbd por ejemplo es ansiogeno) . Dicho esto, otra cosa que he visto en consumidores habituales de cannabis es algo que los psicologos denominan como ""sindrome amotivacional"". Esto no esta recogido en la DSM y a dia de hoy dudo de si es un sindrome real, el caso es que si he visto en consumidores que pierden totalmente la motivacion y pasan de hacer vida social y tal, lo que no se es si culpar directamente al cannabis o a una depresion latente o que se esta manifestando, por estos consumidores que viven atrapados en el mismo dia a diario, el dia de la marmota. No se si hay causalidad entre el consumo de cannabis y la falta de vida social/motivacion, sinceramente ahi no se que decirte, pero voy a ser coherente, seguramente sea una mezcla de ambas, depresion y cannabis.

&amp;#x200B;

Otra cosa que si tengo que comentarte son las edades donde empezaste el consumo. Empezaste muy jovencito, y es cierto que el cannabis no crea dependencia fisica, pero si psicologica (el habito), y la nicotina crea bastante dependencia fisica, aparte refieres que tienes alta tolerancia a esta. Yo a mis pacientes a no ser que me refieran sentimientos egodistonicos/ que me digan oye esto no me funciona en mi vida, no estoy feliz con esto, no intervengo. No depende de mi decidir que es un comportamiento normativo, que esta bien y que esta mal, no soy dios, pero se que muchos profesionales clinicos y sobre todo en estos ambitos de la salud mental si que se consideran dioses. Te voy a decir que sea peor fumar tabaco y cannabis que usar opiaceos? te voy a decir que es peor fumar cannabis que cambiarlo por antidepresivos o ansioliticos? jamas. Todo el mundo tiene su droga para sobrevivir en esta sociedad de mierda desgraciadamente, aun asi por favor no escojas la heroina ni la cocaina para hacer frente jaja. 

&amp;#x200B;

Si despues de toda esta biblia que te he escrito (si la lees) decides dejarlo, sin cambiar una droga por otra, me parecera fantastico, tu eres quien conoce tu vida mejor que cualquier clinico especializado en adicciones, aun asi si quieres consejo escribeme que estare encantada de facilitartelo. Un saludo tio, y mucha suerte",3
126,2019-07-23 08:02:43+00:00,"Seconding gluten free. I tried it for my morphea but I had a lot of other problems at the time that cleared up in days. The morphea patch took a while to heal from the cream that I had been putting on it though, so I can't be 100% sure that gluten free put it in remission. But it did go into remission, and it had been getting steadily worse up to that point.",1
127,2019-07-23 05:37:08+00:00,"This isn't really a crime, but I'll post it anyway. I had a friend named Trent, and he and I were best friends ever since the 2nd grade. Unfortunately, his father switched companies and he had to move to Seattle. He recently came back to California to visit. We were having fun and all, and he suddenly tells me that he's been doing some drugs, like cigarettes and weed. He then told me that he was addicted to Oxycotin. I'm no longer friends with him.",1
128,2019-07-23 04:11:22+00:00,"yeah no kidding, especially when tons of NFl athletes talk about how smoking weed helps them manage their pain. and is way better than those oxycodon doctors like to give out.",3
129,2019-07-23 02:02:51+00:00,"I have fructose malabsorption. Yay! I can barely eat or drink anything. 1/20,000

I had a skin/autoimmune condition called morphea: it's a temporary localized autoimmune disorder, so essentially, I was allergic to my skin on a spot on my stomach, and now it's a scar that will last forever.
1/50,000",113
130,2019-07-23 00:34:54+00:00,"&gt; And yet nobody has

It was the first words out of your mouth. And no you’re wrong, the problem is opioids, not fetanyl. Fetanyl is one cog in a giant machine. You don’t know what you’re talking about and I’m done with you. You’re too stupid to continue this with.",1
131,2019-07-22 23:51:23+00:00,"SD é heroi nacional e com motivo. Mas quando o argumento do pessoal se reduz a ""estilingue não é avião"", ignorando o Flyer 3 que voou sim antes do 14 bis, eles simplismente não querem aprender. Isso não significa que a contribuição do SD não tenha sido importante, talvez ainda mais importante do que os Wright por conta do que veio depois.",4
132,2019-07-22 23:42:11+00:00,Esse não é o ponto do colega ali. Ambos são opióides. Mas Oxy não é Heroina em pilula. O burraldo tá espalhando desinformação.,1
133,2019-07-22 22:46:53+00:00,"THIS. I walked away from a 3 year Perocet habit in a few weeks, but I still can't avoid crap food.",9
134,2019-07-22 22:42:39+00:00,"I'm sorry to hear that you got the C...I know things have changed with pain management.  I was on Methadone, Dr. Perscribed and he closed shop. I got right into PM,after they made sure i had top notch insurance. They continued the 80mgs of methadone a day until they suggested me switching to another med. That was the fentanyl patch. I was on 100mgs to 80mgs when they cut my methadone to 40 and put a 25mcg patch for 2 weeks and then no methadone and a 50mcg patch, which wasn't cutting it. My next appt. Was a 75mcg and some oxy for breakthrough. Worked great for getting off methadone, completely covered my pain any withdrawal or PAWS. I Screwed up at my Pain Clinic and they did a very fast taper from 200mgs of Oxycontin and instant release oxy. I had rotated from the patch to Oxy. It was that or go to 100mcg patch which at the time I wanted off of it, side effects (withdrawal,severe anxiety mostly) patch wasnt lasting 48 hours. my primary has been kind enough to perscribe methadone for now. It's just enough to take the edge off pain and withdrawal. I was ready to go back to a methadone clinic and might still have to as no going any higher from primary doc. Oregon is becoming the worst state for pain clinics. Taper task force is trying to completely take pain patients off LONG term opioids. I dont have cancer but have severe spinal issues and if my primary Dr. Is forced to taper me off the small amount of methadone I'll be going to a clinic. Which I will hate but what else is there? I guess my point is I think with being in your shoes trying a pain clinic and ask about the duragesic patch. I'm calling around pain management clinics, there are still some treating Cancer patients and case by case other illnesses. There seems to be some wiggle room with the patch and the guidelines for morhine equivalent..",1
135,2019-07-22 22:28:48+00:00,"The only drug I’ve had that literally stopped a trip for me was fetanyl, which I don’t recommend.  Benzos just make me not give a shit and have zero anxiety.",2
136,2019-07-22 19:51:47+00:00,"Listening to fentanol documentary as I read this. Lol. Dark, tho.",0
137,2019-07-22 19:17:23+00:00,"Eu vejo muita desinformação nos comentários aqui, como se apenas os estados democratas são os que sofrem com esse problema de homeless e opiodes, o que é besteira, típico de quem não entende nada e quer relacionar política com uma crise que não tem nada a ver com isso. 

&amp;#x200B;

Primeiro, esses são provavelmente viciados em heroina e metanfetamina. Esse problema é tão grande nos estados unidos quanto o crack no Brasil. 

&amp;#x200B;

Tudo começou há anos atrás quando os americanos receitavam Oxycontin (heroina em forma de comprimidos) para QUALQUER dor que sentiam, até mesmo após sairem dos dentistas. Isso tudo tornou a droga muito comum e banal entre os jovens, o que acarretou em inúmeras mortes por overdose e obrigou o governo a interferir e liberar o medicamento apenas em casos extremos. (Existe um episódio que as pirulas foram distribuídas de graça na Flórida)

&amp;#x200B;

Os viciados em heroina tem o mesmo problema que os de crack, simplesmente perdem vontade de viver e só vivem em relação ao vicio, por isso geralmente viram moradores de rua. O que o cara está mostrando em Los Angeles não é diferente de muitos outros lugares americanos, com estados republicanos. Inclusive, California nem está entre os estados com mais usuários de heroina nos EUA ( [https://www.drugabuse.gov/drugs-abuse/opioids/opioid-summaries-by-state](https://www.drugabuse.gov/drugs-abuse/opioids/opioid-summaries-by-state) ).",0
138,2019-07-22 18:56:07+00:00,Na verdade é. Mas a maioria são viciados em meth e heroina. Os americanos tem um problema maior que Brasil em relação ao crack e são os opioides.,1
139,2019-07-22 18:08:19+00:00,"I'm British, am basically bottom 5% and got care from some very highly regarded specialists surgeons this year. Six hour surgery, five day hospital stay, IV oromorph while in and a week's worth of pain meds on discharge and I paid bupkis.",4
140,2019-07-22 15:55:04+00:00,"Says the guy who thinks someone would put fentnyl in coke. A drug that is so dangerous it wouldn’t be worth it (you couldn’t add more than like .1grams. How is that worth cutting?) and has a 100% different active effect than cocaine, which would also defeat the purpose. You literally sound like a moron.",1
141,2019-07-22 14:19:19+00:00,Better than being owned by oxycotin druglords? Possibly,31
142,2019-07-22 10:15:32+00:00,"Consertei pra vc:

Um *fascista* foi empurrado pra debaixo de um caminhão por um *herói.*

Um cadidato *fascista* foi esfaqueado por um *herói.*

Uma mãe *facista* foi agredida na frente do filho por um *heroi.*

Ou seja: não quer apanhar de um herói, não seja fascista.",1
143,2019-07-22 06:23:40+00:00,"I totally can relate. Have you talked to your pain dr about switching your breakthrough meds? I do  oxy for 2-3 months then switch to dilaudid for 2-3 months then back to oxy.  When my pain isn’t off the charts I enjoy the hell out of both, but the constant switching seems to help tolerance issues. I don’t give my body long enough to get used to any one med. 
I have zero scientific data to back this up, and it may just be a way to mindfuck myself, but I swear it works for me. 
My dr uses the conversions for mg of morophine to figure out the doses but basically 10mg oxy is 4mg dilaudid",2
144,2019-07-22 03:07:31+00:00,"I have a rare skin condition known as Morphea. It looks bad but its harmless. Used to be really insecure about it, now I accept and even like my spots 😊",3
145,2019-07-21 20:06:21+00:00,"Créditos a : cómo está la línea” (grupo de fb) y a mi que la subió, ni pude evitar tomar la foto.
En serio dame crédito o te denuncio el post.
Y los gringos no se veían pedos ni Olían a alcohol, más bien estaban bajo el efecto de la heroina",1
146,2019-07-21 18:15:23+00:00,"Well Obama didn’t call it a crisis because it really is not. The number of illegal aliens had fallen steadily since 2000 - I can find you multiple and reputable sources for that. I don’t think its in dispute.
But fentanyl is pretty ugly. Unfortunately even if we could keep imports from Mexico out - it comes by vehicle mostly, so that means it fets smuggled in at ports of entry or semi-submersible craft, or flown in - very little has to do with a need for a physical wall - even if, Chinese fentanyl is nothing to sneeze at. Back in the nineties “China White” heroin was king. Now Mexico is growing more opium and Trump asked China to reclassify fetanyl as a controlled substance or something. Have to look the last one up.

What we really need to is fix the “shithole countries” but that’s hard work against entrenched and well funded corruption. I don’t see the demand for drugs going down

So to recap tl;dr- immigration numbers going way down, mexico not the only source of fentanyl, drugs don’t come on foot, immigration issue is more complex than a simple border wall.

You’re making me work!",1
147,2019-07-21 16:31:18+00:00,Well we do tend to heal poorly and get keloid scarring. It could jsut be that. However some can see it start from trauma. I'd jsut make sure to bring it up to your doctor. I heal poorly now but my Morphea tends to stay on my one leg.,1
148,2019-07-21 15:36:07+00:00,I’m sorry to hear that. So if you have just Morphea can you not have other forms of Scleroderma? Or can Morphea be a symptom of other types of Scleroderma?,1
149,2019-07-21 15:31:21+00:00,"I definitely have other issues. I also have issues with my joints. Basically I was diagnosed with rheumatoid arthritis 10 years ago. I drastically changed my diet and now they have given me the all-clear and said the rheumatoid arthritis is all gone which is kind of a miracle in itself. However I still have some issues with my joints specifically in my hands and fingers, but now I believe it is caused by the scleroderma and it is more an issue with the muscles or something. I have barely any grip and I'm often in pain. I get weird spasms if I overuse my hands. Writing too much with a pen hurts, or driving, or lifting bags, etc.
I have had gastroperisis and bad ibs and breathing and reflux problems that I was scared were Scleroderma attacking my body however since maintaining a very strict diet everything drastically improved except for my hands.

Where my morphea is hurts. My right arm was the first to get the morphea and now 6 years later it has finally started to soften and not hurt as much. But now I am starting to get morphea on the same area on my left arm and where the morphea is aches quite often and I experience spasms there sometimes.",1
150,2019-07-21 15:19:32+00:00,Do you only have Morphea or do you have other organ involvement? I was just diagnosed and am having a ton of other issues with joints etc. waiting to be seen by a Rheumatologist.,2
151,2019-07-21 12:29:33+00:00,"And morphine, addrenaline and norphine",-20
152,2019-07-21 11:20:40+00:00,Why can they not just give them a huge morphinr overdose,8
153,2019-07-21 08:01:09+00:00,"É pura justiça Ultimato bater ""Pocahontas no espaço em 3D"". É um filme bonito com conceitos legais, mas de resto? Bem meh.

Enquanto isso, Ultimato tem um assaulto temporal e a batalha mais estupidamente épica de filme de super-heroi.",1
154,2019-07-21 07:57:38+00:00,"It also depends on what kind of fentenyl it is. There's prescription hospital grade stuff like the patches and lollipops and what not, then there's China white, the street made shit.

 Is he saying these are pure fentenyl pills or mixed with oxy?",2
155,2019-07-21 05:39:17+00:00,"Eh dificil ficar orfao de heroi, mas te garanto que nao vai ser esse. Eu ja falei o mesmo sobre o doria e sobre o moro ha tantos anos quando eles brilhavam aqui no sub... agora o amoedo... pobre brasil. O novo eh uma farsa, desculpa.",1
