,date,body,score
0,2019-03-31 19:02:48+00:00,"A decaying deer head, fentenyl patches, a small painting by the famous musician Xavier Cugat. ",1
1,2019-03-31 18:41:46+00:00,300 percacets,2
2,2019-03-31 12:52:48+00:00,"Op, entendo que eh uma situacao mto complicada. 

Se vc pedisse um conselho eu diria para vc pensar mais sobre o assunto, até mesmo procurar um psicologo pra vc entender melhor seu sentimento em relação a essa situação. Vc não eh o super heroi que vai resolver as coisas, e nem deve ser. Não existe garantia nenhuma que a sua volta vai ajudar em algo.
Você hoje tem condições financeiras de ajudar a distância que talvez não tenha se morar perto, isso sem contar os sentimentos da sua namorada, já conversou com ela sobre o assunto?!

Cuidado para não se afogar tentando ajudar quem tá se afogando, isso não vai ajudar em nada, nem você, nem sua mãe, e nem a sua família.",36
3,2019-03-31 12:31:03+00:00,"**Aãɱthel**  (Imperial seat of ˈAnhouãɱtoɱ)

*  When was it founded

Aãɱthel in its current state  is barely a decade old, yet it has quickly become one of the most prosperous cities in the Empire.

* By who?

 Called Xikunkåtl before the Kaian occupation was the holy city of the nomadic Yisyânˈsi. 

* Who controls it right now? 

Commander Bãsev́ Key'paou has been granted full authority over  and the surrounding territory by the Kaian Empire after seizing it ten years ago although to keep a somewhat shaky peace with the Yisyânˈsi he has to  go through his son's maternal uncles due to tribal inheritance customs.

* Who lives there

Despite the conflicts between the empire and Yisyânˈsi , most are actually are ethnic Ki and Bure people who have been living in the area for centuries. Lower caste Ka have been flooding the city since the conquest, hoping to secure imperial land to improve their station.

&amp;#x200B;

* Why do they live there?

Water. Aãɱthel (lit. great desert well) is the only location in the territory able to support more than a few individuals permanently. The surrounding hard scrub also gives Aãɱthel added defensive properties 

  

*  What's it like living there?

If you're a Kaian with a sense of adventure, being on the fringe of a rather repressive society is quite liberating and the imperial settlement grants are plus as well.  Authorities here have little time or concern for your moral indiscretions as long you stay somewhat respectful of the Ɱåti xẽŝsâ. The Ki are different story as they are classified as traitors under imperial law with no rights and subject to execution. With the focus on securing the province and not losing the city as quickly a his predecessors have, Kay'paou basically listed them as part of province's public property. Bure are treated as Sikaian nationals and given only minimal attention by the new goverment. 

Daily life is hectic within the walls of the new anchor of the desert path, merchants and travelers bustling through streets exchanging goods as well as ideas from afar. Aãɱthelians basically live in the streets as most homes are little more than quick mudbrick apartments containing nothing more than a bed, small heater and washstand. 

The more conservative Ka thetsẽäyas deployed in the recent months to ""assist"" the commander find Aãɱthel and its leader morally bankrupt. Their growing efforts to get the province in line has begun to rekindle a slight unease about the future. 

&amp;#x200B;",2
4,2019-03-31 11:20:27+00:00,"If the “anti IV/gelling agent” is the same as in MScontin, add a smal pinch of table salt, it will prevent gelling. 
Like half a key bump worth of salt. Works great. ",1
5,2019-03-31 03:45:32+00:00,"When she died of a oxycotin overdose in 2012

other best friend: when she chose heroin (she's still alive but very lost)

My sister who was also my best friend is hooked on meth. 

My best friends are all lost
",1
6,2019-03-31 02:26:02+00:00,"I had my first baby in 1971. This is completely accurate. The nurses would get really pissy if you asked to see your baby. The babies lay there in their glass beds and cried too. And for some reason everyone got a perocet at bedtime. Actually is was percodan, with aspirin.  I think there were two breastfeeding mothers on the entire floor of the very big public hospital where I gave birth.  There was a smoking lounge at the end of the hall for the patients though.  It all seemed very normal at the time.",270
7,2019-03-31 01:56:36+00:00,"In spanish, we use heroina for both :)",5
8,2019-03-31 01:56:15+00:00,We use heroina for both in spanish :),1
9,2019-03-31 01:04:25+00:00,"**Aãɱthel**  (Imperial seat of ˈAnhouãɱtoɱ)

\-  When was it founded

Aãɱthel in its current state  is barely a decade old, yet it has quickly become one of the most prosperous cities in the Empire.

\- By who?

Called Xikunkåtl before the Kaian occupation was the holy city of the nomadic Yisyânˈsi.

\- Who controls it right now?

Commander Bãsev́ Key'paou has been granted full authority over  and the surrounding territory by the Kaian Empire after seizing it ten years ago although to keep a somewhat shaky peace with the Yisyânˈsi he has to  go through his son's maternal uncles due to tribal inheritance customs.

\- Who lives there

Despite the conflicts between the empire and Yisyânˈsi , most are actually are ethnic Ki and Bure people who have been living in the area for centuries.

\- Why do they live there?

Outside of Kaian merchants and soliders , most were settled prior for different reasons. Kiian refugees settled into the city to escape enslavement, relying on Yisyânˈsi.

&amp;#x200B;

&amp;#x200B;

\- What's it like living there?

&amp;#x200B;

&amp;#x200B;",1
10,2019-03-30 22:41:09+00:00,"I was about 17 and had impacted wisdom teeth so my mother gave me oxycodone so I could finally sleep, I had never taken anything stronger than a tylenol before. 

I was sitting at the dining room table and applying for jobs online when suddenly I really couldnt focus on the screen anymore, I felt tired so I stood up (too quickly) and nearly fell the fuck over. 

My mother didnt want me going upstairs to my room so she put me in the guest bedroom on the same floor. I felt very dizzy. I threw up later and my face itched so bad. I was incredibly anxious the entire time. 

I found out later I cant really take opiates because they cause severe anxiety and make me itch really bad. No matter if its prescribed to me or not.(tye proper dose) I have it listed in my medical record not to give me Oxycodon because they're worried about anaphylaxis. ",1
11,2019-03-30 21:56:02+00:00,How was it? I've always wanted to try both the morphones but never want to spend what they cost,1
12,2019-03-30 21:46:18+00:00,Damn. 6sir are one lucky bastard,2
13,2019-03-30 20:52:42+00:00,"That's a dumb question - I'm not a big fan of over-prescribing Ritalin (TM) and OxyCotin (TM), man. Szasz warned about that stuff. And told the psych school they were crazy for saying gays are insane - bio cause or not. Psychologist shouldn't be social police. They shouldn't be ""expert witnesses"" making big $$$ to decide who get the kids in a divorce (guess what? It's the parent with the most $$$ who gets them!). Doctors shouldn't be so easily persuaded by big pharma. Yeah, we got the science. Too bad the modern medical delivery system fucks up the science. That's not complicated, right? Go ahead and smoke your Twitter man. You're living in the modern dream state presented to you by corporate America.",1
14,2019-03-30 16:31:14+00:00,"The vast majority of drug overdoses are opioid related and are due to fentnyl being cut into the heroin, I think you would see less addicts dying if that were the case. ",4
15,2019-03-30 16:22:33+00:00,"no deeper issue, been happily married and have kids, no issues in our marriage, the first time her sister snuck into our house when we weren’t home, she has a key. then months went by and we never noticed because we don’t use the pills, when we finally needed them they were gone, we didn’t think that somebody snuck into our house when we were gone, didn’t even cross our minds, naturally we thought one of us had a problem that one of us were hiding from each other, it wasn’t like a huge blow out fight or anything, just a breach in trust we had never had. life goes on. fast forward a couple months, i had been put in the burn icu from a horrible accident at work, i got out and had oxycodine pills, her sister was at our house and the pills came up missing again, i will not forgive her or trust her ever again. My wife and i have a great marriage and test each other fully, and for her to cause an issue in my marriage at no fault of my own or my wife’s is unforgivable, she can fuck off as far as i’m concerned, i don’t need someone in my house stealing and causing issues within my family and household",1
16,2019-03-30 09:41:07+00:00,"Except they prescribe oxycodone and oxycotin. Then they stop, but they don't immediately prescribe methadone or something, so they basically tell a person that they got addicted to opiates ""Hey, you're done now and any fall out isn't my problem!""Then they end up turning to whatever they can get their hands on, usually heroin, and getting their fix. 

I'd highly recommend watching ""Warning: This Drug May Kill You""
",18
17,2019-03-30 08:06:55+00:00,"Nothing to be sorry for, it was more a headache than anything. 

The money was federally insured in a bank, so I got every dime back as soon as it was proven stolen,

She had to pay me restitution, that was a sweet few years getting that monthly deposit. The first few times I used it on bar dates and romancing woman of questionable morals.

And shit, it was a clean break, beats trying to run off an obvious heroin addict, imagine being on Oxycotin for major surgery and a heroin addict takes them all? Lol I think I got off easy",2
18,2019-03-30 06:33:23+00:00,"The only thing ive found on bunk police were these strips (https://bunkpolice.com/products/fentkit) and to combine that with this multi-kit (https://bunkpolice.com/products/mecke-spot-test-kit). If that is the only option, im all for it. However, i just wanted to make sure there isn't a kit that has fetanyl included in the testing, simply because it would be easier and waste less product. ",1
19,2019-03-30 04:19:31+00:00,"It's like that today. The military first aid kits (IFAKs) usually have this ""pill pack"" with antiobiotics etc...and a percocet/oxycotin/something like that. Needless to say all the IFAKs I've seen have had pill packs removed.",-1
20,2019-03-30 03:50:51+00:00,Mix pack will have a fun mix and be very beautiful and just be aware when you pick through the pods there will be variation unless you grind them all up and shake it all together to try and keep it as even as possible (obviously I'm preaching to the choir). Danish flag is beautiful and powerful and Lauren's grape I want very badly... 60p+mg morphone/100g pod yeah that's what I call a good poppynto grow. Sounds like a few good pods and it's a nice couple hour nap,1
21,2019-03-30 02:39:19+00:00,Probably the fentynyl,2
22,2019-03-29 23:02:14+00:00,"I had moments of regret say 6 to 8. The perocet and tylenol 3's barely touched the pain. Day 9, ate lasagne. The pain dramatically went away. You'll be fine and no you won't miss popping out tonsil stones. ",4
23,2019-03-29 22:13:44+00:00,"Old hippie here.

Back in the day, (1980s-1990s) I would ingest any random thing any person gave me. Why not? Sometimes it was crap that made me sick or have a bad trip, but usually I had a great time. Nothing ventured, nothing gain.

Absolutely NFW would I do that nowadays with this fentantyl crap getting into everything.  Test, test, test, and then test one more time to be sure.",26
24,2019-03-29 22:12:39+00:00,i’ve taken bars a lot and i usually always put it under my tongue so i can do the “taste test” it’s a super bitter bad taste but i don’t mind it because i know that’s what alprazolam tastes like but this tasted pretty much like nothing. i talked to my dealer and he said to take a full bar and assured me that they work. my biggest concern is obviously fetanyl but i’m pretty sure fet is more expensive than alp so it wouldn’t make sense to press it with that. hopefully it’s an RC benzo worst case senario,2
25,2019-03-29 22:02:48+00:00,You make mophine syrup? Whats your recipe?,1
26,2019-03-29 21:48:31+00:00,"Yep, he needs a dmg per swing, hp nerf. 

Same hp as kylo

Same dmg with sc as kylo

Heroi might nerfed 

Retribution strongly nerfed.

Passionate strike no knock down",3
27,2019-03-29 21:19:41+00:00,"yes  OP this actually is a great question !!!

I have been telling and retelling my story now for almost 3 years  I kind of try not to bore people that have heard it all before from me 

I co mod several  subs here at reddit snd among these  are:

r/drugs_info

I tell my chilling story several times over on that sub and others  

i did in fact nearly die  

i had a series of seizures and very neatly died  in hospital four days with those seizures  very  neatly  bouught the farm on tjat one!

i hurss i don't really talk about the gross horrors of klonopin  bc I really dont want scare people 

klonopin is a very deadly drug and it sh be very unavailable  

IMO  klonopin is way  more deadly than common heroin - remember I said H - not referring to deadly fentenyl here  

the point is klonopin is in its effects on your mind and body  many many times worse than  any othrr benxo i have ever encountered 

llonopin is a deadly killing drug wheteas  maybe xanax only screws with you in general  

but if you screw with klonopin there is a good posdibility you will die as a result of your ever taking one pill
of klononpin ...
the stories of death and destruction from klonopin are simply legion 

there seems to be a new yerrible story about kpins almost daily!

Obviously, I welcome this opportunity to warn anout klonopin !!

Klonopin can and will  kill you if you mis manage klonopin!

Do not ever  CT  grom klonopin ...

CT equals seizues and maybe death!

Everyone I have ever spoken to about klonopin tells me 

""I wish I had stopped klonopin more gradually!""

Never hurry and try a fast detox from klonopin it might put you in hospital if you are lucky  maybe dead if you are unlucky!

there is a very famous story about a girl maybe 30 yrs and a dr getting her addicted to klonopin ...

so the apparently very true story goes dr gets girl addicted to kpons  dr does not know shit about klonopin so dr sends his case to another dr  ...
you guessef it dr no 2 knows less than dr no1  so long and short of this tragedy is that the good  drs  conspire together to kill patient dr no 1 screwed up on  

tjis is all documented on a web site that i commonly cite to on r/drugs_info  but I dont have the exact name handy  but i think it is still up on www  as a momorial to the now very long dead girl  ...  

again the dr ends up killing the patient over a med error!!

OMG!  

no  OP you are asking me the right questions about klonopin here today!

ehat to do if you are addicted today with all that we now know ?

plan a gradual taper

follow the dr Ashton manual to the letter  about tapering all benzos  ... dr ashton rules!

never  CT  klonopin  .... if you gave to  CT  and i have IRL seen these cases of forced   CT  get to a hospital or an informed dr asap!

long and short of my story is i nearly dued  bc I was careless and I tried to  

CT from kpins ...  bad move!

I am now  way past the 9ne year clean and sober mark for  WD  all kpins ...

I talk about all tjis  ad neausem but the bottom libe us I am pretty  much healed from klonopin ...
yes  my friends know I have kpins issues  lije for example I what is called  
akesthesia  but more correctly called  ""electroplexis"" issues  ...

I even now feel lije there is electricity firing t/o my body  nearly 24/7  but I adjust  but this is a serious un takked about issue .... 

my sleep remains in chaos

my mind is ok  but jyst barely ok

i am aging maybe not very well

please , great question, ask me anything about klonopin!

Thank you!

I am swan

",0
28,2019-03-29 20:05:53+00:00,"&gt; El tema es que los problemas que afectan a una parte de la población, de ser inatendidos, se conviertenen problemas sociales que acaban repercutiendo a todo el mundo, actues de forma responsable o no.

me la suda



&gt; Por ejemplo, no ayudando a elaborar planes contra la drogadicción (incluyendo centros de tratamiento y salas de reducción de daño) hará que haya más gente con drogadicción, resultando en mayor cantidad de gente sin hogar y desempleada, mayor mortandad prematura, mayores índices de criminalidad en el barrio, y mayor tráfico de drogas a nivel global.

del mismo modo que no es ilegal suicidarse contándose las venas pienso que a gente debe estar libre de suicidarse con cocina/heroina/krokodil, de hecho la venta y comercialización de todas las drogas debería ser libre, si multas, licencia o cárceles 
",1
29,2019-03-29 20:05:00+00:00,"I guess I could do with just one Leper, Abom and Antiq for the moment. I also have the same thoughts with the Jester. I mean stress healing is good but tackling the sources of it are better. ",1
30,2019-03-29 19:36:24+00:00,"True but there is a lot more problems that are popping up as well. I am most concerned about all of the drugs (including the fetanyl coming from China) that are causing my city to keep plummeting to the ground. 

Used to be a safe place where you could enjoy life and now, it is a bloody mess now because of all of those damn druggies. 
Life is good but you tend to notice it more when it gets worse compared to when it gets  better. ",1
31,2019-03-29 18:49:29+00:00,"It was a pretty nasty wreck. Single car accident with a .37 BAC. Head first into a tree that didn't budge. Shattered my elbow into pieces and they had to put a buncha medal and screws in my arm. And yes, I'm still in chronic pain but rather go to a 'done clinic and still smoke weed and get 160mg's a day than go to a pain doctor/clinic where I can't smoke weed and only get 60 15mg MScontins and maybe 60 Norco 10s after already being scripted 120 'done 10s before which is ALOT stronger than weak ass 15mg morphine ERs and Norco's in my opinion. Gonna have to find a good pain doctor that'll give me something long acting and something short acting if I ever quit the 'done clinic. ",1
32,2019-03-29 13:16:17+00:00,"destMax is an argument only to the ""safe"" memcpy.  It's discarded by the macro that redirects it to the unsafe one. This would be akin to requiring a review of oxycotin prescriptions, but actually the doctor's office just discards the form and sends you down to the local heroin dealer.",34
33,2019-03-29 11:44:15+00:00,"They help with back pain because quitting cold turkey gives you the ultimate body pains in your life. Maybe thats what he meant. Any Pfizer brand that isnt from a chinese dude, nor told that theyre from canada (canadian ones are larger due to the dosage), then theyre fake AF. Usually cut with fentenyl, but if you really need that sleep, half benzo, half fenty isnt bad. Just don't make it a habit. Withdrawl from fake xans are 20 times worse due to fenty withdrawl. Only cop from ppl who say they can only get 90-120 a month. Shit, used to pick up someones script for the cheap. Network and youll find all you need",2
34,2019-03-29 08:07:18+00:00,"Você fez a coisa certa (exceto a parte de atravessar a rua sem olhar), nesses situações tem que dar um perdido no meliante entrando no primeiro estabelecimento que tiver. Se for numa rua com muita gente por perto gritar por ajuda também pode ser bastante efetivo.

Eu sei que a vontade de que esses malucos tomem muita porrada é grande, mas bancar o(a) heroi(na) é extremamente complicado até pra quem tem treinamento. Então é melhor só se livrar da situação.",4
35,2019-03-29 07:48:56+00:00,"Someone has too much faith in corporate America, money is more important to big pharmaceutical than peoples lives. 

Recently Oxycotin has come under the scope because the manufacturer of that was pushing it to people who didn’t even need a narcotic, simply for profit not caring of the side effects or addiction that may occur with extended use. 

If you think other companies don’t do the same or withhold treatments because current methods produce more money you severely underestimate their greed. ",-1
36,2019-03-29 06:45:44+00:00,"You're probably not going to like this but it needs to be said before you wind yourself into one of those sour tumblr mom's.

People are allowed to be proud. 

They're allowed to advocate/inform others on what they feel is best.

They certainly don't need to make sure everyone gets a pay on the back.

This isn't them doing anything bad. It seems more like you're disappointed with how things went and that's okay. It is.

I've had 4 babies.
Episiotomy with an epidural. Natural. Emergency section. VBAC with dimorphine.

All of my babies were born different but my natural birth was the least stressful. I tried to have that again with baby 3 and 4 but it didn't happen.
My placenta ruptured with baby 3.
The pain was too much with baby 4.
**THAT IS OKAY**

I don't need anyones validation to know that's fine. I don't need people to hide natural births for me because I didn't get it every time.

Things didn't go to plan and that sucks but I don't need people to tiptoe around me because of it.


You did what had to be done. ",4
37,2019-03-29 04:57:20+00:00,"This. It’s also worth noting that not only do these folks go in *knowing* the majority of professionals will judge them the instant they hear -done or -morphone so they’ve got their hackles up. And if they’re even kindof off track with their pain mgmt, they’re going to feel like shit emotionally and physically and that makes them tough to deal with and tough to be them. ",3
38,2019-03-29 04:11:49+00:00,"My very close friend overdosed last year, he didn't make it. Fetanyl is dangerous shit.",1
39,2019-03-29 04:10:43+00:00,I knew fetanyl had become problematic for me when I overdosed at the counter in my local Subway sandwich shop.,1
40,2019-03-29 00:59:48+00:00,"They already do this!
There’s even a guy on this forum who gets pure Diacetylmorphine ampules a week at a time.

What about it makes “zero sense my guy” suboxone doesn’t work for a lot of people as it’s only a partial agonist and it as well as methadone are both way harder to come off of then heroin. 
So giving an addict The same drug they are addicted to but in known pure amounts would allow them to comfortably taper.

You need to get out more. Take a look at what other countries are doing/have done and the success rates. Morphine and hydro/morphone maintenance are already commonplace in multiple countries, suboxone and methadone only is a strictly American stuck way of thinking/managing/curing active addiction.
",2
41,2019-03-28 22:40:11+00:00,"I mean, you could argue that obesity kills quite a few. My point is that  while yes they're bad for you, it doesn't mean it should be illegal. I did read the links, it's a generic list of the harms. Let's start with what I have experience with. Shrooms and LSD can give you a bad trip, and yes people can use them as a crutch as mentioned in the articles, but even having bad trips doesn't seem to be too bad. I can genuinely say LSD helped me grow as a person. 

&amp;#x200B;

Cocaine is super addictive, but I've seen it used responsibly. It's not everyone's flavor, personally not mine, but that doesn't mean no one should do it.  It's like alcohol, I've had several alcoholic friends. Substance abuse can ruin lives, but the solution is good rehab solutions, not banning the substance.

&amp;#x200B;

The only drug I really have a problem with is heroin. You can argue that it's a hypocritical view, and it would be a well founded argument.  That said, I think that for most other drugs you can't really blame a dealer. Let alone the user. Users should be held responsible for what they do while under the influence, that's just common sense. But charging them for having the substance is awful.

&amp;#x200B;

Yes, cocaine is unhealthy for you, but you should have the right to use it. Yes, you can have bad trips on shrooms and LSD and if you're predisposed to certain mental illnesses they can cause it, that doesn't mean they're inherently bad. Some people can enjoy themselves. Arresting people tends to ruin more lives than drug use.

&amp;#x200B;

If you really want to blame the dealer, then there needs to be a system in place to legally acquire the drugs. The dealers that are awful people are the ones that cut shit and sell impure products.  Heroin dealers cutting with fetanyl. Molly dealers normally cutting with god knows. The issue isn't the people. It's the system.",3
42,2019-03-28 21:39:24+00:00,I didn't think it was possible from snorting unless you go crazy overboard. However 4 weeks ago I snorted a tiny line as a starter to test the waters and remember thinking wow this stuff is strong almost immediately afterwards. Next thing I remember is waking up in the hospital. I stopped breathing before they gave me narcan. I tested positive for Fentnyl and Carfentynl. Shit is scary out there. ,2
43,2019-03-28 19:27:27+00:00,"Their problem brother has been on welfare and ocycontin since he was 15, but hungry brown kids just haven't earned it like he has.",4
