,date,body,score
101,2019-03-24 16:48:46+00:00,"&gt;Marijuana made up the greatest amount of drugs caught while being smuggled from Mexico into the United States. Slightly more than 461,000 of the 480,000 pounds of narcotics found was marijuana. All other drug seizures between ports of entry totaled less than 20,000, or less than 5 percent of the total pounds seized.

&gt;At border crossings, pot made up 300,000 pounds of the total 553,000 pounds found at both borders and coasts.

&gt;Other drugs, including **heroin, cocaine, methamphetamine, and fentany**l, were seized in significantly lower quantities, and **more of those were found at ports**, not by Border Patrol.


It's a shame when an article trying to prove something wrong, accidentally proves it to be right. 


TL;DR: The dangerous drugs are *actually* coming through ports of entry and the wall ain't gonna fix that.  






",1
102,2019-03-24 16:23:46+00:00,"People who have a prescription get addicted and start taking more dangerous drug variants rather than deal with the withdrawls. 

Doctors used to not prescribe opioids if they didnt have to, but then Perdue lied and said that their slow-release oxycodone (oxycotin?) had a very low risk of addiction, when they knew it had a high risk. But doctors didnt know, so they prescribed it because opioids are cheap and effective and if theres no addiction risk, why not? ",1
103,2019-03-24 16:20:12+00:00,"Uh nooooo. They use a needle to go through the vaginal wall, puncture the ovary to retrieve the eggs. Both sides. I was on a fentayl drip and felt everything- it was horrible. Because I was screaming through the procedure, the re told the nurses to up my meds, and after that I could still feel what was happening but it was manageable. 

My RE told me after that they had the narcan out because I was on such high dose I was at risk of overdose. 

Having said all that - I do have friends who have had Egg retrievals and had totally different experiences than me : didn’t feel or remember anything. Everyone responds to pain meds differently and historically I’ve needed more to be at a comfortable level (like at the dentist for freezing). 

Now having said that - I’m a therapist so clients I’ve had through the years have told me stories that were similar to mine. That their dr underplayed the pain factor. 

Now also having said that, the last thing I want to do is scare you but I decided to share because after my experience i felt hurt emotionally by my doctor that I wasn’t adequately prepared/sedated. I asked him for my next round if I could be completely put under but he just responded ‘that’s not how we do things here.’

I’m in Ontario Canada. Where are you ? Your clinic may have different protocols etc around pain management. ",1
104,2019-03-24 12:37:01+00:00,Um verddeiro heroi,1
105,2019-03-24 11:22:55+00:00,"Se voce acha que Lemann eh meu heroi, nao tem mesmo ideia. 

Sabia que o a empresa do OP nao eh a Vale, e nem ele eh o Lemann? Sabe o custo de fazer este planejamento tributario, e defende-lo depois que a receita te autuar? 

Tem muita gente nesse forum com problema de entender escala. ",1
106,2019-03-24 07:50:12+00:00,Oxycotin,1
107,2019-03-24 06:57:01+00:00,You sound like a commie sucker using Fetanyl with every meal.,1
108,2019-03-24 05:38:42+00:00,"God: So do you have any good deeds to get you into heaven ? 

pharm: God ive helped the entire united states of america with a pain problem they had. I influenced doctors to  prescribe as much oxycotin as possible that way so not a single person is in pain ever. 

God: You sir created soo many drug addicts, your talking to the wrong guy, im sure you and satan have alot to talk about, for all eternity. bye.",1
109,2019-03-24 05:29:48+00:00,"And some people think it's a bad idea to install the death penalty for fetanyl in China, or whatever that is called. Not to mention all these gangs over there, domestic and international. ",1
110,2019-03-24 02:54:36+00:00,Yeah it's great to hear about the individual who we living a fairly normal life. There are also some really mild forms of it. Scleroderma is generally broken into two sub categories limited and systematic. Limited generally only effects the skin however sometimes it does still progress. In limited there is Morphea and linear scleroderma. On the other is diffuse which has limited and diffuse systematic scleroderma. These ones generally effect the internal organs and tends to only have a 50% chance of making it past the 10 year mark,1
111,2019-03-24 00:59:08+00:00,te miri? in ultimii 20 de ani romania si bulgaria au gaura prin care a intrat 80-90% heroina din europa. \`nu ne vor in schengen\`.. orly?,1
112,2019-03-23 18:15:59+00:00,"morality is not something that consumers really care about. if that was the case, facebook, google would go under because of online espionage, americans would revolt against defense companies, big pharma (oxycotin), and various foods brands (mcdonalds, monstanto etc), starbucks exploting african farmers, etc..... 

one can argue that altria is actually working to reduce harm of tobacco by investing in juul, and supporting american farmers thru tobacco production. 

99% of people that consume products dont even know what ""Altria"" is, they just know the brands = marlboro which dominates the market.  

it may be unpopular among investors who have morals, but the average consumer gives zero shits. most people are looking to buy stuff with a good brand, fancy and attractive logos and images, and gives you a good high (either from nicotine, or eventually thc, or a mix (blunts) ) for the best price. 

smoking marijuana and smoking tobacco bring the same risk to lung cancer. when u smoke, u are burning the material which produces carcinogens. marijuana has also lead to great delinquency among teenagers who become unmotivated and eventually turn to sloths and end up working minimum wage shit jobs, spending what little they bring in on additional vape cartridges or eigths of ounces at the local medmen.

that said, i love to invest in this space because i believe in people's personal decisions, and that while some stand on a moral high ground, morality is not what brings shareholder and consumer value.",1
113,2019-03-23 17:18:45+00:00,"and its pretty obvious what going on. so your substituating 2 30mg er mophine pills, for 1 extra ir 15 mg oxy. also ir oxy has a way shorter half life than er morphine. With the ir oxy you will go thru highs and lows. ",1
114,2019-03-23 16:27:48+00:00,I am beTs fetanyl dealer مثريةي حط يخط ثخيزصويحي inshallah,1
115,2019-03-23 14:34:34+00:00,Oxycotin is child's play compared to heroin.,1
116,2019-03-23 13:29:06+00:00,"1) The guy said he uses fetanyl. And have you heard him talk? It's an open secret that he actively protects drug lords.

2) Most people who aren't exposed to a lot of foreign media don't know what weed is. Those people would be the same people who would be willing to working overseas. The most common drug in the PH is meth. Heroin is also semi-known, mostly stereotyped towards students (particularly law students) who need to stay up and study. Anything else, including weed, is considered ""rich people drugs."" ",1
117,2019-03-23 13:27:59+00:00,"That would be David Hahn. He did this all while he was a Boy Scout. [Here's](https://www.youtube.com/watch?v=W6Uuex4VZPE) a 30 minute documentary/interview with him all about it.

&amp;#x200B;

He died in 2016 after mixing  alcohol, [diphenhydramine](https://en.wikipedia.org/wiki/Diphenhydramine), and [fentany](https://en.wikipedia.org/wiki/Fentanyl)l.  ",1
118,2019-03-23 10:45:47+00:00,"\&gt;  Nie mówiąc tu o tym, że jednak płuca niespecjalnie lubią jakikolwiek dym i badania powoli psują mit o nieszkodliwości zielska.

&amp;#x200B;

Druga część zdania jest tak jakby pozbawiona sensu bo możemy mówić o szkodliwości procesu spalania i wdychania dymu \*jakiejkolwiek substancji\*. Zresztą ludzie, którzy przykładowowykorzystują wpływ CBD na depresję, zazwyczaj susz waporyzują i wtedy niespecjalnie możemy mówić o jakiejkolwiek szkodliwości dla płuc.

&amp;#x200B;

\&gt; Dwa błędy - pierwszy zakładający, że ""wszystko jest dla ludzi"" (czyli kokaina, heroina, pedofilia itp też. Jasne - ekstremalne przykłady niemniej wykazujące błąd myślenia)  

&amp;#x200B;

Nie wiem czemu obok koksu i heroiny wymieniłeś pedofilię. Ale ja uskoczę przed tym strawmanem i nie dam Ci tej satysfakcji. Bo to już nie był ""ekstremalny przykład wykazujący błąd myślenia"" (zresztą, jaki znowu błąd - tym zajmiemy się zaraz), tylko nieudana próba. ;)

Ale tak, kokaina i heroina jest dla ludzi. Tak jak za pomocą MDMA pomaga się - z niezłymi wynikami - ludziom z zespołem stresu pourazowego, tak samo są już jakieś eksperymentalne metody z \*coke and hookers\*. No jakkolwiek by to nie brzmiało to ja się cieszę, że ktoś z PTSD po wojnie może wrocić do normalnego życia.

Heroina? No, zastosowanie w medycynie dość szerokie. Oczywiście znajdzie się wiele lepszych substancji niż diamorfina do osiągania danych rezultatów, jednak jak najbardziej opiaty w wielu przypadkach są używane.

To ja dorzucę jeszcze gorzej - amfetamina. Jej (AFAIK) lewoskrętny izomer jest używany w leczeniu ADD/ADHD. To jak to jest, mamy porzucić badania Adderralem? Pewnie, że nie.

&amp;#x200B;

Rozpisałem się na temat medycznego użycia nie do końca odpowiadając na Twój post - spieszę z dalszą częścią już już.

&amp;#x200B;

Bo wyobraźmy sobie scenariusz. Osoba chora na depresję, której SSRI tak nie do końca pomagają, bo skutki uboczne i bo cokolwiek jeszcze. Taka osoba w klubie, dajmy na to w Berlinie bo w Polsce mało to popularne, zażywa ketaminę - substancję potencjalnie ""zaburzającą działanie mózgu i będąceą szkodliwą dla organizmu"". Robi to dla zabawy głównie. Pisałeś wczeeśniej, że ""wdychanie czy przyjmowanie do organizmu substancji psychoaktywnych 'dla przyjemności' to oznaka"":

\- głupoty

\- niedojrzałości

\- braku umiejętności radzenia sobie bez nich (tych substancji)

&amp;#x200B;

Co w takim przypadku? Jak zmieni się nastawienie do takiej osoby włączając w ten scenariusz to, że taka osoba wie, że ta ketamina pomoże jej z objawami depresji, zniweluje myśli samobójcze i da nadzieję na reminiscencje tych dni, w których chciało się chociaż trochę żyć? 

&amp;#x200B;

\*Jeżeli w której części posta był zbyt ofensywny ton to tak nie miało być, chciałem sprowokować dyskusję po prostu, ale taką gdzie ktoś może zauważy inny punkt widzenia, a może później ja wyniosę coś ze spojrzenia na świat całkiem innego niż moje. I absolutnie nie uważam, że substancje psychoaktywne są dobrą drogą. Po prostu zaznaczam, że jest lwia część użytkowników, którzy są świadomi tego co robią i okazuje się, że naprawiają tymi substancjami pewne rzeczy. Zdecydowanie przestrzegam przed używaniem czegokolwiek na czele z opiatami - nie próbowałem ale nie trzeba próbować jak widziało się co dzieje się z ludźmi. Zazwyczaj jest to o wiele mniej dramatyczne niż w opowiastkach w Internecie ale bardzo ciężko się na to patrzy.\*",1
119,2019-03-23 05:20:28+00:00,"So here's the thing, you have to go through all the DZ's to get their specific items. DZ east-MRE. DZ South-Morpine. DZ-West-Circuits. All these are found in small black boxes scattered around usually inside or in dead ends or around the map border. You need 30 and each box drops 3 at a time of the given item. HOWEVER, when you give the items to the merchant you don't get a shop or anything, he simply drops a single piece of high end loot at 250 gear score. So right now it's a bit of a let down for the amount of stuff you need.",1
120,2019-03-23 03:36:54+00:00,"Are you daft?

Workplace affairs are about the stupidest thing you could do.

Shooting heroin laced with meth laced with fetanyl is much more advisable.

One of them leads to a happy destruction of your life.  The other is just destruction.",1
121,2019-03-23 01:35:15+00:00,I highly doubt it would be cut with fentynyl,1
122,2019-03-22 22:50:11+00:00,"Nao voto, nunca votei. Fiz um juramento à patria e fiz muitos anos de serviço militar (mais de 15). Desenganem-se os que pensam que podem mudar alguma coisa e que o voto serve para algo. Enquanto esta ideia de que o povo precisa do governo existir, vao sempre estar iludidos, e testemunhar enormes injustiças. A unica soluçao como alguem disse era um ""heroi"" mas esse heroi teria de cometer acçoes imorais aos olhos de muitos para obtermos humanidade, empatia e altruismo do ""governo"". Nao precisamos de partidos, nem de governos que so nos roubam. A riqueza de um pais está no investimento privado, nao nas merdas que o governo diz que vai fazer para te fazer mais feliz. Queres mudar algo? Nao queiras o dinheiro do governo para nada (subsidios, vencimentos..) e foge aos impostos como o diabo foge da cruz! Guarda o teu dinheiro num banco que consideres justo (dificil) ou entao investe-o no teu proprio negocio, acçoes, startup, metais preciosos, sejar o que for, mas saca grande parte do teu capital de dentro do sistema monetario global. Politica? Partidos? Votos?aumentem o vosso capital individual com criatividade e libertem-se. Pensem nisto. ",1
123,2019-03-22 21:03:12+00:00,"This really speaks to me.. 

TLDR; This prophecy directly correlates to how my life has gone so far.

Here’s a little backstory,
I grew up really confused as to how the system here worked on earth. I didn’t understand the pain I was feeling around me and within me. I was depressed, had insomnia, and was in a cycle of pain. But being in this mindset I was able to offer those around me a shoulder to cry upon and attempt to heal. I read up on anxiety, depression, insomnia, etc. I learned how our thoughts twist reality. I changed my perspective.

 I then went on to delve into the realm of science because that seemed like the next step. Since science was a concept aimed at understanding the world around us. My knowledge of the physical world grew but it felt like something was missing. As I started to read about quantum physics I realized you can’t leave out the observer. I ended up looking deeply into predeterminism and the concept of free will. Searching for a way out, the answer. 

I found out western science is just a belief, a different perspective/model that didn’t cover the whole picture. That’s when I found out about the spiritual world and how for the most part my peers were blinded by lies told to them saying none of that spiritual mumbo jumbo was real. I became obsessed with finding a way to unite the two systems and ended up making my senior project “an attempt at unifying science and mysticism”
What I found was the spiritual world was grounded in experiences and it was hard to provide clear evidence of correlation even though to me the connections seemed clear. Ended up scrapping the idea and opted to make my project a summary of esoteric ideas and how they could be connected and letting my peers find out themselves if they wished. I ended up getting a public speaking award and my whole class was talking about it for weeks afterwards.
After I graduated I went back to a sleep state. I wasted my time partying with friends and having no real direction. The two things I wanted in my life was love and to travel the world. I kept up meditating and would take psychedelics every now and then. 

Till on my birthday Oct 20th 2018 (in numerology it boils down to five) I had an epiphany, I realized I was sleeping and needed to promptly leave my little home town island in Alaska to go explore. I bought a plane ticket that day to Seattle. Packed up a hiking bag with some clothes, sleeping bag, and the intention I was going to learn something on this trip. I had five hundred bucks to my name and my goal was to get to St. Louis Missouri where a friend of mine told me he had a cool pad and a job lined up for me. Figured I’d hitchhike my way on over since there was nothing for me at home. 

On this journey I found out I was living in a bubble up in Alaska. There were so many people suffering in the streets not able to get jobs, or hell even food or water.. made me think why is it that we didn’t rise as a whole? Why don’t we worry about those who don’t have shelter, food and water? Why was the government so greedy? Why did the 1% hold all this money they weren’t even using? Wouldn’t we be better off if we made sure everyone on earth had food, shelter and water? Ya know build a foundation before you build a pyramid.

As my journey progressed I came to appreciate all of the kind souls that gave me rides or offered me food. In turn I told them my stories living up in Alaska. That seemed to be a big selling point. Skipping over the fluff, I learned that I had this power to do anything I wanted. I remember my friends telling me you’re f***ing crazy for trying to hitchhike in the winter what’re you thinking? To which I replied I don’t know? I’m simply doing. 

I made it to St. Louis where my friend was addicted to fentayl.. an opiate that’s 50% more potent than heroin and a lot cheaper.. also found out he had broken up with his gf and that I was the only person he had in his life because he didn’t have a strong connection with any of his family and he had no other friends. I remember him answering the door and telling me “oh man Hank you showed up at the worst of times” to which I replied “on the contrary my friend I do believe I showed up at the right time” 
I had a profound experience the month and a half I was there. I was working 7 days a week 8-5 coming home finding my friend laying in bed just how I left him that morning. It’s like he was dying. I spent my off hours doing the chores around the house and trying to mend my friends mental wounds. 
I was able to connect with him very deeply and found I was looking at an earlier version of myself. One who had gone through a breakup, got depressed and turned to alcohol (same time as when I was depressed, and had insomnia). I found that seeing myself in him I was able to say all the correct words. And I believe those words gave me the closure to fully heal those old wounds of mine.
I got my friend to go to rehab, got his family involved and seeing as my work was done I went back to Alaska feeling I had accomplished what I was meant to do. 

Time flew by and before I knew it I had already been back in Alaska for a month my friend back in St. Louis was still acting weird. And wasn’t realizing he was twisting reality to fit how he felt inside. He was projecting hatred, and the attitude “the world is against me”. He was chronically lying and contorting other people’s words to match his twisted perspective. Eventually I had to close off communication with him. 
Afterwards strange things happened to me. I kept seeing 555 everywhere I went. My intuition was off the charts and I felt this connection with everything around me. It was almost intoxicating, I had become high on life it seemed. In this time a lot of childhood trauma had come to my attention to. A lot of stuff I must’ve blocked out at some point. What was weird was the moment would come up and I’d have intense feelings of anxiety, sadness, and anger then as quick as they had come the feeling was gone and I felt uplifted. 

It was then I realized that journey down south wasn’t about my friend but about providing me the experiences I needed to heal. And wake up. From that point onward I’ve felt this disassociation with the body, and a greater connection with a higher purpose. Almost as if I remembered that my purpose here is to send out love and guide those to searching within and finding what’s hidden in plain sight. 

When I read this post I felt instantly connected. Wether I am this young lad the prophecy speaks of or just a pawn in the big equation I’m glad to be hear to experience and can’t wait till I perfect my healing abilities and find a platform to project myself. Teaching and healing all those willing to listen.
Lots of love and light for any that read my story! I wish you find your path.",1
124,2019-03-22 20:01:36+00:00,"tente associar o pedido com algo que ela gosta, por exemplo

digamos que ela gosta de filme de heroi, pedir ela em namoro no final de vingadores vai marcar ela, sempre que ela ver algo de heroi vai lembrar do pedido tbm


",1
125,2019-03-22 17:10:22+00:00,"There's nothing wrong with ocycontin. It's a very useful medication that is still regularly prescribed. It is not ""controversial"" at all within the medical community.

The controversy is whether the Sacklers contributed to the misleading of doctors and patients into thinking it's less addictive than it actually is. We know Purdue was found guilty of this, but that doesn't mean the Sacklers are. Seems like UW is jumping the gun on this and I'm sad researchers will miss out on a source of funding as a result.",1
126,2019-03-22 16:55:06+00:00,Is it how many Wombles are addicted to hereoin after get stuck during a clean up without using their PPE? ,1
127,2019-03-22 13:24:48+00:00,"Estas tergiversando las notas para usarlas a tu favor, que paja.

*Además, la mitad de los menores en edad escolar toma dos o más bebidas azucaradas al día*

Es lo que te dije yo basicamente pero bueh

*Por lo que respecta a los menores, Salud indicó que en niños y niñas en edad escolar, el porcentaje con sobrepeso es del 30%, mientras que el 6% son obesos.*

Numeros alarmantes, es casi como que para combatir eso en los colegios se puede consumir frutas y tienen actividad fisica todas las semanas, contra un nene vacunado la escuela no tiene herramientas mas que obligar a los padres a vacunarlos.

Entonces tu argumento es: ""en mi opinion hay cosas peores, no podemos enfocarnos en muchas cosas a la vez porque somos retrasados, no nos vacunemos por ahora"" que sentido tiene eso?

Como que vacuna poco? Si tenemos uno de los calendarios mas amplios en cuestiones de vacunacion

Entonces no sos anti vacunas y te estas quejando solamente porque el estado te pide que te vacunes por el bienestar general? Todo era un capricho nomas? 

Te pregunto de nuevo, suponete que a la gente se la obliga a la ""fuerza"" como decis, que problema habria? Son vacunas, no te estan inyectando no se, heroina
",1
128,2019-03-22 12:09:15+00:00,"The war on drugs has been a failure pretty much since its start. Hell the same people that were suppose to be fighting drugs were the one's selling them. I'm not making this up the FBI and CIA were selling crack cocaine in low income neighborhoods, primarily in neighborhoods with a higher percentage of black Americans to fund their secret wars in Latin America and South Anerica. This isn't some conspiracy theory, this is public knowledge. Next treating addicts like criminals when they aren't that. Most addicts don't go man I really want to become an addict. Usually addiction is a sign of a more severe issue and/or the cause of carelessness of health professionals. I have witnessed the horrors of addiction first hand as my mother was an opioid addict that got hooked on them after she blew her knee out at work and was prescribed them. There are a lot of good people fighting addiction. Now with opioids a lot of addiction came from over medication and in the example of Central Appalachia, Perdue Drug Company used the area as a test market for Oxycotin to see what the negative effects of the drug would have on people and they knew exactly what it would do. They used my people without their consent in their fucking fucked up experiment and has essentially killed some of the more close knit communities in this country in the process, while paying doctors in the area to do it by giving incentives and payouts to them for prescribing the drug. Again this isn't a conspiracy and again is public knowledge. The courts have ruled, I believe, everytime against Perdue when they have been sued by the states and some individuals. My mother actually got her rehab and what not paid for as a result of one of the lawsuits. But, you know what fuck 'em they took my mother away from me for half of my childhood as she fell deeper in their grasp and struggled to get help. To me that is an unpayable debt. ",1
129,2019-03-22 07:09:59+00:00,"Yeup! I have an acquaintance who unfortunately had her children temporarily taken away after her husband (now ex) overdosed on fentenyl(sp?) and she called the ambulance.

She literally found out he was an addict when the medics got there, but the social worker assigned to the family’s case “couldn’t believe that a wife had no idea her husband was addicted to opiates/heroin”. 

This woman’s -life- is her children. I’m talking the most granola of granola Momma’s, more Portland than Alabama. I was devastated FOR her, seeing her talk about it after 4 months of being ripped from her! All because she thought her husband was having a seizure and called 911 - not knowing the shitbag was just living a secret life. 

——
TLDR; people who guffawed at C&amp;C even mentioning terminating Adam’s right/saying they were being dramatic getting Aubrey/etc are delusional. These guys are in SERIOUS mind altering illicit drugs, not weed. It would be negligent of the other adults to allow those children near their parent that is in active addition.",1
130,2019-03-22 05:09:05+00:00,"Franz De Waals talked about how mechanistically there is proof that animals feel love, attachments, etc.. Thing like serotonin and oxycotin is released when animals are with family members, mates, friends, etc.",1
