,date,body,score
333,2019-03-10 00:21:20+00:00,Depends on where you live in Florida. I sometimes think Florida gets a bad rap because they are one of the few states that has all mugshots and crimes posted tobpublic information. I grew up in st. Augustine florida and had the best childhood you could ask for. Surfing. Skating. Big concerts everywhere. Orlando. Tampa. Miami. St. Pete. Jacksonville. Gainesville. Everglades and hundred of state parks and springs. Ocala national forest. Daytona. There is everything here. A city for every political persuasion. Fishing in the gulf. Offshore fishing. Thousands of lakes n rivers to fish. Florida keys. There is a lot to florida besidescrednecks and oxyconten. There are no far extreme leftist  cities like cali. Most areas are a mixcof everyone. South Florida is a different world then north. Disney. Universal and water parks that are crazy,1
334,2019-03-09 23:45:17+00:00,Damn Fetanyl. I am sorry .. that also has been a lot of my friends ,1
335,2019-03-09 23:43:41+00:00,Took a pill that was supposed to be Xanax and was laced with fetanyl.  She would have been 24 as of yesterday.,1
336,2019-03-09 20:03:16+00:00,"Weet iemand wat ze bedoelen als ze half miljoen Nederlanders zeggen, bedoelen ze dan echt een half miljoen lange termijns?


Of in een jaar een half miljoen mensen die ooit oxycodon krijgen, al is het maar voor een week. ",1
337,2019-03-09 19:16:43+00:00,I thought the article said some chemicals like OxyCotin could be produced while others could be reduced.  Idk but that was my thinking at least,1
338,2019-03-09 18:59:12+00:00,"If youre using powder it might be fentanyl thats in the shorter acting heroin.

If its tar, the yeah id say probably some has higher amounts of 6-monoacetylmorphine that doesnt last quite as long as the kind thats been processed better and is more pure diacytlmorphine.

&amp;#x200B;

Its hard to really know honestly. Maybe try getting fentanyl testing strips to test your shorting acting dope with.

Generally the actual high from more pure diactylmorphine shouldnt last too long for someone thats addicted and using it via IV. Its never lasted long for me honestly. It did keep the sickness away for a lot long than the high actually lasts though. People with no tolerance will feel the high for much longer as well. ",1
339,2019-03-09 17:45:32+00:00,Er zijn goede redenen om Oxycodon (en andere opioïden) voor te schrijven. Er zijn ook minder goede redenen om Oxycodon voor te schrijven. Vooral die laatste groep moet in de kiem gesmoord worden: daarvoor hoeft niet deze hele categorie pijnstillers in de ban. ,1
340,2019-03-09 17:40:31+00:00,"Ik heb ook een tijdje Oxycodon en Oxycontin geslikt vanwege een gebroken rib. Één van de twee was voor langdurige afgifte, de ander was wat heftiger en korter.

Zeker die heftige korte pijnstiller was echt een vreemde sensatie. Het deed z'n werk supergoed, maar ik zat kneiterstoned op de bank met een kopje thee een beetje voor me uit te staren. En het voelde fijn. Alsof de hele wereld tot rust komt en de tijd wat langzamer gaat.

Gelukkig had ik maar een beperkte hoeveelheid van de apotheek gekregen en was ik me bewust van de risico's. Ik heb het vrij snel weer afgebouwd en heb het gat opgevangen met paracetamol.

En ergens in mij is een gevoel, een kleine stem, die zich afvraagt hoe het nu zal zijn, zonder die pijnprikkels. Ik denk niet dat het een verslaving is, maar ik kan me heel goed voorstellen dat die lijn erg dun is. ",1
341,2019-03-09 17:25:57+00:00,"Kann sein das du eine ungewöhnlich hohe Medikamenttoleranz hast, wies bei mir der Fall ist. Hast du in der Vergangenheit öfter Alk/Drogen/Schmerzmittel konsumiert? Ich brauchte vor meiner Wurzelbehandlung 4 Spritzen, meine ganze Schnauze war taub, aber die Schmerzen gingen trotzdem durch den ganzen Körper.
Und wenn das der Fall ist dann hoffe ich das du nie eine Operation durchmachen musst, im Aufwachraum mussten die mir 3 mal (denk mal es war) oxycodon ballern, nach der ersten spritze war ich zwar wieder Ko für paar minuten, aber danach wieder direkt am schreien noch in Trance von der OP, jede weitere hatte wenig gebracht und ich wurd immer mehr wach. ",1
342,2019-03-09 17:23:58+00:00,"Errado. 

Vc nao ve traficantes de bebidas porque o processo de fazer bebidas alcoolicas seja uma simples cerva ou um destilado qualquer um faz. 

Ja produzir cocaina heroina crack entre outros eh um trabalho especifico e complexo que apenas traficantes faxem. 

Em suma. Libere a maconha e os cativos de vicios fe outras drogas continuarao a depender de traficantes.

Outra coisa. Nem todo mundo que toma uma cerva no fds ou uma taca de vinho no jantar vira alcoolatra.

Mas todos que experimentam crack tornam se viciados prarlticamente incuraveis.

Aposto que vc deve fumae unzinho....

",1
343,2019-03-09 14:46:47+00:00,"Se ofendeu? Fala pra nos como tem de desregular a medicina e liberar heroina pra todo mundo ficar saudavel. E vender terra pra estrangeiro tambem, especialmente chines.",1
344,2019-03-09 04:20:56+00:00,If anyone needs or wants fentenyl test kits let me know and I’ll get them to you free of charge just pm me and I’ll give anyone free narcan as well so sorry for you lose brother I’ve lost more friends in the last year then the previous 10 it’s scary out here these days ,1
345,2019-03-09 02:40:29+00:00,"GOD DAMNIT MY SHIELDBREAKER DIED FROM STRESS DURING A BOSS RRRREEEEEEEEE!!!! THEN A FEW DUNGEONS LATER MY ANTIQ. GOT CRITTED TO DEATH BEFORE I HAD A CHANCE TO HEAL.  IT WOULDN'T BE SO BAD IF THEY ACTUALLY SHOWED UP IN RECRUITMENT INSTEAD OF OCCULTISTS AND GRAVE ROBBERS ALL THE DAMN TIME. 

ON THE OTHER HAND I'M FINALLY READY TO START AN ACTUAL DARKEST DUNGEON QUEST, SO AT LEAST I HAVE THAT TO LOOK FORWARD TO.",1
346,2019-03-09 02:22:32+00:00,"Dude didn't even smoke, he was taking THC oil capsule, which smell like... well, like every other capsule out there. i.e. nothing.

He did mention that he'd been very open about his use of it, and had told staff and other patients, etc. My guess is that someone heard that he was using The Marijuanas, assumed that meant he was smoking fat blunts in his hospital room, and called the cops.

There is so much wrong with this situation it's hard to even know where to begin, but one really striking irony to me is that this guy is exactly the kind of patient a hospital would typically pump full of fucking *morphene* without anyone batting an eyelid.. and here are the cop squad rummaging through all his shit over a rumor of some weed. There were probably at least 10 far harder drugs already in that room, all provided by the hospital.",1
347,2019-03-08 23:25:07+00:00,"Yes, but the profit incentives need to be in the right places.  

Right now it's more profitable to make insignificant changes to recycle a patent on a drug instead of actually making a new drug.  

Also, it's more profitable to do what a patient wants instead of what they need.  Doctors with low patient approval scores risk losing their jobs.  

Guess what lowers a patient's approval score? Telling them they're too fat and need to lose weight.  Asking them to try Ibprofen before going straight to Oxycotin.  Literally any orthopedic surgery due to a broken bone, because there's no such thing as going back to 100%.  

The insurance system has a huge profit incentive to maximize discounts, even if it means having the hospitals falsely maximize their billing rates so the brokers can say they got the discounts down another 5%.  This fucks over uninsured people who are now on the hospital's good graces to lower the bill voluntarily.  

Insurance companies have no profit incentive to do right by their insured because the insured aren't making the purchasing decisions: their bosses and HR department is.  Dead and dying don't complain about how their insurance company fucked them over to anyone that means anything because that's not how they want to spend their final days.  

Even then it would just be glossed over at the next annual benefits meeting where the Insurance salesman would promise ""it totally won't happen again"" or ""The other guys do it too, but worse"".  

Furthermore, Healthcare doesn't play by free market rules.  You don't go looking for the cheapest heart transplant surgeon.  If you're hit by a bus and scooped up by an ambulance you can't solicit bids for the best treatment, and MUST pay whatever it costs wherever they drop you off.  

It's a fallacy that our for-profit system drives innovation.  Cutting edge medical treatments aren't covered by most insurance plans, and require you (or someone else) to pay out of pocket for them.  If it's not in the normal pre-negotiated catalog, you're on your own.  

That rewards mediocrity, not innovation.  That's why our country is losing our lead and our doctors are leaving.  They know the best course of treatment, but don't feel like negotiating with some $15/hr insurance rep working a phone bank to go straight to it without trying 10 other things that won't work first.  

Nobody benefits from that.  Not the world, not US citizens, not even the for-profit corporations propping this shit system up.  ",1
348,2019-03-08 22:25:38+00:00,"Or instead of food stamps, offer fetanyl stamps...boom, problem solved!",1
349,2019-03-08 22:20:08+00:00,I wanna say it was Sen. Stargel(?) that also said she'd reluctantly vote yes but she didn't think cannabis was actually a medicine and was in fact a gateway drug. Can anyone else that watched confirm that it was her? She then brought up heroin and fentenyl and shit,1
350,2019-03-08 20:49:42+00:00,"This can only be answered by knowing what drug you abused,even the damage of heroim lowers with time,but again it really depends on how much you abused and your own body.everyone is different",1
351,2019-03-08 19:44:08+00:00,"No, cross tolerance would be like having to do more blow because you've been doing Meth. Or how if you take acid one day, the next day you gotta eat more shrooms than normal. Or a heroin addict who has to take a massive amount of oxyxodone to keep from getting sick. ",1
352,2019-03-08 18:14:22+00:00,"Muy buena pregunta. 

Yo creo que los ideales masculinos son en general mas diversos y alcanzables que los de las mujeres y los femeninos son tambien mucho mas unidimensionales. El heroe de la pelicula es guapo, musculoso, chistoso y rico. La heroina ( o generalmente la acompañante del heroe) es guapisisisima, joven y flaca. Como hombre puedo aspirar a ser musculoso y rico como el heroe. Como mujer si no nací con físico de supermodelo ya valí. 

Supergeneralizando, claro. ",1
353,2019-03-08 17:48:16+00:00,Fale sounds like he spent his EBT on Percacets. ,1
354,2019-03-08 17:47:41+00:00,"yes!! i feel your pain . i had to fight tooth and nail for tramadol for sever debilitating pain .never even took opiate meds ever in my life till i needed them. but gets denied by insurance because i take  psyc meds . those were thier exact words .  meanwhile, i  know people with hang nails and pink eye who waltz in to doctors and pharmacies and they get oxycotins and vicodins like they're tic tacs . it sucks being made into a pill seeker just based on ,on going meds from a psychiatrist . i ended up being approved for norco which does the trick but barely . also i was told to seek psychiatric help before pain meds . im like didn't you all just knock me for being on phyc meds already . jokes on them i have actual medical conditions that are verifiably painful. not some imaginary thing in my mind . hope you get help you deserve ",1
355,2019-03-08 17:45:20+00:00,"My high school ran on nicotine and oxycotin before vaping was really a thing, it was just cigarettes and dipping then. It is hardly a new issue. At least they aren't spitting Skoal all over the toilet seats.",1
356,2019-03-08 17:07:56+00:00,His problem was he wasn't paying the pharmaceutical companies tens of thousands of dollars for their Oxycotin. ,1
357,2019-03-08 16:36:07+00:00,"[Click para leer](https://www.elcomercio.com/tendencias/marvel-revela-mayor-heroina-capitana.html)

Marvel, de Disney, dedica la primera película en solitario a uno de sus superhéroes femeninos, con el estreno de ‘Capitana Marvel’. 

La oscarizada actriz Brie Larson debuta en el Universo Cinematográfico Marvel (UCM) como Carol Danvers, piloto de pruebas de la Fuerza Aérea estadounidense, quien inicia un viaje para descubrir su verdadera identidad y dominar los increíbles poderes que posee, pero de los que poco sabe.Esta es la primera cinta de Marvel ambientada en los años 90, en el momento en que Danvers, una noble pero renegada heroína guerrera, cae del cielo para convertirse en la Capitana Marvel y ampliar la ya abultada nómina de los Vengadores.Con la guerra como lenguaje universal de la famosa franquicia de superhéroes, las circunstancias del relato ubican a la protagonista en medio de una batalla galáctica entre dos razas alienígenas, donde tendrá que probar su valor y su destreza.Los tráileres ya anticipan un ‘block­buster’ en toda forma, con guiños nostálgicos, revelaciones y conexiones con otras películas del UCM, escenas poscréditos (dos), toda una variedad de trucos visuales y al igual -aunque después- que ‘Wonder Woman’, un discurso de empoderamiento femenino en el cine de superhéroes.Larson se luce frente a la cámara y el ‘chroma’ como un personaje que derriba prejuicios para ganar respeto en un medio mayoritariamente masculino. Del otro lado de la cámara aparece otra guerrera, Anna Boden quien, junto con Ryan Fleck, sigue abriendo espacio para la dirección femenina.

© Derechos reservados. 2017 Grupo EL COMERCIO.

                                    Queda prohibida la reproducción total o parcial, por cualquier medio, de todos los contenidos sin autorización expresa de Grupo EL COMERCIO.

",1
358,2019-03-08 15:54:33+00:00,"O cliente aqui sou mesmo eu. Vai ser uma edição muito modesta, e estou a tratar de tudo. O livro trata de pequenos contos (alguns deles no r/escrita) sobre um personagem anti-heroi, desempregado de longa duração, que perdeu interesse numa rotina laboral e por entre comportamentos erraticos tece ideias rezingonas.   As letras lembram-me um album de hardcore...a escrita é mais humor tragico.
Vou tentar postar também a lombada...

Muito obrigado pelo feedback!",1
359,2019-03-08 13:44:59+00:00,"&gt; Fiz esse sacrifício em prol da comunidade:

Meu heroi. Fez um trabalho mais competente do que boa parte desses caras da lista vão fazer ao longo do ano.

&gt; 1º Renato Gaúcho - R$ 900 mil

Vale o salário. Mas imagina se tivesse ido pro Flamengo, seria o líder disparado dessa lista.

&gt; 12º Odair - R$ 200 mil

Não sabia que ganhava tanto. Se não me engano ganhava uns 80 mil ano passado. Baita aumento. Mas é justo.

&gt; 2º Felipão - R$ 800 mil

Me surpreende ganhar tão pouco.

&gt; 6º Abel - R$ 600 mil

O Flamengo tá ostentando tanto que me surpreende o Abel aceitar receber tão pouco.

&gt; 7º Levir - R$ 400 mil

400 pau por mês pra estrear a Libertadores com derrota em casa. 

&gt; 8º Ceni - R$ 250 mil

Comé que o Fortaleza tem essa grana toda. 

&gt; 16º Thiago Nunes - R$ 120 mil

O Atlético-PR é um time que deve ter no mínimo o dobro do poder econômico do que o Fortaleza, e tá pagando metade pelo seu treinador.",1
360,2019-03-08 13:43:53+00:00,"&gt; Fiz esse sacrifício em prol da comunidade:

Meu heroi. Fez um trabalho mais competente do que boa parte desses caras da lista vão fazer ao longo do ano.

&gt; 1º Renato Gaúcho - R$ 900 mil

Vale o salário. Mas imagina se tivesse ido pro Flamengo, seria o líder disparado dessa lista.

&gt; 12º Odair - R$ 200 mil

Não sabia que ganhava tanto. Se não me engano ganhava uns 80 mil ano passado. Baita aumento. Mas é justo.

&gt; 2º Felipão - R$ 800 mil

Me surpreende ganhar tão pouco.

&gt; 6º Abel - R$ 600 mil

Ué, o Fluminense não tá em crise?

&gt; 7º Levir - R$ 400 mil

400 pau por mês pra estrear a Libertadores com derrota em casa. 

&gt; 8º Ceni - R$ 250 mil

Comé que o Fortaleza tem essa grana toda. 

&gt; 16º Thiago Nunes - R$ 120 mil

O Atlético-PR é um time que deve ter no mínimo o dobro do poder econômico do que o Fortaleza, e tá pagando metade pelo seu treinador.",1
361,2019-03-08 10:40:00+00:00,"""Oxycotin (sic) every six hours"".

This sounds much more like instructions for ""oxycodone"" IR--every 6 hours; whereas Oxycontin is to be taken every 12--or, at most, 8--hours, yes???",1
362,2019-03-08 10:28:20+00:00,Um heroi!,1
363,2019-03-08 08:16:39+00:00,Why does is say antiq?,1
364,2019-03-08 07:04:44+00:00,"I'm 100% sure no one will ever see this comment. But, for young smokers? Please stop. My mom died of Lung cancer 7 years ago. I've heard people say ""well you're gonna die of something..."". Do you want someone changing your adult diapers? And by ""someone"" I mean your spouse or your kids. When they do, they will notice your legs look like those of a Holocaust survivor. Who will drive you to all the appointments for chemo, radiation, and just Dr appointments? Who will finally decide it's time to call hospice? Who will sleep next to your hospital-bed-in-the-living-room for a few weeks, while you are unconscious? Who will crush pain pills between two spoons and add liquid morphene then slide it into the pocket in your cheek? 

Who will wake up one day, notice the mottled spots on your legs, the black spots on your tongue and call each of your loved ones at work and tell them ""it's time to come home?"" 

If YOU make a decision to continue smoking please realize the ripple effect. It impacts so many of those who LOVE you.",1
365,2019-03-08 00:47:49+00:00,"It's super naive to ignore that some drugs have a super bad track record.

Of course there are drugs that are just shit - they are usually even not illegal or only used under special economic circumstances (crocodile in Russia) 

Some drugs are dangerous and life destroying (fenta, meth...) and are only used by people who are basically fine with that.

This kind of consumption, and the drug it self is born out of a sick world - they have not to do with the plant origins - they are basically economic killer traps to extract as much money from it's victim as possible until they die. They are designed and evolved to be that, saying that they are beneficial to humans ""in some way"" is saying that fly traps are beneficial to fly's ""in some way""

And I even understand your approach to some degree because yes poppy's contributed to folk medicine and yes even fentalyl provides value in medicine. But look what happens to it's addicts. And that begins often with a ""I can handle that"" attitude.

Of course people can then say ""yes, yes but I do it right"" but how to do substances right what direct hit in our reward system in the brain? I mean we humans are pleasure seekers, and weak that's just how we are. You should feel pleasure when you hug a loved one not when burning a chemical behind a dumpster.",1
366,2019-03-07 23:47:46+00:00,"Well, if you don't have money you could make other arrangements like people sometimes do for heroi- OH NOW I GET IT",1
367,2019-03-07 23:11:35+00:00,"I'd agree - it's Doctor's being bribed by Drug Companies to prescribe Oxycotin, and cultivating a generation of Heroin addicts.",1
368,2019-03-07 22:09:07+00:00,"I feel your pain man, in my 30s and have been hospitalized twice for kidney stones. First one was similar to your experience, got some morphene and was told to piss it out. 

Second time it was a bit bigger and they scheduled me for an operation. 


Both times, a few days after I was discharged I receive an envelope in the mail, basically a satisfaction survey. The only bill I got was a bill of good health. I love Canada! ",1
369,2019-03-07 22:03:39+00:00,I’m a tactical medic who just went to a federal training class with majority LEO. I was 1 medic in a class of 26 cops. We were focusing on CBRNE exposure and tactics but I can tell you with first hand knowledge “ nationally recognized” federal LEO trainers are acting as if  a car 3 blocks away has 0.5 mcg of fentany and they look at it the wrong way they are going to OD. I feel bad for the guys and gals cause the information is just so wrong. I spent the majority of our down time going “ look I’m on your side and obviously follow departmental policy but it u equivocally can’t absorb through your skin accidentally. The pharm companies spent a shit load of money trying to figure out how to get it to go through so your not going to accidentally create those circumstances with enough dose delivered to cause the issues they’re seeing.” I can’t remember the name but there a psych phenomena that if you tell people the symptoms they will experience if there’s any chance that X or Y happened then they will report those “ symptoms at an alarmingly high rate. ,1
370,2019-03-07 20:52:41+00:00,"Two responses there:

1. Timothy tells us that pastors must be able to teach, and the word there is interchangable with the word for elders. I'll get into this more below.
2. Even if we don't hold them to be interchangable, elders are still commissioned with teaching in Titus 1:9, where elders are charged with refuting false teaching, and encouraging with accurate teaching. In other words, a core element of the office of elder is teaching. 

&amp;#x200B;

1 Timothy tells us that overseers must be able to teach. The Greek word there is \*episkopes.\* 

Titus tells us that Paul is commissioning his disciple to appoint elders. The Greek word there is \*presbytrous.\*

These words are used interchangably throughout scripture. We can see all three terms used in Acts 20, referring to the same group (the elders of the Ephesian church, who were appointed as overseers, and charged with pastoring).  The following explains some of these examples (from [biblehub.org](https://bible.org))

[https://biblehub.com/greek/4245.htm](https://biblehub.com/greek/4245.htm)

 ***b.*** among Christians, **those who presided over the assemblies**(or churches): [Acts 11:30](https://biblehub.com/interlinear/acts/11-30.htm); [Acts 14:23](https://biblehub.com/interlinear/acts/14-23.htm); [Acts 15:2, 4, 6, 22](https://biblehub.com/interlinear/acts/15-2.htm); [Acts 16:4](https://biblehub.com/interlinear/acts/16-4.htm); [Acts 21:18](https://biblehub.com/interlinear/acts/21-18.htm); [1 Timothy 5:17, 19](https://biblehub.com/interlinear/1_timothy/5-17.htm); [Titus 1:5](https://biblehub.com/interlinear/titus/1-5.htm); [2 John 1:1](https://biblehub.com/interlinear/2_john/1-1.htm); [3 John 1:1](https://biblehub.com/interlinear/3_john/1-1.htm); [1 Peter 5:1, 5](https://biblehub.com/interlinear/1_peter/5-1.htm); with τῆς ἐκκλησίας added, [Acts 20:17](https://biblehub.com/interlinear/acts/20-17.htm); [James 5:14](https://biblehub.com/interlinear/james/5-14.htm). That they did not differ at all from the (ἐπίσκοποι) bishops or overseers (as is acknowledged also by Jerome on [Titus 1:5](https://biblehub.com/interlinear/titus/1-5.htm) (cf. Lightfoot's Commentary on Philippians, pp. 98f, 229f)) is evident from the fact that the two words are used indiscriminately, [Acts 20:17, 28](https://biblehub.com/interlinear/acts/20-17.htm); [Titus 1:5, 7](https://biblehub.com/interlinear/titus/1-5.htm), and that the duty of presbyters is described by the terms ἐπισκοπεῖν, [1 Peter 5:1](https://biblehub.com/interlinear/1_peter/5-1.htm)f, and ἐπισκοπή, Clement of Rome, 1 Cor. 44, 1 \[ET\]; accordingly only two ecclesiastical officers, οἱἐπίσκοποι and οἱ διάκονοι, are distinguished in [Philippians 1:1](https://biblehub.com/interlinear/philippians/1-1.htm); [1 Timothy 3:1, 8](https://biblehub.com/interlinear/1_timothy/3-1.htm). The title ἐπίσκοπος denotes the function, πρεσβύτερος the dignity; the former was borrowed from Greek institutions, the latter from the Jewish; cf. (Lightfoot, as above, pp. 95ff, 191ff); Ritschl, Die Entstehung der altkathol. Kirche, edition 2, p. 350ff; Hase, Protest. Polemik, edition 4, p. 98ff; (Hatch, Bampton Lects. for 1880, Lect. 3 and Harnack's Analecten appended to the German translation of the same (p. 229ff); also Harnack's note on Clement of Rome, 1 Cor. 1, 3 \[ET\] (cf. references at 44 at the beginning), and Hatch in Dict. of Christ. Antiq., under the word . Cf.ἐπίσκοπος.). **the twenty-four members of the heavenly Sanhedrin or court,** seated on thrones around the throne of God: [Revelation 4:4, 10](https://biblehub.com/interlinear/revelation/4-4.htm); [Revelation 5:5, 6, 8, 11, 14](https://biblehub.com/interlinear/revelation/5-5.htm); [Revelation 7:11, 13](https://biblehub.com/interlinear/revelation/7-11.htm); [Revelation 11:16](https://biblehub.com/interlinear/revelation/11-16.htm); [Revelation 14:3](https://biblehub.com/interlinear/revelation/14-3.htm); [Revelation 19:4](https://biblehub.com/interlinear/revelation/19-4.htm).  

This is a more straightforward page, explaining the same:

[https://www.gospelway.com/topics/church/elder-bishop.php](https://www.gospelway.com/topics/church/elder-bishop.php)",1
371,2019-03-07 19:19:33+00:00,"Pure fentanyl sold as fentanyl is safer than heroin sold as heroin cut with fentanyl. 

I believe the black market is evolving to fenanyl not only because it is cheaper, stronger, and easier to smuggle, but because fentanyl sold as fentanyl may be safer than random street heroin.

We need to legalize drugs and ensure their quality control and access of addicts to treatment.

Also, alcohol kills more people than all illegal drugs combined, yet we all know how asinine banning alcohol was.  It's the same thing as ""drugs"" (alcohol is a drug, too).  Making drugs illegal does nothing but make the situation for everyone involved much worse.",1
372,2019-03-07 18:33:27+00:00,Smoke fetanyl,1
