,date,body,score
251,2019-07-14 09:13:04+00:00,"I'm always happy to talk to people who want to seriously examine how we know what we know, and how much trust we put in it, so I really applaud your perspective as far as that goes. I definitely agree that most people don't know and don't care about things like this, and defer to experts because they don't want to think about it.

Another point of agreement is that textbooks on history can be quite misleading about what evidence there is, and how reliable it is. I know that the primary sources for things older than a thousand years almost never still exist (with a very small number of exceptions).

However, I think it's unfair to historians to say that they merely read things in books and copy them into other books. Much of historical research is actually interested in asking *exactly these questions* about historical sources and how much to trust them. Textbooks can present an oversimplified picture of ""how we know what we know"", but my impression is that historians are actually acutely aware of (and very open about) the difficulties of evaluating fragments of manuscripts that might misquote other manuscripts, themselves misquoting older manuscripts. They often write about this difficulty: For example, specifically about Herodotus, there's this note by a historian engaged in compiling a modern edition of Herodotus from the existing manuscripts: [https://www.persee.fr/doc/antiq\_0770-2817\_1983\_num\_52\_1\_2086](https://www.persee.fr/doc/antiq_0770-2817_1983_num_52_1_2086).

I have actually questioned things like carbon dating; it turns out to be a little difficult to do all the relevant experiments yourself, but as you can read in [http://www.feynmanlectures.caltech.edu/I\_05.html](http://www.feynmanlectures.caltech.edu/I_05.html) (by Richard Feynman, another example of someone who's very interested in how we (think we) know what we do), physicists have done experiments that back up the science behind carbon dating. I don't mean that you shouldn't try to do experiments yourself, but I do believe physics textbooks much more readily than history textbooks. Physicists' whole way of working involves doing experiments and checking each other's results, and the fruit of their collective labor is a set of models of the world that explain what we see on a day-to-day basis *and* do so to such a degree that we can build crazy-seeming technologies like nuclear power plants, microchips, and space shuttles, which you can see with your own eyes. So if physicists collectively say ""carbon dating works"", I definitely believe them.

Which brings me to the point of that blog post I linked. I forgot how long it was, sorry; the important part is at the end (A-E), and isn't about any particular set of conspiracy theories, but is just a way to think about which conspiracy theories are likely to be true. Its ""Basic Argument Against Conspiracy Theories"" applies really strongly to historical research. In order for some political group to be pushing false stories about ancient history via academic historians, they'd need to somehow be controlling many thousands of people (3000 in the US), forcing them to promote ideas about the past that they know aren't based in fact, all of whom presumably got into history because they were interested in researching and explaining what really happened in the past. You might be able to do that if it was 100 people, but 3000 seems really implausible.",3
252,2019-07-14 07:16:33+00:00,Doktor Soma macht doch nur Secks Fragen. Oda ist dises Heroinn auch Secks?,3
253,2019-07-14 07:14:24+00:00,"I always attributed the come down you deal with one pressed to the stuff they’re normally cut with, which is usually meth, fetanyl and heroin.",-2
254,2019-07-14 07:02:37+00:00," Li estarrecido, quando estava a caminho de Matera, na Itália, há duas semanas, o [incrível tuíte de Sergio Moro](https://www1.folha.uol.com.br/colunas/bernardo-carvalho/2019/06/justica-no-caso-de-moro-e-ideia-fora-do-lugar.shtml) (“Eu vejo, eu ouço”).

 O tom messiânico, [sinistro e desavergonhado](https://www1.folha.uol.com.br/colunas/bernardo-carvalho/2019/06/o-recalque-e-o-ressentimento-tomaram-conta-do-pais.shtml) continua a retumbar na minha cabeça, contra o pano de fundo daquela cidade de grutas, [onde Pasolini filmou](http://www1.folha.uol.com.br/ilustrissima/2016/08/1807344-pasolini-utopias-e-distopias-por-walter-salles.shtml) “O Evangelho Segundo São Mateus” (1964).

 Moro e Pasolini representam extremos opostos no vasto espectro do caráter humano.

 Numa entrevista a Oswald Stack, em 1968, o cineasta comenta a ambiguidade e a contradição do “Evangelho”: “Eu não queria reconstruir a vida de Cristo como ela de fato foi; queria fazer a história de Cristo, mais 2.000 anos de tradução cristã, porque foram esses 2.000 anos de história cristã que mitificaram essa biografia que em si mesma seria quase insignificante. (...) É um filme violentamente contraditório, desconcertante e ambíguo”.

 Moro escreveu seu tuíte em [apoio às manifestações](https://www1.folha.uol.com.br/colunas/angela-alonso/2019/07/sem-aconchego-do-antipetismo-patriotas-fazem-protesto-a-favor.shtml) que o apoiavam. A frase ecoa um messianismo calculado, ainda mais contraditório e desconcertante na boca de um ex-juiz e ministro da Justiça encurralado pelos fatos. Dá a entender que à Justiça cabe corresponder ao clamor das ruas e apelar para a opinião pública quando questionada.

 [O ex-juiz nunca hesitou em invocar](https://www1.folha.uol.com.br/colunas/angela-alonso/2019/06/so-nao-viram-deslizes-do-heroi-moro-os-cegos-de-odio-pelo-vilao.shtml) para si a imagem de justiceiro, mas não lhe passaria pela cabeça contrariar o público em nome da justiça. Ao contrário, conta com as massas para salvar a própria pele. Age como político populista. É aí que está o mais assustador.

 Ao ironizar no Congresso que Sérgio Cabral, Eduardo Cunha e Renato Duque também precisam de defensores, Moro se entrega por meio do sofisma. Revela que afinal sabe muito bem a diferença entre esses e Lula (se não soubesse, não precisaria recorrer à comparação). Abusa da nossa honestidade intelectual. Ameaça-nos com o risco do fim da Lava Jato para desviar a atenção dos próprios abusos.

 No extremo oposto, [Pasolini era guiado](https://www1.folha.uol.com.br/ilustrissima/2019/03/internet-e-capital-financeiro-embacaram-o-mundo-diz-guilherme-wisnik.shtml) por uma independência radical de pensamento, capaz de fazê-lo voltar-se não só contra o público mas contra si mesmo, em nome da verdade, da justiça, do combate aos consensos e às ideias confortáveis, mas enganadoras. A última coisa que levava em conta era zelar pela própria imagem. 

 Chame-se a isso de coragem, desprendimento ou suicídio, essa costuma ser uma qualidade comum aos loucos, mas também aos grandes artistas e aos homens dignos da categoria de heróis.

 Horas antes de ser assassinado, em novembro de 1975, Pasolini concedeu uma entrevista publicada no jornal La Stampa e reeditada em livro com o título “Estamos todos em perigo”. Referia-se ao hedonismo consumista que nos leva a desejar as mesmas coisas.

 Contra a normatização, Pasolini defendia as singularidades, uma relação mais sensual e vital com a natureza e com o mundo. Para ele, não havia nada mais fácil e traiçoeiro do que exaltar o bem e execrar o mal quando isso apenas reverbera o que todo mundo pensa ou acredita pensar, na inércia de uma manipulação, histeria ou alucinação coletiva.

 Sobre a ambiguidade do autodenominado “homem de bem”, incapaz de reconhecer contradição em si mesmo, Pasolini usa a metáfora admonitória da água que mata a sede mas também afoga. Será mesmo tão difícil entender que muitas vezes defendemos o que nos põe em perigo?

 A esta altura deve estar difícil até para os mais crentes defender que Moro seja quem ele diz que é, em contradição com seus atos. Ainda que, frio e calculista, guardasse na manga uma cartada estratégica (só se voltar contra o capitão ao qual vem atendendo servilmente, na reta final, quando pudesse enfim sair da sombra abjeta para se impor como alternativa ao horror), o ex-juiz contaria com um inimigo fatal em si mesmo. Ninguém se associa ao horror impunemente. Em sintonia com o chefe, lida muito mal com a contradição e o dissenso.

 Até aqui, Moro tem se escorado na ressonância do público que ele diz ver e ouvir, mas ao qual embaça e abafa o acesso à verdade. Incapaz de se defender, delega ao público o veredicto crédulo e devoto sobre seu destino. Pede fé e em troca oferece o pau oco.

 Matera comemora em 2 de julho a sagração da Madonna della Bruna. Um desfile toma as ruas da cidade sob os aplausos do público. No final, a mesma turba que aplaudia avança sobre o carro principal, de papel machê, e o destrói num ato de aparente vandalismo. 

 Não há contradição. A destruição tem menos a ver com linchamento do que com confraternização cívica. Faz parte da festa, de uma relação republicana com os santos, que parece ter mais a nos dizer do que talvez estejamos prontos para ver e ouvir.",1
255,2019-07-14 02:50:33+00:00,"Your solution is an extension of the war on drugs! The most effective policy is to go after the suppliers, and by that I mean major drug companies like Rochester Drug Cooperative who've been exposed as having irresponsibly supplied drugs to pharmacies which then went on to illegally sell them to customers. And the Sacklers of Purdue Pharma who knowingly lied about the addictive properties of OxyCotin and used a lucrative commission system to pay doctors who pushed the most product. There is a direct connection between the Sacklers and Rochester Drug Cooperative and the opioids crisis. I believe they should be held criminally liable for their role is cause so much death and despair in the state of Chesapeake. I also believe that addicts should be given immunity from prosecution if they come forward to receive intensive treatment for their addiction. But your desire to continue the war on drugs will do nothing but continue mass incarceration in our state.",1
256,2019-07-13 19:34:27+00:00,"They forget to mention using highly addictive drugs such as heroin,fentayl,cocaine,meth ect to reel these young girls (reports are going up in age first it was young as 12. Now 14) to get them stuck in a life of addiction to have control over them.

Zorro is also a mafia out in mexico..gang cartel that is alleged to be involved in large scale drug trafficking an human trafficking. Crazy how this is the SAME exact tactic used by Bill Clinton brother while bill was governer of Arkanside. They had been outfitting planes with trap doors an false nose cone cavities to smuggle drugs or drop in low altitude drops overy known drop zones. One being where 2 boys were found dead from smoking to much  weed, falling asleep on the tracks an being ran over by a train....then it came out they actually noticed low flying planes dropping packages (drugs n money) they decided to snag one an were confronted on the track by what one witness (iirc dead now or in jail) said the sheriff was there along with bills brother. Then the case was squashed an repeatedly told not to investigate an anyone who did was fired. So eventually the newly hired investigator seen the blatant connections. Made a huge case file for FEDERAL prosecutors so she could go around state level. She was assured her name would stay anon an feds would investigate.
She handed all info over an the feds back stabbed her. Gave the case file to her boss who said (don't look into it) she was fired,smear campaigns an death threats until she moved.
The documentarysecond

""the Clinton chronicles""

""The boys on the tracks""

Goes in depth into all if it. There was sufficient evidence to prosecute with racketeering,international drug smuggling,human trafficking,murder,conspiracy,complicity,corruption,conspiracy to defraud taxpayers,RICO act (an a host more) ect ect...if my mind serves me right there is NO statue of limitations on murder or running an international drug smuggling op. With help of public tax paid officials mostly all in on it...

Crazy how these people are following the same cookie cutter patterns. They also own secret ranches an houses near the border an could be working with cartels in mexico,to Hollywood an newyork. Not even mentioning the over seas connections. Highly recommended watching both named documentary an see for yourself.",1
257,2019-07-13 16:51:58+00:00,Steve foi de babaca a heroi e depois virou um herói que só se ferra.,1
258,2019-07-13 15:40:28+00:00,"So very true...NO ONE IS IMMUNE TO FENTANOL!
JUST THE USUAL DOSE IF YOU DONT KNOW ,",1
259,2019-07-13 14:33:43+00:00,"Pretty much any of the hard drugs like coke, amphetamines, and powerful opiates like heroin or fetanyl. 

I think this is double the case for people who are a bit depressed as they finally experience what it feels like to be *happy* or free of anxiety, albeit the drugs inflate the feelings more than anyone would feel naturally.",2
260,2019-07-13 14:24:25+00:00,"This is probably not everything I've tried, will edit later.

Alcohol: 6/10
Weed: 8/10

Psychedelics:
Mushrooms: 7/10
LSD: 8/10
2-CB: 6/10
4-HO-MET: 8/10
DMT: 9/10
Salvia: 0/10

Uppers:
MDMA: 7/10
Meth: 9/10
Cocaine: 7/10
Amphetamin: 6/10
2-FMA: 8/10
4-FMA: 8/10
NEP: 7/10
aPHP: 7/10
Methylphenidate: 7/10

Dissociatives:
Ketamine: 10/10
Nitrous: 6/10
2FDCK: 7/10
3-MEO-PCP: 8/10
3-HO-PCP: 8/10
3-HO-PCE: 6/10

GABAergics:
Xanax: 7/10
Valium: 8/10
Phenibut: 9/10
Lyrica: 6/10
GBL: 9/10
GHB: 8/10

Opiates:
Oxycodon: 5/10
Buprenorphine: 7/10
Morphine: 6/10
Heroin: 4/10
Kratom: 7/10",1
261,2019-07-13 10:09:08+00:00,"I had a similar experience with ""lack of non SRS people being reluctant to do anything"".

My local hospital is around 700m from where I live. The hospital I had SRS at is about 150km away. I wasn't allowed to drive because of being on morphene.

Anyway, I was urinating blood for 5 days, went up to the ER, got some antibiotics from them, but they refused to oull the catheter, despite it being time, and it leaking.

A lot of thr reason to do surgery in Europe is based on not wanting to travel as far, and a ""false sense of security"" that thr healthcare is somehow better here than it would be in Thailand for example, but it isn't really the case.

This was Sweden btw.

Wishing you a good recovery and as little discomfort as possible!",2
262,2019-07-13 09:33:27+00:00,"Bravul transilvănean: taie tot.
Tot bravul transilvănean, cu drujba in mana: De ce ar face străinii una ca asta?

Zici ca e heroina lemnul ăla și bietul om a primit prima doza gratis in curtea scolii.",-1
263,2019-07-13 03:44:14+00:00,oxycotin bottles stay open,1
264,2019-07-13 03:40:43+00:00,"The issue with fentany is that risky lethal dose issue. It's a bit like the acetominophen, (Tylenol), which is 'safe' and over-the-counter in the US, and is incredibly dangerous and kills quite a few people.

And the issue with those 'harsher' illegal substances is that cartels will push them harder if the others become legal.

All that said I generally speaking do agree with you, I just think that rather than legalising all drugs, we use evidence and reason to decide which are safe to decriminalise/legalise.",1
265,2019-07-13 02:25:49+00:00,Do you happen to know the release time for an IR morphine? MSContin?,1
266,2019-07-12 19:48:24+00:00,"Then you have this thread full of people blaming their doctor for not prescribing strong enough pain killers when they had x (no you don't need oxycodon after getting your wisdom teeth pulled, ibuprofen will do fine).",38
267,2019-07-12 19:38:21+00:00,"It seems such an inconsistent thing. When I had my wisdom teeth extracted, they gave me a ton of oxycodon when I probably could have been fine with higher strength naproxen + acetominophen and even if not was way more than needed, something like 60 doses. Then you hear stories of people in serious pain who actually could use it not getting it. It seems that if a patient has bad pain, it would be good to prescribe a low dose, low supply and then re-evaluate in a week or so if it's actually still needed, instead of bizarre one-size-fits-all things we seem to do.",164
268,2019-07-12 18:07:36+00:00,"Thanks, lol!

Wow, I didn't even know Heroin was legal at all in the UK, that's good.

I can now see why it's over the counter VS prescription, that's 1 gram of paracetamol/acetaminopen per 32mg...

I can't even take 500mg of it without my abdomen hurting a lot, though I am sensitive to that side effect due to my previous extensive use of it for chronic pain before I had better pain management.

It's way cheaper to use heroin than codeine in the US, too.

There are people who legitimately pay *$1000* for a bottle of codeine + promethazine (prescription anti-histamine) here, just because it's popular and ""cool"", though they're mostly really rich rappers who can afford it and mix it with pop/soda, usually sprite, to make ""lean"".

Most people who use opioids either use codones or morphones, or heroin. There's a **HUGE** problem with laced product here, especially with fentanyl, as you almost certainly know.",1
269,2019-07-12 16:58:22+00:00,"I can tell you from personal experience with being on Suboxone, doctors will often prescribe twice or even three times the amount necessary for withdrawal.

Suboxone is so strong, that 8mgs is usually more than enough to curb a daily heroin addiction. But people I know and even myself have been on upwards up 24mgs to even 32mgs. This produces hellish withdrawal when trying to come off and is definitely more than any one person would ever need.

And what happens most of the time is people end up selling their extra Suboxone and the spiral continues. Any addict will eventually discover they done need four 8mgs a day. And at ten bucks per 8mg strip, addicts fall back into their addictive behavior. 

What I'm saying is if the doctors prescribe more than is needed, obviously addicts will abuse the system. Just like with oxycotin, morphine, hydrocodone etc.",32
270,2019-07-12 16:19:58+00:00,"Wow, two homicides? I've known four people who have died from highschool, both three were fetanyl ODs and the other was illness.",15
271,2019-07-12 15:46:10+00:00,"So, as with most other words, μαλακός could exhibit a range of meanings and characteristics in different contexts.

A statement by Dionysius of Halicarnassus illustrates this range — mentioning a certain Aristodemus, who was called μαλακός ""either because when a boy he was effeminate and allowed himself to be used as a woman [εἴθ᾽ ὅτι θηλυδρίας ἐγένετο παῖς ὢν τὰ γυναιξὶν ἁρμόττοντα ἔπασχεν], as some relate, or because he was of a mild nature and slow to anger, as others state"" (*Rom. Antiq*. 7.2.4). So here we have a pretty clear statement of its use for a passively penetrated male, but also one of the rare uses of a *positive* sense for μαλακός.

But yeah, mostly it assumed a highly negative connotation, and could even be used in reference to a sort of fixed characteristic trait and nature.

As far as securing its usage it regard to passive penetration, one other useful place to look here is the semantic overlap between this and Latin *pathicus* (παθικός). Even more unequivocally than a number of Greek sources, this could suggest a male involved in passive penetration; and see other Latin terms sometimes related, like *pedicatus*. There's also, perhaps most famously, the κίναιδος/*cinaedus* — though at various times these are described as being bisexual. One salient point here may be that, to a number of Greek and Roman authors, hyper-sexuality was portrayed as a kind of degenerate effeminacy. So this can explain some of the overlap between μαλακός as one who's just generally effeminate, and one who's involved sexually with males too.

Ptolemy's *Tetrabiblos* connects the μαλακός and παθικός in this regard — in a passage that might also be compared with some of what we find in Romans 1, too. 

Here's the full entry on μαλακός in *BDAG*, by the way:

&gt;pert. to being passive in a same-sex relationship, *effeminate* esp. of *catamites*, of men and boys who are sodomized by other males in such a relationship, opp. ἀρσενοκοίτης (Dionys. Hal. 7, 2, 4; Dio Chrys. 49 [66], 25; Ptolem., Apotel. 3, 15, 10; Vett. Val. 113, 22; Diog. L. 7, 173; PHib 54, 11 [c. 245 b.c.] may have this mng.: a musician called Zenobius ὁ μαλακός [prob. with a sideline, according to Dssm., LO 131, 4—LAE 164, 4]. S. also a Macedon. ins in LDuchesne and CBayet, Mémoire sur une Mission au Mont Athos 1876 no. 66 p. 46; Plautus, Miles 668 cinaedus [Gk. κίναιδος] malacus; cp. the attack on the morality of submissive homoeroticism Aeschin. 1, 188; DCohen, Greece and Rome 23, ’76, 181f) 1 Cor 6:9 (‘male prostitutes’ NRSV is too narrow a rendering; ‘sexual pervert’ REB is too broad)=Pol 5:3.—S. lit. s.v. ἀρσενοκοίτης. B. 1065. DELG. M-M.

As far as μαλακός goes in terms of being a formalized profession, there isn't much/anything to suggest prostitution, AFAIK. In a particularly well-known example, from the 3rd century BCE Greco-Egyptian papyrus P. Hibeh I 54, a certain Zenobius is referred to as μαλακός, here clearly a formalized profession. And there are in fact a [number of Greco-Egyptian papyri](https://eugesta-revue.univ-lille3.fr/pdf/2015/6.Sapsford-Eugesta-5_2015.pdf) which refer to μαλακοί in terms of a paid profession — one that, in these contexts, seems to suggest that this referred to a kind of hired *musicians* and performers and/or dancers. (As far as it relates to other uses of the term, perhaps it referred to eunuchs in particular, or to those who danced effeminately. P. Hibeh I 54 is especially valuable in this regard, as it goes on to say that Zenobius was ""wanted by the women for the sacrifice."")",14
272,2019-07-12 15:01:49+00:00, The news story was that at least it wasn't opioids or something cut with fetanyl.,6
273,2019-07-12 14:45:24+00:00,"I have chronic pain issues and sitting still makes it worse. Take breaks, try standing/walking around regularly in whatever capacity is possible for you, and listen to your body.

The harsh reality of pain induced disabilities is that your capacity is just less, and you need to adjust to your capacity. You can find ways to extend it by trying different things, but the best thing is acceptance. If you can accept your limitations, it's easier to work with them. Focus on what you can do and respect what you can't do. If you keep trying to do everything you did before, you might end up hurting yourself more and reducing your capacity further.

I'm really sorry you're dealing with this too, but I hope you can find a way to manage this and get back to playing!

(If it's accessible and legal to you, I also recommend CBD oil or straight up weed to vape or smoke. I quit oxycodon and rely on weed now because it has less side effects and allows me to function better overall, especially with computer use! It's not for everyone and it's okay if you don't want to or can't, it's only a suggestion based on how helpful it has been to me.)",13
274,2019-07-12 14:19:34+00:00,You still get high from -substance + normal dosage-???? Man I need at least 40x 80mg oxycodon,2
275,2019-07-12 07:17:17+00:00,"I was getting blue 30s back in 2015 before I knew what illicit fentenyl was I just thought the pills were super strong but now I know. Anyway my cousin came up to stay the night and got a couple from me. I thoroughly warned him but of course he, who used to do the big green 80s back in the day, snorted half which you'd think anyone could handle. 30 minutes later I'm slapping him in the face so hard screaming for him to wake the fuck up getting absolutely 0 response, pry his eyelids open and his eyes just roll back in his head and yelling at my other cousin to call 911 and bring naloxone. EMTs show up very quickly and shoot him up with the narcan and his eyes just magically open back up.",1
276,2019-07-12 07:07:19+00:00,"Just like they outlawed heroi- oh wait, never mind.",2
277,2019-07-12 04:31:27+00:00,"Now that's just masochistic, why don't I give you copious amounts of Black Tar Heroine? Or maybe Phentanol?",5
278,2019-07-12 03:01:17+00:00,"Ah bueno asi si, yo lo deje porque andaba con 300 de ping. Sin nada mas que hacer, Creo que asi se debe sentir cuando dejas la heroina",1
279,2019-07-11 22:56:52+00:00,"Yes mundipharma brand. They make the best opiates. OC's, mscontin, Dilaudid/HP.",2
280,2019-07-11 22:41:43+00:00,"It’s not as, but, by legs, I kinda know what you mean, but, how were you able to deduce from reading the word buprenorphine that it sounded like it had good legs ? Is it The “orphine” part of the word, denoting morphine derivative?",1
