,date,body,score
221,2019-03-17 02:48:44+00:00,"Ah okay gotcha thanks that stops me from wasting anymore, 2 packs full I crushed up and put in a little powder holder necklace thing, I guess it's not a waste I could always put the powder in bits of cigarette paper and swallow, that should still metabolise into morpine. Thanks for the answer. :) ",1
222,2019-03-17 02:17:16+00:00,"Has your aunt (or someone else) been appointed executor of the estate? If she has, then it is possible she could kick you out by following Ohio's laws about ending a tenancy (30-day notice, etc.), although it's likely a very bad idea on her part to do so without a really really good reason (dealing oxy and fetanyl out of the front room or setting fires in the basement level of good reason). With this level of animosity, it might be a good idea for you to get a consultation with a probate attorney of your own to review and explain what's going on. ",1
223,2019-03-16 23:56:58+00:00,"""We know how many have occurred even though 2/3 of those reported last year were shown to have not happened when actually investigated? That does not make sense.""

All we have to do is check the body counts of the mass shootings at schools to confirm those shootings happened. I think we can all agree those shootings are confirmed as happening. 

""Gun companies dont advertise that their guns are to be used for killing people in cold blood. They advertise the advantages during hunting and home defense.""

And they go out of their way to hide data that shows when they are used in any other way. 
Like the Saklers did with oxycotin. 

""What do you want them to do?""

Stop blocking research into the impact of guns on the well beings of Americans.

If that research then confirms the harmful impact they've had on America, then that would mean they, like the Sacklers or the tobacco industry, have actively been hiding the truth and they should pay the price for that.",1
224,2019-03-16 23:54:47+00:00,"everyone has different situations. i worked with a lot of addicts who came from poor family situations of molestation and abuse who turned to drugs. they are not playing the game to risk killing themselves, they want escape

honestly it wouldn't take that much to prevent fentanyl related deaths. safe use sites for instance, can test drugs for fentany",1
225,2019-03-16 21:50:52+00:00,"Oral morphine?? I think this Dr needs to get some education.. these are two totally different drugs, period. Morphine is a full agonist and buprenorphine is a partial. It's the ""orphine"" that is confusing this Dr.   What I would do is have her speak with the pharmacist.  She is wrong",1
226,2019-03-16 21:07:26+00:00,"And as I said, that's irrelevant to the question at hand. It does nothing to establish that guns are safe. All that articles does is confirm that school reporting/ data gathering on shooting incidents is poor. Regardless of that, we still know that many school shootings HAVE occurred, many of them massacres. If I'm at a plant and I see the incident report rate is at 115 but the confirmed incidents is only 25, I'm still going to address the issue causing the incidents, it doesn't get a pass.

No harm is inflicted on anyone due to the poor reporting of schools on the number of shooting related incidents that happen when we have a sufficient quantity of confirmed incidents that show clearly that there is an issue with guns in America.
In that context, any attempt to block/ hide/ prevent research into how guns impact the health of American citizens, like with Oxycotin, becomes worthy of litigation because that malfeasance leads to direct harm to the public.


If alcohol companies were to advertise in a fashion that suggested operating a car while drinking was good, then they'd be responsible. 
But alcohol companies are proactive in promoting a ""don't drink and drive"" message. They have been proactive in supporting the pursuit of the research that shows it is not safe to drink and drive.

Gun lobbyists and manufacturers have done the opposite.
",1
227,2019-03-16 21:00:52+00:00," Ã Ã©poca presidente da Venezuela, Hugo ChÃ¡ves decidiu reabrir o tÃºmulo de [SimÃ³n BolÃ­var](http://www1.folha.uol.com.br/mundo/762320-venezuela-homenageia-amante-de-simon-bolivar-heroi-da-independencia.shtml) faz quase dez anos. A ideia era retirar amostras de DNA para reconstituir os traÃ§os do militar, que auxiliou no processo de descolonizaÃ§Ã£o da AmÃ©rica Latina no inÃ­cio do sÃ©culo 19.

 Vendo a empreitada do governante, a artista Deborah Castillo decidiu: queria fazer o mesmo. NÃ£o era exatamente um procedimento cientÃ­fico, mas o que a performer buscou era fazer tambÃ©m um gesto iconoclasta. Em sua performance âO Beijo Emancipadorâ, ficava frente a frente de um reluzente busto dourado de BolÃ­var. Punha-se a acariciar a imagem do libertador, depois a beijÃ¡-la, lambÃª-la com ternura.

 O trabalho e a mostra em que foi realizado em 2013, em Caracas, acabaram censurados pelo governo. âFui denunciada em um canal do Estado, como se eu fosse a profanadora da pÃ¡tria, como se estivesse faltando com respeito ao pai da pÃ¡triaâ, diz a artista, hoje aos 48. âEu nÃ£o tenho nada a dizer sobre BolÃ­var como pessoa, mas, sim, sobre o que o governo chavista fez com a sua imagem. EntÃ£o eu eu tomo a imagem de BolÃ­var para desestabilizar e resistir ao sistema. Ã minha crÃ­tica Ã maneira como tomaram a imagem de BolÃ­var para dominar o povo.â

 No ano seguinte, Castillo decidiu deixar seu paÃ­s e desde entÃ£o vive em Nova York. Nunca mais voltou Ã Venezuela porque sente que nÃ£o tem liberdade de trabalhar lÃ¡. âNÃ£o sou uma exilada, sou uma deslocada. Queria estar na Venezuela, mas nÃ£o posso, senÃ£o perco a liberdade de expressÃ£o. Um dos problemas mais graves Ã© o desmantelamento do aparato cultural.â A Ãºnica maneira de ter uma mostra num museu ou numa instituiÃ§Ã£o oficial, segundo ela, Ã© fazer propaganda ao Estado.

 Parte da famÃ­lia ainda vive no paÃ­s, mas nem sempre consegue se comunicar com a artista. âA situaÃ§Ã£o no Ãºltimo ano piorou muito. Ãs vezes fico trÃªs dias sem conseguir falar com minha mÃ£e, eles passam uma semana [sem luz](https://www1.folha.uol.com.br/mundo/2019/03/como-funciona-o-sistema-de-energia-na-venezuela-e-por-que-entrou-em-colapso.shtml), Ã¡gua, internet. A Venezuela comeÃ§ou como um projeto socialista e hoje nÃ£o tem nada de socialista. O que tem de socialista um lugar em que as pessoas estÃ£o comendo lixo, bebendo Ã¡gua de esgoto? Ã uma humilhaÃ§Ã£o humana.â

 Mas nÃ£o Ã© apenas do sistema venezuelano que trata o trabalho de Castillo. Ela versa muito sobre o poder e o desejo e como muitas vezes os dois caminham juntos, se cruzam. âNÃ£o me interessa criticar a direita ou a esquerda, mas estudar, a partir da imagem, como essas estruturas de poder vÃ£o em paralelismo em estrutura. Os sistemas totalitÃ¡rios, nÃ£o importa onde sejam, sÃ£o opressores.â

 Como ela faz em âLamebrasil, Lamezuela - Questionamentos ao Poder na AmÃ©rica Latinaâ, performance que ela apresenta dentro da [MITsp - Mostra Internacional de Teatro de SÃ£o Paulo](https://www1.folha.uol.com.br/ilustrada/2019/02/peca-de-felipe-hirsch-escrita-por-alejandro-zambra-sera-um-dos-destaques-da-mitsp.shtml). Nela, ajoelha-se e lambe botas de militares, num gesto de obediÃªncia e desejo.

 Ainda que busque Ã­cones histÃ³ricos e figuras polÃ­ticas, o que faz em seu trabalho Ã© questionar a estrutura e a teatralidade do poder âmuitas vezes com humor negro, como faz em sua sÃ©rie de fotonovelas, em que cria situaÃ§Ãµes absurdas, de tom polÃ­tico. Como no mito de SÃ­sifo, que sobe a montanha com uma pedra e, jÃ¡ no topo, a deixa cair, ela critica como os governos latino-americanos nÃ£o dÃ£o continuidade a projetos de gestÃµes antigas, sempre partem do zero e nÃ£o dÃ£o espaÃ§o para desenvolvimentos sociais mais profundos.

 Mas muito, inevitavelmente, Ã© embebido de sua experiÃªncia venezuelana. âÃ como um amante tÃ³xicoâ, diz a artista. âNÃ³s, que estamos fora, ficamos angustiados pelos que estÃ£o dentro. Ã um duelo que vocÃª leva para onde vai.â

  ",1
228,2019-03-16 19:56:27+00:00,"My friends from USA buy here complect of design spoons and forks. Tell me they cost 3 times more in USA. Also folk stuff - paintings, earrings, antiq stuff. Clothes has same, and sometimes higher prices than in Europe and same quality. Local drinks is also great investment)",1
229,2019-03-16 11:22:49+00:00,Lace my weed with fetanyl my dumb ass doesn't know how to check for that.,1
230,2019-03-16 07:11:36+00:00,"IMPORTANT i guess lol if ur reading this its context to my situation 

Man got pulled out of my whole art mood rn by having to explain my shitty abuser so i dont seem likr a shit bag for doing drugs. So im just gonna copy and paste that to here since this js the main update thread. 

THIS US THE TYPE OF MAN WHO WILL BUY A HEROIN ADDICT MORPHINE PILLS WHEN U TELL THEM YOUR VULNERABLE 

No you haven't met or been around him. I'm a not clearer in mind rn cos ive come down from the initial rush but no lemme explain so i do sound all shitty. He is diafnosed paranoid scizo and is a very angry and bitter person. I'll try and go have night out with my girls or go to a party and hr loses his shit and will drink him self to seizures just to make me feel bad for going out and not spending every waking moment with him. Hes threatened to kill my friend and my coworkers when hes been drunk and it just gest sk fucking intense. And it causes to instead of having a fun weekrnd out to do all my shit in thw wrrk all strung out with him. 

So when. Im talking about killing my vibe im saying im not gonna let him make me sad and pull down like he wants to. and it worked just like i knew ut would. Id dolidnt let him kill my vibe and let him have one of his scizo fits and niw hes awake turbed the lughts back on and wants all my atention aga8n. 

When i first met my sugar daddy who gives me i dope i told my husbad syraight up not to bring any.pills in the house cos i felt i was getting bad again. Like i broke down crying Like laid it all out for him and then i went away for a few days and when i came back? Another sob story about how he almost died (this happens any time I'm gonr longer than a day) and what else F I V E MORPHINR PILLS. And he only wanted one he bought all those to keep me chained. Thatg was at the start of febuary and look at the state of my addiction now. 


Hes an abuser pla8n and simple sorry if im too fucked to explain it in a mire digestible way. 

I HAVE NEVER BOUGHT DRUGS! Everything ivr taken has bern handef to me by the men in my life to keep me complacent and well behaved. 

",1
231,2019-03-16 07:08:45+00:00,"THIS US THE TYPE OF MAN WHO WILL BUY A HEROIN ADDICT MORPHINE PILLS WHEN U TELL THEM YOUR VULNERABLE 

No you haven't met or been around him. I'm a not clearer in mind rn cos ive come down from the initial rush but no lemme explain so i do sound all shitty. He is diafnosed paranoid scizo and is a very angry and bitter person. I'll try and go have night out with my girls or go to a party and hr loses his shit and will drink him self to seizures just to make me feel bad for going out and not spending every waking moment with him. Hes threatened to kill my friend and my coworkers when hes been drunk and it just gest sk fucking intense. And it causes to instead of having a fun weekrnd out to do all my shit in thw wrrk all strung out with him. 

So when. Im talking about killing my vibe im saying im not gonna let him make me sad and pull down like he wants to. and it worked just like i knew ut would. Id dolidnt let him kill my vibe and let him have one of his scizo fits and niw hes awake turbed the lughts back on and wants all my atention aga8n. 

When i first met my sugar daddy who gives me i dope i told my husbad syraight up not to bring any.pills in the house cos i felt i was getting bad again. Like i broke down crying Like laid it all out for him and then i went away for a few days and when i came back? Another sob story about how he almost died (this happens any time I'm gonr longer than a day) and what else F I V E MORPHINR PILLS. And he only wanted one he bought all those to keep me chained. Thatg was at the start of febuary and look at the state of my addiction now. 


Hes an abuser pla8n and simple sorry if im too fucked to explain it in a mire digestible way. 

I HAVE NEVER BOUGHT DRUGS! Everything ivr taken has bern handef to me by the men in my life to keep me complacent and well behaved. 

",1
232,2019-03-16 03:14:38+00:00,That Oxycotin must contain some sort of preservative that only activates under the stress of true evil. That's why these fuckers stay alive so long,1
233,2019-03-16 02:59:29+00:00,Um Verdadeiro Heroi,1
234,2019-03-16 01:49:46+00:00,"Okay, then a more relevant example.

Oxycotin. 

It was (still is) legal to sell within the legally prescribed guidelines. However, like with guns, the manufacturers and their lobbyists (and the politicians they bought) went out of their way to hide/ misrepresent the dangers of the drug. As a result they're now facing multiple lawsuits that they're likely to lose (hence the bankruptcy they're considering).

Do you think the lawsuits against the makers of oxycotin are justified? ",1
235,2019-03-16 01:42:32+00:00,It’s random. The merchant will also require certain supplies to access. For example in the east DZ he requires 30 morophine. Which I believe can only be found in the South DZ containers. ,1
236,2019-03-16 01:01:59+00:00,"Hi. Long term lurker and have switched from Suboxone strips to Zubsolv to the old orange tablets then back to Zubsolv so I thought I'd pitch in my experience. 

I've been on Zubsolv 2 x 5.7/1.4 since getting out of rehab in 2016. In there it was all brand Suboxone strips. Zubsolv is supposed to have better absorption so 5.7/1.4 = 8/2 Suboxone. A guy in rehab told me about them. When I got out I decided not to taper and stay on bupe long term - maybe not forever but for a good long while. Why is another story. 

I don't remember if the doc wanted me to take Zubsolv or if it was the insurance company. Anyway, when the Suboxone strips rehab gave me on exit ran out, I switched to the  Zubsolv, and to be honest never noticed any difference. 

I was recently in the hospital for 15 days. Actually 2 different hospitals. I told them all the medications I am prescribed, including the Zubsolv. The first one put me on 10mg of Suboxone - an 8mg strip and a 2mg strip. I don't know how they arrived at that dose since 2 x 5.7/1.4 Zubsolv is supposed to be equal to 16mg of bupe. The dose reduction was not really a reduction because I only take 1 of those 5.7/1.4 Zubsolv a day. (My bupe doctor is over prescribing because of a clerical error on his part that he will not admit to. So, I have a nice amount set aside in case I ever get caught without a bupe doctor.)

When I got transfered, the second hospital gave me the old orange pills (still an 8mg and a 2mg). The 8mg orange tablets take forever to dissolve. I did get a mild headache the first day but that was it. When I got discharged, I went back to Zubsolv. Still never noticed any difference. 

I will mention that recovering from surgery while pretty much totally opiate blocked was an ""interesting"" experience. Even though I told them, and they were actively issuing 10mg of bupe per day, they still injected me with IV Fentanal and Dilaudid in pre-op (so they told me) and it had absolutely no effect. I asked the anesthesiologist if he used opiates in his drug regimen and he said yes. I said I hoped he had plenty of non-narcotic arrows in his quiver because I did not want to wake up in surgery (I didn't)!

That night, after surgery and post-op, back in my room, they injected morphine (don't know how much) and we're giving me 2 x 10mg Percosette every 4 hours. Nothing. It was a long night. Kind of guy off track but my point is, at least for me, switching from Suboxone to Zubsolv  to the orange tablets then back to Zubsolv never bothered me, other than a mild headache the first day they switched me to the orange tablets. I guess everyone is different. YMMV...",1
237,2019-03-15 18:02:48+00:00,"But why?  Dont you need a prescription for fentenyl?


Just big ole corporate drug dealers",1
238,2019-03-15 15:33:19+00:00,"im not in saf man. was just offering whatever i knew of security trooper and pes b4, apologies for any mistakes. i know 8sir is fucking rabak, my bro trained with 9sir for a while for vocational training and was lamenting. ord?",1
239,2019-03-15 13:48:49+00:00,I suffer with a chronic illness. I'm on 20 mg Oxyconton every 12 hours and 10 mgs of Oxynorm every 6 hours. I've never been out of it like this OP described. That's scary as fuck. ,1
240,2019-03-15 13:35:49+00:00,Buy Anxiety and Pain relief meds depression Xanax oxycodone oxycotin diazepam Valium nitrazepam Text 832-919-6293,1
241,2019-03-15 13:30:52+00:00,"I wish she would pursue drug makers and the creators of oxycotin in the same manner. Makers of oxycontin were allowed to make the antidote for their own drug, can Remington just make bullet proof vests and we be done with the whole witch hunt on arms? ",1
242,2019-03-15 13:26:08+00:00,"&gt; esta criando um personagen que nunca existiu, um heroi, para empurrar a agenda deles. 

Essa afirmação, de que nunca existiu a luta dela pelas minorias e que ela lutava contra as milicias, o quão verdadeira ela é ?

&amp;#x200B;",1
243,2019-03-15 13:20:02+00:00,"Acho que o odio nao é a ela mas a espetacularizacao feita sobre sua imagen apos sua morte. voce deve ter visto comentarios do tipo ""não era ninguen"""", ""nunca tinha ouvido falar"" de certa forma estes comentarios apesar de serem bem merda se sustentam na realidade. 

De 2017 para ca entre prefeitos, vereadores foram mais de 40 mortes um vereador na cidade de Magé- RJ foi morto na frente da Camara, fora os milhares de assassinatos de civis que acontece todos os dias. 

Entao o cara simplesmente por ser politicamente contrario a posicao politica da pessoa em questao acha que ouve uma completa espetacularizacao um ""exagero"", que a midia que o lado contrario é completamente enviesada que esta criando um personagen que nunca existiu, um heroi, para empurrar a agenda deles. ",1
244,2019-03-15 12:28:05+00:00,"EXATO, tinha outras também.
Você é um heroi.",1
245,2019-03-15 09:13:43+00:00,"This is good. The Chinese are about to get a taste of that Jewish poison.

I dont think the chinese psyche can handle seeing massive black dick. This is how we get even for the fentanyal ",1
246,2019-03-15 06:49:40+00:00,"Napagkamalan mo atang former president si Duterte? Mismong siya inamin niya fetanyl adik siya.

Shoot to kill na",1
247,2019-03-15 06:07:05+00:00,"Oo, shoot to kill dapat yung fetanyl adik sa Malacañang /s",1
248,2019-03-15 04:34:13+00:00,"Now do ownership of Pornography companies.

Rap Producers.

NBA team owners.

Mass media Executives/owners.

Ocycontin! Gender destroying hormones!",1
249,2019-03-15 01:53:14+00:00,"I'm also a chronic pain patient.  Pot gets me stoned but cannot say it does much for pain,  I'm also on Oxycodone (same compound as Oxycotin) and I really need to quit because that stuff will eventually (and ironically) make you hypersensitive to pain.  I took hydrocodone for 30 years and don't ever recall any hypersensitivity to pain with that stuff.  Anyway, I'd recommend you try kratom.  Kratom really does work...  the problem is that it's so hit and miss.  You can find some kratom that works real well and they try  to buy the exact same thing from the exact same seller...  and it DOES NOT work.  There's just no getting around the fact that some of the kratom you buy will be worthless.  It got so I had to start asking for my money back every time I got sent some worthless kratom (which is ALL THE TIME).",1
250,2019-03-15 00:30:32+00:00,"Opana way better than h, and i know opana detox is worse than oxycodone i was sayin i was coming off oxycotin and opana thats why it was so bad for me. But i will say when i was on 2-3gs a day of bth the wd was alot more painful and agonizing but the wd from opana  is just so long and i got this horrible feeling that reminded me of methadone wd just cuz of how synthetic it is. They both have the worst wd ever but i just think the wd of bth is more clean u know u feel like ur coming off something natural but opana is more syntheic feeling wd. U cant say it isnt even close when everyones body reacts differently  ive met people who compared opana wd to light fent wd",1
251,2019-03-15 00:20:25+00:00,Bruh ive been on a 2+ g a day bth habit also lol but when i was on 90mg of opana a day the wd was sooooooo much worse than h wd but i was also on sum oxycotin daily as well but i say opana is just more rough on the body ime,1
252,2019-03-14 22:10:19+00:00,The Mob sells Heroin and Oxycotin....... doesn't sound like giving back. ,1
253,2019-03-14 21:53:27+00:00,"Weed is definitely a drug, and it's definitely something that can impare your function level.

The point of the matter is, though, that except in individuals who have something else wrong in their life, that they're self-medicating for, marinuana is generally less of a ""gateway drug"" than prescription painkillers like Oxycotin and Vicodin are.

People smoking pot don't usually switch to pther drugs like Heroin for a ""stronger"" high as their body builds up a tolerance or dependence, because the type of high is different. And withdrawal - if such a thing exists for habitual pot smokers - tends to not be particularly damaging or potentially fatal, the way it can be on harder drugs (alcohol included).

TL;DR - Marijuana is less destructive on the body than most other substances out there. As far as addictions may go, it's the equivalent ""compulsive Beanie Baby collector"". Not to mention, it doesn't kill people or rot their organs like other drugs will.",1
254,2019-03-14 21:50:55+00:00,"Nobody disagrees about border security when it comes to illicit activity. There’s just about 8 billion different ways to enact systems and policies that aren’t blatantly about racism or Islamaphobia... 

If we’d really care about drugs, we’d shift all that money/resources towards securing our ports by building a world class customs inspection system instead of having understaffed/underpaid/under-resourced/overworked workers check literally millions of cubic tons of commerce shipments looking for a needle in a needle stack. We could also beef up satellite, drone, and sensor networks across the border which would be a far more cost effect means to police large expanses, than a wall that’s need maintenance and could be gone over, under, or through.  Hell, we could even setup a draconian legislative provision to refuse deportation and extradition of convicted drug traffickers and hyper violent offenders and convict them with life sentences. That way the US wouldn’t be a training camp for gangs to send the worst of the worst back to home just to either come back or make their communities unlivable.

Also it’d be great if out any of the China trade garbage, we’d lay our foot down on the throats of any and all the corporations linked with producing fetanyl or fetanyl-precursors and pinpoint the Chinese state-funded actors stealing IP with a global initiative like the WTO, but with actual consequences (I.e. a united coalition of countries to either tax/punish/block companies like ZTE or a fair trade stamp for electronics). Lastly, we could also do a lot by bolstering our foreign DEA initiatives and really drive home helping out México and Central/South American countries actually police the drug trade or even help them root out drug cartels completely. It’d an actual solution,  as opposed to an expensive patchwork that’d do nothing to solve the root problem other than make people “feel” safe...",1
255,2019-03-14 21:49:29+00:00,"Oxyconton and Oxynorm. I suffer with a severe chronic illness, but nobody tells you that trying to reduce the doseage of pain meds can be just as bad as the actual pain. It gets to a point that you convince yourself you need them, they're great at what they do but they're also very addictive. ",1
256,2019-03-14 20:51:07+00:00,"This seems to be the post that best applies to me. I don’t have or expect trouble with the Trams. I took them for a couple of months straight and just stopped without any withdrawal symptoms. I’m going to keep using them for a week, 10’days as my body gets used to the zero h-morphone. Then I’ll stop and see how it goes. ",1
257,2019-03-14 19:57:09+00:00,"No, I couldn’t imagine that, “Morpine Chugger”!",1
258,2019-03-14 19:43:06+00:00,"Teria que estudar qual o efeito de fato desses casos, muitos podem dizer que aumentam a quantidade de ataques, outros podem dizer que acalmam os ânimos de quem pensava em fazer, já que agora eles tem um ""heroi"" para cultuar.",1
259,2019-03-14 19:35:02+00:00,"A wrap is also questionable, as that’s what heroi e and crack are sold in. “Can I get a wrap?” Etc",1
260,2019-03-14 19:27:33+00:00,Fentynyl addicted Vancouverites. Just replace the words BC with Vancouver and then the poll makes sense.,1
