,date,body,score
90,2019-06-25 16:50:41+00:00,"Well.. Since you gave me gold, I feel compelled to share a bit of my story with you.  Ill start from May 2015, when my latest relapse took place.

&amp;#x200B;

I went to the hospital in May 2015, I couldn't eat, walk, or really function.  My body had turned septic from untreated Ulcerative colitis (didn't know I had it at the time).  I had 3 and a half years clean at the time.  After getting admitted into the hospital my favorite drug dealer/enabler, the doctor, asked me if I wanted anything for pain.  Well.. wtf do you think doc?  Mind you, I was in very little pain but I told him I was at an 8.  So 2 perc 5's down the gullet.  Every 2 hours after that I was given an opiate. Whether it be Fentenyl, percs, or morphine, something was entering my body.  So I stayed in the hospital for about 2 weeks, eating pills, and taking IV fent, and convinced my self I didn't relapse because the doctors gave it to me.   I was discharged on June 12th ish, and discovered my wife of 13 years decided to cheat on me while I was in the hospital.  Oh yeah.. I had my 35th birthday in the hospital too.  So there's Rez, in the hospital on his birthday alone.. and the exwife cunt bag is out fucking some dude she met at a wedding a few weeks prior.  I decided to use that as an excuse to start smoking weed.  That eventually led me to the DNM's, which was like nothing I have ever experienced before, and do not want to again.  I had access to things I never heard of before, and I did them all.  So I was pretty much a garbage head until Sept 2015, when I just said fuck this shit.. I know what I really want.  And I was off to the races.  Bundle after bundle, cotton shot after cotton shot, half sickness, the feeling of misery, and hopelessness. I decided to move out of the condo because my excuntbag cheating whore wouldn't stop fucking people besides me and she wouldn't stop smoking crack.  So I moved back to my house in the city, with a friend who has been clean for 10+ years.  he agreed to move in, under one circumstance.. I had to kick by February. Uggggh. That sucked, but I kicked cold turkey right before a 3 foot snow fall.  So I had 5 days clean, and had to literally shovel 3 feet of snow.. I have never wanted to die so much in my life.  Just think of how exhausted we are after kicking.. Now imagine having to shovel for 4 hours.. fuck my life man.  But I stayed clean.... until I wanted to put my wing wang in the ex's who-ha again. I did that in May, and kept hanging out with her until I finally started shooting dope again.  She was smoking crack in front of me, and I figured fuck it.. She is having fun, so can I.  So another birthday came and went, except I OD'd on this one.  I was at the condo with cheater mcfuckseveryone, and OD'd. 100% fell out, seizures, blue lips, drool, puke.. Everything.  Does she call an ambulance? nope, they cost too much money she said.  Instead she gives me shotguns of crack, and slaps me for an hour.  (I didn't die.. lol).  So I kept using until July 10th 2016, and decided to kick for good.  It has almost been 3 years since then, and I am grateful as hell to be clean.  I have buried so many of my friends in the last 3 years man.  It sucks, and doesn't get easier.. But it shows mw what will happen to me if I continue to play with fire.  I will overdose and I will die a miserable lonely junky.   


&amp;#x200B;

tl:dr Went into the hospital, wife of 13 years cheated, started pills, kept going with other drugs. Dope came back, OD'd got clean. got gold.. :-) 

&amp;#x200B;

:-) &lt;3 &lt;3 &lt;3",4
91,2019-06-25 16:49:08+00:00,"In my area it comes in all forms. But in the US the main salt of morphine is gonna be sulfate, even for injection. Oral solutions, MScontin tablets from 10 to 200mg, epidurals, injection ampuoles from 10 mg to 30mg for IV IM SC use. 
Yeah, we got all that",3
92,2019-06-25 15:03:32+00:00,"Fetanyl is stronger than heroin and I've received that several times before/during procedures. It's habit-forming over time, a single dose won't make you a junkie.

It's the painkillers they send you home with that might cause you a problem. But they're supposed to monitor it and look for drug seeking behavior to prevent you from going over the edge. Some of the lawsuits going on about opiates now are because of inadequate precautions and a lack of adequate supervision.",1
93,2019-06-25 12:50:49+00:00,"There is a reason the opiate epidemic is so much worse than the benzo epidemic.  Opiate withdrawals are the sole reason why it's so insanely hard to stop, because it is living hell.  I know benzo is too, but do not compare Xanax withdrawals to say heroin, fentantyl, methadone, etc.",1
94,2019-06-25 12:28:59+00:00,"Turn of phrase. As in kicked to the street from the clinic.

I am blessed to have the most supporting father ever. Also my work has been brilliant - paid me for a year of not working these past 12 months and I have a job waiting for me when I return.

I'm not a bad guy and really know my shit about certain IT things. If I was never diagnosed ankylosing spondlyitus I would never even have tried pain meds. I used to have stacks of codeine and tramadol I never took because they didn't work so I asked for something stronger. Had no idea what opioid addiction could really do. My GP is probably criminally negligent in giving me 100ug patches in hindsight. Same GP ""killed"" my Mum as her cause of death was fentany and venlafaxine overdose - both prescribed by said doc.",11
95,2019-06-25 12:26:50+00:00,Morphein. Heroin. Cigarettes,1
96,2019-06-25 12:17:56+00:00,"Why doesnt J&amp;J sue the addicts (or their survivors) for abusing their product? No individual responsibility in this... 

""Nobody told me opioids could be addictive, so I thought it was okay to keep taking more and more than I was prescribed. Then the doctor cut ME off? The nerve of some people, huh? So I was forced to buy my drugs on the street. My dealer sold me a bag of pure acetyl fentantyl and I died. So sue those drug companies in to bankruptcy, its all their fault."" 

Makes sense in OK, apparently...",1
97,2019-06-25 12:03:22+00:00,"No too mention Perdue Drug or Phara., I can't remember, pushed and experimented with the drug Oxycotin in poorer regions in the U.S., particularly central Appalachia knowing good and well that it was addictive, but wanted to see how addictive, while at the same time paying doctors to push the drug. Court Documents back this up. To also add with the crackdown on the pull mills people are turning to heroin as it offers the same high.",18
98,2019-06-25 07:21:31+00:00,"Everyone takes morphene seriously, oxycontin is much worse as far as addictive qualities.",22
99,2019-06-25 05:55:10+00:00,"Fentenyl sends people to the morgue, not the streets",2
100,2019-06-25 04:54:47+00:00,"How do they get the fentanal into the gear and why ? 
When I used it was either heroin or fentanal patches not some mix.",3
101,2019-06-25 01:30:23+00:00,it's true. asians bringing the fentynyl,4
102,2019-06-25 00:40:20+00:00,"Is this mainly a woman thing? Im a dude who hasnt hugged anyone of the opposite gender for probably years (except for my own mother). The only contact i get is from daily training grappling, wrassling and mma fighting and boxing which is alot of physical contact obviously.Maybe tjats my oxycotin lol.",-4
103,2019-06-24 23:10:11+00:00,"And? Does it test for baby laxatives? Or Comet cleaner? Most tests are for Fetanyl, and people cut all sorts of shit into drugs that the tests can’t pick up. 
You do you, but ground scores are sketchy as fuck.",-14
104,2019-06-24 19:19:12+00:00,"I think that's actually a case of the silly censorship resulting in the best outcome. The original fallout games didn't use real drug names either. Buffout, jet, psycho, mentats, stimpacks, rad-x and rad away all came from the early games.  Suddenly adding morphene to the mix would seem a little out of character.",8
105,2019-06-24 18:50:14+00:00,"I'm in the UK and, thankfully, there doesn't seem to be mass hysteria around opioids. In the last year I've been going through diagnosis of hashimoto's thyroiditis (hypothyroidism) and ever increasing back pain. Unfortunately it takes 2-3 weeks to get a Dr's appointment and when you do they're less than 10 minutes long so you really have to prioritise your ailments here! I've ended up in A&amp;E a couple of times where they threw oromorph down my throat along will different things but they just didn't seem to work anyway. I'm going to see someone about getting CBD oil on Wednesday so hopefully that'll help. The fact that I already have one autoimmune condition is why I'm not ruling out Ankylosing spondylitis.

That's excellent news about physical therapy. If anything, hopefully it'll just help to stretch and strengthen all your poor muscles. I'm sorry to hear about your dad. You're right though about just being grateful that it's not worse. It's awful but like I said to my family, it's not life limiting so there is definitely a silver lining around the electric stormcloud of pain!",1
106,2019-06-24 15:58:40+00:00,"Interesting, the evolution to not show pain makes sense. Also Im giggling at the thought of a monitor lizard with a fetanyl patch.",1
107,2019-06-24 12:10:34+00:00,"No te estas inyectando heroina capo, tranqui, no tomes todos los días y listo. Aparte el diazepam es una de las benzos más seguras en cuanto a potencial de dependencia.",2
108,2019-06-24 10:58:25+00:00,Este post lendário convenceu o cellbit a por a RainbowPls. Obrigado heroi dos weeb fogs,1
109,2019-06-24 10:50:53+00:00,PogU o nosso heroi traiu nos,7
110,2019-06-24 08:52:29+00:00,Just say oxycotin modified release,1
111,2019-06-24 00:28:49+00:00,"You will know. I had one following intercourse and it was the most pain I have ever experienced.  They'll be no question of wether or not it happened.  Its normal to feel a little pressure and pain after the surgery.  When my cuff tore, I couldn't move myself from the fetal position on the floor or walk.  All i can sat is it was a searing pain that morphine and fetanyl barely helped.  Just follow precautions and you'll be fine.",1
112,2019-06-23 22:17:26+00:00,"Uh, that’s what this entire conversation is about? They’re saying “fentanyl dealers” as if I could just walk up to one and ask for Fentayl-Free, Diet Fentanyl, Smack Zero, or Countrytime Extra Fentanyl. Not everyone who uses fent knows they’re buying it, not everyone selling it knows they’re selling it, and that’s why ODs are skyrocketing.",6
113,2019-06-23 15:35:41+00:00,"A few reasons. Firstly because massage relaxes the muscles, reduces discomfort/ pain (by pain gating mechanism through the spine), promotes blood flow and helps to  strengthen the muscles and joints. It's beneficial effects also include endorphin release in the brain, which is similar to morohine (= relaxation, well being, bliss) 

Secondly, massage has  communal roots. Grooming is part of our ape past and helps with group  affirmation.",11
114,2019-06-23 05:23:20+00:00,"Hi, good luck on your surgery! For hospitals, most people could only stay on their bed during their stay and only walk around a bit to exercise/drain the serous blood, so you wouldn't really need anything, but some cases people who do well could even shower! So maybe a few changes of clothes, especially socks and underwear. It could be really boring during your stay, you could bring some books/game console/phone/phone-charger. However you might be too morphined up to be conscious to do anything. Bring some small pillows to prop yourself up too! When I had my surgery, the new state of spine was really uncomfortable to lie on the bed (because my muscles haven't adjusted to it I think), so I cushioned my lower back with 2 small pillows.

At home, it's kind of difficult to sit up straight and climb the stairs during the first 2 weeks, so my family had my bed at the living room, I was lying down most of the time. I drank water from a straw for a week and need to be fed at first. You'll probably need help showering at home, and you'll need a chair in the bathroom to shower and brush your teeth. If you have to shower by yourself, get those shower brushes with long handles! It'll be difficult to raise your arms, so you might need to have buttoned down pyjamas to wear for a week. It's also hard to wear your pants at first, so you'll need help too.",4
115,2019-06-23 03:41:22+00:00,I wish. It's totally weak but minimally engaged non-fetanyl Americans 100% think Trump invented the child cages and that any attempt by Republicans to address the issue can only be motivated by racism.,1
116,2019-06-23 03:08:16+00:00,"The rubber bracket around Buddhas neck were handed out at his funeral...it says ""Love never forgets.."" he was an addict..he got fetanyl...but it was a combo of risky shit he was doing...",2
117,2019-06-23 02:27:26+00:00,"A família Heroi X/ Animes Brasil te deseja boas vindas Allan Pierree!

Reddit tem muita coisa boa para você explorar.

Sinta-se a vontade de postar, comentar e curtir!",1
118,2019-06-23 02:11:25+00:00,No puede trabajar de prostituta y ser actividta/heroina? Que manera de descalificar.,4
119,2019-06-23 00:23:47+00:00,Y muchísima gente de este subreddit creyendo que era una heroina. Y ni hablar de worldnews que se creen cualquier cosa cuando apareció la noticia...,14
120,2019-06-22 23:55:38+00:00,"&gt; Porém, ficam repetindo isso porque não conseguem acreditar que o seu heroi é um corrupto arrombado.

Eles não se importam se moro é corrupto. Eles passam pano nesse caso pq foi contra Lula, então tudo é válido.",8
121,2019-06-22 22:36:18+00:00,"Is he on something? 


Fentonyl?",14
122,2019-06-22 22:30:56+00:00,And it's loaded up on a cocaine and heroin and fetanyl cocktail,2
123,2019-06-22 21:30:23+00:00,Or diactylmorphine,3
124,2019-06-22 21:11:42+00:00,"&gt; O ser humano não é burro a ponto de achar que aquilo realmente tá funcionando, mas já acreditaram naquilo a vida inteira, deixar de acreditar no seu heroi  no meio do caminho é complicado.

The Sunk Fallacy Cost. Investiram demais naquilo pra voltar atrás.



Tem sempre os mais malandrinhos que sabem que aquilo é balela mas mantém o discurso alinhado porque preferem aquilo que claramente deu errado do que voltar e fazer as coisas da forma correta.



Pense bem, o caso do Lula foi duramente criticado pelos abusos da Lava Jato e da parcialidade do Moro. Diziam que era mentira, que era defesa do ''presidiário''. De que ele merecia estar preso porque é corrupto mas o caso que ''comprovou'' que ele é corrupto está cheio de vícioas, provas fracas (confirmadas pelo próprio Dalagnol), parcialidade, conluio com a PF, etc. 


O pessoal da extrema direita tem tanto medo de que ele seja julgado por um tribunal justo que preferem fazer esse teatro tosco e defender justamente aquilo que eles atacam, a corrupção. Dessa vez o pior tipo de corrupção, a do judiciário.",20
125,2019-06-22 21:03:01+00:00,Heroin is returning because it is getting harder to get Oxycotin. They are practically the same drug and provide the same high.,5
126,2019-06-22 20:52:00+00:00,"O que é uma mentira pra si mesmo. Todo mundo sabe o quão grave seria um juiz combinando com a defesa como argumentar para ser absolvido, que é tão absurdo quando o juiz combinar com os procuradores. Porém, ficam repetindo isso porque não conseguem acreditar que o seu heroi é um corrupto arrombado.

É tipo o pessoal que vai a igreja e passa a vida inteira rezando pra deus fazer algo por eles. O ser humano não é burro a ponto de achar que aquilo realmente tá funcionando, mas já acreditaram naquilo a vida inteira, deixar de acreditar no seu heroi  no meio do caminho é complicado.",25
127,2019-06-22 19:57:27+00:00,"It is hard to express that mentality to someone. nothing could break my smile that day. I had awoken anew, and it was glorious. plus, ya know, morphene.",21
128,2019-06-22 16:38:03+00:00,"Salut
Fac rap cu mesaj si abordez subiecte complexe pentru majoritatea.
Pareri?
https://soundcloud.com/andydragostealafemei/pestii-piranha-pe-ciclu-au-lingurite-cu-heroina-1/s-sD5iH",-3
129,2019-06-22 16:32:41+00:00,"You can actually get fetanyl testing kits for drugs as a whole, as well as regent test kits for making sure psychedelics are what people say they are.",3
130,2019-06-22 16:01:52+00:00,"I generally don't like a big fuss for my birthday, so a drink out after work is usually my go-to celebration. I went out one year with my brother. I met him at a bar, and he was a couple of drinks in when I arrived. I had a couple of beers, and was getting ready to pack it in for the night when the evening took a turn. 

My brother seemed fine, then all of a sudden turned extremely pale, and collapsed. The idiot bartender refused to call 911 (maybe thinking she'd get in trouble for over serving), so I had to talk to dispatch while making sure my brother wasn't choking on vomit or bleeding from a head wound. I spent the rest of the night in the emergency waiting room, having to talk to my parents, my fiancé, and my brother's girlfriend to provide them updates. Luckily, he was fine after getting his stomach pumped and observed overnight. It turns out that, in addition to drinking heavily, he was also popping oxycotin like candy, dealing with an injury, which lead to his collapse. 

Honestly, the worst part of the entire experience didn't happen that night, but instead manifested itself over a long period of time - years, in fact. I spiralled for months, turning to alcohol to mask the feelings of guilt, anxiety, and shame. None of the emotions I felt made any sense, so I didn't know how to deal with them. I didn't know about the pills, but felt like I should have. I also spent a long time wondering if I should have just let him ""snap out of it"" instead of making the decision to call 911. I wondered if he blamed me for essentially shining a light on his issues with pills. 

So yeah. Michale Jackson died on my birthday too, but he touched children, so my story takes the cake for me.",1
131,2019-06-22 13:38:40+00:00,"I send you love. Addictions a bitch. Especially opiate addiction. Believe me, they are not recreational drugs. They’re only abused to self medicate in the big scheme

My advice:

Go to getnaloxonenow.org. Order fetanyl test strips (everyone thinks that pillheads don’t progress. It’s real chance.). Keeping an addict alive long enough to recover is hard.",2
132,2019-06-22 08:20:39+00:00,I was on a higher dose at the beginning of the year I was rx for 4 15mg mscontin and then decreased to 2 a day  about 2 months ago which is where they will keep me from now on but the norco has remained the same at 3 5mg a day. So that might be what's happening i didnt think of that. Neither the mscontin or norco cause me any of the typical itching or constipation as is usually the case not even when I first started. Thanks for the input.,1
133,2019-06-22 07:37:58+00:00,NAD. You might be experiencing withdrawal symptoms from the mscontin due to an increasing tolerance level.,2
134,2019-06-22 04:05:04+00:00,"uh actually it’s diamorphine, not herojn you fucking thug",1
135,2019-06-22 00:59:15+00:00,"Here's a sneak peek of /r/OpiatesRecovery using the [top posts](https://np.reddit.com/r/OpiatesRecovery/top/?sort=top&amp;t=year) of the year!

\#1: [5 years of 100% sobriety! I'm really excited](https://imgur.com/AVq496c) | [16 comments](https://np.reddit.com/r/OpiatesRecovery/comments/b2gpew/5_years_of_100_sobriety_im_really_excited/)  
\#2: [My husband died Sunday from Fetanyl laced heroin.](https://np.reddit.com/r/OpiatesRecovery/comments/beprc6/my_husband_died_sunday_from_fetanyl_laced_heroin/)  
\#3: [I just really need someone to understand...](https://np.reddit.com/r/OpiatesRecovery/comments/aqggkk/i_just_really_need_someone_to_understand/)

----
^^I'm ^^a ^^bot, ^^beep ^^boop ^^| ^^Downvote ^^to ^^remove ^^| [^^Contact ^^me](https://www.reddit.com/message/compose/?to=sneakpeekbot) ^^| [^^Info](https://np.reddit.com/r/sneakpeekbot/) ^^| [^^Opt-out](https://np.reddit.com/r/sneakpeekbot/comments/afd0dd/blacklist/)",0
136,2019-06-21 23:14:15+00:00,Purdue makes ocycontin. That’s all they make.,1
137,2019-06-21 23:11:29+00:00,"Even if you wouldn't ACTUALLY do it, it's not something to joke about. Would you think putting cyanide in a strangers food unprovoked is funny? I sure hope not.

Yes its a message from THIS subreddit, but its still not an EDS problem or win or anything topical. It's just a hate message you got. 

I personally think it's inappropriate to joke about perscribed pain medicine on a drug subreddit during the opiod 'crisis'. So many of us struggle to get any pain medication due to a small population misusing them and an overreaction to it. You joking about how many drugs you're on talking about it like its a multi course meal with a side of fentenyl is a bit insensitive. 

I went through the other posts too, but again, just because you're struggling like everyone else here doesn't mean its OKAY to joke about something many of us with food allergies fear with our fucking lives all because you have something against a personal choice in diet, which you think its funny to violate. It also doesn't make it okay to make pain medication seem like a fun thing or lighthearted, because its a serious issue.

On another note about that food label post- you really think its funny to feed people things they clearly dont want for whatever reason without their knowledge? How would you feel if you were unknowingly forced into a religion you dont believe in? You'd feel fricken violated. 

Also being anti-vegan is like being anti-muslim, you're just being anti-choice &amp; free will which is kinda a dick move.",2
138,2019-06-21 18:46:58+00:00,num podi se malvado cum meu super heroi :(,3
139,2019-06-21 18:20:58+00:00,where do you live to get codeine otc? usually plugs on street can get you oxycotin or oxycodone. maybe a a friend with norcos?,1
140,2019-06-21 17:45:28+00:00,"No I definitely agree with what you were saying, I just wasn’t aware tar was considered #4 by some. I guess I just learned something new. On the east coast of the US it’s almost all white but on the west coast and south you usually can only get tar. And while it smokes well like #3 it’s still not a freebase like #3. It would be interesting to know a definitive answer on exactly how it should be classified though. Also it usually contains a lot of 6-MAM etc and I think that if it’s #4 it would need to be cleaner than #3 since technically #4 should be the pure finished product that you get after completing the steps required to convert the raw opium to morphine and then that morphine to a pure diactylmorphine hcl. And I was under the impression it was actually less pure then the #3 you guys have in the UK",1
141,2019-06-21 17:26:15+00:00,"Exactly. One person mentioned that administering mophine would be difficult due to the blood vessels becoming to far gone to be effective, but there had to be a human way to euthanize.

Getting as much information as they possibly could was paramount, but at what point do you simply do whats merciful?",1
142,2019-06-21 16:34:20+00:00,"I think I got a favourite drug for every type hah

- Benzos: Valium/Diazepam 
- Opiates: Morpine
- Stims: Amphetamines or phenidates 
- Psychs: 2 CB

Weed is more of a ""duh"" one when I get my hands on some",1
143,2019-06-21 14:30:16+00:00,"Sim. 
Mas nao sei se isso funciona quem eh gado. O moro vai continuar sendo heroi mesmo que provem que ele de fato coordenou uma conspiracao para prender o lula. Da mesma forma que o lula vai continuar sendo heroi apesar de ter mais de 17 processos nas costas.",1
144,2019-06-21 14:13:05+00:00,Love me some herioin,1
145,2019-06-21 10:53:26+00:00,és o heroi cá do burgo.,3
146,2019-06-21 09:04:34+00:00,"Shinji é muitas vezes considerado o melhor protagonista da história dos animes. É um personagem muito complexo e bem desenvolvido.  

O protagonista nem sempre precisa ser um grande heroi genérico cheio de determinação,  aos 14 anos.",2
147,2019-06-21 08:11:38+00:00,Man I wish the ‘Morphones’ worked fo me. They literally do nothing. Tylenol 3’s do way more. It’s so weird.,1
