,date,body,score
231,2020-08-25 09:02:47+00:00," Não sou ombudsman, mas me permito usar este espaço para algumas reflexões. No sábado, o editorial desta **Folha** trouxe o título “[Jair Rousseff](https://www1.folha.uol.com.br/opiniao/2020/08/jair-rousseff.shtml)”. O texto se refere ao desequilíbrio das contas públicas no governo da ex-presidente e à tentação do atual fazer o mesmo.

 A fusão dos dois nomes é um ultraje à ex-presidente. O título chamativo não poderia ter prevalecido sobre o simples bom senso ou o respeito à história de Dilma Rousseff. Na aprovação do impeachment na Câmara, Bolsonaro votou em homenagem ao[ torturador Brilhante ](https://www1.folha.uol.com.br/poder/2019/08/bolsonaro-volta-a-chamar-ustra-de-heroi-nacional-e-recebe-viuva-no-planalto.shtml)[Ustra](https://www1.folha.uol.com.br/poder/2019/08/bolsonaro-volta-a-chamar-ustra-de-heroi-nacional-e-recebe-viuva-no-planalto.shtml), [algoz ](https://www1.folha.uol.com.br/poder/2015/10/1694254-morre-coronel-ustra-ex-chefe-do-doi-codi-durante-a-ditadura.shtml)da [ex-presidente quando de sua militância contra a ditadura](https://www1.folha.uol.com.br/poder/2012/06/1108621-dilma-contou-ter-sofrido-encenacao-de-fuzilamento.shtml). “O pavor de Dilma Rousseff”, tripudiou o então deputado.  
 Bolsonaro deveria ter saído preso da Câmara naquele dia por apologia à tortura, crime de lesa-humanidade. E, no entanto, aquele foi o ato inaugural de sua ascensão ao poder. Que fizeram as instituições? Câmara? Supremo? Ministério Público? Funcionaram “normalmente”.

 Mas a assimilação de [Bolsonaro ](https://www1.folha.uol.com.br/poder/2020/04/no-dia-da-mentira-veja-frases-ditas-por-bolsonaro-desde-a-posse.shtml)como algo natural pelas instituições começou muito antes. No fim dos anos 1980, o Superior Tribunal Militar ignorou as provas de que o então capitão participara de um plano para explodir bombas em quarteis e o absolveu. Foi a deixa para Bolsonaro iniciar carreira parlamentar tão longeva quanto medíocre, marcada por ofensas a mulheres, negros e homossexuais e pela defesa da tortura e da execução de uns “[30 mil](https://noticias.uol.com.br/ultimas-noticias/bbc/2020/07/07/relembre-frases-de-bolsonaro-sobre-a-covid-19.htm)”.

 Sua atuação parlamentar foi tratada como rebotalho caricato e extemporâneo da ditadura. Conselho de Ética? Corregedoria? Ah, sim, as instituições funcionaram “normalmente”. E assim chegamos ao ponto em que milhões de eleitores identificaram nele o comando e a síntese do autoritarismo brasileiro. As instituições, inclusive a imprensa, absorveram Bolsonaro como um corpo doente se acostuma a hospedar um tumor. Um dia, o tumor explode e mata o hospedeiro. A propósito: “Presidente Jair Bolsonaro, por que sua esposa, Michelle, recebeu[ R$ 89 mil de Fabrício Queiroz](https://www1.folha.uol.com.br/colunas/painel/2020/08/cheques-de-michelle-unem-bolsonaristas-e-centrao-em-defesa-de-bolsonaro.shtml)?”.",1
232,2020-08-25 05:06:37+00:00,"I have morphea too. I was prescribed the same cream but I stopped using it. It made the centre plaque thinner but it also made the skin very delicate, and the plaque just kept growing bigger around the outside of the spot where I used the cream.

My morphea went into remission after I solved another problem that was a source of inflammation for me. Fingers crossed it stays that way. But I've heard good things about the light therapy. I think it's worth considering.",1
233,2020-08-25 04:46:15+00:00,"I mean you can but then people find your story  being too evangelist because the hero defeats a social problem by using their status as ""guy that punched demons back to the moon"" to talk the system into improving or corrupt officials into answering for their crime by being moved by the heroim and nobility of the soul.   
Like in anime where the asshole villagers watch the shonen fighting with such vigor they decide to not be dicks anymore and accept minorities",3
234,2020-08-24 23:53:26+00:00,Los planes sociales y las dadivas en general son como la heroina para la sociedad. Somos un pais limado porque la gente no quiere/no puede soltarle la teta al Estado,1
235,2020-08-24 21:51:32+00:00,"ja q o muca nao faz mais live greninja eh nosso heroi, nosso salvador",1
236,2020-08-24 19:38:20+00:00,"Hey dude, i did an Oxycodon withdrawal 5 months ago, i took 75mg a day. If you have enough pills try and lower the dosage, first week 35mg, next week 15mg next week 7,5mg and so on. When ur at 7mg or less just stop taking it. I know it sounds hard. And the withdrawal symptoms are still pretty bad but better than cold turkey. The withdrawal is a pain in the ass, but if you really want to stop you can do it. Honestly I think everybody can stop doing drugs, it’s hard but you can do it! I believe in you. If you have any questions just message me :)",1
237,2020-08-24 19:33:43+00:00,A slight hint of meth with an oxycotin finish.,2
238,2020-08-24 19:25:14+00:00,"Nu e drog. Ori numești totul drog ori nimic. Nu exista cale de mijloc. Pt că alcoolul și zahărul omoară zeci de mii de români pe an și nu le zice nimeni drog. Cu toate că OMOARA OAMENI. 

Legalizarea acestei plante este o problema de libertate umană si acces la tratent. Odată cu legalizarea dispare piata neagră de tip mafiot, creează locuri de munca, creează industrie noua, creează turism, creează acces la tratamente pt oameni ce au nevoie. Scăpa sistemul judiciar și polițienesc de o grija în plus pentru a se concentra pe lucruri mai importante. Heroina, viol, ultraj, șantaj, corupție etc. 

Observi cate lucruri se leagă de ""legalizarea unui drog""? 

Și oricum. Nu te văd că mitezi nici pe tine nici pe alții pt acele lucruri importante care trebuie schimbate. Ba mai mult. Multi când văd un lucru important de rezolvat încearcă să îi tragă pe alții în jos. Jur că românii sunt ca o găleată cu raci. Raci care atunci când unul vrea să iasă. Ceilalți îl trag in jos, înapoi în găleată.",1
239,2020-08-24 19:22:15+00:00,Damn fetanyl making the cop stand on his neck for 8 minutes,5
240,2020-08-24 17:10:25+00:00,"The Medical Examiner's Office has nothing to do with the police department. Innocent people don't have giant violent rap sheets and a lethal dose of fetanyl.

Stay in school, yikes. [More info on BLM](https://www.reddit.com/r/walkaway/comments/i62oom), hope it triggers you 👌",8
241,2020-08-24 17:06:48+00:00,Fake nema heroina,1
242,2020-08-24 17:00:48+00:00,"https://youtu.be/XkEGGLu_fNU

Uncut Body Cam of Floyd's arrest complaining he can't breathe before he lies down on the ground or officers restrain him. It's confusing me. I want to like your post but I'm not sure he was killed by police of if he died from the fetanyl that was in his blood shown by his autopsy.",1
243,2020-08-24 16:05:44+00:00,"&gt;fetanyl and heroin are schedule 2.

heroin is schedule 1, alongside marijuana.  might be a good idea to know what you're talking about before you try to educate others",1
244,2020-08-24 14:59:14+00:00,"Oral administration will produce the same results, chewed or unchewed.  Exception being long acting formulations like oxycontin, mscontin, etc.  Snorting allows it to be absorbed through the nasal membrane which will produce differing effects.  The same way Iv drugs act differently than oral drugs.",1
245,2020-08-24 14:57:29+00:00,"&gt;Whether blood is taken postmortem or antemortem actually is a big deal for certain drugs like fetanyl where antemortem dose can't be determined from portmortem concentrations.

No, it's not a big deal at all, actually, you just don't know how to read your own sources.",1
246,2020-08-24 14:51:11+00:00,"PCP is a dissociative sedative-anesthetic drug. So even though you're assumption stem from ignorance,  maybe he was on Fetanyl, or some other drug or no drug at all. The point I am trying to make is, if he was tazed and it did nothing, then maybe something is up. The fact he is walking away while ignoring being tazed , ignoring direction from authorities, and doesn't appear to be jumping in the car to drive away, but appears to be reaching onto the car.... then maybe something is up with this guy. 

You have no clue and I have no clue what really happened.  The groupthink in here and all over Reddit is  both sad and frightening.",1
247,2020-08-24 09:11:44+00:00,"Da, alaturi de legalizarea prostitutie. E cel mai stupid moment de ""mai catolic decat papa"" al societatii noastre. Punem toti colectiv mainile la ochi si ne imaginam ca aceste legi ajuta real oamenii prins in acest cerc al abuzului. Nimic mai fals, pe langa greseala/ghinionul de ajunge in pragul abzului de droguri sau victima traficului de carne vie, mai adaugi si tone de probleme legale, ce te impiedica si mai mult sa te reintegrezi in societate. 

Din toti acesti bani generati din vanzarea de droguri ilegale se alimenteaza chestii mult mai nasoale, pregum traficul de persoane, arme etc. Este o linie vitala de capital pentru interlopi si ar fi o lovitura puternica data criminalitatii organizate. 

Totodata, nu cred ca pe absolut nimeni a fost oprit vreodata defaptul ca un drog e interzis, ca sa il gaseasca si foloseasca daca si-a dorit.
Adica, cine ar baga maine heroina daca ar fi legala? Probabil ca foarte putini, deci nu neparat faptul ca e interzisa ne opreste, ci educatia si constientizarea riscurilor. 

Dependenta este o boala si trebuie tratata ca atara, nu o infractiune.",1
248,2020-08-24 06:02:42+00:00,"- martin nonstatic - granite
- lab's cloud - imminent awakening
- fresh moods - orphine
- scann-tec - unyt
- m-seven - imaginary being",1
249,2020-08-24 04:09:05+00:00,Educate your mom on LSD and how it’s impossible to actually die from the drug. Also educate her how literally 90% of “good” drugs that offer health benefits and you can’t die from are schedule 1 while fetanyl and heroin are schedule 2.,1
250,2020-08-24 01:29:05+00:00,"Are you going to solve them being homeless in a way that is useful to them in any way?  

Given the complaining about the park board not letting drinking in parks, there's definitely tolerance for moderate amounts of public intoxication. I dunno, I am from Montreal originally, where public marijuana and drinking in the park are both normal, so I don't get the argument other than you being jealous of a homeless person getting more compassion.  

I mean... I would prefer if he had a supervised injection site and needle exchange (to be frank a dimorphine prescription to boot), but if your main complaint is that the guy is awful for committing public intoxication, it's not blanket across Canada that being intoxicated in and of itself a crime, only causing a disturbance associated with that.",0
251,2020-08-24 01:08:52+00:00,"I think John the Baptist is fairly well accepted as historical due to being in all the gospels and in Josephus. The only issue with reconciling the sources is Josephus has his execution a little later than it would have to be to fit the timeline of Jesus' life. I *think the* consensus is Josephus got his dates right, but someone in that field may be able to correct me on that. Here's the passage from the Antiquities. 

&gt;“(18.5.2) Now, some of the Jews thought that the destruction of Herod’s army came from God, and that very justly, as a punishment of what he did against **John, that was called the Baptist**; (18.5.2) for **Herod slew him**, who was a good man, and commanded the Jews to exercise virtue, both as to righteousness towards one another, and piety towards God, and so to come to baptism; for that the washing \[with water\] would be acceptable to him, if they made use of it, not in order to the putting away \[or the remission\] of some sins \[only\], but for the purification of the body; supposing still that the soul was thoroughly purified beforehand by righteousness. (18.5.2) Now, when \[many\] others came in crowds about him, for they were greatly moved \[or pleased\] by hearing his words, **Herod, who feared lest the great influence John had over the people** might put it into his power and inclination to raise a rebellion (for they seemed ready to do anything he should advise), **thought it best, by putting him to death**, to prevent any mischief he might cause, and not bring himself into difficulties, by sparing a man who might make him repent of it when it should be too late. (18.5.2) Accordingly he was sent a prisoner, out of Herod’s suspicious temper, to Macherus, the castle I before mentioned, and **was there put to death.** Now the Jews had an opinion that the destruction of this army was sent as a punishment upon Herod, and a mark of God’s displeasure against him.” (Antiq 18.116–119 JOSEPH)",1
252,2020-08-24 01:04:29+00:00,"What did you do, take a pressed pill or you’re saying you took too much real oxycodon",1
253,2020-08-23 21:57:23+00:00,"Sometimes life just gets unmanageable, so you take a break, reset everything, and ignore consequences.
I find it helps me in the long run. 
Not like there is any real medical support anywhere.
Every OD patient isone less they are forced ti deal  with 
This is no mess, no muss, no fuss, and responders showing up everything isvsorted as much as possible for them. Please DNR, there you go even less for temm to do.
Wpoo hoo party like its  1999
 March 4 20** that's my sorrow and pain  
Not this shit again. 
That's tine for more diazepam, zopicline, pilss.fentalnyl patches, morphibe patches, oramorph  and oxy shots.
This starting  to not make sense, getting confused,time for my sleep.
Love you all, we l are connelmcted.
I don't want freedom, I'm take hapoy soma for life.
What would you give up?  Nothing,  it's turning into soma. My levels are getting better. Before this i was useless. Now i can provide if I actually wake. Man i hope not. 
I'll answer everything if they allow me through the night 

You are beautiful, use it. I'm not talking best face etc... you are fng perfect, I want you to want me.
Linor oren I love you. You are  perfect you are but replicateable. I chose you over not you. Loren over life.
Everyone occasionally just says or do something we find impossible.
Ive got Fingers fired it hero or hurt me. Do I want them back.  What does world leader doing which his safety. Dolarr short, hi. At least change the ķ7 A 1 BY GUY GUY FT",1
254,2020-08-23 21:57:09+00:00,Low dose Opioids like 5 mg oxycodon or 50 mg Tilidine if you take more it might take you hours to come,1
255,2020-08-23 21:01:23+00:00,It's antiq,1
256,2020-08-23 20:56:19+00:00,I was randomly drug tested at my doctor's and got a false positive for fentinyl. They had to send test out for further analysis to find that i had NO 'drugs' in my system. 🤫,1
257,2020-08-23 18:04:52+00:00,He was choking on fetanyl. No neck damage in the autopsy. But according to /u/Guns_Of_Zapata that's a fascist talking point. 😂,1
258,2020-08-23 17:08:13+00:00,"Forgot to mention sharing water bottles and coughing/sneezing close to other players will pass the sickness. So clean bottles with cleaner spray and tinicture if you are sharing with sick ppl, and wear masks when standing near to them. Every medical facility spawns the stuff you need for sickness.

Charcoal for poison

Codine for coughs, though it never seemed to help me.

Tetracycline for cholera, samonella, common colds/flu's.

Nothing cures brain disease kuru

Epinephrine and morphinr stims for ppl about to die and need to get some water/food/blood in themsleve's or others. 

I've read there used to be defibrilators but never seen one personally.

Here is the goto link for sicnkess forum that helped me the most... if reddit allows my link.
https://www.dayzrp.com/forums/topic/98762-guide-sicknessdiseases-in-dayz-107/",1
259,2020-08-23 15:05:27+00:00,Was that a Fentnyl lollipop?,1
260,2020-08-23 14:21:42+00:00,Que heroi ?,1
261,2020-08-23 14:04:09+00:00," A repercussão negada pelos jornalistas não nega ao exame da atualidade pelo ministro Edson Fachin, do Supremo, a condição de [mais importante pronunciamento de um integrante das altas instituições brasileiras](https://www1.folha.uol.com.br/poder/2020/08/fachin-diz-que-tse-deveria-ter-autorizado-candidatura-de-lula-e-critica-escalada-autoritaria-apos-2018.shtml), ao menos desde iniciado o governo Bolsonaro, se não desde a queda de Dilma Rousseff.

 A “recessão democrática” ainda não recebera nada no nível adotado por Fachin, exceto em parte pelo ministro Celso de Mello.

 Objetivo como os magistrados evitam ser, claro e simples como os magistrados detestam ser, franco e lúcido como deveriam ser as considerações necessárias dos magistrados, Fachin advertiu que “as eleições de 2022 [as presidenciais] podem ser comprometidas se não se proteger o consenso em torno das instituições democráticas”. Proteger de quê ou de quem?

 O diagnóstico é forte e destemido: há “uma [escalada do autoritarismo no Brasil](https://www1.folha.uol.com.br/colunas/silvio-almeida/2020/08/regimes-autoritarios-sempre-tem-os-seus-juristas-de-estimacao.shtml) após as eleições de 2018”, gerada pela existência de “um cavalo de Troia dentro da legalidade constitucional” do país.

 “Esse cavalo de Troia apresenta[ laços com milícias ](https://www1.folha.uol.com.br/poder/2020/06/powerpoint-dos-bolsonaros-conheca-novas-revelacoes-do-elo-familia-queiroz-e-milicias.shtml)e organizações envolvidas com atividades ilícitas. Conduta de quem elogia ou se recusa a condenar ato de violência política no passado”. O  
 que inflama o presente com “surtos arrogantes e ameaças de intervenção”.

  Fachin vê, como todos, e diz, como poucos: “O futuro está sendo contaminado por despotismo”.

 No Supremo, a ministra Cármen Lúcia pareceu dar eco às palavras de Fachin no Congresso Brasileiro de Direito Eleitoral. Considerou triste a volta forçada do tribunal, diante do[ dossiê do Ministério da Justiça contra antifascistas](https://www1.folha.uol.com.br/poder/2020/08/relatorio-existe-mas-nao-dossie-diz-ministro-sobre-monitoramento-de-antifascistas.shtml), “a este assunto quando já se acreditava ser apenas”, ou ter sido, “uma fase mais negra da nossa História”. Nada a ver com o dito por Fachin, se até agora Cármen Lúcia tinha tal crença. Mesmo a tristeza soa irrealista.

 Não faltaram ocasiões em que o Supremo e o TSE foram chamados a sustar a candidatura que atacou a democracia com a[ defesa da ditadura e da tortura](https://www1.folha.uol.com.br/poder/2020/01/o-heroi-de-bolsonaro-me-torturou-diz-jornalista-preso-por-9-anos-pela-ditadura.shtml), atacou as instituições constitucionais, prometeu acabar com os petistas e outros, anunciou uma população armada, transpirou ódios preconceituosos e vocação homicida. Isso tudo expelido por uma perturbação mental indisfarçável e com histórico comprovado.

 Hoje[ não faltam crimes de responsabilidade acumulados](https://www1.folha.uol.com.br/poder/2020/03/veja-crimes-de-responsabilidade-que-bolsonaro-pode-ter-cometido-desde-o-inicio-do-mandato.shtml). Como não faltam mortes pela Covid, não combatida de fato e inocentada para os incautos. E nem é só o figurante principal que continua inatingível pela defesa da ordem constitucional e do devido à população.

 Flávio Bolsonaro não precisa controlar as [revelações que se sucedem sobre sua delinquência](https://www1.folha.uol.com.br/poder/2020/08/pgr-investigara-transacoes-da-jbs-com-advogado-ligado-aos-bolsonaro.shtml), porque controla a passividade do Senado e o vagar dos seus inquéritos. Carlos Bolsonaro nem interesse demonstrou pelas revelações que o atingem. [Fabrício Queiroz e seus contatos milicianos ](https://www1.folha.uol.com.br/poder/2020/06/queiroz-e-advogado-dos-bolsonaros-atuaram-para-contatar-miliciano-foragido-afirma-promotoria.shtml)estão protegidos.

 A instauração e a ameaçadora continuidade do descrito por Edson Fachin, como ninguém ousou fazer nas altas instituições, têm corresponsabilidades no Judiciário e no Congresso. Mas aí mesmo, na impossibilidade de negar o exposto pelo ministro, ficará mais difícil não ver o que está vendo, para não fazer o que deve.

 ### Os bons moços

 Desde que passou de senador a deputado, para que seus processos saíssem de Brasília rumo à sua Minas, Aécio Neves não cessa de receber benesses.

 Agora é o [desaparecimento de delações premiadas integrantes dos seus processos](https://www1.folha.uol.com.br/poder/2020/08/duvida-sobre-paradeiro-de-documentos-vira-entrave-em-inquerito-sobre-aecio-neves.shtml), que por isso param... na Justiça (sic) de Minas.

 O que importa é poder usufruir bem, com sua vocação de playboy, os milhões que extorquiu por aí com a irmã. Enquanto [Geraldo Alckmin e José Serra ](https://www1.folha.uol.com.br/poder/2020/08/apos-mirar-pt-e-centrao-lava-jato-vira-algoz-de-tucanos-saiba-o-que-pesa-contra-aecio-serra-e-alckmin.shtml)seguem suas vidas discretas e bem providas. Aos bons moços do PSDB correspondem bons moços no Ministério Público e nos tribunais.",1
262,2020-08-23 13:49:21+00:00,"Watch the full video it's online. Dude was clearly high off his god damn ass and refused to comply with everything even when his friends did and encouraged him to. That officer should be convicted for at least manslaughter and fuck the police unions but there's a reason why he's dead and his friends who were not on meth and fetanyl are alive. 

Moral of the story: Too many police are incompetent and don't do drugs ever. Incredible how you can argue for both sides and not surrender to the echo chamber.",1
263,2020-08-23 13:18:25+00:00,??? É exatamente por isso que ele é meu heroi,1
264,2020-08-23 12:13:59+00:00,"Claaro, porque nunca se dio con heroina en Argentina...

La verdad que es una discusion de pendejo de 14 años esta.",1
265,2020-08-23 11:26:08+00:00,"&gt;  Im assuming being a cop is not an easy job dealing with all the bs that comes with it

Definitely not an easy job, but you make a choice to be a cop, and you get to take off your uniform at the end of the night. Black people do not have that same privilege.

&gt;Do you really want to get rid of cops and have criminals running around taking over?

Nope, we didn't talk about abolishing the police, did we? I didn't say any such thing.

&gt;What are you gonna do when someone robs and kidnaps people you care? Call the cops?

Yes, that is the police's job. Not to arrest a citizen for *not* using a counterfeit bill just because he happened to be be a drug user, which like I said, is abundant in the US and even legalized in some states.

&gt;If your on drugs and you see cops pulling you over of course your gonna panic especially on fentayl and meth which he was high on (I forgot to say he was on fentanyl and meth).

Now you're changing your tune. So he had a right to panic? Being in a country where black people are killed 2.8 times more than white people, he had a right to panic. He had a right to freak out. He feared exactly what he knew was coming. And the cops should be trained to handle someone who might be high, someone who might have a panic attack (the amount of times police have killed people when responding to wellness checks because they're not trained to deal with mental illness is staggering). 

Emphasizing whatever drugs he was on does not justify him being killed. There are charges for possession and usage of controlled substances. DEATH, is not one of those charges.",1
266,2020-08-23 11:09:16+00:00,The one that put his knee on him should be arrested not the others. Im assuming being a cop is not an easy job dealing with all the bs that comes with it. Do you really want to get rid of cops and have criminals running around taking over? What are you gonna do when someone robs and kidnaps people you care? Call the cops? No. They need better training for this kind of thing so it dosent happen again. If your on drugs and you see cops pulling you over of course your gonna panic especially on fentayl and meth which he was high on (I forgot to say he was on fentanyl and meth).,1
267,2020-08-23 11:07:07+00:00,"how many tries it took you.
It took me 2 days to beat orphin",1
268,2020-08-23 10:20:40+00:00,"I have read your post a few times, I don't like the ""fuck them"" bit as we are all different smaller, larger, shorter, longer, habits etc. I am living proof you do not have to go through pain during detox. Day82 now and I have come off 4 drugs inc 90ml methadone But I like your post It is truth! methadone is a very hard drug to come off, your post reflects that and I hope informs others. Doctors should prescribe dia-morpine not methadone but methadone is a few cents cheaper and most don't give a fuck about addicts. Ignorance ain't bliss. Thank you again.",1
269,2020-08-23 06:53:36+00:00,"yea i been on 8mg subs for about a year and a half after using street fentanyl and heroi, i tapered down to 1-1.5mg but its still gonna be terrible",1
