,date,body,score
394,2020-08-17 15:39:39+00:00,"o q as pessoas costumam chamar de ""subir na vida"" não é ter suas necessidades e de sua familia atendidas com um pouco de conforto, tipo ter saude, educação, segurança e até um dinheirinho pra praticar um hobby e talvez algumas viagens, o q se chama ""subir na vida"" é entrar pra turma dos ricos, pra turma q tem tudo isso e muito mais, q pode esbanjar e se achar bem acima dos outros e até mesmo viver uma vida de parasita na sociedade sem precisar trabalhar

por isso milhoes apostam na loteria toda semana pra ""subir na vida"" e o lula vendia essa imagem de heroi dos pobres q subiu na vida e nao tinha nenhuma vergonha nem enxergava a contradição de ser um beneficiario da desigualdade extrema do pais, num pais muito mais rico q o brasil mas porem mais socialista e com um welfare state e desigualdade muito menor, o presidente da republica/primeiro ministro gastaria 1/10 do q gastava o lula",1
395,2020-08-17 14:35:20+00:00,"Crypto currency is a libertarian fever dream.  Whatever original promise or legitimacy it may have shown has been obliterated by the fedora brigade using it to buy fentenyl and kiddie porn.

Replacing one fiat currency with a different fiat currency isn't helping anything.",5
396,2020-08-17 14:28:42+00:00,"Knee on neck cannot suffocate someone. Czech and Israeli police use it alot, he died of lethal doses of fetanyl and meth",1
397,2020-08-17 14:18:44+00:00,"Herobrine=heroi brilhante ,vei o cara voltou dos mortos e resucitou em um jogo claro que ele vence do itachi",1
398,2020-08-17 14:07:11+00:00,"O tio nessa parada toda deve ta sendo considerado um heroi por esses ""cristaos""",1
399,2020-08-17 13:53:56+00:00,"Están hasta el orto de heroina, coca, cocaina, esteroides, anfetas...",1
400,2020-08-17 12:35:00+00:00,"A questão é que várias tribos têm as chamadas ""guerras rituais"", que são uma guerra mesmo (com morte e tudo, mas o objetivo é apenas criar ""herois de guerra"", e não exterminar a outra tribo (como numa guerra ""normal"").

O esporte foi criado pelos gregos para substituir essas ""guerras rituais"". No esporte, basta mostrar as habilidades marciais (como arremessar dardos, correr, marchar por longas distâncias, trabalho em equipe, etc.), quem tiver as melhores habilidades marciais é o vencedor, é o heroi que trouxe glória a sua nação. Até hoje os ganhadores de medalha de ouro desfilam em paradas triunfais e são homenageados pelos chefes de Estado.",1
401,2020-08-17 03:13:34+00:00,"I hope you didn't those needles to arrange them like that. Not only is there a risk of a finger stick, they could also have residual fentenyl on them.",1
402,2020-08-17 00:23:13+00:00,A pharmacy or pharmaceutical production plant. Looting Oxy and Fetanyl instead of coke for once.,1
403,2020-08-16 22:51:34+00:00,"nasli se srat splicani kojima je ""baza"" stih o dilanju heroina",1
404,2020-08-16 21:00:39+00:00,"Yo vivi un par de años en USA y la verdad es increible como, no se, vos compras algo y lo tenes, algo sencillo como eso. Queres algo y a mas tardar en 2 o 3 dias lo tenés en la puerta de tu casa. Y como lavaplatos tenes un auto que no tienen ingenieros acá. Te sentis mal porque te pasan ferraris en la carretera? no se, yo no. A mi me gusta ver pasar ferraris aunque no sean mias.

Aca en Argentina no nos damos cuenta pero tu guita la gastas en lo que podés, no en lo que queres. Compras la ropa que podes, la computadora que pudiste conseguir, el celular que justo estaba en oferta o que te vende un amigo, etc.

Renegar por alquiler no existe, no se, es como que tu vida la dedicas a cumplir tus objetivos, no es una constante lucha por sobrevivir como en latinoamérica. Aca el objetivo de todos es sobrevivir, alla cada uno tiene el suyo propio, y si tu objetivo es drogarte con heroina, sos un junkie en la calle, aca ni a eso llegas. Aca el que se droga lo máximo que consigue es paco.

En cuanto a nivel de vida, a ver, el 80% de USA es como vivir en la parte cheta de Olivos o Recoleta. A ese nivel.

Algo como Morón, Lanús, Lomas, no existe. Las partes pobres alla son mejores que la ""clase media"" acá. No se como explicarlo, es todo ""lindo"", limpio. Hay edificios pobres y barrios marginales, pero son como limpios, no tenes gente poniendo música, autos quemados en las eredas, etc.  Eso quizas contribuye a la sensación de seguridad, aunque como dije, robos igual hay.

A los que dicen que la gente es fria...y que se creen que el Argentino no es falso o cagador? aca en Argentina te saludan y por atras te la recontra ponen, chismorrean, te serruchan el piso, etc. Alla la gente es fria pero vi mucho menos de eso, no maquina a tus espaldas ni hay peleitas por las sobras como vi en Argentina. Y si tu vida es jugar al fulbo con lo pibes y escabiar los domingos, y no, quedate en tu barrio o andate a Italia.",1
405,2020-08-16 20:31:03+00:00,"That technique is actually trained, nothing wrong with it, it’s effective. George died from breathing complications from covid, meth and fetanyl while hyperventilating from an anxiety attack due to the drugs. But a suggestion is following the commands and not resisting. That will almost guarantee not having a knee placed on your neck to restrain you",4
406,2020-08-16 20:15:18+00:00,Methadone sticks around longer than fetanyl.  You cant take methadone for a few days then take suboxone. Go find a methadone clinic. Anyone selling takehomes is still in active addiction and will probably sell you 90% watered down dose.,1
407,2020-08-16 19:50:39+00:00,"Yup. Russians always switch out the H for a G at the start of the word. No idea why.. They say ""geroi"" instead of ""heroi"" (hero) or ""gemorroi"" instead of ""hemorroi"" (hemorrhoid)..",2
408,2020-08-16 18:58:30+00:00,"postei exatamente essa foto no r brasil e achei que ia levar instaban, fui ver agora e ta com 250 upvotes e os caras realmente acham que o gordão ali é um heroi pqp!",1
409,2020-08-16 18:32:48+00:00,Um verdadeiro heroi,1
410,2020-08-16 16:17:54+00:00,pe vremuri cred ca se fuma heroina la greu,1
411,2020-08-16 14:19:29+00:00,"Unfortunately I doubt anything will scratch that I itch entirely. I am convinced that will wrote the books using liquid haroin  instead of ink and he then somehow convinced the siren Travis Baldry to read them.
With that said here is every fantasy series I have listened to that might help as a placeholder in order of my personal recommendation. 

1. king killer chronicles Patric Rothfuss- everyone should read this at some point.
2. Mother of learning- this book came close to scratching that itch for me it is a web novel with time travel/fantasy/progression elements set in a somewhat industrial era world. You can listen to the entire thing on YouTube.
3. Powder mage trilogy- military themed fantasy book set in an industrial era world. The magic system is interesting and the author has similar skill to will at bringing the characters to life without excessive backstory. Highly recommend this one.
4.thread Bear- I have read a lot of litrpg over the last 2 years and am usually disappointed at the end but not with this book! this book is simply put adorable. The book is set in a magical world with a game like leveling and class system. The main character is a teddy brought to life by a golem maker. The world it’s self is rather dark and brutal. The teddy then embarks on an epic journey to protect its owner a little girl. Fair warning Tis book may melt your hear.
5 dungeon lord- your usually litrpg iseki Situation but it’s well done.
6.Knight angel trilogy-brent weeks- a good fantasy book MC goes through a zero to hero situation similar to lindon.
7 anything Jim butcher.
8 anything brandon Sanderson.
Good luck hopefully this helps someone scratch that itch a little.",1
412,2020-08-16 13:34:29+00:00,"no its the steps of synthesis:
#1 is raw opium
#2 is black tar heroin
#3 is brown Heroin base (which is why you have to add citric acid to shoot up so it becomes water soluble
#4 is Herion Hydrochloride which is the pure HCl salt form of Diacethylmorphine and should be white",1
413,2020-08-16 12:19:07+00:00,"RY TALPAT ICKAPEAR N E

IN EVERY MEMES

LIKE FO

heroi



---

v0.6.0 | This message was posted by a bot. | [FAQ](https://www.reddit.com/r/TranscribersOfReddit/wiki/index) | [Source](https://github.com/GrafeasGroup/tor) | Questions? [Message the mods!](https://www.reddit.com/message/compose?to=%2Fr%2FTranscribersOfReddit&amp;subject=Bot%20Question&amp;message=)",1
414,2020-08-16 09:49:15+00:00,The words you are looking are 'accidental shooting' and 'death by fetanyl overdose' respectively,5
415,2020-08-16 09:07:51+00:00,"um Heroi nasce ,esse vai ser um bom soldado",1
416,2020-08-16 02:53:17+00:00,"I can't argue any of this, there's a lot of crossover or confusion about what dependance and addiction is (too broad for me to waste energy/time on a definition). What spoke to me that is relevant, is a Ted Talk about research showing elderlys who had some certain surgery (can't remember which, not relevant) we're on diamorphone (pure heroin to the layman) for a long period of time, BUT none of them came out as heroine addicts. That studies show addiction/dependence/whatever you call it isn't a physical thing, that it's a mix of psychological and social matters. The experiment showing that giving struggling addicts more opportunities and less punishment, made them clean and responsible, in most cases. The rare exceptions for argument sake is irrelevant to the point, can't save/help everyone.",2
417,2020-08-15 16:48:37+00:00,"Legalizar cosas como heroina o crack/pasta base me parece exagerado y peligroso. Se puede decriminalizar la tenencia para uso personal.   


El canabis si, creo que debemos tener un sistema para consequirlo legal como en Uruguay.",3
418,2020-08-15 15:15:07+00:00,Where have you been? We have a massive heroin problem today. And now it comes with free fentenyl and is much more dangerous.,7
419,2020-08-15 14:20:38+00:00,"What about say meth or fentanol? PCP seems fairly begnine. But my sister recently quite meth, after over 10 years of consistent use, and really did seem to be struggling to construct a single rational thought for like the first year after she quit.",2
420,2020-08-15 13:27:43+00:00,"Question. I've been on oxycodon since my accident (broke sternum, and 18 ribs on multiple locations and my jaw) Getting injections soon to block nerve system so I won't have to be on oxy anymore. I read that they put you on medication (pain I guess) around this whole procedure. Any insights what I can expect from that?",1
421,2020-08-15 10:37:26+00:00,"&gt;El primero atenta contra las libertades individuales y tiene que hacerse en momentos como éste

Entonces porque está prohibida la venta de las sustancias estupefacientes (heroina, cocaina, etc,...), dicha prohibición también atenta contra las libertades individuales.",1
422,2020-08-15 10:13:40+00:00,"That's because once again you got played into thinking cops are racist murderers. The body cam of the cops show they were calmly trying to arrest George, slowly trying to walk him into their car, escorting him. Until he resisted arrest and seemed paranoid and high on drugs.

Deadly dose of fentonyl in his body btw.

If those cops were racist bastards, why would they try to detain George calmly and escort him to his car if they could've just beat his ass in the first place by dragging him out of his car, without asking him 5 fucking times to put his hands on the wheel.

&gt;but but but cops are racist and should've treated him like a good individual

They tried to, until mr Floyd kept resisting  and was continuously saying he couldn't breathe before they put him on the ground, while he was resisting arrest.

And just as again a few days later a drunk black guy steals a tazer gun and aims it at the police, and wonders why they retaliate.

You continue to wonder how you could live in such an evil world why you don't even bother to learn why they won't show you the big picture like this. They're just looking to enrage people and install fear into them. The dems take advantage of installing fear into people just as much as republicans gain out of installing fear into people against immigrants or black hood gangsters.

This whole thing is just a falacy, keep posting acab though. 

And people keep saying FOX is solely the only propaganda media. L M A O",1
423,2020-08-15 05:52:04+00:00,"Your sister should leave prescribing to those with licenses to do so. It was prescribed to help prevent the pain and swelling you are complaining of and is totally normal, even a mild drug for extraction pain.
Why does everyone on this sub talk about minor things like ibuprofen like dentists  are handing out Fentenyl?",1
424,2020-08-15 05:50:03+00:00,"I didn't say all BLM supporters are looters are rioters. See, you are a liar. You put words in my mouth. It is dishonest to do that. You should admit that was a lie. 

You are the kind of person I was expecting to respond to my reasonable post. Probably a leftist, white, and feeling guilty for being white. 

Blacks are for the most part treated equally. Racism is a very minor problem. Of the top problems facing black America, racism is not in the top 3. 

Act civil and I will be civil. I could tell by your comments you aren't interested in the truth. To say ""you're the kind of person I was expecting to respond"" isn't civil. 

George Floyd was NOT killed by the cop so you lied about that. He was killed by being on fentanol, infected with Covid-19. He ASKED to be put on the ground. Literally. Derrick Chauvin is going to be fully exonerated. You probably haven't even seen the full body cam video the media hid from you.

Floyd was a known criminal with a violent history. Hinnant was an innocent 5 year old. One was murdered by a racist person. The other died accidentally while in police custody. The fact that one that didn't involve murder/execution caused riots is why the media is the enemy of the people. The full body cam video exonerates Chauvin and you probably haven't even watched it yet.",0
425,2020-08-15 04:54:46+00:00,Oxycodon same thing in every perky these ones officially trust me 🤯,1
426,2020-08-15 04:50:42+00:00,I bet this clown works for big pharma and wants the good old oxycotin back.,1
427,2020-08-15 03:28:07+00:00,"Why are you concerned about who said what before?  I said it right now.  All you do is ask leading questions.  Do you have anything you would like to say or are you just sitting here trying to put words into other peoples mouths?

People have been allowing themselves to be led down the path of the progressive stack since Occupy Wallstreet.  I was there protesting and watched it happen.  Slowly it has crept up through universities and twitter into the mainstream.  Eventually people assume the only things of importance is race sex gender and sexuality.  This leads to people pushing for massive activism for these things in the media ignoring other issues.  This creates a distorted sense of magnitude of these issues since they are repeatedly shown over and over.  If you look at the statistics you see that they are not nearly as common as we are led to believe.  This leads to people thinking that police are out killing black people because of racism everyday which is simply not true.  9 black people were killed by police last year.  George Floyd video came out showing he was saying he couldn't breath before he even went to the ground.  He said he wanted to be on the ground and pushed himself onto the ground disobeying orders.  He was on a lethal dose of fentenyl and meth among other drugs.  People assumed because of the ideology of the time that he was murder when it turned out he was having a overdose while an officer happened to be using a approved (yet fucked up method)  Since then many more have been 20 killed, thousands injured almost a billion in property damages with countless businesses going under and entire families ruined.  So yes I think that this slippery slope of identity politics political correction and inter-sectional, critical race theory is responsible.

Police violence should be addressed but destroying everything this country was built on and making cities warzones during a pandemic where everyone is out of work is not a great plan.",1
428,2020-08-15 00:18:47+00:00,Pra vc ser heroi,1
429,2020-08-14 23:25:50+00:00,Here the thing fetanyl didnt pop upon my ua but ik ive been taking presses cuz oxy didnt pop up either,1
430,2020-08-14 22:27:46+00:00,"Amor 💕 

¿Qué es el amor?' 
 
Digo, en serio. Qué es?' 
Un verbo?' (yo te amo), 
Un sustantivo?' (ella estaba enamorada), 
Una verdad universal?' 
(Solo se necesita amor), 
Un ideal?' 
El hilo comun a todas las religiones?' 
Una parte de un plan?' 
Un fenomeno neurologico?' 
No hay escasez de respuestas mi amigo, algunas lo abarcan todo. 
Lo conquista todo. 
Es todo lo que necesitas. 
Lo es TODO. 
Estas son solo comparaciones, o formas de definirlo por contraste al decir que es mas importante que todo lo demas; pero acaso lo es?' 
Claro, el amor es mas importante que una Pizza, pero es acaso mas importante que un Hospial?' o la conciencia?' o una pizza con orilla de queso?' 
Sin importar cual sea tu respuesta solo lo estas clasificando no definiendo. 
Otro de los desafios para definir el amor es que con frecuencia lo definimos cuando estamos enamorados o desenamorados (Broken Heart), confiarias en alguien que acaba de sacarse la loteria para que te defina exactamente lo que es el dinero?' 
O tal vez pedirle a alguien que te defina que es un Oso cuando este fue atacado por uno en el pasado, o acaso el amor no es como sacarse la loteria?' o las rupturas no son similares al ataque de un Oso?' 
Estoy haciendo malas comparaciones?' 
Si, ese es mi punto. 
No estoy en mis cinco sentidos porque estoy enamorado, asi que Ja!' 
Bueno, ya. 
Posiblemente el amor es una de las cosas sobre las que mas se ha reflexionado en toda la historia de la humanidad. 
y, a pesar de siglos y siglos de obsesion, y estremecer tanto nuestro cabello aun nos deja perplejos. 
Con frecuencia escuchas a la gente decir que el amor es bueno, es grandioso. 
Un senitmiento hacia alguien que nunca habias sentido. 
Pero... los sentimentos son cambiantes; no son una base muy concreta para poder dar una definicion. 
A veces odias a la persona que amas. 
Ademas, vamos, ya lo has sentido antes, solo que en menor escala. 
Las relaciones con tu familia le da forma a las relaciones con tu pareja, y el amor por tu pareja puede que sea una relacion con dinamica propia, sea esta normal, o totalmente rara comparado al amor de tus padres y hermanos. 
El amor es tambien un conjunto de comportamientos que asociamos con este sentimiento vistas desde un contexto social: Tomarse de las manos, Besarnos, Abrazarnos, Demostraciones publicas de afecto, Salir, Casarse, Tener hijos o simplemente tener Sexo. 
Pero estos actos de amor son subjetivos y estan relacionados con la cultura. 
Puedes amar o ser alguien que no puede tener hijos, o no quieres tenerlos, que creé en el matrimonio pero tambien en el divorcio. 
Pero si el amor es algo que podamos definir, entonces como es que son cosas tan opuestas para tanta gente?' quizás el amor solo esta en tu cabeza, un misterio personal que atraviesa tus neuronas y estalla creando una sensacion de recompensa en tu sistema nervioso. 
Talvez estas recompensas son adictivas. 
A lo mejor el amor es una adiccion permanete o temporal hacia una persona como la heroina mezclada con extasis. 
No quiero sonar cursí como la mayoría de  las canciones Pop. 
Hay evidencias que muestran que los quimicos en el cerebro estimulados por otra persona pueden hacer que desarrolles un habito por esa persona, la persona viene a satisfacer un deseo psicologico y vas queriendo mas y mas... 
Pero luego, a veces, ya sea lenta o repentinamente, ya no quieres mas. 
Te has desenamorado, perdiste la adiccion por el encantamiento. ¿Que paso?' 
Será que desarrollaste una tolerancia?' o llegaste al limite?' 
Por qué algunos amantes se mantienen adictos los unos a los otros toda la vida?' 
Quizá para crear nuevas vidas proliferando la especie?' 
Tal vez el amor es solo un metodo efectivo del ADN humano para lograr conservar la raza y así la naturaleza sigue su curso. 
Pero acaso el amor es solo eso?' o peor aun, es solo un invento?' Un concepto falso que hemos tratado de convencernos de que hay que mantener por un sentido de proposito falso?' 
Quizá sea un concepto, pero seamos mas precisos sobre lo del ""invento"". 
Porque el amor se inventó a partir de la realidad de nuestras Experiencias, los Sentimientos, las Hormonas, Contexto Social y Nuestras Vidas. 
y esta creacion puede verse desde diferentes perspectivas: Cientifica, Emocional, Historia, Espiritual, inclusive Legal o simplemente Interpersonal. 
Si no hay dos personas iguales entonces por consiguiente  el amor de dos personas tampoco sera igual. 
Asi que en toda relacion amorosa hay mucho de que hablar y las parejas deben estar abiertas a escucharse o la relación estara destinada a perecer. 
(Y más teniendo en cuenta lo complicadas que son las mueres...) 
El amor siempre estará bajo discusión y por supuesto, en construcción. 
Así que si no podemos definirlo, eso mi amigo es una buena señal; porque quiere decir que aun lo estamos haciendo. 
Alimentando nuestro ser para finalmente darle un sentido a nuestras vidas. 
Asi qué escucha lo que te tengo que decir y ve a dar y recibir amor.",1
431,2020-08-14 20:57:02+00:00,I always thought they boot you after a few tests. Theres a sign at mine something about detoxing or not getting dosed if positive for fetanyl.,1
432,2020-08-14 17:04:48+00:00,"Look, I personally think it's incredibly fraught to try and compare Australia to America in any regard because the countries are so completely different that you need a post-grad level understanding of the history/politics/law of both countries to be able to correct for the differences.

I wouldn't even know where to begin to parse how to apply what white, college educated, higher median Texans think about vaccinations could mean for Australians. I don't think there's actually any Australian population group that would map directly onto that group except for maybe some parts of Perth. 

&gt;Would those richer and more informed women not be more likely to have private healthcare and the ability to inform the practitioners of their wishes regarding birth?

My point is that the medical system is so bad that those women don't feel they can do that and are opting out. Private healthcare in Australia is extremely different to private health care in America, or anywhere else as far as I can tell. In America, you can forum shop for your doctor and simply dictate what medication and what treatment you want, and if your doctor doesn't listen, well you can find another doctor in network who will do what you say. In America, you can go straight to a specialist and 'referrals' from GPs are perfunctory. Here, there are heaps of procedures/drugs/treatments which are not available from GPs are require a referral. 

For instance, American GPs prescribe controlled drugs like xanax, oxycotin, adderall themselves. In Australia, there is no GP in their right mind that would do that, and adderall is illegal. For any those, a patient would have to goto a separate specialist. Psychotherapist, pain specialist/anesthetist, different psychotherapist. So what could be accomplished in an afternoon at an American GP would easily take 3-4 months, several GP visits, several visits to specialists (multiple if one turns you down), and hundreds of dollars. This weird kind of throttling/limiting applies to many many many treatments, not just drugs. In America, a GP will order an MRI no problem. Here, a GP would probably stretch things out a bit with multiple visits, then a useless x-ray, maybe a useless CT scan, before finally ordering an MRI.

The point of that is, 'private healthcare' in Australia is really just a shittier, more expensive version of the public healthcare option. There is no pay-and-get-your-way option unless you are very very wealthy. 

The private healthcare doctors have no obligation to do what patients say because they are not controlled. In America, doctors report to insurance bureaucrats. You can call up your insurance and scream your head off about a doctor and there will be consequences for them, financially. There is literally no such recourse here, so, it makes sense to me that women would seek out a system which does have a feedback system for criticism- home births. It's word-of-mouth and patients have agency.",1
433,2020-08-14 17:02:20+00:00,Fentalyl Chungus,1
434,2020-08-14 16:26:52+00:00,"What eldido is saying is that the fact that he was high on fentanol likely was a contributing factor in his death.

To my knowledge and I may be wrong, it is significantly harder to asphyxiate from pressure to the side of the next. If you watch the recently released new footage you can hear him say he can't breathe before the officer abused him, and it was abuse.

My guess is that a combination of the drugs and stress caused his heart to give out. Frankly speaking, I don't know, and I don't particularly care.",1
435,2020-08-14 14:43:34+00:00,"Os críticos do governo deveriam gastar mais tempo melhorando a própria imagem do que ficam tentando derrubar o presidente. Ficar o dia todo falando mal do governo não te transforma em heroi de causa alguma nem, tampouco, em opção viavel pra 2022.",1
