,date,body,score
0,2020-08-31 18:54:18+00:00,"Não não, matar uma pessoa te torna um assassino. Em sua própria defesa ou não. Não foi esse tal de Jesus que disse pra dar a outra face? Pensei que não matar era um dos fucking 10 mandamentos, mas sei la, o que eu sei.  


""Deixa eu, garoto branco de 17 anos, pegar meu fuzil não registrado, ir pra outro estado defender (argh, brincar de COD real life) patrimônio que não é meu no meio de um protesto racial""  


""AIN EU TAVA SOH MIM DEFENDENDO""  


A narrativa tentando botar esse muleque como heroi me enoja.",1
1,2020-08-31 16:51:26+00:00,"Show me the evidence of the fetanyl, I'll wait.",1
2,2020-08-31 16:40:09+00:00,"One of the most haunting things I ever read was when I woke up &amp; saw juice wrld died. I had been begging his manager to put him in rehab because his past ig lives he'd been really acting completely out of it and a lot of his leaked music around that time was mentioning heroin &amp; fetanyl. I can't believe  they let him die his whole team never even explained what really happened. His girlfriend is hella shady too and has been arrested for trafficking meth, that was her drugs on that plane",5
3,2020-08-31 15:03:43+00:00,"Nah, the fetanyl did that.",1
4,2020-08-31 14:17:01+00:00,heroi,1
5,2020-08-31 14:01:07+00:00,"Wonder how long you antiQ tards spend bashing a batshit insane conspiracy theory.

God forbid all the other actually insane conspiracy theories...

Now THAT is sad.",0
6,2020-08-31 12:26:19+00:00,"&gt;They also think they have footage of Floyd swallowing a bag of fentanyl and ditching another two.

1. If he swallowed a bag of fentanyl don't you think that would have shown up in at least one of the two fucking autopsies?

If all they have is ""video"" that I'm sure doesn't exist, how do they know it's fetanyl? It's white powder in a bag. They'd need to test it to ascertain the contents.

&gt;They argue he was screaming ""I can't breathe"" before he was removed from the police vehicle and held on the ground.

2. ""They argue"" their word against video evidence of a knee on a man's neck saying he can't breathe. This isn't evidence.

&gt;They dismiss his claustrophobia assertion as bs because Floyd didn't seem to be having claustrophobia in his own car that police removed him from.

3. driving your own car is very different than being thrown in the back of a police car. Also unrelated to leaning on the guys neck for 8 minutes while onlookers beg you to stop.

All these things would not even be admitted as evidence, they are not backed up by any reality in the case.",1
7,2020-08-31 12:06:25+00:00,"Este finde vi las dos de Trainspotting. La primera es una obra maestra, la segunda es medio un quilombo pero la pasas bien gracias a lo bueno que son los personajes.

No toco heroina en mi vida después de verla...

Ah y btw, esta fresco y nublado. Linda manera de arrancar la semana",1
8,2020-08-31 11:46:54+00:00,"+ Tengo todo tu material y si me sale de los huevos los puedo volver a subir ( Ya viste que de heroina no tienes nada) si lo vuelves a a bajas los vuelvo a subir 

Aparte que jodías y jodías por DM rogándome para que eliminara tu material ERES UNA MENTIROSA 

OSEA EL DECIRME QUE TE ""DIFAMABA"" en serio?? 🤦 al parecer no tienes ni puta idea que es la DIFAMACION y capaz solo lo pusiste para sentirte la culta con tus seguidores que son todos niños 😂

En NINGUN MOMENTO TE HE DIFAMADO Y SI TIENES LAS PRUEBAS ME RETRACTO 
( sin editar eh ) 😏

Tanto que te he promocionado y hasta te lo dije por DM, personas que me han preguntado si vale la pena tu material yo de buena manera les dijo que si, por que con ese material tan caro uff 

Por eso deberias de agradecerme Y HABLAS A MIS ESPALDAS Y NO DICES MI NOMBRE 😂😂 
QUIEN COBARDEAA

Y para todos los niños que te siguen en tu Telegram esperó y hayan disfrutado del material que subi y no se crean cuentas falsas aqui en Reddit para despues preguntarme si se los puedo pasar por Privado 😂😂😂😂😂 

AY! Lo que yo se... 😂😂😂 pero bueno!! 

🔊 MICA INVESTIGA UN POCO MAS POR INTERNET QUE TODAVIA HAY PAGINAS QUE SUBEN TU MATETIAL, Y NO, EL INTERNET NO ES PORINGA 😂🤡 JAJAJAJAJA 

Y NO MICA NO ESTOY ENOJADO VIVO MI VIDA AL MAXIMO, TODO ESTO DEL REDDIT ES POR 'HOBBY', FUERA DE TODO ESTO ME LA PASO DE MARAVILLA 😉😘 COMO SI FUERAS LA UNICA MUJER EN EL MUNDO QUE ME INTERESE JAJAJAAAA!!!",1
9,2020-08-31 11:32:45+00:00,"Of course the defense is arguing this. It became the best defense the second the toxicology report showed fetanyl in Floyd's system. And unfortunately, it's probably going to work.

2021 is not looking much better than 2020.",1
10,2020-08-31 06:28:31+00:00,Use by 9SIR??,1
11,2020-08-31 06:07:14+00:00,"Clearly the cops contributed to his death... But did they fill him with fentynyl and call themselves due to his behavior? 

People OD in police custody all the time because the cops get called when people are on drugs and not acting in line with society expectations- right or wrong. 

To shrug off that drugs had ZERO to do with the death of a man with a lot of fentynyl in his system, who had lungs full of fluid, who was screaming ""i can't breathe"" well before he was knelt on- that is just kinda rediculous. 

This wasn't a healthy 31 year old sitting on the curb that cops put in a headlock and killed. Clearly, if he HAD been healthy and not in drugs, it's EXTREMELY unlikely the positional asphyxiation would have happened.",1
12,2020-08-31 06:02:08+00:00,George Floyd died from an OD. He had fetanyl and heroin in his system. Lethal doses of it at that. He said he couldn't breath before he was even in the ground. Watch the bodycam. This wasn't murder. Not to mention; how to do you get choked out from a knee on maybe 3 inches of the back of ur neck? Did none of your parents grab you like that when you misbehaved?,1
13,2020-08-31 03:58:44+00:00,"It’s not all the same receptors a drug like oxycotin would affect though. Considering Kratom affects other neurotransmitters too that typical opioids don’t, I wonder if narcan would even fully negate it.",1
14,2020-08-31 03:20:21+00:00,"The toxicology report said he had a high amount of fetanyl in his system, drawn antemortem. They also, as I said, cited parts of the video which show with no stuff in his mouth, he then turned into the car a little, and opens his mouth with a visible round white substance in it. After he opens his mouth again, the white stuff is gone. It's shoddy evidence, but could be the alternate reasonable explanation that acquits them.",1
15,2020-08-31 03:20:05+00:00,"The narcocalypse has begun. Lord Asmodeus has claimed a legion of  fenanyl tainted souls. Holy Mammon has cast us out of our hovels to stare in wonder at glittering towers. And Ahaziah who fell through the lattice in his upper chamber which was in point grey, and became ill. So he sent messengers and said to them, “Go, inquire of Baal-zebub, the god of Ekron, whether I will recover Dougs Norco.”",3
16,2020-08-31 02:32:41+00:00,"O cara é bandido por todas definições da palavra, portou uma arma ilegalmente.

Mas porque assassinou os antifa!!!!!!!!!! é hEroI e bandido bom",1
17,2020-08-31 02:15:52+00:00,"If you want to do dope and get high stay on the dope. Methadone isn't for getting high. People messing around and giving methadone patients a bad name is why just now after 10 years my clinic finally let us 2 weekers go up to a month. There's no high from methadone, the best you are going to do is get a non euphoric nod that is just a pain in the ass when you are trying to be a productive human being. Seriously though if you aren't ready to stop using and you are still looking to stay high why even bother? You will just end up with a dual habit and then they will end up throwing your ass out and you will be in hell withdrawing from 120mg that you may not be able to get on the street at least no consistently and 2 grams of fetanyl dope",2
18,2020-08-31 02:08:53+00:00,It's more that they're mad about oxycodine,1
19,2020-08-31 01:57:04+00:00,"But the ones letting fetanyl drive them into poverty and dictate their well-being are just fine, right? I'm ok with being a sad human being, at least I contribute to society.",1
20,2020-08-31 01:01:01+00:00,"I was in active addiction for over 20 years, vast majority of the time using pharmaceuticals (I got an INSANE number of 100mcg/hour fent patches plus nearly 200 roxy 30s for breakthru pain). Like any addict, when I was in wds, I would do anything that would make me well. I had a few friends over the years that got MSContin and MSIR who hooked me up occasionally. My point is that I think I am mildly allergic to morphine. Every time I have taken it, I get this weird, clammy feeling in my thigh muscles and my stomach muscles. It was like the were partially contracted for the duration of the morphine, either causing the clammy feeling or a result of it. Not point to my comment other than a trip down memory lane for me lol.

Enjoy OP!",1
21,2020-08-31 00:27:37+00:00,"Hard to swallow pill

White oxycotins

Pick one",1
22,2020-08-31 00:25:51+00:00,"Heroin, meth, Fentanal, pcp, crack (cocaine is much healthier), salvia and bath salts? I guess the drugs that turn you into a zombie or a cannibal.",1
23,2020-08-30 23:47:50+00:00,The defense pointed out some frames of the bodycam that they claim shows him swallowing about 2mg of fetanyl.,1
24,2020-08-30 23:18:01+00:00,"Well the key part of that statement is that the autopsy did exhibit symptoms of an overdose death. Increased lung weight, lethal amount of fetanyl in the system, cause of death (cardiopulmonary arrest) consistent with an overdose. However, there were other signs that made him believe that the other cause of death was more likely. But to convict someone of a crime, there is a higher burden of proof than ""more likely true than false."" This may play big in the defense",1
25,2020-08-30 22:01:54+00:00,"&gt;Seems to be a pretty easy thing to do, considering the medical examiner  stated he would've certified the death as a fetanyl overdose **had the  death happened in his home or anywhere els**e. 

This is a bullshit ""what if"" defense. I mean sure, if you remove the accused from the situation entirely. and magically transport the victim to his home, then yes, the only possibility left is that Floyd would have died of something other than what the accused was doing. But this death did not occur at Floyd's home or anywhere else. It happened on that street, while Chauvin had his knee on Floyd's neck.",1
26,2020-08-30 21:47:56+00:00,"He does not need to prove anything in the sense of ""more likely true than false."" He simply needs to say that it's possible, and in some ways supported by the evidence, as to create a doubt to the state's narrative. Seems to be a pretty easy thing to do, considering the medical examiner stated he would've certified the death as a fetanyl overdose had the death happened in his home or anywhere else.",1
27,2020-08-30 21:19:44+00:00,"This was always going to become their defense the moment they discovered the fetanyl in his body. You'll probably hear the defense argue George Floyd was a 'dead man walking' even if cops never showed up and intervened, and that there was no way that the cop had knowledge that Floyd had that much drugs in his system when administering an otherwise standard response in a manner consistent with their bureau's training.

It''s up to a good prosecution to offer an alternate response where police use the minimum force necessary to detain and cuff Floyd while they sort out the accusation of using a fake $20, where if Floyd were to suffer a medical emergency on his own, it was clearly not exacerbated by an excessive use of force where one guy is kneeling on his neck while two others are sitting on his body adding hundreds of pounds of resistance to his efforts to breathe through an already restricted airway.",1
28,2020-08-30 21:19:28+00:00,"My dude you seem an expert in drugs so let me ask you, could you make an educated guess as to why I can take enough benzos for a month straight sometimes to make late Fentalyl Floyd look like a girl scout, and then I stop taking them for months without any problem? No seizures, nerve damage or anything, I usually want to get fucked up once in a while so I buy a box or two of benzos, take them over 2 or 3 weeks everyday until I run off and then I just stop cold turkey until I feel like getting high again usually 2 or 4 months after I last stopped.

also on the same note: I have been having back pain for like a year now, could that be because of the benzos? I thought it was because of my office job as my coworkers have a similar back pain, I think I had the back pain before I started taking benzos here and there, and it doesn't stop once I stop taking them neither it gets worse when I do take them, any pill you could recommend for back pain?",1
29,2020-08-30 21:11:04+00:00,When asked the medical examiner answered that he would certify the death as a fetanyl overdose if his death had happened in his home. So there is a case to be argued.,1
30,2020-08-30 20:22:25+00:00,Four doses of fentonyl coming up.,1
31,2020-08-30 19:56:38+00:00,"I study politics quite a bit and am versed on the state of the system as it exists today.

Ya i get the single issue politic idea.

Pot is tasty issue.

The problem is pot is also divisive.

Now the right can claim "" LOOK!!! They want drugs AND LAWLESSNESS""

Single issues can mobilize the other side too. 

Someone who is moderate whose kid was killed by fentenyl might see this as a demotivator to either stay home or switch vote for the douchebags.

Theres so many more issues that are more unifying that people seem to ignore.

Wtf ever happened to reasonable people sitting down together to talk about issues that impact us all that we all see every day?  Some are far more pervasive and destructive if you dig in a little.

Why is it you as a wage earner cant get ahead?  Cause republicans rite?  Well almost.

Its because offshoring and oursourcing.  

I travel quite a bit and i understand global labor market place.  You are fucked as an american wage earner cause people around the world are now just as educated, internet has made remote work possible, and the cost structure - between their wages and health insurance and taxes - is 90% less than yours.

One party is trying to shine a light on this while the other is doing everything they can to not let you see it:

https://youtu.be/hmQhrzMhDMM

And bipartisan my ass.  Like 2 republicans reached across the isle while the rest of the scumbags did everything thry could to discredit the idea as unworkable.

Anyway, Thats a unifying concept.  Who doesnt want ssi?  who doesnt want clean water and safe infrastructure? Who doesnt want higher wages and more disclosure to the nefarious shit corporations are doing?

See tax on your wages pay for schools, bridges, waste treatment, grammas ssi.

When these jobs are exported, none of that gets paid and the disparity between rich and poor get greater.

No one takes the time to explain this....instead they reach for political partisan bullshit which can poison the well.


America is not ""great"" anymore.  Its just potlitical hacks and dirty trick bullshit on both sides.


Ya, me just another random dood who left amerca because i think its too far gone to save.",1
32,2020-08-30 19:44:26+00:00,"It's fine. I understand that the internet isn't exactly a place where people come to respect each-other's humanity. I'm just as guilty as you, brother.

From experience talking with people with different political ideas, we have more in common than we think. The problem is we have different language to talk about the same thing.

As I understand it, the companies who manufacture opiates purposefully manipulated research to show that they were less addictive than they actually are. On top of this distributors like CVS and walgreens who were supposed to alert the government of irregularly high opiate sells failed to do so because they were making insane amounts of money. Then you have doctors and clinics who got kick-backs that functioned as prescription mills. In every case these people put their personal profit above the well being of society. someting like 75% of opiate addicts and people who overdosed on opiates (1999-2017) started with opiates that were prescribed to them. Since 1999 about 450,000 people have died of an opiate overdose. People were hoooked on opiates due to prescriptions, then when the governemnt clamped down people turned to heroin and fantanyl.

&amp;#x200B;

[https://www.cdc.gov/drugoverdose/epidemic/index.html](https://www.cdc.gov/drugoverdose/epidemic/index.html)

&amp;#x200B;

[https://www.drugabuse.gov/publications/research-reports/prescription-opioids-heroin/prescription-opioid-use-risk-factor-heroin-use](https://www.drugabuse.gov/publications/research-reports/prescription-opioids-heroin/prescription-opioid-use-risk-factor-heroin-use)",1
33,2020-08-30 19:22:07+00:00,"A diferencia é a questão moral cara, Deadpool é um antiheroi, e capitão america é um heroi.
Blade não era um heroi era mais um caçador de vampiros, d acordo com ele mesmo né?Tipo cara...",1
34,2020-08-30 18:14:04+00:00,nicotine - increases effects. the buzz sure but also nicotine increases the conversion from codidne to morephine in your body aswell g,2
35,2020-08-30 17:54:30+00:00,"Its a pain in the ass. Especially with family in law enforcement. I can go to the dr and get fentayl oxcontin percocet loritabs, Valium, Adderall. Xanax. And carry those pills legally on to school grounds. God forbid if i get caught with a doobie though",1
36,2020-08-30 17:41:23+00:00,"Oh, you mean the footage of him high on Fentnyl and resisting arrest? If he wouldn't have resited arrest, they wouldn't had to have taken more extreme measures.",1
37,2020-08-30 17:34:48+00:00,"Mano o ator acabou de morrer deixa quieto.

E Blade não é heroi, sério antiheroi.Anti heroi.",1
38,2020-08-30 17:30:42+00:00,"He had 5x the lethal amount of Fentnyl in his system, plus high blood pressure. Read the report",1
39,2020-08-30 17:23:25+00:00,He overdosed on Fentnyl. He died at the hospital.,1
40,2020-08-30 17:05:34+00:00,I said oxy but I feel like if I got the morphone I would have a little bit of a different opinion.,2
41,2020-08-30 16:59:01+00:00,"HHahah 300 grama heroina, dileri pocetnici. Kolike su to gramaze da bi se smatra faca u gradu?",1
42,2020-08-30 16:34:08+00:00,"Ok, that will be hard for you to accept, but you are generally better off without rehab, if you are Kratom addicted.
The rehab system doesn't work, you trade one drug for another which can be much, much worse (hello methadone).
Kratom is generally unheard of, I had to explain my family what on earth I am addicted too and they gave me love and support.
Most People, even in the positions you mentioned won't know anything about Kratom and want to set you on suboxone etc which is way worse.
After reading many Heroin stories, watching addicts etc, Kratom is like opening the door of Hell and getting a good look in.
Heroin, Methadone, fetanyl, suboxone, etc you name it is being in Hell.",1
43,2020-08-30 16:30:56+00:00,"Trust me- you're hardly alone. I hated dealing with my MIL so much when my son was a baby, I basically refused to go there for months and months on end. Any attempt on my end to have any kind of positive interaction leads to her acting completely rude and crazy and we've had MULTIPLE blow out fights...

She too bought a FULL CRIB when I didn't even have one myself and she couldn't comprehend that we were not leaving the baby with a smoker who was WAY high on pain meds all the time (and I'm a chronic pain patient myself- she was flat out nodding out on fentynyl 24/7 on top of being mentally ill!)

 Like the time she made Christmas MISERABLE by insisting that I ""set her up to fail"" by giving her a list of Xmas gifts our son would like - and then allowing other people to buy things she didn't get.... And then she SCREWED UP, saying she bought him ""the game"" when she really bought him ""the rocket gun thing""- and then my son opened a second rocket gun and POLITELY SAID ""my uncle got me one of these this morning. I love it nana, but it's okay, the store at the mall has the ring toss game I want, so maybe we can take one back.""

She LOST IT and started YELLING at me in front of everyone that was at my husband's gmoms house for Xmas dinner! Then she not only accused me of ""wasting her time walking ALL THE WAY THROUGH THE MALL""- She told my son he couldn't play his ""Pie Face"" game (that she had already SHOWED HIM the whiped cream can for!) - telling him ""You can go make a mess at your own damn home"" and made my 4 year old CRY ON CHRISTMAS.

 I was FURIOUS and told my husband we were leaving. After her whole fucking outburst- she tried to say ""my grandson isn't leaving without a hug""- I told him to go to the car and UNLOADED on her. ""You made my child CRY, you disrespected me after I tried to fucking HELP YOU by offering you affordable suggestions for gifts he would be truly EXCITED about- and then you GUILT AND SHAME a five year old because YOU TEXTED ME THE WRONG THING- (At this point I held the fucking text in her face- reading allowed how she ""bought him the game from the toy store at the mall""- one was a BOARD GAME, the other was a NERF GUN type thing. It was HER mistake and she not only ruined everyone's Christmas, but I was DAMN SURE not forcing my son to hug someone who made him CRY. 

Years went by and after a weekend in the Poconos where I TRIED SO HARD to be nice- I told my son we had ""a while before we were leaving and he could build a Lego set before we go""- I had already cleaned the bathroom and bedroom in the guest house id basically been FORCED TO GO STAY IN over MY WEDDING ANNIVERSARY which my MIL fully planned with zero interest in weather I would WANT to go there... And her response was to PASSIVELY AGGRESSIVE start slamming things in the kitchen, yelling about how DARE we be leaving without doing""anything to help out"" and ""who did I think I was to leave without cleaning the rooms we used""- because somehow ""there's time for you to build a Lego set""- in her insane mind translated to ""we're leaving as soon as your dad gets out of the bathroom"" - she's a literal psycho. Once again, she made my son completely upset and she's screaming to herself about how she ""TRIED SO HARD TO BE NICE ALL WEEKEND"" for me to ""ACT LIKE THIS"". I have never wanted to punch someone in the face more than her. 

My son is going to be 10 when his sibling is born. Our older son was the product of an assault before my husband and I were together, and so he's not biologically her grandson. Honestly, I'm worried about my son being related to that insane bitch by blood. 

But no girl- you are not crazy or alone in crying or being upset. My husband and I had a few wars because he spent his life coddling her and her insanity and I made it clear that was not going to happen at the COST of my happiness. 

If she thinks she's going to get her grubby mits on my baby for even a second, she's got a rude rude awakening coming.",1
44,2020-08-30 14:40:45+00:00,"Eu acho que é tesão por cano quente.

Qualquer um que mate alguém a tiros vira heroi.",1
45,2020-08-30 14:09:44+00:00,"se provares que estou errado, com provas concretas, eu paro de o fazer.
Anda la heroi.",1
46,2020-08-30 10:00:14+00:00,some people don’t metabolise codiene into morephine we’ll in their body,1
47,2020-08-30 05:35:32+00:00,"Once upon a time Tallari Gatta of Anegundi is one of the main entrance to enter in to the Vijayanagar kingdom. You can find an antiq Nandi statue on the Anegundi side of this place. As you see in the picture a… 

***

posted by [@LostTemple7](https://twitter.com/LostTemple7)

[Link in Tweet](https://www.instagram.com/p/CEgHvAJASAD/?igshid=1gyx34ozdqtol)

^[(Github)](https://github.com/username) ^| ^[(What's new)](https://github.com/username)",1
48,2020-08-30 04:54:26+00:00,"It's heroin or probably more likely fenanyl.

Crack is cocaine mixed with baking soda lol. You ever seen a sleepy coke head?",1
49,2020-08-30 04:37:01+00:00,"Maybe, but some people just happen to be predisposed to addiction way more than others. Some people just take the pills prescribed to them by their doctor and get hooked that way (e.g. Oxycotin, Ritalin, etc.). It's not true to say that all addiction starts with a person's bad choices, especially considering the current opioid epidemic. Even if it did start with questionable choices, we need a system that cares for people who need help regardless of why they need it.",1
50,2020-08-30 04:27:15+00:00,"What medication?  If you are lucky, it might be Hydroxyzine.  I recently was moved from Zoloft (for depression and anxiety) over to hydroxyzine which has been a HUGE benefit.  It acts quickly, isn't habit forming, doesn't affect your clarity or dull senses or anything and it even clears my sinuses (apparently it was originally an antihistamine).    


I was always concerned about moving to ""as needed"" medications because I'm very sensitive to sedatives (at 14 I was given a super small amount of Oxycodine to manage pain for recovery from my wisdom teeth being removed that I ""should"" have been able to go to school with, but even half a pill made me super loopy for hours and I barely made it in the building my first day back, so they told me to stay home till I was recovered).  However, it's worked LITERAL WONDERS and since started it I've felt better than ever and I don't feel any ""need"" to take it and I've gone weeks without it sometimes.",1
51,2020-08-30 01:46:15+00:00,Definitely fetanyl. If its an active investigation I wouldn't post about the trail of people dropping from hot drugs you gave them,1
