,date,body,score
609,2020-08-07 17:11:48+00:00,"#*Pressed pill inquiries are not permitted under any circumstances.*

There is absolutely no way that we can tell you if the pill you have is real or if it is pressed by looking at a picture of it. If you are wondering if they make presses of the pill you have, the answer is very likely going to be yes. [You can take a look at some of the dies that are easily available for purchase here.](https://imgur.com/a/6EPiLul) 

If you are worried that your tablet is pressed and contains fentanyl you should [purchase some fentanyl test strips here.](https://dancesafe.org/product/fentanyl-test-strips-pack-of-10-free-shipping/) This is the only way you can be pretty confident your pill does not contain fentanyl unless you picked them up at the pharmacy yourself. Be mindful that not all fentanyl analogues can be detected by fentanyl test strips.

----
#Pressed Fentanyl Detection

Fentanyl pressed pills are especially dangerous because they are often sold as regular pharmaceutical pills which are normally considered *safe*. They can be very hard to spot even if you know exactly what the real pills look like.
With the widespread explosion of fentantyl pressed pills it is recommended that you **apply the utmost caution before ingesting any opiate that you do not have the direct prescription for.**

Generally speaking, pressed pills will be lower quality than their pharmaceutical counterparts. 

    One or more of the following will usually be off:

* **Taste**

* **How they break**

* **Color**

* **Imprint**

*Pictures mean nothing in comparisons and only experience/physical examination can begin to help you determine authenticity.*

*Another tip is comparing them against all others in the batch that you are buying from. There should be little to no differences.*

However, there are never any guarantees and presses are getting better and better. The only 2 ways to be sure are if it is your prescription and if you get it lab tested. Proceed with caution. 

**A slightly cheaper option is [**Test Kits**](https://dancesafe.org/product/fentanyl-test-strips-pack-of-10/), but they may not work on all known analogues*

**Here are some examples of Fake Presses:**

1. [FAKE EPIC Pharm E8](https://imgur.com/3NAVLfm) comparison (fake left/Real Right) 

2. [FAKE A215](https://imgur.com/kUZxegN) -Notice the hook on the 5 curves up like the font on this 5. Should be parallel with divider line. Also not clean edges. Should be smooth. You can't tell in this pic but they were also smaller in diameter 

3. FENT [HOT SPOT](https://imgur.com/qRZynO4)- what to look for inside a pressed pill 

**Quick Reference of four different** [REAL OXY PILLS](https://imgur.com/277VvPK) (NOT fake/pressed) 

----

#Fentany Reagent Testing 

--

Although [Lab testing](https://www.ecstasydata.org/) is the only foolproof way to see what absolutely constitutes a substance, there are a few things you can do to minimize risk when there is a suspected fentanyl (or analogue) adulterant.
_________________
The best option is through reagent testing using a variety of tests like Marquis, Mecke, and Froehde. Using these three you will be able to identify between many different psychoactive and Fentanyl Analogues. 

Find more information on, where to get reagent tests, color-codes for different [substances](https://dancesafe-wp-uploads.s3.amazonaws.com/uploads/2017/01/2017-chart-a.jpg), and up to date reagent-color-codes for other analogues/compounds at /r/ReagentTesting.  

An extremely helpful chart when differentiating between fentanyl analogues and other opiates can be found, [here](https://imgur.com/c0BoewL). It's important to note that if there are different types of substances in your mixture that the reaction depicted by the reagent testing table may have more than one result. As such, one result that is a darker color may cover a lighter color. To overcome this, multiple tests is preferred. It is best to do a thin layer chromatography screening test (to separate out the mixture). These are available from suppliers like [Bunk police. TM](http://bunkpolice.com/separation-test-kit/). They will insure that your results are not obfuscated.
__________________________
Another option (that is more expensive, less accurate, but may work in a pinch), is to use pre-designed *[Fentanyl Test Strips](https://dancesafe.org/product/fentanyl-test-strips-pack-of-10/)*. An important note with test strips is that they will only detect the fentanyl and anologues that they are designed to. In this particular case they only test for Fentanyl,
Butyryl-fentanyl, Acetyl-fentanyl, 3-Methylfentanyl, Carfentanil, Thiofentanyl, Furanylfentanyl, 4-Flourofentanyl, Flouroisobutyryfentanyl, and Sufentanil. That is to say that they will not work for any future analogues that are released.

Choose whichever method you are most compatible to the risk.

---

*If you feel that you received this message in error please [contact the moderators of /r/opiates.](https://www.reddit.com/message/compose?to=%2Fr%2Fopiates)*",1
610,2020-08-07 15:55:31+00:00,"Hey! So I also have a large number of plaques of Morphea, back, forearms, ankles (UV therapy also did nothing..) so I decided to try getting a tattoo over the smallest patch on my arm to see what happened. It was more painful over the patch and the ink didn’t take as well to that part but it seemed to work out.
However, when I searched some forums about tattooing over Morphea (very few and very old forums) I saw that it could be risky and could potentially cause new flare ups. I decided to risk it and got my tattoo. However, after 7 years of being in remission, I ended up getting a new patch on my side 6 months later which I’m now having to go back to hospital for. I have no idea if the two are related (tats and new flare up) but I just wanted to put this on here so you’re aware!",1
611,2020-08-07 15:53:42+00:00,"He boofed fetanyl with Floyd Maywhether and fought him MMA style. Jesus, learn to read bro.",4
612,2020-08-07 15:02:16+00:00,"Patches are fine, but compare it to any other opioid. Dilauded, mscontin, oxy, it’s all way better. It’s not like you won’t feel fentanyl. It’s very sedating. It just doesn’t touch the energetic rush that opiates give me. Hell alcohol is more euphoric than fent for me. The high compared to the hell that is fentanyl addiction is pretty loose loose.",1
613,2020-08-07 14:48:27+00:00,"Zlo enostavn je vse skupej sploh ni treba na dolg in sirok razpredat. Zakaj bi clovek voljno posegal po substancah, ki unicujejo telo?

 To da droge unicujejo organizem je dejstvo, tak je konsenz. Vse pa je odvisno od frekvence in dolzine uzivanja. Nad cimer pa nimas nadzora, ne mors preprect, da nau en 30 let 3 jointe na dan skadiu, tko ne mors preprect, da nau en 2 skatlce cikou na dan 30 let pokadu.

U temu zaspiu je sicer velik cudmga napisanga, pa bom raj prasou da nam domnevou:

&gt;Škodljivo je vse ampak vprašanje je kako

Zelo siroka stvar. Ni vse skodljivo, ce bi blo vse skodljivo nas ne bi bilo kot vrste. Kaj s tem mislis?

&gt;Trava je naprimer dober primer, ker je prepoved bila bolj politična kot strokovna

Obravnava se jo kot drogo. Kako je tk prepoved bolj politicna? Kaksne so politicne posledice?

&gt;Marsikateri psihologi sami kadijo, tako kot tudi zdravniki (čike ali pa travo).

Marsikater naravovarstvenik se voz z avtomobilom kar pa ne pomen, da avto ni skodljiv okolju. Kaj si s tem hotla?

&gt;Tudi psihadelike sami raziskujejo.

Raziskovanje in uzivanje kr mal tko je mal razlike.

&gt;Bo pa vsak psiholog močno nasprotoval vsaki rekreativni rabi heroina naprimer, ker je izjemno zasvojljiv in nevaren. V ZDA vidimo kako hude posledice ima, ko se razširi v populaciji. 

Dobr point. Vsak zdravnik bo nasprotoval vsaki rekreaticni uporabi vsake droge. Ja v ZDA imajo ornk tezave z opojnimi substancami, vsak let hujse.

&gt;V življenju je marsikaj sivega in redko bodo meje, ki jih postavljamo črno-bele.

Kdo postavlja te meje in glede na kaj?

&gt;Ko poskušamo zadeve preveč poenostavit ponavadi zabredemo v nevarne vode.

Kako? Vsaka stvar je brez meje nevarna vkljucno z drogam. Zdej je sam vprasanje regulacije. Kdo bo preprecvou, da nau clovk sam sebe unicvou s tem, da skadi 5 jointou na dan pa da to pocne 30 let? (Pretiravanje). Pac kdo bo regulirou kolk se skadi da je se zdrav.

&gt;Pri psihoaktivnih substancah je zelo veliko faktorjev in ne moremo it na vse ali nič

Kaksnih faktorjev? Kateri so tisti faktorji, ki odlocajo kaj je nevarno in kaj ne? Eni bi za faktor vzel kolk dobr se pocuts.

&gt;Zelo malo pravil bi imeli, če bi lahko sprejemali samo tiste, ki so povsem objektivno določljivi.

""Najpomembnejsa"" so vec al mn vsa objektivna. Pod najpomembnejsa mislm tista, ki so prpeljala clovesko druzbo do kjer je danes. Ne ubijaj, ne kradi itd itn. Taka pravila da dam primer",1
614,2020-08-07 14:02:07+00:00,"Škodljivo je vse ampak vprašanje je kako. Trava je naprimer dober primer, ker je prepoved bila bolj politična kot strokovna. Marsikateri psihologi sami kadijo, tako kot tudi zdravniki (čike ali pa travo). Niso tako rigidni glede tega. Tudi psihadelike sami raziskujejo. Bo pa vsak psiholog močno nasprotoval vsaki rekreativni rabi heroina naprimer, ker je izjemno zasvojljiv in nevaren. V ZDA vidimo kako hude posledice ima, ko se razširi v populaciji. 

V življenju je marsikaj sivega in redko bodo meje, ki jih postavljamo črno-bele. Ko poskušamo zadeve preveč poenostavit ponavadi zabredemo v nevarne vode. Pri psihoaktivnih substancah je zelo veliko faktorjev in ne moremo it na vse ali nič. Potrebno je upoštevati različne faktorje in argumente, ter se poskušati odločit najbolje glede na informacije. Zelo malo pravil bi imeli, če bi lahko sprejemali samo tiste, ki so povsem objektivno določljivi.",1
615,2020-08-07 12:30:39+00:00,I can sense rhe oxycotin being released .,1
616,2020-08-07 12:17:17+00:00,Sepse s’ka qënë heroina që mendojmë ne se ka qënë?,1
617,2020-08-07 12:07:54+00:00,"Eu gosto das séries que ele fez em 2014-2015, Pra falar a verdade, nunca gostei do Authentic, só gosto de umas séries antigas dele(66 quartos dos desafios, Vida de heroi, etc)",1
618,2020-08-07 10:29:36+00:00,"Buddy of mine got caught up in herioin and started abusing cats. He would light them on fire and dump them in the trash can. 

He was married to a beautiful wife, good looking guy, had a lot of drive. He gets out of prison in three years. Fucked it all up.",1
619,2020-08-07 10:13:42+00:00,Sentenced 12 years for writing oxycotin prescriptions without seeing patients.  I wonder how many lives he ruined by doing this?,1
620,2020-08-07 09:35:53+00:00,"I have Universal Morphea (the systemic form of Generalized Morphea). It started as small plaques on my legs and arms that spread to cover most of my body in a symmetrical way. I was originally diagnosed with systemic scleroderma, but ruled that out because I have no CREST systems besides calcinosis and sclerodactyly. However, I am beginning to progress to internal involvement of the bowel and kidneys.",1
621,2020-08-07 09:20:11+00:00,"From the clinical history of iv dhc theres probably been enough adverse reactions to iv dhc for the med and pharma institutions to state its dangerous to use it iv. But i used it for years iv and had no issues. Same with diconal, palfium, oxycontin and MScontin pills they all say on the leaflets not for intravenous use but people shooting pills up so long as they use a micron filter wheel to filter the insoluble binder particles out then overdose is the actual risk. But not using a micron filter wheel and just using a cig filter that would let the tiny binder particles direct into your blood stream and it would really fuck your lungs up if they blocked a capillary.",1
622,2020-08-07 08:19:22+00:00,"Na zapadu su plate uvek obračunate bruto, a uglavnom su robe i usluge takođe obgračunate bez poreza, pa je svakom građaninu nedvosmisleno jasno koliko daje u budžet. To je bitna stvar koja je ovde verovatno planski obrnuta, pa kad poskupi hleb kriv je pekar, a ne baja što je klepio akcize na gorivo.

Jako dobri predlozi. Ako bi legalizovali marihuanu i ostale zabranjene supstance koje koje su objektivno manje destruktivne po zdravlje od cigara i alkohola (što znači skoro sve sem heroina) i eventualno prostituciju, imali bi dodatni priliv u budžet uz istovremeno pad kriminala.

Problem je što se neće desiti. Kao što kriminalci ne bi bili oduševljeni legalizacijom mnogih njihovih aktivnosti, jer su marže na crnom tržištu daleko veće zbog rizika, isto tako ni političarima nije u interesu efikasniji aparat bez korupcije. Mislim da se ponavljam sa ovim poslednjim primerom.",1
623,2020-08-07 07:29:53+00:00,"Ja se strinjam, da je to neumn, tko neumn kokr da bi legalizirou samo travo ne pa heroina, kasna hinavscina, nekaj legalizirat ker ti je osebno pri srcu. Zato sm nekje tut ze napisou, karkol drucga kokr absolutna prohibicija ali legalizacija vsega je hinavscina tako zagovornikov ali nasprotnikov.",1
624,2020-08-07 06:19:19+00:00,"If they were selling cocaine I'd be fine with it.  We have a fentayl and heroin problem in my city. A lot if dealers aren't that exuberant if they're selling cocaine, shrooms, weed and etc.",0
625,2020-08-07 06:08:35+00:00,"&gt; 12-year sentence for writing oxycotin prescriptions *without seeing* patients

&gt; he was so looking forward to being back, and then through their *negligence* they let him die

🤔🤔🤔

Edit: Downvote me to hell. But first, try dragging some poor soul two blocks to an ER because they're overdosing. Try comforting a fourth grader who found their mom dead of a heroin OD. 

Maybe you'll feel differently about illegal, money grubbing prescribing practices after all that. Far as I'm concerned karma came through on this one. 

Y'all wanna complain about ICE? Let's talk about the kiddos locked up, not some corrupt doctor whose hands are red with blood.",1
626,2020-08-07 05:14:01+00:00,"I mean most of the music juice was making post Death Race was super dark lyrically and The Weeknd might not wanted to be associated with some of that stuff. Even somewhat poppy song like Coraline has him singing ""where's the fetanyl it brings me pleasure"" and on Impatient he talks about using Heroin. And almost all his unreleased music talks about being in hell &amp; overdosing on percocets. Just a lot of dark foreshadowing of his death.",1
627,2020-08-07 04:44:47+00:00,"Ya ves op, yo quería heroina... Chale",2
628,2020-08-07 03:32:25+00:00,I’ve taken fucking perocet for cyst bursts and it does absolutely nothing for the pain,1
629,2020-08-07 03:12:06+00:00,"&gt;If a suspect is saying they have problems with breathing then why would you think it's okay to constrict their airway?

Did you watch the video yourself? You're talking like you're just repeating highlights from others.

He straight up tried to escape. He was claiming he couldn't breath, but showed zero evidence of actual difficulty breathing. He claimed he was too claustrophobic to be in the vehicle, but didn't even know how to pronounce the word. If he was claustrophobic, he'd probably have known how to say the word. It's more likely he heard it from someone as a way to get out of being put in a cop car so he can try to escape.

Also, the amount of Fetanyl in his system was ""above"" the average-dose for people who die from Fetanyl overdoses.",1
630,2020-08-07 02:28:54+00:00,"Okay?

I used to work at trailhead and it is no secret that fentan/dope is all over the place. He decided to buy it knowing what it was. Nobody even says ""heroin"" anymore because everyone knows that all the dope is straight fentayl so everyone just calls it fent. Wasnt that way even just 7 years ago, but now there is no heroin, Nd everyone is totally okay knowing that they are buying fentanyl

There are a million ways this could have played out. And hiding fent from security is the easiest thing to do ever. It is a sad reality, but this doesn't even slightly surprise me at all. I am a former addict, and while I was still using,  this was an extremely common occurrence. 

It is sad. But mainstreet is getting worse because it is all bleeding from STL, you know how many times I've gone to the airport to buy fent? And Ameristar is right there. Usage is going way up because there is tenfold more fentanyl and fentologues on the street than there probably ever was heroin. But there used to be plenty of that too",1
631,2020-08-07 01:21:31+00:00,"&gt; He had ×5 the lethal dose of fetanyl

Where did you see that. Ridiculous.",1
632,2020-08-07 01:14:42+00:00,"total mano ainda mais nessa epoca ta ligado?  
um monte de gente desempregada, pandemia, dolar em 5 reais, o caramba a quatro e os cara comprando heroi de joguinho que vai ficar de graça em 2 semanas???",1
633,2020-08-06 23:31:24+00:00,"Not to mention its more than likely less costly than healthcare for a lot of people lmfao

(Just a foot note, I'm not condoning herioin use, the American Healthcare system is just that fucked)",3
634,2020-08-06 22:41:53+00:00,El Tramadol es un opioide al fin y al cabo. Creo que hay mucha gente que no sabe que pertenece a la misma familia que la morfina o la heroina. Hay que tener cuidado con eso.,1
635,2020-08-06 21:52:57+00:00,Here have some oxycotin,1
636,2020-08-06 21:05:52+00:00,"And about anesthesia and surgery, this one should be easy but for some reason is the hardest part of Suboxone treatment. A patient on buprenorphine should \*never\* have to stop taking their bup because of surgery. Never. An anesthesiologist is more than qualified to determine the best route of anesthesia based on a patients medical history, and properly monitor the patient while under to mitigate any possible adverse outcomes. Opioids do NOT have to be used for anesthesia to be effective so the argument about the buprenorphine interfering with the efficacy of fentanyl is bullshit. First of all, no it doesn't. Fentanyl is one of the few drugs that has a higher affinity for the opioid receptor than bup does. And secondly, if they're really that afraid then don't use fentanyl... It's really and truly that simple. The problem lies in (again) a profound lack of understanding of addiction and addiction medicine which leads to surgeons and anesthesiologists developing warped ideas of what it means for a patient to be on Suboxone. Taking someone off of this medication for surgery where an anesthesiologist is intently monitoring all blood gases and vitals is absurd, and they should realize that the withdrawals the patient will experience will inhibit healing thereby INCREASING surgical risk. But they don't realize this. They honestly think that it's best to take someone off of buprenorphine for 24 or more hours before surgery and then treat them with a typical course of opioid pain management which is often 2-4mg morphine or dilaudid every 3-4 hours or 5-10mg perocet every 4-6 hours. Even if the patient has been maintained on say 16mg buprenorphine for any significant amount of time. That post surgical ""pain management"" is bullshit for someone maintained on buprenorphine or methadone for that matter. ALL surgical patients should be maintained on their USUAL dose of bup or methadone and any pain medication should be used on top of that.",2
637,2020-08-06 20:50:27+00:00,"&gt;*Fentantyl hidden in with heroin epidemic

Eh, I would argue that it is at its most lethal when found in pressed (counterfeit) pills. It isn't any better when it's in dope, but there's a certain implicit caution when one is buying sketchy powders on the street, whereas people tend to see pills as safe and quality controlled.",4
638,2020-08-06 20:35:18+00:00,"Nah, I wish Putin was our president.  He is the greatest national leader alive today when you realize he took Russia from an absolute apocalypse that lost 25% of it people to starvation and hardship in 10 years...to the boogeyman of the West it is today.  

Name me a US president still alive with that kind of track record.   I can name you one who is a frequent flyer f Lolita express!  

If had leaders like Putin, we would be adding the planet Mars as the 51st state to the union right now.   Instead we are lighting ourselves on fire over imaginary racism in the name of a Fentnyl addict who is guilty of home invasions.

But won't worry the deep fried cheeto will build a wall that will save us from hard working people who want to come here and live good lives making a nation great.",0
639,2020-08-06 20:27:19+00:00,"\*Fentantyl hidden in with heroin epidemic.

Fentanyl itself can help pain patients a great deal, especially cancer pain!  When used/prescribed correctly under medical supervision of course.",2
640,2020-08-06 19:08:20+00:00,Uno es una novela que describe la vida de un toxicòmano (heroina) y como un hombre de familia pasa de ser un drogadicto rechazado de la societa. El otro va a ser tanto más filosófica sobre de significado de la vida Explorando objetos y sentimientos cotidianos explorando objetos y sentimientos cotidianos.,2
641,2020-08-06 18:39:57+00:00,"Wait until you have withdrawals kicking in before taking subutex as if you take it too soon its got a higher binding affinity to the opiate receptors and kicks off any other opiate molecules present and that causes precipitated withdrawals and its like jumping to day 4 of a detox within minutes. Darren and me learned the hard way. Couldnt score h for a bus journey from Delhi to Dharamsala but he scored buprenorphine amps in a chemists and bish bash bosh in the bus toilet and next thing explosive vomitting and diarrhoea. 

You dont get immune to dhc you just get s tolerance after yrs and its the classic notion that we chase a high we will never capture again. Maybe take a tolerance break.. Strangely enoughr i use subutex for that cuz the cross tolerance isnt the same like say if i switched to MSContin or Oxy for a week my tolerance woukd get higher but cuz subutex is a weird one its a partial opioid agonist and partial opioid antagonist whereas Dhc is a full agonist like morph oxy and heroin. i usually switch to snorting 4mg lines of sub twice a day for 5 or 6 days once a month and its like my DHC tolerance halves in just shy of a week and my 2 x120s i get scripted crushed up, soaked in cola overnjght and downed in the mornjng gets me buzzing again. For another week or so then i need to get more 120s elsewhere and then when they run.out i switch to sub for.5 or 6 days..been doing that for yrs now. Jimbo taught me that trick.

Edit: if your dhc habit is huge , like taking a tub of 120s every few days youre better off going on methadone if you really need that strong gouch. Even after being on methadone for 13 yrs if i took 20mg of diazepam i was nodding like crazy but i got sick of the daily pick ups and piss tests and supervision like i was a drug addled child.",1
642,2020-08-06 18:38:51+00:00,*laughs in Oxycotin*,1
643,2020-08-06 18:21:40+00:00,"Zašto ljudi postanu ovisni? Jer im je kokain/heroin/štogod ""najbolji osjećaj koji su imali u životu"". Ovisnost ne nastaje samo zato što tvar ima nešto u sebi što ti daje feel ""Woah, ne mogu bez ovog"" prvi put kad probaš. Ovisnost nastaje radi stalnog korištenja toga i nakon nekog vremena tijelo se toliko privikne na taj najbolji osjećaj da ti to postane potreba. Kao voda. Bar ti tako misliš.

Najmanji dodatak dopamina koji jedva osjetiš, tipa šećer ili cigarete, su dovoljne za jake ovisnosti. Znaš da ti štete, ali tijelo postane kao neki magnet kojem nije dosta dok ti ne bude slabo. I to je problem.

Jednom u mjesec dana je valjda OK. Ali sve može vrlo lako prijeći u tešku naviku iz koje se ne da izaći. Isto tako, kokain može biti gateway do heroina kod osoba slabog karaktera. A ta droga je zlo iz kojeg nema lakog izlaska. Nekima je i jedan put dosta za ovisnost.

Droge oštećuju moždane funkcije i zato nisu nimalo dobre, i zato je bolje ne drogirati. Ljude lako neke stvari mogu omamiti jer tako mozak funkcionira.

Drogiraj se, tvoj je izbor, ja sam za to da se legaliziraju sve droge uz neku vrstu potvrde da si narkoman kako ne bi drugi mogli ući u taj pakao, ali opet. Nije dobro to konzumirati jer šteti. I veliki sam protivnik toga da društvo nagovara druge da to probaju i da smatraju druge kukavicama jer ne žele probati, te da ih izbace iz društva radi toga. Svatko tko ima želju probati mora znati moguće posljedice i rizike konzumacije te droge. Isto tako, depresivci su podložniji ovisnostima. Nemam ništa protiv konzumacije ako je sve o tome dobro istraženo, ali većina uzme to bez poznavanja posljedica. Pogotovo malo neobrazovaniji ljudi.

Rijetko tko je idealan tho btw, rekao bih da sam ovisnik o šećeru.",0
644,2020-08-06 17:18:21+00:00,"No no i get that. I was worried about what would happen if i took my next sub dose after taking morphone. 

I took my sub this morning got into the accident and then was given pain killers but I dont want to re induce and was wondering if i could keep taking my subs",1
645,2020-08-06 17:18:12+00:00,"Ako nađeš takvu, mogla bi bit. Samo znaj, i trava je štetna po zdravlje.

Ali nisam tako mislio. Droga kao takva nije prava sreća. Prava sreća je ona koja se ne dobiva nikakvim umjetnim ni prirodnim supstancama ili kemikalijama, dakle prirodna sreća. Ona koja dolazi od životnih događaja, a ne unošenjem šećera, nikotina, alkohola, kokaina, trave, metha, heroina i ostalih droga.",1
646,2020-08-06 17:17:16+00:00,"&gt; Why did they confront him? 

Because he was trying to pull a fast one on them? What the fuck is wrong with you?

&gt; He wouldn't have died if the employees didn't confront him.

Sorry, no. He wouldn't have died if he wasn't a fucking tweaker committing crimes and then causing a scene. He was OD-ing on fentanol you fucking ignoramus.",1
647,2020-08-06 17:04:55+00:00,Claro o nosso heroi,1
