,date,body,score
186,2021-11-23 19:34:35+00:00,"I'm vaccinated and agree with that the science we have says the vaccine is safe.  With that said, 

Of course the opposition to the covid vaccine is political.  It's based on mistrust in government which often times is based on valid reasons. 

It wasn't that long ago that Democrats, Republicans and the media covered up the fact that government officials poisoned the drinking water of Flint Michigan, then lied about it and gave thousands of children permanent disabilities

https://youtu.be/cvlcI2TmfdI

We have a government void of any accountability that has been proven to side with money off safety countless times.  Do you really blame people for not trusting the fda? The same organization that is complicit in killing over a million Americans through Oxycotin?

There is a consistent history of the medical community knowingly doing awful shit to people in the name of legitimate science. So when people are hesitant to give the vaccine to their 4 year old, there should probably be so empathy",7
187,2021-11-23 19:17:46+00:00,"Could be lots or fent or there's newer stuff easy 10mg etezeze  well its70 time the strength morphine, who now what's new time to legalize acRd but no limit. Mabye observation if narcan available.  See how safe shit can get. Morphine  and dimorphine,orheroin, pooh,not so bad.just a thought.  Gotta go .",2
188,2021-11-23 19:14:48+00:00,"Seems like he's trying to make extra bucks by putting you on Suboxone. Keep in mind, a lot of doctors and nurses were given false misinformation about kratom, the FDA had a campaign where they told doctors and nurses to look out for kratom and said it was dangerous. My friend who works as a surgical nurse said she was told to look out for kratom. We are fighting a battle with big pharma who has funneled the FDA money in order to spread misinformation (the guy who used to be in charge of the FDA, Scott Gottlieb, is literally an employee of big pharma, Glaxo Smitg Klein, you can see his LinkedIn profile). So unfortunately there is going to be lack of understanding from the mainstream healthcare industry about kratom, the American Kratom Association is trying hard to put out actual studies about kratom and fight the misinformation. Doctors and hospitals have close ties with big pharma unfortunately, remember they were the ones that handed out OxyCotin legally and caused the opioid epidemic. Kratom does not suppress breathing, unlike opioid, but your doctor doesn't know the difference, he gets his information from the corrupt FDA. Keep in mind that our US healthcare industry is a for profit industry, it's main purpose is to make money rather than genuinely treat people.",3
189,2021-11-23 18:52:47+00:00,"They tell a bunch of kids that marijuana is just as dangerous as meth and heroin. The kids try marijuana and realize its not that bad. Then they wonder what else dare lied about. Maybe meth and haroin also aren't that bad for you. 

Its a dangerous and slippery slope that could be avoided by just being hinest with kids about the dangers drug use can pose.",1
190,2021-11-23 18:49:47+00:00,"I'm far from a sadist but this dude deserves it... locked up and having a strict schedule




For 5 days he is given slightly large doses of benzos/heroin/fetanyl so that he becomes addicted. Then for 4 days he is forced to go through withdraw. 

For the 5 days he is being dosed with drugs you also give him shrooms/LSD every now and then.


While all this is going on you are all torturing him 7 days a week. Shoving points under his finger/toe nails and stuff like that. All that whilst really making sure that you give breaks because we don't want him to break to the point where he loses his shit completely. Thus making the entire ""treatment"" easier to go through for him cuz he's totally lost it.... so yeah would have to walk a very fine line there...




Lmfao I really feel like there should be a whole team of ppl just carrying out this ""treatment"". Plenty of other ppl in the world deserve thus like every pedo ever... again I'm not a sadist but yeah idk haha",-11
191,2021-11-23 18:42:46+00:00,"This may be fake, but I had a very close friend die from weed that had fentanal in it. Probably just a shittty dealer who cross contaminated, this was a few months before prohibition ened here in Canada. If he had gotten legal bud we would be able to share a bong bowl today.",1
192,2021-11-23 18:41:32+00:00,"Sorry to hear of your issues but glad to hear you're alive!

I'm no stranger to chronic pain, and for a long time did use Kratom for that instead of prescriptions.

If you're already on oxycodone (active opioid in percocet) it's not likely Kratom will equate the same relief as the medication, but it's certainly better than nothing. Just want to accurately set your expectations. Kratom works for many but usually people already on opioid pain relief find it insufficient for analgesic relief due to the tolerance (as well as expectations).

If you're still in pain with oxy, your dose either needs to be upped or increased in frequency, but good luck telling some doctors that, just depends on your ""luck of the draw"" and how you communicate your needs with them. Some won't budge no matter how much pain or discomfort you're in.

I'm a chronic pain sufferer myself, but one that has actively refused going back to full mu-opioid agonists (like oxy, hydrocodone or morphone, etc) because of addiction, and have instead settled on buprenorphine for both the pain relief as well as the addiction temptation/relief.

I don't know the right answer for you, but personally I'll answer your questions here:

* I preferred powder to capsules because it hit quicker but tasted like dirt and shit -- chug it shaken with cold water with an OJ or acidic drink to increase absorption and effectiveness -- if you find you require a bigger dose, or easier dosing: pills would be the way to go but take a bit longer to hit and isn't as ""intense""
* Recommended dosage: it depends -- but if you start low you can always increase and take more. (some start as low as a single gram, others are at 4-5, some are 10+) Take too much and you'll know it -- nausea, the spins, vomiting, double vision, shaking -- stuff like that will happen in my experience. Increase slowly and look for side effects or when your pain is relieved to an adequate level without the kratom side effects of taking too much. Can sometimes seem like threading a needle.

I hope that helps, good luck man! From one chronic pain ""experience-r"" to another.",1
193,2021-11-23 17:04:14+00:00,"Aia-i principala cale de intrare in Europa. O gramada de pachete mai mici sau mai mari trec pe acolo si de aici si capturile astea uriase. Sa nu mai vorbim ca datorita legilor locale e mai usor de prelucrat acolo.

In schimb intrarea prin Romania e aleasa intentionat si ma gandesc ca nu e aleasa la intamplare. Prindem si noi pentru ca nu absolut toti oamenii din sistem sunt niste corupti handicapati.

Dar asta nu e nici o garantie asupra modului in care functioneaza (sau mai degraba nu functioneaza) sistemul. Durata lunga de vama, controale aiurea, mite si coincidente ciudate (e.g. acum 2 ani cand a ""esuat"" in larg cocaina sau heroina aia -- ca nu mai tin minte ce era -- nu functiona radarul prin coincidenta).

Si alte ciudatenii de asta care se intampla foarte des. E imposibil sa nu ai oameni care sa-ti scape, nu e asta problema. Problema e de cate ori suntem pusi in situatii absolut penibile in care trebuie sa fi orb sa nu vezi ca s-a lucrat din interior.

Si daca tot suntem la discutia asta, politistii de frontiera inca si acum (din cate stiu, chiar sper sa ma insel) fac cheta pentru benzina/motorina sa se incalzeasca in masina iarna. Asta e sistemul nostru si ne miram ca nu functioneaza. Mereu ii futem pe cei cinstiti ca sa ne aparam de aia putini necinstiti si astfel mereu inrautatim lucrurile si ii futem pe toti.  Iar hotii mereu vor gasi o cale de a ne pacali (atat pe noi cat si pe Olandezi, aia nu-i problema).",6
194,2021-11-23 16:52:30+00:00,So did the police accidentally drop some confiscated buds into some fantanyl and then the lab tested it? But the cops thought it was funny so never reported they were the source?,1
195,2021-11-23 16:42:48+00:00,"Sempre quiz ver um protagonista de anime do tipo cartman do south park sabe? que é pé no chao, anti-heroi, sarcastico e etc",8
196,2021-11-23 16:07:12+00:00,"Dar statul roman are deja drept de decizie ce intra in corpul tau si ce nu.  
  
Nu numai ca are drept de decizie, si-l exercita foarte puternic chiar. De aceea exista substante interzise si substante permise. In toate domeniile.  
  
La propriu statul decide ce intra in corpul tau.  
  
Care este acea istorie pe care nu o stim?  
  
Stiu istoria cu liber la orice si oamenii bagau in ei heroina ca medicament si azbest si mercur si ... surpriza... mureau .... pentru ca erau prea prosti sa stie mai bine.  
   
Asa ca acum statele decid pentru noi ce avem si ce nu avem voie sa bagam in noi.",2
197,2021-11-23 16:02:00+00:00,Fetanyl use.,3
198,2021-11-23 15:44:49+00:00,"I think you're mixing up fetanyl and carfentanil. Carfentanil is used to sedate rhinos and elephants. It's so strong they don't even use it on humans, but I'm sure a junkie would pop it without a pause.",5
199,2021-11-23 15:33:06+00:00,"Grappig dat je het nodig vindt om mij persoonlijk aan te vallen terwijl ik juist een andere aanpak voorstel, eentje waar de balans eerder op impact (voor een individu maar ook maatschappelijk), maar dan wel op basis van betrouwbare cijfers en op wetenschappelijk onderzoek.

Canabis wikipedia stats voor Singapore zijn uit 2004 en totaal niet realistisch, die van Japan van 2011 waar cijfers sowieso onbetrouwbaar zijn omdat het allemaal onder een maatschappelijke taboo valt, en ik zou een tijdje kunnen doorgaan.

Ik pleit overigens niet voor een totale liberalisering. Ik zou juist de (overigens vaak legale) opioïden willen terugdringen. Er wordt veel oxycodon en fentanyl voorgeschreven... Een en familielid is door coke misbruik omgekomen.

Een beetje blowen en af en toe een (veilige) pil is echt het probleem niet, en repressie zou dit weer in de illegaliteit drukken met nog minder controle en meer troep op straat.",2
200,2021-11-23 15:30:45+00:00,Would fetanyl even get into your lungs or would it burn off before?,4
201,2021-11-23 15:12:41+00:00,Soooo firing squad? Fentanol overdose? Suicide booth? There's alot of pretty cheap ways to die right? Guess that doesn't counter the appeals problem as far as cost go right?,-6
202,2021-11-23 14:57:52+00:00,Cops in San Diego tried some ridiculous scare tactic. They showed an officer who appeared to be overdosing. They stated that his Overdose happened because he touched a bag of what might've had some fetanyl in it. He started convulsing as if the fetanyl was absorbed through the skin. What a fucking joke.,18
203,2021-11-23 14:53:21+00:00,"No one is lacing weed with fetanyl, on purpose.",123
204,2021-11-23 14:15:07+00:00,"check LSF, I think it was mostly about force-feeding alcohol to someone who was ostensibly on oxycotin and then a whole lot of back-n-forth and blame thrown around.",21
205,2021-11-23 12:30:04+00:00,Esophageal cancer s/p radiation? Has the patient taken opioids before? Also think about converting PO morphine to PO oxyxodone to get a sense of how strong 2.5mg PO morphine really is. Hope this helps,24
206,2021-11-23 11:32:05+00:00,"Maybe somewhat. He was very close to someone I was closed to. I didn't talk about everything with him but I'm sure he knew some of it. He would always ask me how I was doing. More than anyone. He genuinely cared about people. He knows I raved, he did too. He knew me when we started working together. I was very young. Not too young but too young to be a single mom. I had my son at 21. I think he would be proud to see the impact on me. I never did drugs around my son, made excuses for doing it at parties and raves. But that could've been me. That's why it hit me so hard. I got into something that I didn't make an every day habit out of but still could have left my son without the person he loved the most. I didn't think about that. I trusted the people that would give it to me, I worked so much and listened to the friends that said I deserved some me time. I deserved an escape. And really, I didn't need any of that. It's one of the things I regret the most. I would even make excuses. I thought it'd be ok to go to a party or a rave and get fucked up cause I got an annual pass to Disneyland and would take my kid the next day to justify me going out. I made so many excuses and justifications for it but having the clarity now, I regret it because none of it was necessary. It's been 2 years. And I haven't done a single pill, no cocaine, no Xanax (which I was prescribed a lot in the past). I'm on my third month of no alcohol. And it all started with him. It was my wake up call. And with how fetanyl is going around like crazy in California, who knows maybe it would've been me if not him. Cause I'd be lying if I said I didn't snort cocaine from a stranger in the crowd at a festival. And I know many of my friends have too. I can't believe how stupid I was. Literally he was my wake up call to get my shit together. I feel so horrible he's gone. He was so caring to everyone in his life and he helped me to be more caring as well. I think he would hope that others wouldn't take the risk like he did and I think he would be glad to know that because of him I won't be taking that risk anymore. Not only did it help me out but it helped my son to have his mom.",7
207,2021-11-23 11:23:59+00:00,"Mine started on my foot at the age of 9, at the same time a huge patch of dark Morphea showed up on my back. I had just got out of a wheelchair and dealt with a lot of rude remarks about that before, so I knew people would say something about the Vitiligo and Morphea. 

Sure enough, they did. The first time, I was swimming and one person noticed, then others wanted to know. Being curious about something is one thing, but making fun of it is completely different. Over time, I learned to emotionally detach and explain when I wanted to, and not explain when I didn’t want to.

You don’t owe anyone an explanation if you don’t want to. If they’re new people you’re around and they’re only curious, that’s one thing, but if they keep bringing it up they don’t give you the respect you deserve. Just remember that what anyone could say doesn’t define you. It’s a bad reflection on them for being rude, not you.",1
208,2021-11-23 08:58:44+00:00,"&gt;Als de verslavingsrisico’s van alle drugs op een rijtje gezet zouden worden zou het logischer zijn om echte harde drugs zoals alcohol, tabac, oxycodon en fentanyl aan te pakken ipv party drugs.

Voor het gemak houd je coke, heroine, crack, lachgas buiten het rijtje. Waar trek je de lijn met drugsbeleid? Ben wel van mening dat de legalisatie van mdma, xtc, en andere 'legale' drugs naar meer zal gaan smaken.",5
209,2021-11-23 07:10:30+00:00,"De maatschappelijke kost (zorg, ellende bij familie, enz.) van alcohol en tabak is vele male groter dan de gevolgen van minder ‘harde’ drugs zoals MDMA. Haal het uit het illegale circuit en werk aan voorlichting, vooral bij de jeugd. De minst kwalijke substanties zoals psilocybin (paddo’s) en LSD zijn verboden terwijl dat alcohol vrij te verkrijgen is. Het is krom en berust niet op feiten of wetenschappelijk onderzoek.

Als de verslavingsrisico’s van alle drugs op een rijtje gezet zouden worden zou het logischer zijn om echte harde drugs zoals alcohol, tabac, oxycodon en fentanyl aan te pakken ipv party drugs.

Daarbij is het jammer dat religieuze splinterpartijen het politieke programma kunnen bepalen, enkel omdat grotere partijen ze nodig hebben in een coalitie.",14
210,2021-11-23 07:04:00+00:00,It would be easy to believe you lived in an age of modern medicine when you observe how amazingly well your toddler fell asleep after the mophine-alcohol-cannabis-cloroform cough syrup.,2
211,2021-11-23 04:33:55+00:00,"Como suspeitava. O motoqueiro mereceu.
Quem dera o heroi sem capa tivesse parado na primeira batida na moto",0
212,2021-11-23 01:32:01+00:00,Not if it has fetanyl,4
213,2021-11-23 01:22:26+00:00,Oh ok idk why I thought the ops were called opanas I know they are oxycotin but gel blocked,1
214,2021-11-23 01:06:10+00:00,"wikipedia citing Bond, Helen K. (1998). Pontius Pilate in History and Interpretation. Cambridge University Press. ISBN 0-521-63114-9. for a ""500 strong cohort"" as mentioned in John 18:3.

The word used is σπεῖραν (speiran). Strong's Greek Concordance defines it as: *cohort, the tenth part of a legion; a military guard.*

You can arguably read it either way, I think, based on the [Thayer's Greek entry](https://biblehub.com/greek/4686.htm):

&gt;**a military cohort** (Polybius 11, 23, 1 τρεῖς σπείρας. τοῦτο δέ καλεῖται τό σύνταγμα τῶν πεζῶν παρά Ῥωμαίοις κωρτις), **i. e. the tenth part of a legion (i. e. about 600 men (i. e. legionaries), or if auxilialies either 500 or 1,000; cf. Marquardt, Römisch.** Alterth. III. ii., p. 371. But surely τοῦτο τό σύνταγμα in the quotation comprehends the τρεῖς σπεῖρα; hence, **Polybius here makes a σπεῖρα equal to a maniple,** cf. 2, 3, 2; 6, 24, 5; cf. Zonaras, Lex., p. 1664, σπεῖρα σύνταγμα διακοσίων ἀνδρῶν.  
&gt;  
&gt;**On the other hand, ""the later Greek writings almost uniformly employ σπεῖρα as the representative of cohors""** (Smith, Dict. of Antiq., edition 2, under the word exercitus, p. 500); and the rise of χιλίαρχος (which was the equivalent of tribunus, the commander of a cohort) in connection with it (John 18:12; Acts 21:31), together with the uniform rendering of the word by cohors in the Latin versions, warrants the margin cohort uniformly added in R. V. to the rendering band): Matthew 27:27; Mark 15:16; Acts 10:1; Acts 21:31; Acts 27:1, and often in Josephus; **a maniple, or the thirtieth part of a legion, often so in Polybius ((see above)); any band, company, or detachment, of soldiers (2 Macc. 8:23; Judith 14:11): John 18:3, 12.**

So 500 is there? Then a maniple is about 120 soldiers [altogether](https://en.wikipedia.org/wiki/Maniple_(military_unit)).

So the word usually either means ""cohort"" which would be like, 500 men, sometimes it's used to equal a maniple, which is about 120 men, and possibly it can just mean ""any company or whatever who knows.""

still, modern military numbers often hew close to roman ones and if a company of today is anything like a roman one, that's still a range of 80-250 people.

I don't know anything about ancient Greek tbh. It's either that they used a word that usually means somewhere between 120-500 men to just mean ""a whole lot of soldiers"" or they really did send out a ton of soldiers and not all of them were in Gethsemane itself.

Which, given everything else I quoted when someone asked for my Pilate sources, I'll say ""split the difference.""

It may not have *literally* been 500 men, as the word implies, but the fact that there were probably way more soldiers sent than reasonably necessary is probably not just outright fabrication, because Pilate send out a ton of soldiers to go suppress riots or kill people other times too.

and re: John, that's also the last of the books written, isn't it? Mark, by contrast, is the oldest, and shows Pilate more willing to punish. The narrative details change with time progression, which indicates there was a reason for christians to want to reframe Pilate.

...I did just try to google map the route walking. Looks like under two hours if I located the right places and you walked straight from one to the other (only one time each) so while it is a ridiculous absurdity of trotting him around the city, it's probably doable. longer if you retrace steps and return to places.

anyways basically the only reliable historical thing I can glean here is ""pilate ordered his crucifixion. and a load of other people's. Rome was pretty fond of crucifying Jews, actually, if we're to believe [Josephus](http://penelope.uchicago.edu/josephus/war-2.html), the Roman Governor Varus had ***2,000*** people crucified:

&gt;...but Varus sent a part of his army into the country, against those that had been the authors of this commotion, and as they caught great numbers of them, **those that appeared to have been the least concerned in these tumults he put into custody, but such as were the most guilty he crucified; these were in number about two thousand.**

honestly given that it's most likely none of the gospel writers were actually there for this petitioning of pilate, I assume all of the specific details of conversation are fictionalized beyond the sentencing and execution, and perhaps that the temple priests thought he was nothing but trouble and a threat to their power.",2
215,2021-11-23 01:02:16+00:00,idk but ido know from exp (dont remember it but nurse that was ocassionally a fwb showed me a vid) that when on iv morphene and still sedated pulling your stuff out looking at the curvy in all the correct ways nurse her 2nd week outta college saying you are fucking soo sexy and saying this is your fault and finishing saying thank you and passing out can def happen lol,1
216,2021-11-22 22:22:09+00:00,"with all due respect. I hear the ""new"" cocaine is fentenyl loaded.",0
217,2021-11-22 21:58:20+00:00,"I don't think her face was literally on fire, just a fire occurred near her oxygen tank that he had to stop. He sadly lost his mother almost a month ago, not related to the fire but the reason for the oxygen tank. This is asmongold and his mother. 

Esfand said to melena not give minx alcohol because he assumed she was on oxycotin all day (shes been staying at his house, drove her to the pharmacy earlier in the day). Joke between melena and minx, about drinking too much, and getting the other drunk. Esfand didn't know they were joking, says for them to stop. Gets called simp, and is basically thrown under the bus for basically being a ""buzzkill"". 

Asmong hours later, saying esfand shouldn't have done what he did, because its her (minx) life. 

Asmongolds mother refused treatment nearing the end of her life. So its easy to connect the two, that he couldn't get his mother to change, and had to settle with letting her live her life how she wants. So hes now applying that logic to everyone else.",1
218,2021-11-22 21:55:50+00:00,"E pe bune, când deschizi o gura de canal parca îi și auzi cum cânta: “O heroina, o, o, heroina, ooo heroina mea…”",2
219,2021-11-22 21:39:48+00:00,Sau: “Filipinezi transsexuali din România au lăsat boschetarii români fără heroina.”,7
220,2021-11-22 21:12:58+00:00,There's different degrees in connotation between the two though. Oxycotin is a prescription opiate that many people get addicted to then die via its overprescription in America. I've known multiple people who have died from reckless use of prescription drugs and so have many people in America. We're conditioned to laugh at cocaine as a bit through movies and shoes. I've few people who have done cocaine than people who've  taken prescription drugs nonchalantly.,1
221,2021-11-22 20:24:14+00:00,"Difference is Oxycotin is prescribed. Cocaine is not. Unfortunately many people are still under the impression that something a Doctor prescribes can't be harmful, which it can. So yes, this is a dangerous ""joke"" imo.",8
