,date,body,score
0,2021-03-31 19:26:49+00:00,"I believe that the fantanyl theory is that while the police approached his vehicle he swallowed a shit load of it, as found all over his vehicle and clothes. He had previously done this at a different traffic stop. Unfortunately this time he succumbed to the effects of a fentynyl overdose. In other words, floyd did not die by a legal restraint technique, he died because of the effects of ingesting a large quantity of fentynyl in an attempt to hide it.",1
1,2021-03-31 19:14:31+00:00,"Damn, that's all?? I guess that would be a 30[a 20 if he's really ur peeps] ever since I started ive gotten nothing less than 1.7 which is a 100 for me but I would just do .1 3 times. Honestly because u gonna like it if it supposed to do wut its supposed to then break it in half &amp; do that. It should take like 5-15mins tops to hit &amp; the drip is way heavier than H (well the bullshit Im getting right now) I don't get get drips with H unless its the ""popi bags"" I guess they call it that cuz the Spanish boys are the only ones that be having it but once my stimulus get here I will send for sum from the Netherlands 10 grams of #3 &amp; 10 grams of #4 &amp; if it gets too me &amp; if its wut its supposed to be than u can get over 900 bundles off that 20 grams &amp; if u do it the right way at 20 dollars a bundle (I.e.. pop I bags) that's over 18 thousand dollars off of 300 bucks yo.. That's how the brothers in the 70s were getting so rich but the only difference is the interface. The had to go thru the Italians &amp; I have to go through the internet &amp; Bitcoins &amp; encryption &amp; escrow &amp; mailman &amp; finally mailbox but if all fails then the safety net is escrow but if the deals seems too good then its probably not wise to fuck wit that. Look at the responses from all others good &amp; bad &amp; decide. Also, ive ordered hash from overseas (Netherlands) &amp; I got it in 10 days so if the deal is in escrow &amp; u can afford it then take that gamble cuz if they say they'll send it then rock out but do ur research first &amp; if u have to pay a little more for their service then I rather do that then to fuck wit someone who's on sum bullshit cuz its a waist of time, its takes forever to dispute it to get ur money back but at least u can get ur coins back but the darkweb is the best place to get anything u want but beware that everything ive ever gotten off their has been potent as hell. Its not for scary lightweight people so either if ur trying to buck up or personal its the place for you. All u have to do is find the stores which I rather deal with them because of escrow but the mushroom guy is so thorougho u can trust him but he is the only person I would give my money to upfront (isn't that a shame) smfh, be careful of those FE's finalize early escrow is to protect u unless u have it to throw away ive never ever finalize early I don't care wut they say or how long ive dealt with them never. Thats how they exit scam. The only countries I order from other thr United States is United Kingdom &amp; the Netherlands &amp; maybe Germany but thats if they say they will send it. Don't order a whole bunch of little packages at once &amp; don't do a whole bunch no more than a kilo or pound &amp; I would be easy on that. Half of that would be good enough &amp; wait 2 weeks to a month unless u have other addresses u trust &amp; don't use fake names. Ive had every order come to my front door &amp; didn't break a sweat trust me unless they get tipped off or the sender fuck up the packaging Thats it.. I write all this is to say the darkweb is the way to go unless u have the connects out in the real world which I don't not with the quality &amp; price the prices will amaze u. U will have no choice but to sell sum cuz one sale u could make ur money back. Yall follow me?? IM jumping back in ASAP if I had the money I would of been in but I don't have no one who would invest in ur brother but no need cuz when I get it I can say fuck all Yall I did it on my own &amp; yea this is wut I been telling ya scary asses for years.. Raw heroin, Raw cocaine,real mdma(molly),shrooms,AAA+Marijuana with names oz run 75 dollars-120dollars an oz, thc vape cartridges,wax,shatter,keif,terp bidder resin,LSD liquid,LSD gel tabs &amp; paper sheets,pills xanax percacet oxycotin adderall Viagra all for prices where u can come back &amp; sell at regular prices &amp; kill everybody &amp; the quality is top notch.. Educate yourself u heard it from a real live nigga overstand &amp; dominate get yours so u can get out &amp; do something better &amp; if ur smart &amp; respected u can. By Halloween Christmas u could be done &amp; just getting stuff for yourself.. Word up",1
2,2021-03-31 18:43:23+00:00,"Damn it! I have HORRIBLE INSOMNIA and ANXIETY, Depression. From seeing my bff murdered, and chronic pain. 
Neck surgery buldging disc, OHS, pace maker,which cause frozen shoulder. I have TRIED  everything for anxiety and insomnia. Took seroquel for years for my insomnia. I get Lunesta, 90 1mg kpins, 2 anti depressants from her. PM I  get 30 10 my oxymorphone er ( started this month) from 30 mg mscontin 2x a day(it sucked.) 90 10 mg oxy, 120, butabital n 90 zanaflex..I'd kill for somas again..",1
3,2021-03-31 18:08:25+00:00,Yeah I looked it up a little more and that's seems like that's how it's treated... Just a basic push through the pain because it's all in your head... Now they have me on 7.5/325 oxycodon twice a day for the pain till I can get into pain management at Cleveland Medical Center... But even then I don't know if they are going to try and treat me as a CRPS patient or a AMPS patient... I did send my doctor a email this morning with a list of questions but I probably won't hear anything back till next week... I know they say the mind is a powerful thing but I don't think my mind could make all those things happen... Especially the temperature difference in my arm compared to the rest of my body...,1
4,2021-03-31 17:16:49+00:00,"I agree with most comments here.   First let me tell you that I’m coming from a similiar situation the only thing is my boyfriend is a cereal cheater and full well knows what he’s doing he simply just does not care enough about himself first off and secondly does not have enough live or respect for me to be decent and treat me with the liydd as lay SND respect any body would treat there own dog with ,   He even lies straight faced to me for long periods of time claiming to have been so decent and loyal only to find out like I s as Keats do that he’s a two faced lieing animal with moral compus?   How do you go back to ever trusting a minipulative coward ever again after that.    Just recently I was finding things that kinda stood out to me in things I read and then conversations that were had that there might be a person of interest that may or may not be coming around from out of the city or Provence , it was really quite Vaugue to me but non the less it stayed with me for some time until just recently I was doing laundry and kept coming across clothing that was far to large to have been his or mine for that matter as being an extra large anything is not something I subscribe to but at any rate not only was it one or two things. It was shirts pants hats and most notably do-rags if I’ve said that properly and unless I’m mistaken other articles of clothing to suggest that a man of colour was now not only dating him but sooarrbtky living with him as the amount of clothing would suggest and thus my suspicions of sonrr Ed I’ve from out of the city were put to rest , that and all the receipts that were found only painted a perfect picture of there time spent together ,  sll this while if befn at home mostly thinking about him and most of the time but bring Abel to reach him and so on and so on. To add insult to injury I also found done oxi morphene and other such drugs that are not welcome in my home for any reason shape or form. His family is as Lao all out of province and he often says how he misses them ...  come to think of it actually he never does say that ,  must be that he’s relieved to a certain extent to be away from them.  All the same he’s been here now for over 15 years I think so this must feel like home.   My point to most of this is what are you really going to help yourself first ?    Are you abusive?   Do you include him or her in everything that you do ?  Do you even really want to be with that person ?   Just because you can see that this person might be a catch SND the people around you would live to have a chance with him or her and it might make you a bit jelouse is that a good reason to keep that person in your life ?  Sounds kinda selfish if that’s the case ?   Why do you want to stay with this person so badly ?  You mention you get along well ?   How so. ?   Is it only sexually?   Are you faithful ?   Can you ever be faithful ?  If the answer is no SND you’ve already proven that you can not be trusted then maybe now is the time to back off and go get your own life away from them. ,   They deserve SND demand the right to be respected and loved SND to be the most important thing in your life , after all isent this sbiut being with this person for your life or is it a just a fling. ?  Decide what works and maybe you can work something out so you don’t lose this person for good ,    Sounds like a lot of work to me. Depending on how does I add l the person is to you will depend on how much iou actually care to put into this.     Do you depend on this person for shelter and safety. ?   Is that what this is about ,  the list goes on and on. .    Maybe just go start fresh with yourself. And don’t include other people.    If you really love this person the way you say then have you ever just bitten the bullet and been shockingly honest with them about everything even if you don’t need to because they just might not know something ?  The only way to move forward is to leave no dirty secret to secret ,   All must be revealed if your ever going to have a chance in hell.    If rightfully are honest to the king you think he or she will murder you then you might have a chance. Because it’s after all the hurt and pain clear that there appears a place of complete solid ground for once where everything us in the table and there nothing else but a foundation of solid rock that you each might hook your buckles to and start from a solid place to grow from and see what happens. But the more you lie and sugar coat bullshit the more apart you grow.     Out some thought into what you want.  If it is still that person then go tell them.  And try to communicate what you want  and if it’s not then just stay away and don’t be a loser about it.    Don’t speak badly or blame them
For anything anymore.    Just move on and do it in silence nobody wants to hear your bad mouthing. It only makes you look weak and foolish.    Just dissapear      And sometimes it’s better to dissapear and save that person more hurt then it is to stay and continue to cause all this un neccessary  pain because you have self esteem issues and cheat and basically afford this person no dignity or happiness.    Nobody deserves that.",1
5,2021-03-31 17:16:02+00:00,I had the procedure done before when I had abscesses on my liver in 2019. They gave me a shot of fentenyl. Barely did shit.  This stupid procedure is so gnarly. I don't wish it on anyone,1
6,2021-03-31 16:15:44+00:00,"It's hard to breathe when you're on a bunch of different drugs like fentanyal and you have Covid. He needed to just get in the back of the police car or let the officers know he swallowed a bunch of drugs, but fentanyal is no joke and neither is covid.",1
7,2021-03-31 15:53:01+00:00,"Damn it boy! That's awesome. I just started 10 mg oxymorphone er 2x a day this month from 30mg mscontin 2x a day. I also get 90 10 mg roxies a month for breakthrough pain. I want to see if she will go up on the oxymorphone er, but scared she'll cut down on my roxies!! How do you do your pandas?",1
8,2021-03-31 15:38:56+00:00,"Can't say I do. I do know people who have died from fetanyl overdoses though, that's real easy to do. Waiting for testimony on the autopsy and toxicology before making my own judgements.",1
9,2021-03-31 15:30:27+00:00,And didn't he get higher when he knew he was in trouble? allegedly scarfing down a bunch of fetanyl... on top of all the meth he's clearly on in the surveillance footage?,1
10,2021-03-31 15:11:47+00:00," 71.000 in 2019 in USA (328M people) -&gt; 1 in 4620 people died  
In Germany we had 1.581 od deaths in 2020 (83M people) -&gt; 1 in 52.498 died

Looks like there's something going wrong really badly in the staates. 

In Europe there's much less fent around, and you can get into Meta-Ambulance, or Morphin-Substitution-Therapy really easily. Here in Berlin we even have a Diamorphin programme, were some hundred patients get pure pharmaceutical Heroin from the state. And there are the social aspects: I think the streetprice is cheaper, plus the police don't really care for consuments, so you are not that awfully under stress all the time. And everyone in Germany has a healthcare insurance thats pretty good and pays a lot for therapies, Methadone and other neeeded meds.  


So after all, if you are not too dumb, you can really get old as a junkie in Germany, regarding the outer conditions. (The psychological costs are a different matter)",1
11,2021-03-31 14:53:31+00:00,https://www.google.com/search?q=killer+bean+o+super+heroi&amp;safe=active&amp;client=ms-android-xiaomi-rev1&amp;prmd=visn&amp;sxsrf=ALeKk03jBnJTLEyKMpdFKVTyFxP9XsrX4w:1617202266037&amp;source=lnms&amp;tbm=vid&amp;sa=X&amp;ved=2ahUKEwj87-L049rvAhVPIrkGHWsSDh0Q_AUoAXoECAIQAQ&amp;biw=450&amp;bih=812#,1
12,2021-03-31 14:15:33+00:00,"Try fentanyal in mainline , be a man",1
13,2021-03-31 14:08:29+00:00,"Although i agree with most items, i disagree with some, mainly guardian helmet, as it provides no stats other than hp, which for tank is deadly, defence stats are more important than hp(even gor belerick who i main) 

blade armor has better alternatives such as dom ice and antiq, and it doesn't actually counter claude nor kimmy, since they just lifesteal the health back, (claude has shield on his ult aswell)

Immortality, which i agree is controversial but i stand by it, shouldn't be used on tanks, since getting more stats will make you unkillable, and if it happens that u must sac urself, then its still a waste of an item, theyll just kill u twice (ik it gives def stats but as much as other items)

Cursed helmet i consider a troll item, it gives like 1/3 of athena shields magic res and as for the dmg, tanks job is to protect his team not deal dmg.

Thunderbelt i only recently started to build and it is of more use than Immortality and blade armor

The good thing is u mentioned mask, which is the most important item and should always be rushed. It gives you more passive gold, more gold for assists and kills, gives regeneration aura for your team, increases their dmg and lets them farm.

And one thinv you forgot is tank emblem, unless you use atlas or khufrq (cc heavy tanks) then you NEED tabk emblems, youre paper without them

(a small tip is: when enemy has 3 magic dmgs or more then you should build one oracle and two athenas, i snstead of cursed helmet)


Re-reading this i realized bow much it sounds like critic, so sorry, dont take it personal:)

(all is based on experience, MG with tanks on higher than 60% wr soloq)",1
14,2021-03-31 14:02:43+00:00,"I gather that most people that ""peacefully in their sleep"" wake up at that final moment. Especially heart attacks which can be painful. 

My uncle had cancer and at the end I was in the hospital room when he passed. He was morphined up to a state of unconscious, but right before he died he kinda jostled and mumbled as if he was trying to jump out if bed and say something but his body wouldn't work, and then he just went limp and let out a long sigh and a gnarly fart.",1
15,2021-03-31 12:32:24+00:00,"And when the police were called he was stopped by them, was he not?


How the police emerged is immaterial. The point I'm making is it seems he ingested the fentynyl in the police car after being stopped in order to hide them.



Regardless the point is that he ingested the pills after encountering the police, its very likely if he was let go from the car or station then he would have dropped dead later due to the ingested pills.


In my view the main question the court is trying to answer is how much did the direct actions of the police expedite Floyd's demise.",1
16,2021-03-31 12:22:59+00:00,"Photo by [Antiq](https://catalog.antiquorum.swiss/en/lots/rolex-lot-108-97?page=5)[uorum](https://archive.is/KN2Mr). Sold for $6,850 in May 2006.

Following the [saber lugs I posted on Monday](https://www.reddit.com/r/rolex/comments/mfoyu4/cool_rolex_of_the_day_1254_4542_dress_watch_with/), I figured I'd keep the weird-dressy-lug theme going with the 4477 and its distinctive ""Oriental lugs."" According to Antiquorum this reference was only made from 1945-1946.",1
17,2021-03-31 11:38:22+00:00,"The DA on Chauvin's case isn't making that argument though, he's making the argument that the he followed departmental training (which he did) and that the Fentayl In Floyds system contributed to his death.",1
18,2021-03-31 08:20:09+00:00,"1) stf tira Lula da cadeia

2) stf inocenta lula

3) stf elimina os crimes do lula e faz elegivel

4) midia podre que apoiava lava jato bate palminha e lula passa a ser heroi

4) lula sai pelo mundo fazendo conferencias com apoio da midia podre",1
19,2021-03-31 04:08:18+00:00,"I was given morphene for my wisdom teeth removal. Seems excessive now, but the military does shit like that when you threaten to bite your dentist if you're conscious enough to remember to do so.

I remember watching the IV being put in though, and nearly immediately removed. I asked if the nurse put it in wrong, and they said that the procedure was done. I don't remember anything about the surgery itself, or the following three days.",1
20,2021-03-31 03:47:47+00:00,"All imprisonment for personal use of Drugs or Alcohol, is just bullshit. Prior to the Harrison act of 1914  folks just had themselves a grand old time most everybody got happy with their personal favorite concoctions. The passage of this law was justifiable to some folks, others not so much. I know it sucked really bad when the Fed's said no more to this or that. some of these law's were Race Related. Blacks and Cocaine or the Latinos for the Weed and Moriphine for the vet's of the Civil war all of these laws are designed to oppress and incarcerate, us Deplorable's and Fuck Yes it is way past Ridiculous even Moronic !",1
21,2021-03-31 03:14:52+00:00,"I framed a murdered black civilian as a drug addict because he’s a drug addict who was high on fentanyly, not because he’s black. Nice try in race baiting though.",8
