,date,body,score
215,2021-03-12 13:57:24+00:00,"I think a lot of the medicine industry is driven solely by money; there are definitely life-saving treatments by solid companies out there, but big pharma funds most of the research to make sure doctors prescribe their drugs. Like OxyCotin funding research that says we are *underprescribing* pain meds, so that doctors start prescribing more. This has led to an opioid crisis in America. Big pharma also makes sure most plant based medicines stay illegal through lobbying (even when they may be more effective for treatment) because they want to make money from patents.

Curing patients is not a sustainable business model, so that has led to a money-driven research in that field.

That's just one example of a legitimate conspiracy in my eyes.

When thinking about conspiracies, I first question whether it's physically possible, and next think of how many people would have to be directly involved. That usually cuts the list a lot so I can focus on conspiracies that are very plausible.",1
216,2021-03-12 06:04:35+00:00,"It's also an extremely tedious method too, right? I mean Antiq and MaA don't deal very high damage.",1
217,2021-03-12 05:34:20+00:00,"I successfully detoxed myself from bupronorphine (suboxone and subutex) January 2019, and it is worse than detoxing from oxyxodone, morphine etc. My worst experience was in 2015 when I  checked into the VA hospital as a residential substance patient. I was trying to detox from 16mgs subutex per day too, which is a heavy dose. 

The thing about that ""treatment"" st the VA is its more substance abuse education than it is treatment. In fact, they do very little to treat you for heavy withdrawl symptoms. If you're lucky, they'll give you a colonidine every 4 hours. Its a blood pressure medication znd it turns you into a cotton mouth zombie who can't function...

But despite that, they expect you to be in every class and at every AA and NA meetings which are held every evening at various locations in the area no matter how badly you're feeling and explosive diarrhea you're suffering from. The VA approach to substance is stuck in the stone age at best. They try to force feed the 12 step approach and then try to convince you that without NA you will fail. 

The program also doesn't take demographics and trends into account either. Uuugh... I'll stop here since all this is another story in of itself. One that gets my blood boiling",1
218,2021-03-12 03:26:53+00:00,"Nah since Purdue originally created the patent on oxycotin, they had exclusive rights to it for 10 years.  Meaning nobody but you can make or produce it.  Once that runs out. And since Purdue got hit with like 800million in fines and paid it like it wasn't shit- Purdue ONLY makes oxyneo which you can't sniff and BARELY CHEW... so thr main generic manufacturers are TEVA, PMS, and APO.   Facts, feel free to look into it.

The SANDOZ come from Europe where there is no abuse protection and their very offley plentiful and supply usa and Canada with their basically original Purdue 80/CDN formula ones - which t this day we still don't have anything you can smoke - BUT the Sandoz can",1
219,2021-03-12 03:09:30+00:00,"La marihuana no causa síndrome de abstinencia. No es como la cocaina, la heroina, el tabaco o los opioides.
Respecto a otras adicciones, ¿no estábamos frente a una ""guerra contra las drogas"" hace 50 años? ¿Cómo es posible entonces que toda esa gente haya tenido acceso a ellas entonces?
Es lo mismo que la prohibición del alcohol, incluso peor porque esta respaldada internacionalmente.
En Portugal legalizaron todas las drogas, y a cambio usaron el dinero que iba destinado a la ""guerra"" en centros de rehabilitación. Hermoso país, te recomiendo una visita.",1
220,2021-03-12 02:14:46+00:00,"Well, that's a little complicated because I often reuse my faces to generate even more faces!

But the ones I know for sure I used: Henry Cavill, Christopher Reeve, Tyler Hoechlin, Brandon Routh, Dean Cain, Matt Boomer (I only know he voiced Superman, but google says he played him in a commercial), and one of the actors from the 90s Superboy TV show. I'm pretty sure Joshua Orphin was also used, although indirectly (in a scrapped face for Conner).

For Lois, I used Bitsie Tulloch, Margot Kidder, Teri Hatcher, Kate Bosworth, Amy Adams and Erica Durance.

Mind you, some of the older actors are a bit complicated to factor in due to picture quality.

Jon is entirely composed of AI generated images, mostly from scrapped Clark images with a few of Lois thrown in (weighted a lot on the Clark side because the long hair and jewelry can really mess AI generation).",1
221,2021-03-12 02:05:43+00:00,HE O.D. ON FENTANOL!!!,1
222,2021-03-12 00:41:50+00:00,"A estória é um ponto de vista, analizar a obra é tentar entender por que ela existe da forma que ela é, por que ela teve o impacto que teve, se ela reflete a realidade ou não, se não de que forma a ideologia se infiltra na obra. Que tipo de sociedade tem como maior heroi um burguês que sai bater em pobre?

 As pessoas não são imunes a mídia, a ideologia dominante se reflete na arte, se impõe ou é criticada nela.

Resumindo a arte é um bom ponto pra se analizar e discutir a realidade.",1
223,2021-03-12 00:17:56+00:00,Pharmacy said he could order them but fentnyl patches would be best???? ADVISE,1
224,2021-03-11 23:44:34+00:00,A brick of herioin in a (empty) trash bin.,2
225,2021-03-11 23:00:34+00:00,"The US healthcare system, unless you're rich, is horrific. I've just had to have fairly major surgery and my gf just gave birth to our little girl and it cost nothing, well it actually cost around $5 a day for me to stay in hospital with her and that was just to cover my meals. Even my pain relief was really cheap, around $6 for a big box of oxycodon.",1
226,2021-03-11 22:50:43+00:00,"&gt; Y'all elected a dude that was openly misogynist, built his election campaign on xenofobia against mexicans and had countless rape allegations on his name.

Either your media is as bullshit as MSM in America and you refused to watch the links in my comment or even read my comment or you are an ignorant bigot that refuses to let reality have an impact on his opinions.  

Trump never sent troops to stop any riot.  He offered them to local state officials and they decided if they wanted them or not.  Trump only protected federal property.  

As for George Floyd he had three times the leathal amount of fentanal in his system plus other opiates and was covid positive.  The knee on the neck may or may not have been an issue but he would have died regardless and it is an approved tactic that the officer was trained to use and has been shown to be force.  If you remove all options other than deadly force force than YOU are the one calling for deadly force.  

What country are you from or are you also afraid to admit to that?  

If you",1
227,2021-03-11 22:40:00+00:00,"You just watch this solve the immigration issue...I hope...A large % of people who cross the border come for seasonal harvesting and 6 months later they go back to Mexico having made a few grand (idk) the problem in the last 10-15 yrs is that because of fentynyl the mountain farmers from Guatemala, Honduras &amp; other Central American countries who made a living growing poppies or coca now have no income and have to find work. So for like 50 or more years the American drug market gave these people a livelihood and then it's gone and they gotta eat. fyi in the documentary I watched none of Nicaraguan poppy farmers knew what they sold to the cartels was made into a dangerous drug. they are uneducated and most can't read and definitely don't have internet and were always told it was made into medicine for America.",1
228,2021-03-11 21:26:38+00:00,But its not true that he died from a fetanyl overdose. That’s far left police labor union propaganda.,-2
229,2021-03-11 21:20:01+00:00,"For morphea I've used clobetisol, applied 2x day. I've been prescribed several and this turns the plaque spot white and softer.",1
230,2021-03-11 21:19:36+00:00,"How, I used to get 15 mg. And could break them in pieces with a hammer! I now get mscontin 30 mg 2x a day and 3 10 mg oxy for break thru pain. But the morphine is causing bad side effects. So I am either going to OC, oxymorphone er, or last resort fetnyl patches ( which I DON'T want to do!",1
231,2021-03-11 20:57:03+00:00,On a real oxycotin us? Please share,1
232,2021-03-11 19:30:55+00:00,Is that a real crush proof US brand name Ocycontin 😳,1
233,2021-03-11 19:10:41+00:00,"I feel like allot of the point was already lost.. empty carts are cheap, making oils or distillate dosent require a multimillion dollar facility, anyone can do it and pretty easily to similar standards as you would get in a dispenserary.. lots of synthetic is just delta 8 CBD... and I vape that all day long.  

Really its no different than buying any other drug off the street.. you gotta trust your connection.. are you buying coke laced with fentanol? Who knows.. does that cart have vitamin-e acetate in it? Who knows.. that was the issue.. and you'd know if you got one of those carts cuz you'd either be dead or spent most of that year in the hospital.. theres no ""wait 10 years for the results"" it was coating your lungs with a substance that you couldn't breakdown or get rid of essentially causing you to drown even though you don't have water in your lungs.. and like drowning.. it dosent just ""kick in"" down the road years later..",1
234,2021-03-11 18:44:20+00:00,"I didn't use it any where near 10 years but I did use ut for a while myself and I also never had WD'S from it. It's crazy Alabama banned Kratom bc ""it was similar to oxycotin (which its not even close) and then that's the reason Tia blew up here which is just like OC and heroin lol. Which brings up my next point. I've always said counselors in rehab imo should always be am ex addict and not someone who went to school bc they truly don't know what we are going through and it should be the same for people who say insane things like Kratom is legal heroin. Honestly to me Kratom wasn't even that good as far as getting a great high. It did take away the minor pain though.",1
235,2021-03-11 17:58:51+00:00,"El pedo se remonta al gobierno de Nixon, donde se empezo a demonizar su uso por los hippies y comunidad negra y se propagandizo su comparación a uso de otras drogas como la heroina. De ahí, por todo el mundo se esparcio la propaganda y la ilegalizacion de la mota, desde que salieron las Nixon Tapes se sabe.",3
236,2021-03-11 17:16:18+00:00,"No the coroner did not. The coroner said it was cardiopulmonary arrest complicating everything he went through, heart disease, and fetanyl use. He said that the evidence at autopsy did not support mechanical or positional asphyxia.",1
237,2021-03-11 17:10:27+00:00,gonna bring fantanyl kit incase,1
238,2021-03-11 16:22:44+00:00,"Pode ser que esta notícia esteja protegida por um paywall.

O r/coronabr entende a importância do acesso à informação e sugere aos nossos usuários a utilização do
[Outline](https://outline.com/https://www1.folha.uol.com.br/opiniao/2021/03/professor-isaias-raw-um-heroi-brasileiro.shtml) ou instale o [burlesco](https://burles.co/)

Lembre-se que jornalismo também é trabalho, e, se possível, considere assinar o jornal. 

*I am a bot, and this action was performed automatically. Please [contact the moderators of this subreddit](/message/compose/?to=/r/coronabr) if you have any questions or concerns.*",1
239,2021-03-11 16:13:35+00:00,"&gt;lies to protect the ""cartels"" that many here in reddit support with their drug habits (sorry meth, coke, crack and the pills you think are MDMA etc but are just fentanol from China will never be legalized).

What the fuck are you on about? This has nothing to do with migrants because 95% of drug trafficking into the USA comes thru legal porta of entry, not migrants.",2
240,2021-03-11 15:09:53+00:00,"Our current policy encourages human trafficking.  I love how no one cares that Biden outright lies.  Not how many people were at my inauguration lie, but lies to protect the ""cartels"" that many here in reddit support with their drug habits (sorry meth, coke, crack and the pills you think are MDMA etc but are just fentanol from China  will  never   be   legalized).

People lost their shit with kids in cages.  Biden does the same and boldface lies about it.  He states Trump separated families.  Well, now because of Biden's policies he has the families and cartels doing the  separating - Biden has made it more dangerous.  WTF do people think are ""unaccompanied minors"" Dwarves without parents?",1
241,2021-03-11 14:35:17+00:00,O custo de ser heroi ai ficou caro,1
242,2021-03-11 13:21:28+00:00,"Jea no, the Fentayl knocks you out so no pain and memory. But the Valium you get upfront makes sleepy, happy and relaxed",1
243,2021-03-11 12:42:43+00:00,Place the fentayl at the druggie alter,1
244,2021-03-11 11:43:12+00:00,"I had a c-section with my second after shoulder dystocia with my first.

It is a harder recovery, getting out of bed is not easy and it's fun learning your new limits. Pain relief was ibuprofen/paracetomol which managed it when I remembered to take it on schedule. I did have a little oromorph at the hospital once. 

My milk came in around the same time as my first, but we had a few supply issues combined with jaundice that meant I was triple feeding for a few weeks (breastfeeding, then pumping and feeding pumped milk from a bottle, then topping up with formula). As soon as she hit her birth weight again, we stopped with formula and she breast fed until 16 months without issue.

She has no allergies (that we know of) and she's almost 2 and a half.

The first night she did bring up a bit of fluid that they said wasn't 'squeezed' out of her (as it were) so my recommendation is to get them weighed and compared to her birth weight before you leave the hospital, as she was probably bringing up a bit of milk with it too. After the first night, she wasnt bringing up fluid. She's not any chestier than her big sister.

I'm also already booked in for another c section with my third due in June! I could have opted for a VBAC but because of the shoulder dystocia, the size of my second (she was 9lbs 2oz), and blood loss during the c section (which also affected my milk production, as did an infection in my stitches), we decided another c section was the safest route.",1
245,2021-03-11 11:32:40+00:00,Yeah just dose up on some morphene man. It will do the trick.,1
246,2021-03-11 10:51:58+00:00,"Why didn't he just get in the fucking car and none of this would have happened (apart from the fetanyl overdose?) I watched the footage all the way through and it didn't appear that the officer involved had his full weight on his neck. For the first 4 minutes or so he seemed relatively responsive, then calmed down (perhaps while od'ing?) They had an ambulance coming pretty much from the start.

I didn't see him swallow a baggie of fent though, it would be interesting to see if someone's got a timestamp on that.

Let it play out in the courts and see what the jury have to say, but having seen how much fentanyl there was in his system, I can't see how that doesn't immediately bring reasonable doubt into play.",1
247,2021-03-11 10:24:38+00:00,I just recently got on this app and wanted to look for a community of people exchanging information about Morphea/Scleroderma. I just read your paper (which was amazing) but was also shocked to see you live in Madison! I live in Janesville about 45mins away. What are the odds. I got diagnosed last year with localized scleroderma that started out about an inch in size and is now over 8 inches and spreading like crazy. My doctors treatment has consisted of two topical medications that haven’t helped with improvement or slowed progression. Im on here to see what has worked for other people. 🙂,1
248,2021-03-11 09:16:24+00:00,"Hello /u/Morphien,

Your request has been submitted successfully and will be attended to when a Moderator or Ditto Helper is available. **Once the Ditto has been sent, you must wait 48 hours before requesting another Ditto**.

Please make sure you are requesting a **Level 91 or higher Ditto on the GTS** to prevent sniping. If you receive a Ditto that does not match [our Dittos](https://www.reddit.com/r/morebreedingdittos/wiki/dittos) and no Moderator or Ditto Helper has left a comment, please deposit another Pokémon onto the GTS and **make a comment on your thread** to provide us with the new Pokémon's details.

If you have any questions, please **read the [FAQs](http://www.reddit.com/r/morebreedingdittos/wiki/faqs)** before sending a modmail.

***

**Title:** [8] [Jolly] Wingull, F, 60

**User:** /u/Morphien, 

**Post:** \[8\]

 

* Ditto Requested: Jolly
* Pokémon Deposited: Wingull
* Nickname: Morphien
* Pokeball: Quick Ball
* Gender: Female
* Level: 60
* Home/IGN: Elliott
* GTS Message: Please trade Pokemon with me. Thanks in advance!
* Game Version: Sword/Shield
* Game Language: English
* Trainer Description: Brendan

***


*I am a bot, and this action was performed automatically. Please [contact the moderators of this subreddit](/message/compose/?to=/r/morebreedingdittos) if you have any questions or concerns.*",1
249,2021-03-11 07:37:20+00:00,When do I unlock the antiq. and future Garuela AD? I just finished chapter 65.,1
250,2021-03-11 07:26:01+00:00,"i should add, if i’m used to snorting 20 to 30 mgs of oxycodone, should i take the same amount of oxycotin?? i’m so clueless lmao",1
251,2021-03-11 07:10:20+00:00,so are 20 mg tabs of oxycotin not crushable? can’t you just take off the coating or am i wrong... sorry i’m clueless and wanna make the right decision,1
252,2021-03-11 05:30:41+00:00,"Side Note: I haven't experimented with any RC's besides the two Im going to mention (mainly because I have been prescribed medications that aren't too dissimilar from ODMST and Etizolam)  and I just haven't come across any others that I find all that appealing.

Answer: ODMST has been the toughest and then Etizolam is the runner up (note: I am prescribed a benzo which I take consistently and the way Im supposed to so that has made the come down from Etiz easier for me. Also, Ive read that 1mg of Etiz is like as fourth as powerful as 1mg of Klonopin, aka I believe Etizolam is overall, a weaker benzo (I know its technically a thienotriazolodiazepine). 

ODSMT has affected me about the same way as Tramadol (although its a bit weaker).

I took tramadol every day for a few years during grad school and I loved it because it of course relaxed me, it was actually a bit of an appetite suppressant, it helped me block out painful memories (PTSD), and (Im sure other people have experienced this), it gave me energy both mentally and physically. 

Some people might say that I felt like I had more energy because I was happier/less depressed, which could be true. However, Ive tried literally every opiate under the sun and while I enjoyed many of them (hydrocodone was actually preferable to oxycodon or morphine for some reason) and none of them gave me energy. 

Ive been addicted to opiodes and benzos for about ten years (jesus christ) and Ive withdrawn countless times both on my own and while in in-patient and the withdrawal from benzos is waaaaaaay more painful and drawn out. This isn't everyone's experience obviously and I know many would disagree and thats fine, understandable. 

Anyhoo. Great post. Sorry for getting so far off topic!",1
253,2021-03-11 04:53:54+00:00,"it is dependent if the patient is realy hurt use morphine if the patient is at the point of ""literally seconds away from dying"" use fentayl, but PLEASE be careful that thing can kill somebody if you put too much of that thing into somebody, also if you are low level on medicine just go for morphine untill you are high level. i ***do not*** take any responsability for any dead crew mates or any accidental suicides. hope that helped mate  
eddit: i made spelling mistakes and i fixed them",2
254,2021-03-11 02:04:23+00:00,fentnyl lolipops are the best things to subdue raccoons.,1
255,2021-03-11 02:03:50+00:00,"It’s called excited delirium also known as agitated delirium and sudden death in restraint syndrome and it’s a very very real thing that happens when people on drugs like fentanyl are put in stressful situations, the coroner also said Floyd had “fatal” levels of fentenyl in the autopsy report, he was also saying “I can’t breath” before the police even restrained him, the entire case checks all the boxes for a drug induced delirium accidental death this really isn’t that hard 

https://en.m.wikipedia.org/wiki/Excited_delirium",28
256,2021-03-11 01:43:14+00:00,"#*Pressed pill inquiries are not permitted under any circumstances.*

There is absolutely no way that we can tell you if the pill you have is real or if it is pressed by looking at a picture of it. If you are wondering if they make presses of the pill you have, the answer is very likely going to be yes. [You can take a look at some of the dies that are easily available for purchase here.](https://imgur.com/a/6EPiLul) 

If you are worried that your tablet is pressed and contains fentanyl you should [purchase some fentanyl test strips here.](https://dancesafe.org/product/fentanyl-test-strips-pack-of-10-free-shipping/) This is the only way you can be pretty confident your pill does not contain fentanyl unless you picked them up at the pharmacy yourself. Be mindful that not all fentanyl analogues can be detected by fentanyl test strips.

----
#Pressed Fentanyl Detection

Fentanyl pressed pills are especially dangerous because they are often sold as regular pharmaceutical pills which are normally considered *safe*. They can be very hard to spot even if you know exactly what the real pills look like.
With the widespread explosion of fentantyl pressed pills it is recommended that you **apply the utmost caution before ingesting any opiate that you do not have the direct prescription for.**

Generally speaking, pressed pills will be lower quality than their pharmaceutical counterparts. 

    One or more of the following will usually be off:

* **Taste**

* **How they break**

* **Color**

* **Imprint**

*Pictures mean nothing in comparisons and only experience/physical examination can begin to help you determine authenticity.*

*Another tip is comparing them against all others in the batch that you are buying from. There should be little to no differences.*

However, there are never any guarantees and presses are getting better and better. The only 2 ways to be sure are if it is your prescription and if you get it lab tested. Proceed with caution. 

**A slightly cheaper option is [**Test Kits**](https://dancesafe.org/product/fentanyl-test-strips-pack-of-10/), but they may not work on all known analogues*

**Here are some examples of Fake Presses:**

1. [FAKE EPIC Pharm E8](https://imgur.com/3NAVLfm) comparison (fake left/Real Right) 

2. [FAKE A215](https://imgur.com/kUZxegN) -Notice the hook on the 5 curves up like the font on this 5. Should be parallel with divider line. Also not clean edges. Should be smooth. You can't tell in this pic but they were also smaller in diameter 

3. FENT [HOT SPOT](https://imgur.com/qRZynO4)- what to look for inside a pressed pill 

**Quick Reference of four different** [REAL OXY PILLS](https://imgur.com/277VvPK) (NOT fake/pressed) 

----

#Fentany Reagent Testing 

--

Although [Lab testing](https://www.ecstasydata.org/) is the only foolproof way to see what absolutely constitutes a substance, there are a few things you can do to minimize risk when there is a suspected fentanyl (or analogue) adulterant.
_________________
The best option is through reagent testing using a variety of tests like Marquis, Mecke, and Froehde. Using these three you will be able to identify between many different psychoactive and Fentanyl Analogues. 

Find more information on, where to get reagent tests, color-codes for different [substances](https://dancesafe-wp-uploads.s3.amazonaws.com/uploads/2017/01/2017-chart-a.jpg), and up to date reagent-color-codes for other analogues/compounds at /r/ReagentTesting.  

An extremely helpful chart when differentiating between fentanyl analogues and other opiates can be found, [here](https://imgur.com/c0BoewL). It's important to note that if there are different types of substances in your mixture that the reaction depicted by the reagent testing table may have more than one result. As such, one result that is a darker color may cover a lighter color. To overcome this, multiple tests is preferred. It is best to do a thin layer chromatography screening test (to separate out the mixture). These are available from suppliers like [Bunk police. TM](http://bunkpolice.com/separation-test-kit/). They will insure that your results are not obfuscated.
__________________________
Another option (that is more expensive, less accurate, but may work in a pinch), is to use pre-designed *[Fentanyl Test Strips](https://dancesafe.org/product/fentanyl-test-strips-pack-of-10/)*. An important note with test strips is that they will only detect the fentanyl and anologues that they are designed to. In this particular case they only test for Fentanyl,
Butyryl-fentanyl, Acetyl-fentanyl, 3-Methylfentanyl, Carfentanil, Thiofentanyl, Furanylfentanyl, 4-Flourofentanyl, Flouroisobutyryfentanyl, and Sufentanil. That is to say that they will not work for any future analogues that are released.

Choose whichever method you are most compatible to the risk.

---

*If you feel that you received this message in error please [contact the moderators of /r/opiates.](https://www.reddit.com/message/compose?to=%2Fr%2Fopiates)*",1
