,date,body,score
62,2021-03-29 16:25:04+00:00,"Nu har jeg, sammen med dit svar, efterhånden hørt nogle eksempler på ikke-kræft patienter, der også får Oxycodon, så jeg tog vidst helt fejl på det område. Mig bekendt er det blot den officielle lægelige anbefaling at man forsøger sig med morfin som 'first line' treatment og bruger Oxy i yderste tilfælde. Men du blev ikke tilbudt morfin først? 

Jeg er iøvrigt virkelig ked af din situation. Hvordan kan det være at ud udtrappes, hvis årsagerne til dine smerter endnu ikke er løst via operation? 

Må jeg iøvrigt høre om dine erfaringer med udtrapning? Hvor længe var du på 60mg om dagen og hvor svær er udtrapningen indtil videre ifht til den fysiske afhængighed, som du vel uundgåeligt har udviklet som længerevarende smertepatient?",1
63,2021-03-29 15:44:18+00:00,"You're confusing recreational drugs to pharmaceuticals. Opioids are pharmaceuticals so it's not a valid comparison.

For pharmaceuticals America is 1 of 2 countries that are allowed to advertise pharmaceuticals via paid advertising. These ad campaigns are enormously successful in increasing sales numbers &amp; new drug adoption.

Oxycotin specifically had hundreds of millions of dollars in marketing/advertising poured into it (being one of the most heavily advertised drugs ever) and this is uniquely American.

See the conclusions of this research report: https://www.ncbi.nlm.nih.gov/pmc/articles/PMC2622774/

While there are plenty more advertising &amp; marketing practices play an enormous role in Americas opioid epidemic &amp; why it out-scaled all other countries by an enormous margin.",1
64,2021-03-29 15:35:55+00:00,"Mas na real, ele era CHATÃO. Ele causou mt confusão, só q os alecrins ficaram zuando ele, ai virou heroi nacional",2
65,2021-03-29 12:11:03+00:00,Obrigado você é o meu heroi,1
66,2021-03-29 11:57:40+00:00,Oxycotin-let us  give you a hug and massive shits.,1
67,2021-03-29 09:19:32+00:00,"Hvala sto si se iscimao sve ovo da nam napises da znamo kako bi to trebalo da izgleda... U praksi od prasinara do ministra cela policija ogrizla u kriminal, kad me zaustave na ulici izgleda kao da imaju osnovanu sumnju da sam terorista i diler heroina",1
68,2021-03-29 08:35:10+00:00,"o grande heroi policial brasileiro é o capitão nascimento. todo mundo quer ser fodão igual o nascimento.

o nascimento que tomava (e deixava de tomar) antidepressivo, matava pra caralho e destruiu o proprio casamento.

sim, ninguem liga pro emocional do pm porque ninguem enxerga o pm como gente. ressociabilizar o pm é mais importante que desmilitarização.",1
69,2021-03-29 05:33:44+00:00,"Explique qué no te hacen bien, muestra los estudios sobre reducción del tamaño del cerebro. Heroina y anfetaminas salieron de farmacéuticas primero, nonhay que confiarles, es solo un negocio. Debes buscar otro doctor y insistir en obtener un segundo opinión - busca uno y hable primero voz para que no lo controla la situación tu madre, ya eres adulto y no tienes que hacer lo que hace un médico sin ver que dice el otro porque nadie sabe realmente que pasé en nuestros cerebros. Insiste en que debes bajar la dosis progresivamente y dejar en no mas que unos dos o tres meses, si hay recaída podría ser mas justificado pero no vale medicarte de por vida por un par de cosas temporales que ya te han pasado. Dile que no vas a estar fumando mota ni nada, que vas a cuidar tu salud pero no quieres sustancias ni farmacéuticos ni drogas.

Si no te vale debes encontrar empleo e independencia lo mas pronto posible. Pero primero trata de hacerla entender. Habla con tu padre también, tus abuelos quizás si es que viven o algún tío o tia, busca aliados antes de irte de casa, eres chamo y el mundo esta jodido ahorita. 

No puede ser que un solo doctor decide que hacer con tu cerebro, es algo muy importante y estos medicamentos podrían dejarte problemas de por vida.",1
70,2021-03-29 02:35:17+00:00,"The cops didn’t kill him, the fetanyl did.
You’re comparing the murder of a unarmed women to a drug induced overdose. 

That’s what they’re trained to do. And like I said it’s not what they wanted to do. They exhausted all other options. It’s not like they shot him in the throat like that poor women.

I agree that’s why they didn’t kill him. The drugs did. 

I wish you cared this much about the poor women who was executed as much as you do over the death of a junkie.",1
71,2021-03-29 02:02:18+00:00,"Most Cops don’t carry narcan https://www.google.com/amp/s/www.governing.com/archive/gov-naloxone-police-officers-cities.html%3fAMP

He wasn’t unconscious. Kneeling on his back is what he was trained to do. They tried putting him in the back of the portal car but he resisted. He would still be alive if he never took that fetanyl, crack and cocaine",1
72,2021-03-29 01:14:05+00:00,"Fentanyl is rarely used to cut benzo’s with, because benzos are very very cheap, so they wouldn’t be making much profit using fentany.  packets are safer in my opinion as they’re a lot smaller than the bars, so even if it isn’t Valium, whatever it is will be in a smaller dose so it’ll do less harm.",1
73,2021-03-29 00:10:26+00:00,"so: 
Good Drugs: fentanyl, oxycotin, xanax, tramadol, valium, kpins
Bad Drugs: DMT (found in your body), shrooms (naturally growing), pot (amazing anti-anxiety uses), mescaline (naturally growing)
putting alcohol in a separate category is interesting! but again, it's how you use it. one beer with friends is great! a bottle of vodka alone, not so much.",1
74,2021-03-28 22:40:25+00:00,"Lol that’s the price of addiction. I was selling 80s back in the day for $160 a piece and they were selling like crack. I’ve spent more money than I can count in my 20 + years of perks, vikes, oxycotin, and heroin. Basically the only reason I go to work is to support my habit unfortunately.",1
75,2021-03-28 20:42:39+00:00,"ai voce perde a razão. 

não é por que voce não entendeu as mensagens que significa que elas não estão lá. 

CA2: The Winter Soldier não fala sobre a vigilancia exagerada do estado que infringe a privacidade do cidadão e se vale a pena trocar a liberdade pela segurança?

Homem-Formiga não toca de leve no problema de ex-condenados não ter suporte para recomeçar depois de cumprir sua pena? principalmente de crimes não-violentos.

Demolidor não explora o nivel de corrupção que pode existir por tras de instituições governamentais? o rei do crime comprou todo mundo sem super-poder nenhum, simplesmente na base do dinheiro e ameaça.

Coringa mesmo mostra como é a vida de alguem com problemas mentais e como o sistema trata eles, do pior jeito possível, e até que ponto uma pessoa pode ser considerada vitima de suas circunstancias ou autor de suas escolhas.

essas não são as unicas, eu podia listar todos aqui, mas se voce não percebeu sozinho nem vai adiantar. 

e não é só ""filme de super heroi"" que tem isso, toda história tem esse tipo de coisa, mas diminuir ""filme de super heroi"" sendo que ele toca nesses temas as vezes muito melhor que um ""filme sério""  é simplesmente estupidez.",1
76,2021-03-28 18:00:18+00:00,"You just have to lose a leg or a arm and say it hurts really bad, then you will get oxycodon for free. At least if you live on a country with free healthcare",1
77,2021-03-28 17:58:33+00:00,"sempre achei essa parada de filme de super heroi insuportavel... quando eu vi o primeiro vingadores eu fiquei abismado, pensei que eu era o unico conseguindo realmente perceber quão ruim aquele filme era, algo meio They Live quando o cara bota os oculos e vê os monstros no lugar das pessos",1
78,2021-03-28 17:55:15+00:00,"Read what? You cant say something is 100% and that it can be resisted all at one time, which is what you literally did. Anything that is resisted is not 100%, even the skills that ignore resist arent 100% if the mob is immune, it then becomes 0%(ie mushroom horror vs pain/poison in antiq prison). I dont need to understand any further that anything that can fail is in fact not 100%, because that is simply untrue.",1
79,2021-03-28 17:09:22+00:00,filme de heroi só presta o batman do michael keaton e hq nunca gostei.,1
80,2021-03-28 17:05:30+00:00,Yeah didn't think about that...I have a good relationship with my doctor so I think he would call for me.  I might try that thanks!  Oh and I had to switch from Walmart bc of their shitty Rhodes brand oxyxodone...it should be illegal to prescribe that junk lol,1
81,2021-03-28 16:01:11+00:00,Did a mscontin 10 mg too,1
82,2021-03-28 15:57:53+00:00,What are the pills Op? U got a morphine or an oxycotin / oxyprlong?,1
83,2021-03-28 15:50:12+00:00,"Oxy 80’s that’s straight oxy percs are oxy and acetaminophen nothing you have in your hand is a “PeRC” how you getting 80’s and don’t even know the right terminology 

There all oxycotin all Oxycodone but time released***",1
84,2021-03-28 15:35:07+00:00,"I have buldi g disk and a congenital fusion in my cspine,cabinet, frozen shoulder after OHS.  They just switched me to 30 mg of mscontin 2x a day to oxymorphone er 10mg 3x a day. With 3 10 mg roxies a day for breakthrough pain.  Anybody know anything about oxymorphone er? Also they just started mandatory pill counts! So trying to figure out how to get into the onion fields. I can't figure it out...HELP",1
85,2021-03-28 15:34:04+00:00,"Overdosed after taking a lethal dose of fetanyl, along with other drugs. Boyfriend shot at the police, hiting one of them, and she died when they returned fire. Haven't heard that one so i won't speak on it. 

Sounds plenty realistic to me. If I were to shoot a police officer Id be dead too.",1
86,2021-03-28 14:40:52+00:00,"Hashimotos, adrenal insufficiency, PCOS, a chronic embedded UTI, and morphea.",1
87,2021-03-28 10:56:31+00:00,"I had a severe knee injury in October that required extensive surgery.

After being on oxycotin for months and coming off of it it’s nothing compared to taking a weed break.

Try taking painkillers for a few months and stopping cold turkey and you’ll see what addiction truly is, y’all are A ok to smoke as much weed as you want.",1
88,2021-03-28 06:56:33+00:00,"I hate it when i hear about kids at my schools doing drugs and shit. Mainly because my dad got addicted to cigarettes and alcohol when he was 14, and his addiction got worse and worse. It got so bad that he died in 2016 from an overdose of a combination from heroin and fetanyl. The worst part is that he was clean for a week and was trying to get better.",1
89,2021-03-28 06:25:50+00:00,Yeahh I once when i was younger used my mothers oxycodon pills 50 mg’s at once with never used an opioid before. I did read about respiratory depression and noticed that my breathing became almost non existent so I would breath consciously and I really think it helped.,1
90,2021-03-28 06:02:53+00:00,TIL balding men hit rock bottom like herioin addicts,1
91,2021-03-28 04:21:03+00:00,"Essa tem váriaa facções lutando contra si, alianças e traições. Na 20 só foi a suprema fadosensatismoplantismo x um heroi e seu escudeiro (spoiler: ele perdeu) e uns gatos pingados",1
92,2021-03-28 03:51:07+00:00,"There's a wide variety. Nsaids such as Tylenol and aspirin are probably the most common, though anything a client uses for pain management can impact their pain perception. This can include prescription drugs like oxycotin or self medication like Marijuana. 

Physiological conditions can impact a client's pain perception, and this also has a wide variety. Diabetes is the main one I can think of, as sometimes sensory perception in extremities can be altered. Though neurological conditions like a nerve root being impeded could alter perception as well in some cases. 

Sometimes convective tissue like fascia can be really restricted and that can impact the ""depth"" of a treatment. Sometimes people with restricted fascia will want a lot of pressure thinking more pressure = deep = best treatment. you can press pretty hard and they still may not feel it. In this case, doing fascia work and releases will help you get into the deeper layers. The techniques come off as light sometimes, as you're addressing superficial tissue but can be intense in their own way and will allow for deeper work as the treatment goes forward. 

Emotions/ stress play a large role in how people perceive pain, though I find i encounter this in the opposite direction where a stressed/sad/ anxious client may be hyper sensitive. One treatment you could have your elbow in their traps and they can take it well then next treatment they may hardly be able to effleurage.  I'm uncertain if there are certain mental illnesses or emotional states that could make someone disconnect from feeling physical pain, but it's possible.

Generally I take it on a case by case basis. I go through the intake form with my clients and ask them questions about any conditions and medications they highlighted. Some ""red flag"" conditions for pain perception i would consider would be diabetes as I mentioned, paralysis, stroke, tingling or numbness. If I see pain medication listed i also ask how long ago they were taken and if they have noticed any changes to their pain perception. 

Also if while I'm working on a client and I suspect their sensation to be altered I do ask them about it. I'll check in if they may have taken anything they might have been shy of telling me earlier. I don't want to come off as accusatory so I just ask ""I'm using quite a bit of pressure here, have you taken anything that could have impacted your pain perception today?"" It's also good to use context clues as well. If I still suspect someone is lying to me, I don't push it, but I also don't give deeper pressure if i don't think it's to their benefit. If I think the pressure they're requesting is beyond reasonable and could ultimately be harmful, I don't do it. I explain to them that more pressure  isn't always better, or equal to deeper (especially in cases where I have to do a lot of fascia work to eventually work deeper tissue) and in some cases, I may express concern for them if they have a hard time feeling what I'm doing and to get checked out by their doctor as it may be a symptom of a bigger issue. 

I hope you find this helpful.",1
93,2021-03-28 02:04:53+00:00," Inglês, alemão, creole. As três línguas são faladas pelo ator Welket Bungué, de 33 anos, ao longo das [três horas de ""Berlin Alexanderplatz""](https://www1.folha.uol.com.br/ilustrada/2021/02/berlin-alexanderplatz-traz-ecos-expressionistas-em-nova-versao.shtml), em cartaz no streaming agora. Na nova versão da trama, um clássico da literatura alemã, [ele é um refugiado que encontra um destino trágico](https://www1.folha.uol.com.br/ilustrada/2020/10/berlin-alexanderplatz-retona-as-telas-como-um-drama-de-refugiado.shtml) em meio à violência, o sexo e as luzes néon da madrugada berlinense.

 É em português, no entanto, que Bungué conversa com esta repórter por telefone, numa brecha das filmagens de um longa que ele protagoniza e que roda agora na Bélgica. O ator, nascido na Guiné-Bissau, na costa oeste africana, cresceu em Portugal. Mais especificamente, em Beja, no sul do país, num internato, onde morou dos 11 aos 19 anos. ""Só ia para casa nas férias, Páscoa, Natal.""

 Foi também em Portugal que Bungué descobriu e desenvolveu o gosto pela atuação, entre videocassetes alugados nos fins de semana —ele cita as performances de Will Smith em ""Inimigo do Estado"" e de Russel Crowe em ""Gladiador"" como algumas que mais o marcaram na época— e, mais tarde, a formação na Escola Superior de Teatro em Cinema, em Amadora, a 20 minutos de Lisboa.

 Foi no Brasil, porém, que a carreira de Bungué ganhou tração. Por causa de um mestrado, o ator se mudou para o Rio de Janeiro em 2012, quando a cidade estava ""no pico"", diz. Conta que estava decepcionado com as oportunidades que vinham sendo oferecidas a ele depois de um papel importante na minissérie ""Equador"", adaptação do best-seller de Miguel Sousa Tavares, exibida quatro anos antes.

 ""Estava entre os que eram na época os atores mais respeitados da indústria portuguesa. E isso não me deu, a meu ver, o respaldo e a atenção da mídia que teria em outro país"", diz. ""Saí de Portugal por ser muitas vezes obrigado a aceitar papéis residuais nas histórias. Estava sendo subaproveitado enquanto artista, escalonado para fazer personagens que na trama não tinham grande impacto.""

  O caminho que Bungué encontrou foi, então, virar um ator global. Ou melhor —""globalizado"", ele corrige, rindo. ""Ator global, você sabe, é da Globo.""

 Bungué hoje fala seis línguas. Aprendeu alemão em menos de seis meses para ""Berlin Alexanderplatz"". Para o longa de agora, estuda uólofe, idioma falado no Senegal e em outros países da costa ocidental da África.

 A aposta numa carreira ainda mais internacional foi reforçada no ano passado, quando ele enfim se mudou para Berlim, uma das cenas artísticas mais efervescentes da Europa.

 O ator, que passou os primeiros meses de pandemia no Rio, diz que chegou a pensar em fixar raízes por aqui, mas desistiu depois da eleição de Bolsonaro. ""E isso se revelou sintomático, porque na comunidade artística, todos os que puderam estão agora vivendo em Lisboa ou em Berlim."" Ele e a companheira ainda mantêm um apartamento no bairro de Santa Teresa, porém.

 Questionado se conhece outros atores que, como ele, não temem a barreira do território ou da língua, Bungué responde que isso não é exatamente novo. O que ele diz observar agora é uma autonomia maior dos descendentes da diáspora africana para atuar no mercado global. ""Agora temos acesso a uma maior diversidade de atores e atrizes, com perfis muito diferentes daqueles que a própria Globo vinha celebrando desde os anos 1980.""

 Bungué atuou, aliás, numa novela da emissora, ""Novo Mundo"". Também participou de uma série de filmes nacionais. Viveu um escravo, fiel escudeiro de Tiradentes, em [""Joaquim"", de Marcelo Gomes](https://www1.folha.uol.com.br/ilustrada/2017/04/1876104-joaquim-filme-de-marcelo-gomes-traz-genese-do-heroi-tiradentes.shtml). Um operário imigrante em [""Corpo Elétrico"", de Marcelo Caetano](https://www1.folha.uol.com.br/ilustrada/2017/08/1909603-corpo-eletrico-sobre-jovem-gay-foge-de-estereotipos-e-explora-sensualidade.shtml). E um contra-almirante inglês no [ainda inédito ""Pedro"", retrato intimista de dom Pedro 1º de Laís Bodanzky](https://www1.folha.uol.com.br/ilustrada/2018/12/com-caua-reymond-filme-de-lais-bodansky-faz-retrato-intimista-de-dom-pedro-1o.shtml).

 Uma das parcerias mais longevas desde que o ator veio para o Brasil é menos conhecida do público, no entanto. É com o cineasta capixaba Bernard Lessa, que ele conheceu ainda em terras lusas. Bungué atuou na maioria dos filmes que Lessa dirigiu. No último, ""A Matéria Noturna"", ainda em processo de finalização, vive um romance com uma motorista de aplicativo.

 Lessa diz que, das qualidades de Bungué, uma das mais marcantes é sua presença em cena. ""Ele pode não estar fazendo nada, mas você percebe que há uma densidade por trás. A câmera adora isso."" Além disso, acrescenta, ao mesmo tempo em que o ator não perde a câmera de vista, ele se deixa levar pelos personagens que interpreta, e tem uma grande capacidade de improviso.

 O último comentário é ecoado por outros cineastas que trabalharam com o ator. Marcelo Gomes lembra como ele trouxe textos em creole e coreografias aos ensaios de ""Joaquim"". Laís Bodanzky conta que Bungué e Isabél Zuaa, outra atriz portuguesa, estavam prestes a rodar suas cenas finais em ""Pedro"" quando sugeriram à diretora um novo desfecho para os personagens.

 ""Ainda bem que eles apertaram o botão vermelho e disseram 'essa cena está estranha'"", diz Bodanzky. ""Do ponto de vista narrativo, e principalmente do respeito às personagens pretas e dos seus destinos nos filmes.""

 ""Achávamos que o final que o roteiro propunha não era o mais justo para a trajetória dos dois personagens"", afirma Bungué sobre o episódio. ""Ao mesmo tempo, estamos contribuindo para que esse cinema que é feito com um enquadramento histórico não reproduza a imagem de descrédito e subalternidade de determinados perfis. Nós ficcionalizamos histórias, e essa ficção deve contribuir para elevar a autoestima e, sobretudo, trazer um imaginário mais livre entre interpretações estigmatizados. É nisso que acredito.""

 É uma busca que, quanto mais se conversa com Bungué, mais soa crucial para ele. Ele diz que parte do motivo pelo qual decidiu se mudar para o Brasil foi a percepção de que só assim entraria em contato com suas origens africanas –ele só voltou à Guiné-Bissau, da onde saiu aos três anos, em 2019. ""Uma mãe de santo me disse que eu voltaria"", conta, lembrando a passagem pela Bahia durante as gravações de ""Equador"".

 A questão ainda permeia suas incursões pela direção —ele já dirigiu mais de 15 curtas até agora. Seis deles serão exibidos numa mostra dedicada a Bungué no festival Cine Esquema Novo, que acontece entre 10 e 15 de abril de forma virtual e gratuita.

 ""Como ator, defendo o personagem. Mas como diretor, no limite, terei a oportunidade e a responsabilidade de expor as motivações estéticas, políticas e pessoais que estão na base daquele trabalho"", diz. Mas esclarece que não tem planos de abandonar a interpretação. ""Ser ator é o meu sonho concretizado. É aí que me vejo me expressando.""",1
94,2021-03-27 22:27:15+00:00,"I just finished it today- I inserted the 2 dose in my vagina and an hour later I was cramping. I took a 800mg ibuprofen &amp; two 5mg oxycodine &amp; the pain was very manageable after! DO NOT WAIT to take the pain pills I started with just the ibuprofen and it was extremely painful- I got chills, a slight fever, the shakes, and a ton of cramping. I got in a hot bath and that helped a ton with the pain...stayed the tub while bleeding and kept emptying it and refilling for constantly clean and warm water.I am 5 weeks and 6days- I passed a golf ball sized clot. &amp; was done with the whole process in 6 hours after the cramps/pain begun. You will be okay! Good luck",2
95,2021-03-27 21:09:21+00:00,"The secret isn’t dancing. If I started dancing the last thing I would hear was a loud crack and then the beeping of the monitor in the hospital where I was brought in after I bent backwards without the following step of coming up in a straight position again. I am on Tilidin now, next step was oxycodon with some morphin. So I say ‘cause it happened to me already.

But you nutted in Shrek, that’s an achievement itself.",3
96,2021-03-27 20:59:59+00:00,orphine addiction and all,1
97,2021-03-27 20:27:37+00:00,Well if a kid born into a rich family called me a poor looser I couldnt care less. But if a herioin addict would say that.. then maybe theres some truth behind it lmao.,1
98,2021-03-27 20:03:40+00:00,It was also marketed as a less addictive alternative to morphene.,1
99,2021-03-27 19:44:45+00:00,Universally accepted to purchase bulk fentanol on the internet though.,2
