,date,body,score
570,2021-11-09 17:10:58+00:00,"So who wants to tell this dumbass nazi that hitler was high out of his mind on opiates?? Wanting to ban Narcan is one of the most idiotic things I’ve ever heard of. 
Like, “I was at the bar and someone drugged my drink with fetanyl but I guess I’ll just have to die because nazis don’t want the life saving drug narcan anymore”",1
571,2021-11-09 16:31:18+00:00,"
Table of Questions and Answers. Original answer linked - Please upvote the original questions and answers.
***

Question | Answer | Link
---------|----------|----------|
Anyone die around you directly related to “business”?|Pretty much everyone. Either dead, in prison or addicted to drugs.|[Here](/r/AMA/comments/qq56sg/i_distributed_and_trafficked_illegal_drugs_for_10/hjxvc9m/)
Unfortunately I got into international trafficking when I was like 20. It's very hard to cope with how many lives I helped ruin even this many years later.|I try not to think about it. I was desensitized for a long time. Nothing I can do to change the past. It hurts to think about that.|[Here](/r/AMA/comments/qq56sg/i_distributed_and_trafficked_illegal_drugs_for_10/hjxvz49/)
What did you think of Breaking Bad?|Accurate. Many high level drug dealers I've met were very professional businessmen. They don't do drugs. They are very disciplined and friendly. Don't cross them.  The only thing I don't like is when they're meeting in the desert. We all know to hide in plain sight|[Here](/r/AMA/comments/qq56sg/i_distributed_and_trafficked_illegal_drugs_for_10/hjxw5az/)
How much money did u net. How did you hide it.|Ehh.. hard to say profit wise. My money was always somebody else's or invested in some type of product and all over the place. I was also an addict and unable to stop. Always had lots and lots of money, but could never ever keep it. That's the game. You get exploited while exploiting people. Not fun.|[Here](/r/AMA/comments/qq56sg/i_distributed_and_trafficked_illegal_drugs_for_10/hjxx0qd/)
Did you ever use reddit for illegal activities?|Nope. This was before the internet got big. We never spoke of activities via text or on the phone. That would've been stupid.|[Here](/r/AMA/comments/qq56sg/i_distributed_and_trafficked_illegal_drugs_for_10/hjxx3sb/)
How many overdoses do you think you contributed to?|Probably a few. Herion was taboo and I would never sell cocaine or meth. I was more into the festival scene. This was also before fetanyl showed up in every drug known to man. It was a different game than it is now.  We sold pot, LSD, ketamine, shrooms, and MDMA in bulk to street dealers. I'm sure somewhere down the line someone got too messed up from something I sold.|[Here](/r/AMA/comments/qq56sg/i_distributed_and_trafficked_illegal_drugs_for_10/hjxvcea/)
Which illegal substance was most profitable?|LSD|[Here](/r/AMA/comments/qq56sg/i_distributed_and_trafficked_illegal_drugs_for_10/hjxvs2d/)
Have you needed to stick it up your bum?|Hah! Nope lmao. I've heard many stories, though😅🤣|[Here](/r/AMA/comments/qq56sg/i_distributed_and_trafficked_illegal_drugs_for_10/hjy0at5/)
Did you have notable competitors in the drug market? If so were they ever a threat to your wellbeing?|Nope. I was able to supply everyone and their competitors. We had no problems with anybody, we really just managed the logistical aspects of moving things around and getting them from one place to another and conflating the price.  The only threat to my wellbeing was when I beat a guy up for ripping me off. He was in a gang and that was a bad idea. Spent the better part of a year looking over my shoulder.|[Here](/r/AMA/comments/qq56sg/i_distributed_and_trafficked_illegal_drugs_for_10/hjy3gri/)
Have you transitioned from that trade to a “normal” career and life, and if so please describe it?|Yep. Took years and years of fighting addiction and re learning how to be a human being.  I've worked as a Sous Chef and a chef.  I love kitchens, easy jobs to get and lots of fun, but I want to do something more meaningful.  Participate in N/A and A/A, still smoking weed but looking to move on and be sober so I can help people and show them recovery is possible|[Here](/r/AMA/comments/qq56sg/i_distributed_and_trafficked_illegal_drugs_for_10/hjy4z51/)
Not here to ask a question, just to say that I’m happy for you. Go you for getting out.|Thank you! Almost didn't make it. Not sure how or why I'm here but I want people to know  1. It's a dangerous, ugly business based on the exploitation of people  2. Nobody gets to keep their money, ever. Eventually you will be sucked dry or caught and robbed by the police. (Or you will die. Ive lost 8 friends in total to this lifestyle, 20 if you count those incarcerated)  3. It's possible to recover from this lifestyle.|[Here](/r/AMA/comments/qq56sg/i_distributed_and_trafficked_illegal_drugs_for_10/hjy5kw6/)
Any close calls during trafficking?|Ironically, no. Every close call was when I was just trying to have a good time myself and was unprepared.|[Here](/r/AMA/comments/qq56sg/i_distributed_and_trafficked_illegal_drugs_for_10/hjxymla/)
Have you ever had a gay experience?|Plenty of guys have tried to persuade me, but no 🤣|[Here](/r/AMA/comments/qq56sg/i_distributed_and_trafficked_illegal_drugs_for_10/hjy9hqr/)

---
[Source] (https://github.com/johnsliao/ama_compiler)",1
572,2021-11-09 15:48:59+00:00,Nu te mai vaccina = nu mai baga heroina ?,1
573,2021-11-09 14:55:12+00:00,"Probably a few. Herion was taboo and I would never sell cocaine or meth. I was more into the festival scene. This was also before fetanyl showed up in every drug known to man. It was a different game than it is now. 

We sold pot, LSD, ketamine, shrooms, and MDMA in bulk to street dealers. I'm sure somewhere down the line someone got too messed up from something I sold.",10
574,2021-11-09 14:43:59+00:00,"Ah, okay. So they are Oxycodon. My Compensan 200s look absolutely the same. Same size, same color. 
Nice score man. Two boxes of them 🤩",1
575,2021-11-09 14:21:29+00:00,"You get Methadone in jail.
You have to bring a prescription from your doctor, otherwise they dose you down within 1-2 Weeks.
We have 3 Doctors in the Programm. The one who wrote me the prescription for jail thought she had to convert the Diamorphin into Polamidone, so she wrote me a prescription for 120 mg Polamidone!!!!
I dosed myself down to 60mg in the first week. Now i'm at 50 which is still far too much",2
576,2021-11-09 13:58:09+00:00,"é um reagente quimico, cortas um bocado ínfimo da substância e metes o tal líquido em cima dele

aquilo vai reagir com a substância e a cor mudará, consoante o tipo de teste. a cor irá indicar que tipo de droga poderá ser, não diz com exactidão, mas para termos de segurança é o suficiente

existem kits para muita coisa, mdma, lsd, heroina, cocaina, etc. 

exemplo: https://www.eztestkits.com/en/",2
577,2021-11-09 13:27:23+00:00,CNN just reported that they are investigating if “fetanyl laced pills” were the cause. So disgusting that they are working THIS hard to get Travis off the hook.,33
578,2021-11-09 13:22:03+00:00,"As of CNN on TV just now, they are now trying to shift the blame to “Fetanyl laced pills”. They are really trying to make sure Travis doesn’t get held responsible 😡🤬🤬🤬",4
579,2021-11-09 13:15:34+00:00,Smells more like fentenyl to me,60
580,2021-11-09 13:14:47+00:00,Omg they are trying to blame Fetanyl now WTF,1
581,2021-11-09 12:44:21+00:00,E você esperava algo diferente de filminho de super heroi?,1
582,2021-11-09 12:39:16+00:00,Ets el meu heroi,2
583,2021-11-09 09:41:39+00:00,Mine comes out so dark like coffee but i feel like my morphime comtent is lower. When my sn poppy seeds used to come back in the day they were dark but a few shots of the tea and i was fully morphined out. How are these seeds in cases of a morphine high? Im thinking to switch my vendor soon,1
584,2021-11-09 09:37:26+00:00,"I don't think drug companies purposefully create drug dependency either. Opiods have their uses in clinical settings because they work. Every hospital has codein, fantanyl, morphine, and even cocaine, which has legitimate medical uses too, it helps stop hemorrhages.",0
585,2021-11-09 08:22:33+00:00,"You're really trying to argue that someone could shoot someone with a needle using a fentantyl mixture in a random spot, straight into the muscle, and that person would just fall unconscious without being aware of what had happened to them? Why are you trying to act like **you** know what you're talking about?",1
586,2021-11-09 05:28:00+00:00,You are bragging about shoplifting in your profile and have opiates as an interest subreddit I'm sure you are a very educated and cultured individual. Hopefully you don't ingest any fetanyl and make your life a net negative. Have a happy holidays ;),-8
587,2021-11-09 04:29:09+00:00,"I've never seen a listing for it. Even when I do see listing claiming purity it's bullshit. 

If I were selling it, it would make absolute sense to at least cut it a bit, maximize profits.

Besides. A liquid vial of pure fentynyl would be akin to a weapon of mass destruction worth several hundred thousands of dollars. 2mg is a lethal dose for an adult human.",3
588,2021-11-09 03:33:46+00:00,"What also didn't was him encouraging people to mass enter for free, over doubling the crowd population, and him also over the years encouraging his fans to be assholes at his concerts. Literally he could have stopped playing just to have people pay attention.


And never at ANY concert has there ever been this bad of a crowd injury count, much less this many deaths. Literally the only one higher I can think was Woodstock, and that was from drugs over 3 days. You honestly can't tell me it's normal for hundreds to be injured at a concert.


And regarding ""maybe he thought it was fentanol,"" you still have dozens of fans falling over or being forcefully pressed, drugs would still not be an excuse to not stop the crowd from, idk, preventing paramedics from helping the injured and dying and dancing on the ambulances



Edit: Oh, and idk what concerts you go to, how his fans were that night is not at all how most concerts of any other artist are",5
589,2021-11-09 02:36:04+00:00,"La única vía es que México entre a los programas internacionales de producción de opiáceos.   

En Australia se siembran 50,000 hectáreas de amapola legal.    

En México se siembra cuando mucho el 10% (unas 5000 hectáreas), de forma ilegal.    

México produce heroina ilegal, y al mismo tiempo debe importar morfina desde USA, India o Australia, a precios exorbitantes, y se importa al menos 8 toneladas anuales.",0
590,2021-11-09 02:22:00+00:00,You literally cited the worst news sites on the web good on you buddy 👍the dude had lethal levels of fetanyl in his system at the time of arrest his own girlfriend admitted to that. So you go on and keep believing the narrative my friend . Your probably also scared of covid and wear a mask along in your car lol 😆,2
591,2021-11-09 01:55:50+00:00,"This isn't a new clip and nothing was confirmed. The security guard could be a pill popper or took some drugs that had fentanol on them he confiscated from an attendee and then OD'd and then is being covered with suspicious ""needle mark"" by his precinct. It is hard to effectively inject a substance into someone's neck sneakily in any environment, let alone that one. It would have to go to into vein and it would be noticed. Unless your were napping in public, its hard to imagine this scenario.",1
592,2021-11-09 00:35:29+00:00,"One time I cheated on my boyfriend with my best friend's boyfriend, and left myself logged in on Facebook at my bf""s house. Messages were discovered. Facebook password was changed by my best friend. She took over my  account and posted a fuck ton of stuff about how I am a whore with STI's, blah blah blah, for all of the world to see... Ended up dating her bf, who eventually left me to go back and impregnate her. During this time my haroin habit was exposed to my family, who told my boss, and had a 30 person intervention that I ran away from...


I cannot describe to you the humiliation and regret over this time period- at the time. Not even SIX months after these events, I was laughing about every single one from a Florida rehab, onto a whole new adventure....



I tell you this to say, our curse is impulsivity but our GIFT is resilience. You will recover from the humiliation and image-destruction faster than you know. Try to keep your head up and try to laugh at yourself as soon as it's humanly possible. You aren't alone here.",2
593,2021-11-08 22:40:52+00:00,"I’m thinking extra methadone and 800mg ibuprofen is going to be my best bet if it was five years ago I would feel confident I could buy pills but I’d rather not die from
Fetanyl sooo I’ll stick with the meds I know I are legit my grandma said oh just drive down to Mexico and go to the pharmacy only a 90 min drive lol no thanks nana the pharamcias are all fake even medicine for migraines and diabetics has been found to have fetanyl NOPE!",2
594,2021-11-08 21:51:40+00:00,"O fato de ter a mesma pessoa de tempos diferentes no mesmo local faz com q a linha do tempo entre em colapso, fazendo com q o universo exploda , felizmemte os seres do conselho universal consertam ele praticamente instantaneamemte, porem no meio do colapso a pantera cor de rosa acaba sendo ferida fatalmente, infelizmente nosso heroi perdeu 😔✊",1
595,2021-11-08 18:57:19+00:00,"I bet you have your PHD in medicine, right? You're the one who copies and pastes other peoples comments to prove you're right from /r/trans, but I'm the one who doesn't ""understand"" things? Anyone can copy and paste pre-made arguments all day long and not understand what they're posting. 

Lupron is used to treat the diseases I have, I have had many conversations about lupron with people who prescribe and have been treated with it, have you? Unlikely. I know many people who have been hurt by lupron, clearly you don't, I guess good for you? One of those links is a child who was prescribed lupron to prevent puberty, does that person not understand what it meant to have to have their entire fucking jaw rebuilt because of lupron? 

Propaganda? You believe the multi-billion dollar corporations over peoples actual experiences, and I'm the one more likely to fall for propaganda? Right. Sure. And oxycotin is a safe drug, unlikely to cause addiction too. I'm sure me googling ""lupron dangers"" is random googling. The seizure issue I posted in the first link is right in the pamplet that comes with lupron depro-ped (the lupron meant for children), but you probably wouldn't know that either since it didn't come from your form letter from /r/trans. 

I'm done talking to you, the best you can do is pretend that somehow parroting other peoples form letters somehow makes you intellectually superior, when it really doesn't. There are many doctors concerned about the long term effects of using chemotherapy on children who don't physically need it for a medical reason, whether you agree with them or not doesn't make everyone else wrong just because you can copy and paste /r/trans ""propaganda"".",1
596,2021-11-08 17:37:46+00:00,TU É UM HEROI MANO,1
597,2021-11-08 17:35:24+00:00,"Haha wish it was for period cramps.. I have pain on daily base. Buuttt the doctor is from Holland I got Fentanyl, Oxycodon and something else I forgot the name of it but its stronger than Oxycodon and its fun! Fentanyl is the best",1
598,2021-11-08 17:16:28+00:00,"&gt;Fentayl is cheap

Yeah....so the profit margin is HUGE. That's why it is such a problem.",2
599,2021-11-08 17:15:28+00:00,"Fentayl is cheap...  go read up more on how potent those substances are,  you need only a few grains to put a bunch of people down.   They aren't giving out thousand dollar shots.",0
600,2021-11-08 15:59:13+00:00,"The characters represent the trauma, pain, and lengths of which the addicted go to through their journey very accurately. This show hits very close to home. 

Source: I was born and raised in Appalachia (Eastern Ky) and have lost family members to OxyCotin.",15
601,2021-11-08 15:56:11+00:00,"Kelsey Johnson (who is from DFW) and Carmelo Jones (who is from East Texas) Patton is also from East Texas,, there are a couple that don't have a primary recruiter listed (Kaian Roberts-Day being one), but that's all I can see on 247.

I think the only real danger for a flip is the DL from Lubbock, Kyler Jordan, but he is our lowest rated commit so I don't think that's a major cause for concern, in fact, bar one OL (Coleton Price), the entirety of our class this year bar Jordan that come from Texas are no further west than the DFW metroplex. Also, I only see Patton, Jordan and Alvin Ebosele (OL) as the only 3 of our commits as having Tech offers, atm, so it would take a lot for Joey to flip the others, imo",1
602,2021-11-08 15:52:59+00:00,"sim, as leis sao beneficas

mas a questao da heroina foi moda sim

ja ng se mete nissp q foi uma trend dos anos 80

é um facto isso.

agora eu nao tou criticar a lei em si, so disse que é mais um indice assim destas coisas.",1
603,2021-11-08 15:31:05+00:00,"Last night I stayed up till 3 reading every personal story written in r/travisscott. Many people at the concert didn't know people were dying either. This ritual sacrifice shit is 100% fucking bullshit. The police officer who said their buddy felt a prick in their neck and was injected with fetanyl sounds like bs water was $7 a bottle and there wasn't enough of it. Security went there to party not to keep the place secure. The event was poorly organized. Apple Computers Co. Set up giant filming platforms in the middle of where they knew the crowd would be. People packed so tightly they couldn't move their arms, if one of them fell when they were packed like that they were walked over. There was one area where 2 emts and one off duty emt from the crowd were performing cpr for 40 minutes on multiple people. Everyone around them was still dancing thier hineys off. 8dead 300 injured  for reference the Boston Massacre had 5 dead 6 injured.",1
604,2021-11-08 15:11:57+00:00,"nao era por ser a altura tb da moda da heroina?

sabes q a heroina ja passou d moda e isso nem tem nada a ver com as leis, certo?",1
605,2021-11-08 14:39:29+00:00,Saiu de casa para defender o próximo sem querer nada em troca. Demasiado heroi.,1
606,2021-11-08 14:15:18+00:00,"nessa altura o gajo ja ta enterrado na heroina ou matou-se

enfim",4
607,2021-11-08 13:47:32+00:00,First it was fetanyl cigarettes then people being trampled on then someone poking needles in people.,4
608,2021-11-08 13:15:18+00:00,"Logo depois felipe  neto invoca seu poder supremo, 
Virar uma foca, pantera cor de erosão ficou sem saber oque era aquilo e começou a atirar merda de hipopotamo nele, felipe neto então invoca lucas neto, que se juntaram e se transformaram no felucas net
Pantera erosão joga uma coca cola com rato nele, felucas net bebe e não sente nada. Seria o fim do nosso grande heroi?",3
609,2021-11-08 11:07:39+00:00,"Amigo, Inglaterra y USA no son primer mundo. En Suecia yo dejaba mi bici sin lock y encontraba mi bici al día siguiente. 
Desde hace 3 años vivo en Alemania y nunca me piropearon ni me tocaron el culo. En Paraguay no podes caminar en paz. 
Yo vivo en Berlín y NUNCA cierro mi puerta con llave. 
Acá la gente tiene suficiente para vivir. No necesitan robar. Y si de verdad te acosan, la policía toma acción. La ley existe. Claro qué hay robos entre los clanes libaneses y los musulmanes a veces no respetan las bici sendas porque en su país seguramente no existe eso y se creen dueños de la calle. Pero asaltos a mano armada no hay, máximo adictos a la heroina en una estación de tren pero nunca te hacen nada, si les dejas consumir en paz. 
Alguna vez viviste en otro país? En Paraguay seguramente sos privilegiado. Ahí ya me pasó de todo. Una vez casi me acuchillaron en la calle a luz del día por un BlackBerry. Entraron a disparos a mi casa a robar el auto de mamá. Me manosearon frente a un Shopping. Dios mío. Acá eso créeme que si pasa es así UN ESCÁNDALO. Allá hay mucha Testosterona y mucha pobreza, cero infraestructura.",1
610,2021-11-08 06:41:01+00:00,Fds q heroi. Ripostar um estilo de musica com outro. Medalha pa este senhor.,1
611,2021-11-08 04:31:53+00:00,They took away my oxycotin,6
612,2021-11-08 04:23:43+00:00,"#*Pressed pill inquiries are not permitted under any circumstances.*

There is absolutely no way that we can tell you if the pill you have is real or if it is pressed by looking at a picture of it. If you are wondering if they make presses of the pill you have, the answer is very likely going to be yes. [You can take a look at some of the dies that are easily available for purchase here.](https://imgur.com/a/6EPiLul) 

If you are worried that your tablet is pressed and contains fentanyl you should [purchase some fentanyl test strips here.](https://dancesafe.org/product/fentanyl-test-strips-pack-of-10-free-shipping/) This is the only way you can be pretty confident your pill does not contain fentanyl unless you picked them up at the pharmacy yourself. Be mindful that not all fentanyl analogues can be detected by fentanyl test strips.

----
#Pressed Fentanyl Detection

Fentanyl pressed pills are especially dangerous because they are often sold as regular pharmaceutical pills which are normally considered *safe*. They can be very hard to spot even if you know exactly what the real pills look like.
With the widespread explosion of fentantyl pressed pills it is recommended that you **apply the utmost caution before ingesting any opiate that you do not have the direct prescription for.**

Generally speaking, pressed pills will be lower quality than their pharmaceutical counterparts. 

    One or more of the following will usually be off:

* **Taste**

* **How they break**

* **Color**

* **Imprint**

*Pictures mean nothing in comparisons and only experience/physical examination can begin to help you determine authenticity.*

*Another tip is comparing them against all others in the batch that you are buying from. There should be little to no differences.*

However, there are never any guarantees and presses are getting better and better. The only 2 ways to be sure are if it is your prescription and if you get it lab tested. Proceed with caution. 

**A slightly cheaper option is [**Test Kits**](https://dancesafe.org/product/fentanyl-test-strips-pack-of-10/), but they may not work on all known analogues*

**Here are some examples of Fake Presses:**

1. [FAKE EPIC Pharm E8](https://imgur.com/3NAVLfm) comparison (fake left/Real Right) 

2. [FAKE A215](https://imgur.com/kUZxegN) -Notice the hook on the 5 curves up like the font on this 5. Should be parallel with divider line. Also not clean edges. Should be smooth. You can't tell in this pic but they were also smaller in diameter 

3. FENT [HOT SPOT](https://imgur.com/qRZynO4)- what to look for inside a pressed pill 

**Quick Reference of four different** [REAL OXY PILLS](https://imgur.com/277VvPK) (NOT fake/pressed) 

----

#Fentany Reagent Testing 

--

Although [Lab testing](https://www.ecstasydata.org/) is the only foolproof way to see what absolutely constitutes a substance, there are a few things you can do to minimize risk when there is a suspected fentanyl (or analogue) adulterant.
_________________
The best option is through reagent testing using a variety of tests like Marquis, Mecke, and Froehde. Using these three you will be able to identify between many different psychoactive and Fentanyl Analogues. 

Find more information on, where to get reagent tests, color-codes for different [substances](https://dancesafe-wp-uploads.s3.amazonaws.com/uploads/2017/01/2017-chart-a.jpg), and up to date reagent-color-codes for other analogues/compounds at /r/ReagentTesting.  

An extremely helpful chart when differentiating between fentanyl analogues and other opiates can be found, [here](https://imgur.com/c0BoewL). It's important to note that if there are different types of substances in your mixture that the reaction depicted by the reagent testing table may have more than one result. As such, one result that is a darker color may cover a lighter color. To overcome this, multiple tests is preferred. It is best to do a thin layer chromatography screening test (to separate out the mixture). These are available from suppliers like [Bunk police. TM](http://bunkpolice.com/separation-test-kit/). They will insure that your results are not obfuscated.
__________________________
Another option (that is more expensive, less accurate, but may work in a pinch), is to use pre-designed *[Fentanyl Test Strips](https://dancesafe.org/product/fentanyl-test-strips-pack-of-10/)*. An important note with test strips is that they will only detect the fentanyl and anologues that they are designed to. In this particular case they only test for Fentanyl,
Butyryl-fentanyl, Acetyl-fentanyl, 3-Methylfentanyl, Carfentanil, Thiofentanyl, Furanylfentanyl, 4-Flourofentanyl, Flouroisobutyryfentanyl, and Sufentanil. That is to say that they will not work for any future analogues that are released.

Choose whichever method you are most compatible to the risk.

---

*If you feel that you received this message in error please [contact the moderators of /r/opiates.](https://www.reddit.com/message/compose?to=%2Fr%2Fopiates)*",1
613,2021-11-08 02:53:22+00:00,Fetanyl,8
614,2021-11-08 02:49:37+00:00,"I too doubt thats the reason. Almost certainly the reason is people are mad he hasnt gotten the fetanyl injection. Er sorry vaccine i mean. Same company, easy mistake.",0
