,date,body,score
0,2021-11-30 20:16:17+00:00,"mas ele era o justiceiro do morro, ia no tapa com os bandidos, esse era o super heroi brasileiro, ele matava os bandidos e pegava as armas dele para matar mais bandidos, ele era o anjo da noite, TEM ALGO MAIS SANTO QUE ISSO ????",1
1,2021-11-30 17:39:49+00:00,"Fuck accidentally replied wrong, here:


Oh fuck lmao sorry, yes weeks

It’s incredible how right you are, that is exactly how my emotions are going right now, so far this morning I’m on some kind of crazy coffee and hormonal ride and I feel amazingly motivated and kinda shit

And given the last few days, I fully expect to be sobbing in the shower by 6 pm

It’s absolutely fucking insane, I’m generally stoic as hell, and can take pain but I was actually fucking passing out during ultrasound 2, they offered me IV mophine a few hours later, but by then I was already almost asleep and the pain had lessened so I refused 

It’s fucking crazy about the people who were and weren’t willing to help and talk - very accurate and very surprising


Thank you for your response my guy, I wish you the absolute best with everything 

The big decisions thing, fuck. I’ve gone through so many fucking crazy schemes in my head the past few days, and only the fear of psychiatric hospitalization or worse repercussions has kept me in check, but I think (hope) I’m past the “seriously considering faking my death” stage",1
2,2021-11-30 16:15:34+00:00,Diamorphin und AP 237,2
3,2021-11-30 14:25:42+00:00,"There's an episode of Chicago Med with an OBGYN using drugs ""safely"" at an underground clinic.

Would you feel comfortable with your doctor being a recreational user of a drug so addictive that ""recreational use"" is actually daily?

The problem that the legalization folks don't tend to want to deal with is that there are people who can't use in moderation and there are drugs that can't be taken in moderation. So what then? Do we legalize something that people wouldn't try if it wasn't legal?

I gave birth 3 months ago and was given 800mg of Motrin in the hospital for my pain. It worked fine, but one of my doctors still sent me home with 20 Oxycotin pills? Why would I need more pain relief at home than I was receiving in the hospital? It made no sense especially because I took regular OTC ibuprofen instead when I got home and was fine.

I'm all in favor of decriminalizing drug use in favor of social programs that say keep people safe and alive. But the goal should be to discourage drug use because sitting on a sofa blazed out of your mind because you hate your life is destructive to society. I have enough trouble trying to convince my non-drug using husband that he's rotting away in front of the television.",-10
4,2021-11-30 13:02:37+00:00,E na bolha? Quase elevador a status de santo. heroi salvador da democracia.,1
5,2021-11-30 11:06:35+00:00,"Yep…add Oxycotin to that list as well. 

Literally destroyed people’s lives and turned them from normal people with injuries to opioid addicts who lost their families, lost their jobs, ended up in jails and many even ultimately lost their lives. All prescribed by doctors.",3
6,2021-11-30 07:06:24+00:00,"This. If you're so inclined go for oxycodon (percs) dillies(hydromorphone) or oxymorphone (rare, godfather of opiates, nothing comes close) Heroin is mid tier, especially nowadays, if you IV it it's fine but the pills are way better",1
7,2021-11-30 05:43:39+00:00,"Nothing helped me but a cystectcomy (removal of my bladder) and an ileal conduit. I now have a urostomy bag. I cried when I was told my bladder was not salvageable.                                                 My surgery was scheduled 6 weeks out from that appointment. About a month before surgery I had to urinate about every 30 minutes and I was having difficulty emptying my bladder. I was not sleeping and about to loose my sanity from pain and lack of sleep. I had to have an indwelling catheter for a month prior to my surgery. I was able to get some sleep but when I awake my pain was still just as excruciating with the catheter.                                   I was taking 4 perocet (10-325) every 8 hours, 6 mg of tizadine 3 times a day, 100 mg of trazadone at bed time, and 50 mg of Atarax at bed time. I was still crying from the pain. I had already stopped the elmiron because it didn't help and I lost a lot of hair. I couldn't use any installations because I had blood and long stringy blood clots in my urine.                                                  After my surgery my urologist told me my bladder was about the size of my fist was just blood and infection with no healthy tissue. After I got over the surgical pain I weaned my self off the pains meds  (not cold turkey) and all the other IC medications before my 2 month follow up my urologist. He was pleasantly surprised and happy I was able to do without assistance / medical intervention. My primary MD was shocked I was able to come off the pains. She express her concerns numerous times I was going to get addicted to the perocet.  I have NO pelvic pain anymore. I still get the occasional sensation I need to urinate but NO pain. I have passed numerous kidney stones 6 mm and under and numerous surgeries / ureteroscopies to remove stones from kidneys and ureters greater than 6 mm and 2 lithotripsies. The pain from a kidney stone was a nothing compared to IC pain and I am so relieved to be free of that unbearable pain. Fyi I am 53 and have other auto immune and health conditions. I am also a Physical Therapist but don't practice anymore due to medical issues. If anyone has questions feel free to contact me directly.",7
8,2021-11-30 05:35:51+00:00,"Wtf, ive cooked up mscontin 60,100's for years, u use a swab to wipe coating off, swap spoon, put hotplate on, put pill in spoon, add 3-4 mls of water, put on hotplate, keep tapping the pill until it's dissolved, get a cotton cig filter, soak filter in water first, use a 25-26 size end, suck it up, put an extra 2 mls of water to cook whats left in spoon, u end up with about 4-5 mls in syringe, put new end one &amp; shoot it,&amp; u don't eat morphine pills because of the 30% bioavailability, ive been getting stoned for years,&amp; heroin is only heroin whens its not in your blood stream, h gets turned back to morphine as soon as u shoot, smoke, snort it,
So no wonder u havnt got high off them",2
9,2021-11-30 04:30:01+00:00,"- Aprenda a despertar atencão plena, serio, aprender a controlar sua atencao, porque ela é geralmente o que guia toda a sua vida. 
- Administrar o quanto de significancia que voce da pras coisas, aprenda a dar valor somente ao que importa, vai te evitar aborrecimentos e perder seu tempo com gente que so existe pra te distrair e desperdiçar seu tempo. 
- Entenda que o seu tempo é o que voce tem de mais valor, apesar do tempo do relogio ser relativo e nao existir, o tempo que voce existe é o que fa toda diferença.
- Esclareça suas proprias duvidas pra si mesmo, detalhe-as e simplifique-as ao maxima, entenda que voce nao precisa de ninguem pra conseguir as respostas da sua vida, nao dependa emocionalmente de ninguém, procure alcançar o autoconhecimento sobre o que é a realidade (o espaço limite entre o que existe na rede social ate aonde vai o que existe na realidade da rua). 
- Aprenda sobre a paciência, é ela quem lhe trara o amadurecimento das coisas, entenda de onde vem suas ansiedades e procure cura-las pois uma lebre aleijada nao chega em nenhum lugar..
- Acredite em si mesmo e nao permita-se se sustentar em reconhecimentos alheios, nessa de que voce so é bom em algo pela qualidade do elogio que voce recebeu, aprender que voce so existe 1 dia de cada vez entao faça as coisas continuamente, uma planta nao da frutos do dia para o outro é um tarefa de paciencia e compreensao.
- Viva o bastante, mas questione o que é viver de verdade, o que te faz bem e da continuidade que o deixe 1 semana inteira com o sentimento vivo.. nao apenas viver limitado, onde a diversão termina quando voce sai pela porta e desliga as luzes.
- Beba bastante agua, voce e um ser vivo como a planta, voce precisa de agua para permanecer saudavel e com a autoestima elevada.

- A internet é o caos, e voce encontra mais gente paara falar merda do que pra te ajudar com um momento de sabedoria. 
- Desperte a sua espiritualidade, ainda que deus nao exista, o ser humano sempre teve fama de ser um super heroi acredite nessa metafora, os simpsons nao acertaram nas previsoes da historia nao é a toa.
- Sai fora de religiao, ou doutrinas dogmaticas, essas querem induzir voce acreditar no deus deles porque a ignorancia é vendida quando tem muita gente alimentando ela.
- Estude e esteja sempre alimentando informacoes saudaveis, e o mais importante, abra os olhos na internet muita informacao é fake e sensacionalista, o jornalista nao vai perder tempo dele procurando saber o veredito da informacao dele, o que importa é vender a noticia.. acredite as pessoas fazem qualquer coisa por dinheiro. Isso nao é nenhum novidade. 
- Fique esperto com as pessoas, nem tudo mundo presta o tanto que diz. Se quiser encontrar um amor verdadeiro, durma e acorde todo dia pensando nisso, a lei da atracao é clara tudo que a mente pensa, ela cria, tudo o que ela cria, se torna realidade pra ela, e por meio disso é o que te liga com quem se iguala no mesmo pensamento e no mesma intenção.. quer confirmar? Procure o artigo da dupla fenda, das moleculas atravessando uma tela com duas finas entradas e do outro lado formando como se fossem 3 entradas. 

- E pra fechar: o google é excelente ferramenta, internet nao é feita de rede social, o google te disponibiliza tudo literalmente de graça se voce souber procurar, sem voce precisar pagar por qualquer programa que voce esteja necessitando.",1
10,2021-11-30 02:12:51+00:00,C4 or brown haroin?,6
11,2021-11-30 02:06:49+00:00,"Thank you, I expected a little bit of this as I knew he was on Xanax and fetanyl but I don't know thr very specifics. And honestly I expected more to show up but I'm not sure that the fact its just this is better or worse",4
12,2021-11-30 01:39:25+00:00,"Estás en todo tu derecho de sentirte frustrado por las generalizaciones, pero se dan para los dos lados. Tenes una idea de las veces que me dijeron feminazi? Siempre trato de ser los más diplomática posible, pero siempre están los que asocian feminista=feminazi. Es repugnante, esa gente esta comparando al feminismo con un movimiento antisemita, racista y homofobico que asesino a millones. Es aún peor siendo que existe un termino formal para referir a las mujeres que se creen superiores a los hombres/que los odian a todos, la palabra es Misandrica. Y en lo personal las detesto, pq se llaman feministas y hacen un montón de ruido y cagan el movimiento para las demás. 
Volviendo al tema original, la violencia de género es un tema serio y si bien creo que estas imágenes en particular son bastante sensacionolistas, es cierto que la mayoría de las mujeres realmente viven con el miedo de que algo así les pase, y por eso verlo puede ser realmente shockeante. No tengo ni idea, ni nadie la tiene la verdad, cual era el objetivo de la chica al hacer la publicación, si tratar de ayudar/difundir lo que paso, o quedar como heroina como dicen algunos o simplemente quizo hacer la publicación para desahogarse y sacarselo de adentro. Podemos opinar todo lo que queramos pero al final nadie va a tener razón pq no sabemos que le pasaba por la cabeza cuando difundió el asunto. Todo esto para decirte, que es un poco presuntuoso exigir que ""si van a contar una historia no se pongan pelotudas y haganlo como se debe"". Estamos de acuerdo que si la chica pretendía ayudar no lo hizo de la forma correcta y que además puede ser hasta peligroso a largo plazo, pero es lo único que podemos concluir. Hay mil razones para hacer una publicación, esa es solo una. Eso sin meternos en las posibles o no capacidades de redacción de ella, al fin y al cabo no todos tenemos el mismo nivel de educación como para ir exigiendo estructura de articulo informacional a todas la publicaciones. 
Esos son mis puntos, no busco condenar a nadie, sino dar mi opinión y entablar un debate respetuoso si se ge posible.",2
13,2021-11-30 01:28:01+00:00,"Die Rede ist von oxycodon. Wollte fragen wieviel ich davon ziehen muss um ein guten Turn zu bekommen, ich wollte doch kein lean ziehen hahahah.",1
14,2021-11-30 01:26:46+00:00,"Okay, both seem to be way above the reporting limit. But more fetanyl than norfetanyl. 

Not sure I'd you'd also know the answer to my next question but would you happen to know the difference between ""alprazolam"" and ""a-OH-alprazolam"" ? Is it the same type of logic where the latter is the used up one?",3
15,2021-11-30 01:13:47+00:00,pensaba que esa serie era de los efectos secundarios de la heroina,11
16,2021-11-30 01:13:29+00:00,"Totally bullshit, Fentanayl would be destroyed when burning. Not a single person has laced weed with fent this is fake as fuck",-1
17,2021-11-30 00:53:38+00:00,"Just had my first kidney stone a couple months ago. I’ve never had any other health issues and it woke me up from a dead sleep at 2:00 AM. Had no clue what was happening but felt like I was dying. Actually asked my wife to call an ambulance. She drive me to the ER and I was dying from the pain. Took 2 hours for them to get me checked in. Then they gave me some kind of mussel relaxant which did squat. Sat there in miserable agony for another 7 hours until they got me back for an ultrasound. Then the dr. was like, here’s a bit of morpheme to help with the pain. Go home and pass it. Morpheme barely helped. Got home and spent the next day and a half in and out of pain as it slowly moved. I ate more gummies in that time frame than I ever have before and let me tell you, they helped better than the morphene and I will literally always keep one on me just in case this ever happens again. 0/10 would not fucking recommend to anyone. Oh and btw, know what causes kidney stones? Excess electrolytes. Yeah. Watch the shit you drink ppl. They literally advertise added electrolytes as a good thing. Well too much of anything is poison.",1
18,2021-11-29 22:17:21+00:00,"Daca se ajunge la chinuit, ii poate administra si acasa morfina, sunt chiar plasturi cu eliberare progresiva: Fantanyl plasturi",2
19,2021-11-29 21:35:50+00:00,"Oxycodon ist einfach der König. Da kommt auch kein H, Hydro oder Bupre (Subotex) dran!✌🏾",2
20,2021-11-29 20:22:00+00:00,é um filme de heroi/policial que nao vai tudo mundo que vai gostar mas eu recomendo muito tem na netflix,1
21,2021-11-29 20:09:15+00:00,Fentynyl Switch Engage,1
22,2021-11-29 20:02:27+00:00,Fetanyl ( blue pills ),1
23,2021-11-29 19:22:59+00:00,"I imagine that would work I use a mophine battery bank.

Mophine is owned by Zagg the screen protecter guys.

It’s about the same size as my phone but a little thicker but works fine for me I just throw it in my pocket",1
24,2021-11-29 19:19:26+00:00,"He didn’t die of a drug overdose. I’m on adhd medication and recently had a blood test, around 4 hours after my medication. I’m on a low dose too (compared to the average). I have a higher amphetamine concentration than him. He had more norfetanyl than fentanyl on his body. Norfetanyl is a metabolic product of fetanyl breakdown, converted at a 1:1 ratio (approximately). This shows that most of the fetanyl had broken down at time of death. It doesn’t make sense for overdose being chase of death, as fetanyl slows down autonomic nervous function causing death (people breathing too slow, heart too slow, etc). If this was the case, he would have died earlier, as the effect would have been stronger with higher fetanyl dosages. Additionally fetanyl kills by slowing breathing and heart rate down. People don’t struggle, they go to sleep and never wake up. Maybe vomit on themselves and die of aspiration. None of that seems consistent with his death. Do you have any evidence that points to it being a drug overdose? The ME specifically said “cardiac arrest following law enforcement restraint”",12
25,2021-11-29 18:57:26+00:00,Where’s the fetanyl,1
26,2021-11-29 18:18:48+00:00,"Yea.  Dark web im just too god dam lazy and paranoid that all miss a step towards privacy and get caught. 

Luckily for me i never developer a habit.   Always used BTH like alcohol. Once a week.on my day off to relax.  So i just try to make settle hints to friends of friends seeing if they know a guy. 

The drug.is vilified so cant just ask any friend, cousin etc.....gotta seek out the drug.users and than somehow ask for a connect without being judged

But yea.  Fent high I just dont like.  Too drowsy. Also when I did get the ""nod"" I couldnt even enjoy it Cause.im thinking i possibly OD and purposely stay awake cause.im to scared to close my eyes or lay down.  

So 2 options on fent.alone.  chip away and only get a buzz which sucks...causr again....i just get drowsy and sluggish.   Or get the right dose to achieve an actual high BUT how do I know if i did too much or not.....therefor I cant actually enjoy it.  


Option 3 is have my sis (who knows I smoke and approves/doesnt judge) to overlook with narcan so I can enjoy the nod.....but my habitual routine was smoke BTH alone have a nice toke....take a hit....watch a peaceful movie.  Take another hit....n just be in my zen mode.  


BTH i was more into the ritual of smoking.  Same as people.who are addicted to the routine of smoking a cig


Whats funny.is.  after I snort.  Ill smoke a stogey. Cause.it mimicks me smoking BTH.  But its just not the same.  


For short term goal. Is just.get my lazy ass to use the dark web 

Long term hunt.   Ill find it when i find it type of thing.  


Any way its better off i do the long hunting game. Goves me brain a big break from it.  Even doing just once a week im more than sure.my dopamin receptors are slightly adulterated and damaged.  So let thy brain heal.   Cause I threw away my pills.  

Today I did a full drug.screen.  and not a SINGLE opiate popped positive.  The ONLY thing I couldnt get my hands on was fent strips.  

But did a full opiate/opioid drug screen via piss and im negative on every single.perscription/illicit drug.  Which means the pills I got is straight fillers.....bunk....and fentynyl.  


So too dangerous.  And LUCKILY since my dumbass did do 2 pills the first day I got it and didnt OD.    Thank god! Should have tested before.   And texted all and any noobies/friends who bought these pressed Oxy who NEVER done H or any strong opiates besides perscription Oxy time to time and told them NOT TO TAKE IT.  

Or at least have me present with narcan! Dont drink.  No benzos.  Etc........cause these dangerous pills will get them killed.  And told my dealer hes a piece of shit selling to non heroine users acting like pressed M30s is just ""stronger version of Oxy"" without saying directly its fucking fent.    Unless its some other synthetic opiod analogue.  Regardless........fucking scummy dealers...",1
27,2021-11-29 17:32:34+00:00,"""Fun"" little fact:

During the earlier phase of the oxycotin over-prescription debacle in the US, some minority groups were statistically less affected because of greater hesitancy by medical professionals to prescribe legal opiates. 

The leading hypothesis is that said groups were perceived as more prone to opiate abuse, so their access to a legal supply was more sparse. Of course, after a while the disparity completely disappeared because the illegal supply increased to meet the unmet demand.

I still think that legalisation and taxation across the board, along with the treatment of substance abuse/ addiction as a public health matter, would enable for way better outcomes. We already know ""cold turkey"" treatments are not effective, we're wasting resources and time on adults deciding to smoke meth on a Friday night rather than allocating those resources to solve thefts/sexual assaults/murders/etc.

The sooner we start treating people like adults, and hold them to it, the sooner we'll come out of this pit we dug ourselves into when it comes to drugs.

The initial shock might be hella brutal, but the medium- to long-term will see net gains. Hell, might even be able to abolish the income taxes if we replace them with taxes that reflect your consumption (smokers, drug users, alcohol drinkers, added sugar consumers would pay more into the system because they're more likely to have a need for it)

Edit: Abolishing economical rents would be good too. Those are bullshit and add no value whatsoever.",2
28,2021-11-29 16:13:13+00:00,"Dashing through snow

In a run down vanbulance

To the drunks we go

Crying all the way

High pitched sirens wail

Making spirits low

Oh what fun it is to ride and sing a narcan song tonight

Oh fentany, fentanyl, fentanyl away!

Oh what fun it is to ride and sing a narcan song tonight

Oh fentany, fentanyl, fentanyl away!

Oh what fun it is to ride and sing in a run down vanbulance!


Anyone wanna do Rudolph the Red Nosed Drunkard?",27
29,2021-11-29 13:13:12+00:00,Heroi trágico,10
30,2021-11-29 12:15:50+00:00,"ja mislim da je normalno vaspitanje sasvim dovoljno da ti deca ne postanu kurve i pajdomani. deci iz tog vremena je mozda bilo pametno dati da citaju to, al mi ne zivimo u 80im, ekspanzija heroina nije u jeku ko tad sto je bila",1
31,2021-11-29 12:05:51+00:00,"They sell [oscillococcinum](https://en.wikipedia.org/wiki/Oscillococcinum) in the pharmacies, because it’s popular and works through the placebo effect.

The non-science behind homeopathy is the thing that prevents them being sold as real medicine, thankfully. That being said, the pharmaceutical industry is far from perfect, and there is a strong preference for the medical industry to prescribe expensive drugs, even when less invasive of dangerous alternatives exist. Even in the Netherlands there is a disproportionately high number of oxycodon prescription.",4
32,2021-11-29 08:33:46+00:00,"Ive been on subutex for 14 years. It helped me become a bachelor's degree holder, obtain a 6 figure career iver the past 12 years, become a father. Ect ect.

Well... the ""straight bupe"" is what its called now. I started on suboxone all those years ago. Lots of research went into the medications on my side over the past decade and a half of being on it. Judge me if you may, but its saved my life and i see no reason to quit at this point...

But back to topic. Research. I learned that the naloxone active in suboxone is actually pretty much inert. Ive seen junkies straight up inject suboxone without any interference, if they were actualy in PAWS. Saying that. Ive also seen junkies pop a subutex when not in PAWS.... and 30 mins later, they were in the worst PAWS they had ever experienced. Why? Why can the drug without naloxone promote withdraw effects? Well... because the naloxone is inert. It has no pull on anything other than for me, side effects...

The mechanism at work here is binding affinty. Buprenorphine has close to the most binding affinity of any opiate known to science. It will even kick a heavy dose of fentenyl off mu opiod receptors. This is the mechanism also which prevents people from getting analgesic effects from full opiate agonists.  Its not the naloxone at all. Once buprenorphine is bonded with a receptor, nithing can kick it off... outside of MAYBE sufetenyl. Which isnt readily available. This is also causing some issues in the emergency and operating rooms across the world, and what i see to be a very concerning one. If i were to have an accident,  chances are id have to tough out the pain, have a spinal, or be administered ketamine for pain management.  

So, just wanted to say, the naloxone was prly put in there as a sales pitch and patent note for big pharma. It does nothing. And me taking subutex has no ploy on my 15 years of sobriety.",1
