,date,body,score
154,2021-03-15 16:09:04+00:00,Din cauza seringelor refolosite. Drogatii intra in bai publice plin de mizerie si se injecteaza cu acelasi ac heroina si alte prostii. E focar pentru hepatita C.,1
155,2021-03-15 14:00:40+00:00,"I've only read some of the New Testament, but I don't remember the bit about Jesus being high on oxycotin and fentanyal at the time.",1
156,2021-03-15 11:08:01+00:00,"Maybe I wasn't clear, but maybe your biased orejudice got in the way since I guess you assume my political orientation or news sources from one interaction.

Maybe you should consider the fact that I almost never watch fox and that it is just a common sense question.

Maybe you missed my points, so I will make them more clear. My points are the ones that are industibutable facts, which is why I am asking about it since it has piled up.
1. Immigrants coming here illegally are not all violent gang members, but enough are that it is completely irrational to not just use legal means.
2. Children and hostage family members are being trafficked for drug or sex purposes. This isn't disputable, just solidified fact.
3. Illegal immigrants, as opposed to legal, are much more likely to be homeless or on welfare while they are not paying taxes, for at least some time, creating an unnecessary burden at a time when we are not supporting our OWN welfare/homeless people.
4. Drug cartels are extremely dangerous. Even 2% (example) coming in here illegally is completely unnecessary. You are focused on the fact that a majority are not drug dealers, most likely, and that is most likely true. But why in the wide wide world of sports would you bring more drug cartel members over than you would normally, especially since families are being taken hostage.
Here in Indiana (Texas not my governor), a Mexican cartel was just proven to have taken a guy's family hostage. They said for him to sell their drugs or they would murder his family. Illegal guy's were coming to give drugs for him to sell.


All this is not rocket science, just common knowledge. My question is why, when democrats want to do well with immigrants (as do I), they would allow an INCREASE in such events, MORE incentive for such events to take place, all in the name of ""helping""

I can make this even simpler for you. Let's say I let 10 people in my house every year, but I have standards and ways to screen people. 1 of those people, turns out, lied for my standards and I missed it (the real numbers are less than 10%).
Well, after a while, I want to help more, so I get rid of most screening and allow 30 people. I was already allowing more people into my home than any other person in my neighborhood (world), even though my own family was having problems I could not or was unable to support. Now, I have 30 or more people coming in my home, but 5-7 are hiding drugs in here, and a couple are in my attic and I cannot get them out because it's dark. One even tried to take my daughter by selling her heroine laced with fentanol.

Do you understand yet? I highly doubt your house is without a lock. I HIGHLY doubt you allow people to come into your home and stay, no matter who they are.

The border stuff is causing chaos, not order. That is straight-up fact. Why go for chaos and not order?",1
157,2021-03-15 01:30:16+00:00,That heroin is laced with fentenyl,1
158,2021-03-14 23:30:26+00:00,"OCs oxycotin, I love the basic stuff. 

I like Actavis perc10s too",2
159,2021-03-14 22:54:36+00:00,I run an antiq. With Schrade 9430 cards at work. However i built the system at home using a cheap 20$ reader I bought on Amazon. The only difference is the 9420 cards are encrypted. When I scan them with my cheap reader i get different information then with the antiq readers. It works either way.,1
160,2021-03-14 22:47:00+00:00,"[And the B7076](https://www.google.com/maps/@54.9926297,-3.0528893,3a,75y,341.45h,89.33t/data=!3m6!1e1!3m4!1sIrV5pxUo8Cs1ax6Ci_u7pg!2e0!7i13312!8i6656)

And the [A6071/Main St.](https://www.google.com/maps/@55.002226,-3.0455077,3a,75y,245.34h,83.72t/data=!3m6!1e1!3m4!1saJuDYzQgawlNl9I4PzV3Rw!2e0!7i13312!8i6656)

And the [B6318](https://www.google.com/maps/@55.0883427,-2.8897645,3a,75y,53.07h,81.12t/data=!3m6!1e1!3m4!1sgLL9rKhTnxMSVqzmCFNNgA!2e0!7i13312!8i6656)

And the [B6352](https://www.google.com/maps/@55.5599815,-2.2667742,3a,75y,2.75h,83.88t/data=!3m6!1e1!3m4!1s9GSlLo6qUCr6IvKG6Jdw5A!2e0!7i13312!8i6656)

And the [B6396](https://www.google.com/maps/@55.6036149,-2.288382,3a,75y,292.69h,88.16t/data=!3m6!1e1!3m4!1sir-Wv6IYhSL-qsPZ4Fh2Ng!2e0!7i13312!8i6656)

And the [B6350](https://www.google.com/maps/@55.6322999,-2.3358669,3a,75y,222.41h,90.46t/data=!3m6!1e1!3m4!1shIyDy6KBWzdMJ0fH61JBGw!2e0!7i13312!8i6656)

And the [B6470](https://www.google.com/maps/@55.718673,-2.1731384,3a,75y,268.97h,87.02t/data=!3m6!1e1!3m4!1sn53b20fzCHeI5nVJdRCVeQ!2e0!7i13312!8i6656)

And the [B6461](https://www.google.com/maps/@55.7655566,-2.0789228,3a,75y,108.26h,93.25t/data=!3m6!1e1!3m4!1sU2moLI5UdNSt7WzJxvmPGQ!2e0!7i13312!8i6656)

And the [A6105](https://www.google.com/maps/@55.7911087,-2.0875109,3a,75y,293.36h,83.66t/data=!3m6!1e1!3m4!1s3gH_gUanUVrXtgQUbZnafw!2e0!7i13312!8i6656)

It's more like 14 classified/main roads, probably just as many unclassified farm roads (as you say), and double again as many public rights of way.",1
161,2021-03-14 22:32:02+00:00,"cara, ultimamente eu ando numa renascença do nerdcast, fiquei muitos anos só ouvindo do 450 pra trás e agora tou ouvindo alguns ""novos"" e me divertindo muito... eu sou mt seletivo com os casts, não ouço todos mt nao consumo mt coisa do mundo nerd, mas o azaghal ainda é maneiro, acho que isso que tu descreveu é algo da personalidade dele mesmo. como eu mesmo disse, eu não ouço os eps sobre cultura pop nerd (filmes de super heroi, series da disney etc) então eu não sei como ele é nesses, mas eu ainda consigo aproveitar nos que eu ouço",1
162,2021-03-14 19:48:20+00:00,"Ya that wasn't too bright attacking  DC . Here's some whataboutism ...The 3 months of burning looting and killings last summer  .. Those geniuses up the road in chop in Seattle ..shooting innocent black teenagers in their WOKE frenzy.. Looting minority businesses ..Give me a big screen TV for George Floyd !! really ?  all that meth and american killing fetanyl  is coming straight into AZ . Immigration is cool as hell through proper channels ,, you need to stop that shit. and we should be getting profits from the Sinaloa cartel for helping them.. I've had friends die from Mexican/Chinese  dope ATTENTION  all of both parties are pathetic  TRUMP,BIDEN , PELOSI . SCHUMER . MCCONNELL   thats our BEST charismatic brilliant fearless leaders?  no",1
163,2021-03-14 16:01:50+00:00,"Read the autopsy, it's really obvious you haven't.  Fetanyl would have killed Floyd before the cops got there, let alone crushed his neck.",1
164,2021-03-14 16:00:17+00:00,"Uh huh, just like all the other conservatives """"""""accidentally"""""""" claiming he died of an overdose instead of asphyxiation.

Spoiler, if it was fetanyl Floyd would have been dead before the cops got there, let alone crushed his neck.",1
165,2021-03-14 15:52:02+00:00,"This isn't specifically for morphea, I've read on this platform that its been prescribed for plaque psoriasis. Its a steroid.",1
166,2021-03-14 13:45:46+00:00,"Don't forget the medical abuse. I mean the medical abuse has directly been mentioned in the show, like where fred fired a worker because of him using pain medicine which makes him unable to operate heavy machinery. Something like Oxycodon or something like that and I am pretty sure that this name of a medicine fell more often throughout the seasons.",1
167,2021-03-14 13:34:18+00:00,"Except it literally was due to a knee to the neck, fetanyl doesn't cause you to asphyxiate unless you have a critical withdrawal, and *that's* only if you're asleep.",1
168,2021-03-14 12:15:07+00:00,"yeap for infantry.
depends which camp u go, got diff bookout timings

u will know whether u gg 8/9SIR, BOF or K9 at the end of 5 weeks",1
169,2021-03-14 11:41:33+00:00,"It’s sorta possible, a few months ago I was on 270-420mg oxycodon a day, and since it was a daily thing I didn’t feel no more highs. I really tried, like the person above me said earlier, eventually you’ll OD, with luck you’ll live, without you’ll die, one month ago I saw my best friend OD and he didn’t make it.. after that I immediately stopped cold turkey, almost died in my sleep ‘cause of that so I wont recommend doing the same. But I made it, since then opiods didn’t cross my mind once!",1
170,2021-03-14 08:44:14+00:00,*Half breed orphin,1
171,2021-03-14 05:12:30+00:00,if im not wrong airport is 9SIR,1
172,2021-03-14 04:52:17+00:00,"Its not methamphetamine, he had lethal doses of fetanyl in him",1
173,2021-03-14 04:25:24+00:00,I just watched the episode where the fbi raids the snells and finds the burnt poppy field. I’m wondering why they didn’t do anything with the poppy that the FBI agent picked up and smelled. Couldn’t they have just tested it for morphene or whatever?,1
174,2021-03-14 02:48:29+00:00,Temos um pequeno problema quando um genocida é considerado um heroi mas ok,1
175,2021-03-14 02:45:52+00:00,"Marina, Ciro, Flávio Dino e etc também, mas tem que novamente ir atrás do heroi populista, Brasil ta fadado ao fracasso mesmo.",1
176,2021-03-14 02:18:29+00:00,"Yo en lo personal no me la pondre, me niego a ser rata de laboratorio (siendo 100% pro-vacunas). Es la **1ra vez en la historia de la humanidad que se usan vacunas con origen de mRNA** \- no saben ni carajos esperar. No hay estudios a largo plazo, no hay absolutamente NADA. Tienen un conocimiento ""aproximado"" después de 20 años de estudios pero jamás habiéndose aplicado al mundo real. Los humanos somos pendejos, usábamos la heroína como cura de alcoholismo para luego tratar la adicción a la heroina con cocaína. Edison falló en mil ocasiones antes de hacer un foco, ¿qué les hace creer la tendremos bien a la primera?  
Es más, hay un efecto secundario 100% documentado que es el aumento exponencial de contagiarte de VIH y otras enfermedades, porque estás cambiando genéticamente tu estructura, ¿porqué carajos permitimos cambiar una pandemia por otra?   
¿Nadie lee la historia del grado de problemática que fue el VIH en los 80's? ¿Porqué nadie está mencionando éste efecto secundario gravísimo?   
Con la popularidad de la liberación sexual y aplicaciones como Tinder, Bumble y otras, ésto se puede poner color hormiga.

[FUENTE](https://youtu.be/8urAr6gMC3g)

Irónicamente, me CAGA AMLO. Pero la vacuna que va a traer China, **la Sinovac, es la vacuna clásica con el virus inactivo y la mejor del grupo.** La única que estaré de acuerdo en colocarme cuando esté disponible.   


[FUENTE](https://www.nytimes.com/interactive/2020/science/coronavirus-vaccine-tracker.html)  


En fin, cada quién tiene la libertad de escoger su cárcel.",1
177,2021-03-14 01:25:00+00:00,"if it is real, who tf would wanna put fetanyl in a cart isnt that like more expensive than boof or d8 oil??",1
178,2021-03-13 23:42:46+00:00,And then people cut cocaine with fetanyl so some unknowing college kids will end up overdosing on fentanyl. Way more common than people think,1
179,2021-03-13 22:58:43+00:00,That's not a fact diamorphine is not the most dangerous (toxic) drug on the planet. Pleas do some research before spitting out fake facts. No disrespect. I'm an occasional H user. Like once a month. The addiction lies in the person's mentality and control. And like I said it's far from being the most toxic. Alcohol is actually more toxic in the body then dimorphine and many others. Not trying to jump on you just spread truth. Is all,1
180,2021-03-13 22:31:00+00:00,Is dimorphine not an opiate..... jk,1
181,2021-03-13 21:47:09+00:00,Vc é um heroi,1
182,2021-03-13 21:17:13+00:00,Yeah they have fetanyl bro. People died,1
183,2021-03-13 21:16:59+00:00,Yoooo stop. They tested positive for fetanyl recently.,1
184,2021-03-13 20:36:53+00:00,"given that the autopsy report said that if there were no extenuating circumstances Mr. Floyds death would have been ruled a fentanol overdose,  I wonder why the city council did not wait for the trial verdict.         now lets say the jury does not give a verdict that the mob wants and the mob riots, lots and burns again.    the floyd family will have garnered millions and the riots still will happen.    makes no sense.",1
185,2021-03-13 20:19:13+00:00,"Por la manipulacion sistematica, igual que alla. Por que no legalizan la cocaina y la heroina los yanquis? Eso resolveria muchos problemas de violencia, pero el negocio es demasiado bueno.

Aqui ya se esta regularizando la mota a nivel federal, alla apenas llevan unos pocos años que despenalizaron la mota y no se si fue a nivel federal pero me parece poco probable que los sureños toleren algo asi con lo progresistas que son.",1
186,2021-03-13 19:20:02+00:00,His last name sounds legit like someone trying to say fentany in Spanish or Italian.,1
187,2021-03-13 17:48:57+00:00,"You are assuming he was imprisoned for drug running and not the prison break part.

I totally support drugs except meth and heroin and fentenyl etc. 

Loved hallucinogens back in the day.",1
188,2021-03-13 17:02:28+00:00,Meu heroi!,1
189,2021-03-13 16:59:44+00:00,"answering to the best of my abilities:
- for my batch there was recon trades course for troopers for the three units: 12C4I (sungei gedong camp?), 1SIR, and 42SAR (gedong camp)
-  so far, only the recon course was really challenging. be prepared to carry really really heavy loads. I put all my equipment into my ALICE pack once, sat down and put on the bag and tried to stand up and i rolled backwards HAHA
- during the recon trades course, RTI will be mentally exhausting. dont think i can say much more about it
- how much of a good time you have throughout your recon life also depends on your sgts and plt sgt. mine is really good so good life so far
- now waiting on rotation training where I learn more skills. daily life pretty chill, 2 PT a day as usual, inbetween just play uno.
- waiting on bike course where we will be sent to learn how to ride motorcycle. but i cannot ride bicycle so will likely fail the bicycle test required",1
190,2021-03-13 16:08:54+00:00,"Yes. Why not?

Heroin in a drug store that is regulated by the FDA is much safer than heroin from some dude on the street.

Shooting up in bathrooms, hiding from your family, re-using needles because you don't have access to clean ones, buying heroin laced with fetanyl, going to jail, these are all bad things. Even if you are morally opposed to drug use or have no interest in helping addicts, these are all things that we should look to eliminate because of their cost to society. Legalizing and regulating drugs seems to be a smart way to effectively treat addicts at the same time lessening the burden on both them and society.

Also, not sure where you live, but I am not aware of hero available for purchase in the US, even with a prescription.",1
191,2021-03-13 14:35:19+00:00,"Which was showed in their training. In that light, it wasn't murder but manslaughter. I agree training needs to be better but this whole situation would have been avoided if he didn't resist because he didn't """" want to go back to rehab"" Driving high is a crime despite what you hear. What if he caused an accident and killed someone because he was high on fentayl and meth?",1
192,2021-03-13 14:17:57+00:00,I say we bring the car up on charges since he was saying he couldn't breathe when he was sitting in his own car.  Also don't do fentayl and meth you're worried about breathing ;),1
193,2021-03-13 13:25:55+00:00,E hora do heroi,1
194,2021-03-13 06:43:48+00:00,how can you jave fun at a dentist? she been morphined? lol,1
195,2021-03-13 06:35:22+00:00,"That's nice, but that's not what happened here.

Watch the full video. Floyd was saying he couldn't breathe when he was sitting on the squad car with the windows wide open, and no one was touching him. His body was crashing out on him due to him being a fat, drug addicted loser who was ODing on the fetanyl he crammed down to not be caught with a possession charge.",1
196,2021-03-13 06:27:14+00:00,"If you're assuming it's because the cop legitimately did anything wrong, think again.  In the wise words of Nick Rekieta, the lawyer for Fentayl Floyd's family did the legal equivalent of ""nice city you got there, be a shame if it burned down...  again.""  That's why the city settled instead of telling them to get bent.

https://www.youtube.com/watch?v=lFBH2-6CDeM",1
197,2021-03-13 05:43:48+00:00,"Hitler was taking Oxycodone as part of his drug cocktail in the 1940s, and it was a well established drug at the time.

It was classed as a schedule II drug in the 1970s by the US Government.

Oxycotin was developed in the 90s, which may be what you're thinking of.

""Oxy"" as a colloquialism is used to refer to both drugs.",1
198,2021-03-13 05:12:01+00:00,Not like she was OD'd on fetanyl and meth resisting arrest lol 😂,1
199,2021-03-13 04:31:47+00:00,These tested positive for fetanyl recently do not even taste these,1
200,2021-03-13 04:31:07+00:00,Both kids are sick. They likely ate some fentanol,1
201,2021-03-13 02:32:53+00:00,Thank you. I’m going to mention that one to my derm. Right now he has me on Betamethasone and protopic ointment. Neither are for morphea or scleroderma specifically 😏,1
202,2021-03-13 01:45:48+00:00,a lenda do heroi kkk,1
203,2021-03-13 01:41:02+00:00,Hahaha ur Lucy got u feeling like u did oxycotin,1
204,2021-03-13 01:05:28+00:00,"/u/Morphien, I can't seem to find your Ditto on the GTS. Please redeposit another pokemon and reply to my comment with the new information.

Make sure you request a level 91+ Ditto. Thanks :)",1
205,2021-03-12 21:47:36+00:00,"As an adult who got their id last week i relate. but i also feel like kids being able to obtain it thru no id, is a bigger problem than an adult who cant buy it bc they dont have an id and its required. Just seems like imo, harm reduction in kids outweighs a personal inconvenience for adults. 

You also bring up a good point with the discussion that kids are doing harder shit like pills &amp; opiates. But i must counter it with how addictive robotablets truly are and how easy it is to get addicted to them. Kids will be charged way more expensive prices for opiates vs a 20$ bottle of 100 pills that they only need to take 10 of to be absolutely fucked. The fact that theres so many in 1 bottle to be obtained thru a single purchase gateways the bingeing of them very easily for a susceptible brain like a minors. While i agree opiates are more dangerous due to fetanyl and higher od rates, dxm is not many tiers below opiates in terms of addictive properties and danger. 

As for an enforced ID encouraging shoplifting, lets be real, kids who are grimey/fucked up enough to want to do dxm, are not gonna pay for it in the firstplace. Theyre gonna shoplift it either way. And while this is a good discussion topic, robotablets are specifically sold online so i dont think that pertains to my original post. Im wanting specifically an enforced ID on robocoughs website. 

ps: sorry for the long reply",1
206,2021-03-12 21:04:25+00:00,I think you need a lot more than oxycotin,1
207,2021-03-12 20:08:27+00:00,Cade esse heroi nacional?,1
208,2021-03-12 18:51:50+00:00,Is the sentence for taking fetanyl death?,1
209,2021-03-12 16:13:52+00:00,They better get you on an IV line and morphene drip quick! you bout-a bleed out,1
210,2021-03-12 15:20:00+00:00,leh mao i already rote it: orphin 55,1
211,2021-03-12 15:18:38+00:00,"I've tattooed over my morphea spots- no issues. Check out post history, in the outline work you can make out one of my spots under the ravens wing",1
212,2021-03-12 14:53:49+00:00,"I agree that the crushed neck angle shouldn't be pushed, but these days I mostly see that said by people who are only saying it so that they can discount it with the fentenyl levels in his blood. It's the only reason I gave you such a long answer in the first place, but I was wrong about your intentions. Again, sorry about that.",1
213,2021-03-12 14:51:07+00:00,"Hey, 27 F here. I've had morphea since I was 13. Feel free to PM me",1
214,2021-03-12 14:05:59+00:00,"#*Pressed pill inquiries are not permitted under any circumstances.*

There is absolutely no way that we can tell you if the pill you have is real or if it is pressed by looking at a picture of it. If you are wondering if they make presses of the pill you have, the answer is very likely going to be yes. [You can take a look at some of the dies that are easily available for purchase here.](https://imgur.com/a/6EPiLul) 

If you are worried that your tablet is pressed and contains fentanyl you should [purchase some fentanyl test strips here.](https://dancesafe.org/product/fentanyl-test-strips-pack-of-10-free-shipping/) This is the only way you can be pretty confident your pill does not contain fentanyl unless you picked them up at the pharmacy yourself. Be mindful that not all fentanyl analogues can be detected by fentanyl test strips.

----
#Pressed Fentanyl Detection

Fentanyl pressed pills are especially dangerous because they are often sold as regular pharmaceutical pills which are normally considered *safe*. They can be very hard to spot even if you know exactly what the real pills look like.
With the widespread explosion of fentantyl pressed pills it is recommended that you **apply the utmost caution before ingesting any opiate that you do not have the direct prescription for.**

Generally speaking, pressed pills will be lower quality than their pharmaceutical counterparts. 

    One or more of the following will usually be off:

* **Taste**

* **How they break**

* **Color**

* **Imprint**

*Pictures mean nothing in comparisons and only experience/physical examination can begin to help you determine authenticity.*

*Another tip is comparing them against all others in the batch that you are buying from. There should be little to no differences.*

However, there are never any guarantees and presses are getting better and better. The only 2 ways to be sure are if it is your prescription and if you get it lab tested. Proceed with caution. 

**A slightly cheaper option is [**Test Kits**](https://dancesafe.org/product/fentanyl-test-strips-pack-of-10/), but they may not work on all known analogues*

**Here are some examples of Fake Presses:**

1. [FAKE EPIC Pharm E8](https://imgur.com/3NAVLfm) comparison (fake left/Real Right) 

2. [FAKE A215](https://imgur.com/kUZxegN) -Notice the hook on the 5 curves up like the font on this 5. Should be parallel with divider line. Also not clean edges. Should be smooth. You can't tell in this pic but they were also smaller in diameter 

3. FENT [HOT SPOT](https://imgur.com/qRZynO4)- what to look for inside a pressed pill 

**Quick Reference of four different** [REAL OXY PILLS](https://imgur.com/277VvPK) (NOT fake/pressed) 

----

#Fentany Reagent Testing 

--

Although [Lab testing](https://www.ecstasydata.org/) is the only foolproof way to see what absolutely constitutes a substance, there are a few things you can do to minimize risk when there is a suspected fentanyl (or analogue) adulterant.
_________________
The best option is through reagent testing using a variety of tests like Marquis, Mecke, and Froehde. Using these three you will be able to identify between many different psychoactive and Fentanyl Analogues. 

Find more information on, where to get reagent tests, color-codes for different [substances](https://dancesafe-wp-uploads.s3.amazonaws.com/uploads/2017/01/2017-chart-a.jpg), and up to date reagent-color-codes for other analogues/compounds at /r/ReagentTesting.  

An extremely helpful chart when differentiating between fentanyl analogues and other opiates can be found, [here](https://imgur.com/c0BoewL). It's important to note that if there are different types of substances in your mixture that the reaction depicted by the reagent testing table may have more than one result. As such, one result that is a darker color may cover a lighter color. To overcome this, multiple tests is preferred. It is best to do a thin layer chromatography screening test (to separate out the mixture). These are available from suppliers like [Bunk police. TM](http://bunkpolice.com/separation-test-kit/). They will insure that your results are not obfuscated.
__________________________
Another option (that is more expensive, less accurate, but may work in a pinch), is to use pre-designed *[Fentanyl Test Strips](https://dancesafe.org/product/fentanyl-test-strips-pack-of-10/)*. An important note with test strips is that they will only detect the fentanyl and anologues that they are designed to. In this particular case they only test for Fentanyl,
Butyryl-fentanyl, Acetyl-fentanyl, 3-Methylfentanyl, Carfentanil, Thiofentanyl, Furanylfentanyl, 4-Flourofentanyl, Flouroisobutyryfentanyl, and Sufentanil. That is to say that they will not work for any future analogues that are released.

Choose whichever method you are most compatible to the risk.

---

*If you feel that you received this message in error please [contact the moderators of /r/opiates.](https://www.reddit.com/message/compose?to=%2Fr%2Fopiates)*",1
