,date,body,score
356,2021-11-18 13:41:20+00:00,"Certainly be something you're not going to forget anytime soon. I'd fill out that paperwork as soon as possible and include Everything including any lost wages for you and lost income if you're unable to get it in order in time for the next guest. Professional cleaning services who hopefully have experience dealing with this sort of situation 😬. This stuff is so toxic. I read on another reddit that a ride share driver suffered $1800 in damages to his leather car seats because someone split their cocaine which probably had fentanal in it. If they allow you to upload it via a website great. If not, make copies and mail it with a tracking number. One thing is for sure: Feds are slow 🐌 and loose paperwork often. The DEA doesn't just randomly find a small time dealer. Local cops do. I suspect they had been monitoring them for a period of time. They don't need to include that in the search warrant.",5
357,2021-11-18 13:41:15+00:00,"The FDA approved oxycotin which destroyed many lives. They all knew it was addictive. My mother was so addicted to her pain killers she would crush them up and snort them. 

The FDA rush approved this vaccine without proper testing. One of the side effects is myocarditis which can cause death. Heart problems runs in my family.",0
358,2021-11-18 12:25:29+00:00,U think fetanyl dealers care about any of the users ?,20
359,2021-11-18 08:10:36+00:00,"Rijetko komentiram, ali ovaj tvoj komentar mi je stvarno dao povoda. Mogao si proguglati sam prije nego nekome tko je u pravu kažeš da prvo progugla.

Definicije su slijedeće:

Narkotici (prema grč. ναρϰωτιϰός: koji otupljuje), sredstva za omamljivanje, uspavljivanje i umanjivanje bola. U širem smislu narkotici su sva sredstva koja djeluju umirujuće na središnji živčani sustav izazivajući povratnu kljenut pojedinih njegovih dijelova. To su: anestetici, analgetici, hipnotici, sedativi, neki spazmolitici te steroidni hormoni, poput progesterona u visokoj dozi.

Opijati, prirodni alkaloidi opijuma, kojih su glavni predstavnici morfin, kodein, papaverin i noskapin. Uz alkaloide opijuma u opijate se ubrajaju i neki sintetski spojevi poput metadona, petidina, heroina i tramadola.

Source: enciklopedija.hr",8
360,2021-11-18 07:15:16+00:00,Mais um dia acorde e entenda que o cellbit jogou a lenda do heroi?,1
361,2021-11-18 06:14:15+00:00,"Honestly. This kinda makes me mad.

I saw this coming. Fetanyl coming over the borders en masse due to open borders.

Poor police sentiment, inflation, and defunding police. 

Literally the worst combination, this is probably just getting started too... Could be the next 70s cocaine epidemic.... That many of us saw coming.... But everyone else was wrapped up in their own biases and politics to care.",3
362,2021-11-18 06:13:28+00:00,Laced with fentanal,5
363,2021-11-18 05:04:06+00:00,"People lace other drugs with fetanyl, i'm sure a lotttt of ODers don't even know it's in what they have. ALWAYS TEST YOUR STUFF",1
364,2021-11-18 05:00:48+00:00,On CNN today they said the DEA has seized a record amount of fentanol. Enough for a lethal dose for Every American! Drug 💉 dealers i recon are avoiding higher profile places like hotels. I'm curious 🤔 how the DEA knew where they were and what they were up to. Must have been monitoring them (hopefully legally). One less dealer off the street. A thousand more to go. Good luck with Airbnb on this. So sorry for what they did to your condo. Did the DEA leave anything with you to file a claim for damages the DEA caused 🤔? Hopefully they gave you a copy of the search warrant.,10
365,2021-11-18 04:19:55+00:00,"Extremely random but maybe something to keep in your back pocket because sometimes it takes people ten years to figure it out. I have seen many many people with spots like that in online groups for morphea. I have it personally. Mine look different than that but there are tons of different types and some people just show up as darker splotchy colored skin and that’s all while others are much more affected. Anyway, it’s autoimmune and can be diagnosed by skin biopsy if you wanted to ever in the future. I doubt it is that because morphea is rare but didn’t want to scroll by without mentioning. Edit: I do actually have multiple spots that look exactly like that on my back but have one that looks far worse and more strange so that’s my “main” morphea spot that I think of. It’s basically excess collagen.",1
366,2021-11-18 02:39:26+00:00,HEROI..is the word,2
367,2021-11-18 02:15:53+00:00,"Um sistema pica pra krai é o do Mutantes q é de super heroi, o bagulho q fode ele é q ele é mt técnico, se vc n acompanhar o tamanho, peso, velocidade, tempo, distancia dos bagulho vc invalida metade dos poderes se pa mais até",1
368,2021-11-18 01:57:14+00:00,"Lol that’s funny. 

OP- I think oxy and morphine would be a closer comparison tho… seeing it’s literally oxy-morphone, and OxyM is more sedating, like morphine and unlike hydromorph and straight oxy.. just sayin…",4
369,2021-11-18 01:53:13+00:00,"To ligado tenho 25 tbm.conhecu pessoas de 30 que asvez senti isso tbm





[Extra]...

....comeca a faser academia ficar forte, na sequencia muda alimentacao ovo e arroz, aprende a lutar artes marciais e invista tbm.em aprender magia.

( va uma costureira.fale para ela faser um uniforme de super heroi )",1
370,2021-11-18 00:11:22+00:00,"*Hightown* is currently halfway through its second season. Realistic story-telling, characters you can care for, quirky, gritty setting (cape Cod with fentanol), fully thought through protagonists and antagonists and who really is who, and to what lengths, no holding back on dark  moments, ramped up intensity from episode to episode.

Don't sleep on this..",2
371,2021-11-17 21:13:21+00:00,"man, they should really start getting rid of illegal substances, weed, fetanyl, cock, heroine, ass",1
372,2021-11-17 19:28:40+00:00,"https://apnews.com/article/overdodse-deaths-fentanayl-health-f34b022d75a1eb9776e27903ab40670f

We invaded two countries over 3,000 deaths",-3
373,2021-11-17 19:22:32+00:00,"Very interesting, this article is covering exactly the same stuff I spoke about with my partner today. Realizing how incredibly effective oxycodon is compared to the safer psychiatric meds for mental health is like the frustration I felt as a kid when I realized all the best tasting foods were shit for your health.

It's been an enlightening experience. I never considered how mundane and positive something could be that has such a terrible stigma. Not to say that the stigma isn't warranted (re: the dangers, risks, and ubiquity of opioid addiction), just that it's kind of only one half of the coin.",1
374,2021-11-17 18:44:48+00:00,"Danke Bruder, ja, ich habe es gelesen und ich habe gesehen, dass die orale Bioverfügbarkeit nur 1-2% beträgt und hauptsächlich wegen Verstopfung und um den Missbrauch zu erschweren, aber ich war mir einfach nicht sicher, ob ich viel genommen habe ihnen würde das Naloxon stapeln und dem Oxycodon entgegenwirken, und ich konnte nichts darüber finden. Aber danke für die Aufklärung, es ist ein interessantes Thema.",1
375,2021-11-17 18:42:07+00:00,"They blame Fetanyl, but let's be real blame big pharma, and the medical system that prescribed opioid to everyone they could.",78
376,2021-11-17 17:14:03+00:00,"Nice score there bruz !

Fkn love me some MSContins , esp the Grey Nurses ay , killer days 🔥 . Them 30s are dope too sub, love the colour of em even tho they nearly joked me last time lol. 

Aw fucknsokenNiffaz and Diablo ( ? ) too . Dammitx I’m jealous . 

Happy Hypnotic Muscle Relaxing Nods lad , looks like u in for a swell weekend in the clouds 😇 .
 
Also tbh ain’t seen much of these around lately ay , dunnno why , they used to be everywhere !

Ooo some Nitraz as well ?!
Happy Jypnotic nods my G 🤤 .",1
377,2021-11-17 16:37:16+00:00,"Isso é a mais pura verdade vide o video de cerimonia do Bidê, dos outros contantes eventos ligados a ele e do ultimo fracasso do Fauci querendo ser retratado como heroi da pandemia.

Esse pessoal não aguenta a verdade por isso tem que apagar ela.",2
378,2021-11-17 16:36:38+00:00,Was für ein bullshit. Es gibt nur 3 Marken von Oxys mit Naloxon in Deutschland. 1. Targin (Mundipharma) 2. Oxycodon comp. (1A Pharma) &amp; 3. Oxycodon/Naloxon (Heumann).,1
379,2021-11-17 15:53:29+00:00,"Questão 1

Cloroquina é um tratamento eficiente contra covid-19?

a) sim
b) nao


*meme do super-heroi suando escolhendo o botão*",17
380,2021-11-17 14:06:16+00:00,Ronaldo é /strongmind/. Seria a minha escolha para heroi planetário.,9
381,2021-11-17 14:00:53+00:00,"and there are so few shares to trade.  When the FDA did not approve Pain Therapeutic's  transdermal oxycotin patch, the company was forced to regroup, refocus, and conduct and 7:1 reverse share split. (It should be noted that the oxycotin patch was not approved because it did not work; it worked and SAVA continues to be awarded patents today for that development work. The FDA did not approve the transdermal patch because of the widespread opiate abuse and political pressure to scale back on new opiates.)   

Anyway ... SAVA has about 40 million shares outstanding.  By comparison, PFE has a 5 billion share float; LLLY, 1 billion; and BIIB has 145 million.  Then look at the other MEME stocks:  AMC, 500 million shares;  GME, 75 billion.  The pool is too shallow for the SHORTS to play fairly simply on volume so they have to resort to FUD to extract shares from disillusioned and scared LONGS.

Understand, the possibility that simulfilam is not proven to be effective is greater than zero.  How much so?  IDK.  But, as they say with investing in general, don't invest what you can't afford to lose.  One day you might wake-up with life-changing money in your brokerage account or none.",1
382,2021-11-17 09:05:11+00:00,Exactly. How come i dont get oxycodon for my crippeling gamer pains?,11
383,2021-11-17 05:05:05+00:00,"Dawg, this is DCJ, fentanyl is king. Worship fentanyl, boof fentanyl, inject fentanyl, smoke fentany; put fentanyl up your vagina and pound it down with a dildo fentanyl, fentanyl is the end goal for every COMMITTED opioid addict. A handle of vodka, and a 8 ball of Canadian street fetty is a good time in my books, oxy is too weak for a fiend with a tolerance. When I was 12, I enjoyed the fuck out of it too believe me. Don’t worry, you will get there my fellow grasshopper. A oxy a day, keeps the doctor away. A fentanyl patch a day, keeps the hospital stay at bay. Once your tolerance is high enough, you won’t worry about dying, it will take a LOT more than the pussyboi opioid naive individuals you hear about on Facebook and the local news source/social media outlet. I do not condone unnatural fentanyl tho, stay away from that shit. Only 1000% ethically sourced, vegan, organic Kosher grade, halal fentanyl dude. That shit is the best. Anything else, is just an imitation.",1
384,2021-11-17 02:43:05+00:00,Oxycotin 80 mg,1
385,2021-11-17 02:15:06+00:00,"I was on oxycodone for many years.  Even after the first year sober, I was stuck in some type of weird psychosis and literally nothing made me happy.

But it's been so long I can't even remember the feeling anymore.  Once that feeling is gone, you're good.

Sooner the better to let the healing begin, b/c you literally can't take drugs forever, it's a dead end road...jail/overdose/ or even worse.. losing your mind.  Plus the risk of fetanyl that seems to be put in everyones drugs these days.

Trust me, I was an oxy addict doing drugs with a billionaire and supermodels. &amp;  I am much happier/satisfied with myself being some regular joe in Ohio now that's living a lawful, respectable life..",2
386,2021-11-17 01:03:31+00:00,Powder. Fetanyl is everywhere too,1
387,2021-11-16 21:34:21+00:00,"Hacia tiempo que no me prodigaba por aqui pero he visto esto de pasada y como en su dia lo segui, imagine que aqui habria tomate hoy.

O sea, que me quede a mi claro, porque a lo mejor en lugar de emigrar lo que tendria que haber hecho es decir 'soy una tia':

* Esta hija de una hiena se casa con un italiano con mas o menos buena posicion economica para tocarse el papo a seis manos.
* Tiene un hijo con el.
* Decide que se aburre en casa y se va de pedo dia si, dia tambien.
* Llega un dia borracha como un piojo, le da de ostias al marido porque, obviamente le recrimina que es un pesimo ejemplo para el crio que tienen en casa.
* Como el se defiende, ella le denuncia a el.
* Ella gana el juicio porque el acepta no seguir peleando en un juzgado en el que tiene las de perder por haber tenido la mala suerte de haber nacido con pilila. (en contra del criterio de su abogado).
* Vuelve con el pavo, con el que tiene un segundo hijo.
* Se lia a cascarle denuncias, todas ellas falsas, un poco cada vez que le viene en gana.
* Secuestra a sus hijos, privandoles entre otras cosas de escolarizacion durante un periodo de tiempo.
* Los medios la llaman heroina (no confundir con la droga derivada del opio, el caballo no es tan malo como esta señora).
* El gobierno la indulta de todo.
* La fiscalia no le toca un pelo por sus denuncias falsas (algunas de ellas totalmente inverosimiles).

Definitivamente, si tener tula en España no se esta empezando a parecer a apellidarse Cohen en la Alemania de 1920... Poco falta. Desde luego en este sentido, yo personalmente votaria porque se aprobara todo delirio trans que sale del gobierno, te declaras tia y a vivir que son dos dias, y si me toses, viogen y a correr. Todo ventajas.

Y ojo, que luego a las verdaderas victimas se las ignora, que es lo mejor de todo. Conozco de primerisima mano casos que son para mear y no echar gota. Pero claro, no son Juana Rivas.",6
388,2021-11-16 20:49:06+00:00,"Pot addiction*

Not my best analogy, as in pot won't ruin you like say, oxycotin, but pot addicted people spend years in dead end jobs getting by , kinda like spending years as an amazon entry-level employee.

I mean i'm not anti amazon, personally they're alright in the ""i need something to pay the bill"" type of job, you can get hired any day of the week with no qualifications. I worked there for a few weeks during lockdown since my old job was closed, 7/10",20
389,2021-11-16 20:44:52+00:00,"I think he’s a bit too nice. I would watch almost anything with him in it though. 

The show about the Russian doctor who became adddicted to morphein was great. A young doctors notebook.",3
390,2021-11-16 19:57:26+00:00,"So I should have been more clear above - that's just my personal opinion, I shouldn't have presented it as fact. Others may disagree and that's fine. Also, this is totally Brando's story and I'm not saying any of it is WRONG, it just doesn't agree with me. Regardless, to answer your questions:  
  
Characters: Characters are imo awful by ""cosmere standards"". Each character gets one trait, then maybe a scene or two showing something else: Sarene is smart politics girl with one scene about being forever alone; the king is big dummy dick with one scene where he's a cultist serial killer; Gallodan is a snarky pessimistic sidekick; Kaian (cook?) is a funny warmhearted cliche; etc.. Hrathen is the exception - he's an incredible character, even with the IMO silly and unnecessary declaration of love at the end of the book. Compare these characters with Stormlight characters - they're incredibly nuanced, complete with personality contradictions, hopes, flaws, boons, etc.; obviously they have the benefit of more pages allowing better development, but I'd argue they were vastly superior at the end of TWOK than any character in Elantris minus Hrathen.  
  
As far as Raoden - I'm frankly surprised that needs explaining. He's completely faultless. He turns a mass murderer crime lord into a gentle devoted muffin that makes toys for children with just, like, 3 lines of dialogue. Not even Naruto could do that. He is a perfect leader, a perfect friend, a consummate scholar (seen in his relentless and unbelievably effective research); he's selfless, brave, intelligent, emotionally mature, convincing, strong-willed, a great actor, etc. etc. etc. you can honestly go on and on. I found him incredibly boring and had trouble staying tuned during his chapters.  
  
Again, this is all just one fan's opinion, and I do still enjoy the book and Brandon Sanderson is my favorite author at the moment. But I like Elantris in spite of the problems, and can't say that I love it like I can every other Cosmere story.",6
391,2021-11-16 19:34:31+00:00,"Damn, Donnie Adderall and Mike Crackhead Lindell doing a sit down.
Where's Melania Oxycotin Trump?
I'm sure there is a lot to be learned from this interview...... lol",85
392,2021-11-16 18:55:32+00:00,"Yes kids can only do cannabis or fetanyl. No in between, life or death. 

What are you on?",1
393,2021-11-16 17:36:57+00:00,If it was Oxycotin there'd be enough made in a week to supply the world 3 times over.,105
394,2021-11-16 17:32:48+00:00,"Lik imao naoruzano obezbedjenje, laznu policijsku znacku i rotaciju, saradjivao sa korumpiranim agentima BIA i VBA. Ali biljke su mu pod stresom slucajno proizvele vise THC-a nego sto je dozvoljeno, pa onda sve ovo ostalo zanemarimo jer ocigledno je samo nespretni poljoprivrednik. Nek analiziraju i onih 22kg heroina sto je njegov sofer vozio, mozda se ispostavi da ima samo 0,54% aktivne supstance.",6
395,2021-11-16 17:02:14+00:00,Det er da også helt sort hvorfor i alverden fabulere over det? Du aner da ikke hvor jeg har det liggende? Hvor jeg bor? Jeg har aldrig haft indbrud her og believe me man reklamerer ikke med man har en pakke oxycodon liggende til venneflokken eller anden uvedkommende indbrudstyv eller misbruger,1
396,2021-11-16 15:58:24+00:00,"Damn bruh we about to see a live action adaptation of the Purge in Vancouver.

Inb4 hockey stick fight to the death over the last package of hickory smoked bacon at a Safeway.

Junkies using fentenyl laced needles as ninja darts to fight over turf.

Canadian mounted cop's horse being ripped apart and eaten raw by a hungry mob.",11
397,2021-11-16 15:33:13+00:00,"Hacia tiempo que no me prodigaba por aqui pero he visto esto de pasada y como en su dia lo segui, imagine que aqui habria tomate hoy.

O sea, que me quede a mi claro, porque a lo mejor en lugar de emigrar lo que tendria que haber hecho es decir 'soy una tia': 

* Esta hija de una hiena se casa con un italiano con mas o menos buena posicion economica para tocarse el papo a seis manos.
* Tiene un hijo con el.
* Decide que se aburre en casa y se va de pedo dia si, dia tambien.
* Llega un dia borracha como un piojo, le da de ostias al marido porque, obviamente le recrimina que es un pesimo ejemplo para el crio que tienen en casa.
* Como el se defiende, ella le denuncia a el.
* Ella gana el juicio porque el acepta no seguir peleando en un juzgado en el que tiene las de perder por haber tenido la mala suerte de haber nacido con pilila. (en contra del criterio de su abogado).
* Vuelve con el pavo, con el que tiene un segundo hijo.
* Se lia a cascarle denuncias, todas ellas falsas, un poco cada vez que le viene en gana.
* Secuestra a sus hijos, privandoles entre otras cosas de escolarizacion durante un periodo de tiempo.
* Los medios la llaman heroina (no confundir con la droga derivada del opio, el caballo no es tan malo como esta señora).
* El gobierno la indulta de todo.
* La fiscalia no le toca un pelo por sus denuncias falsas (algunas de ellas totalmente inverosimiles).

Definitivamente, si tener tula en España no se esta empezando a parecer a apellidarse Cohen en la Alemania de 1920... Poco falta. Desde luego en este sentido, yo personalmente votaria porque se aprobara todo delirio trans que sale del gobierno, te declaras tia y a vivir que son dos dias, y si me toses, viogen y a correr. Todo ventajas.

Y ojo, que luego a las verdaderas victimas se las ignora, que es lo mejor de todo. Conozco de primerisima mano casos que son para mear y no echar gota. Pero claro, no son Juana Rivas.

La pena en este caso, siendo como son las carceles de mujeres, es que no se la hayan cargado en un descuido (porque me juego un pie a que la tiparraca encima estaba en prision a cuerpo de reina porque el resto de presas se la querian quitar de en medio).",1
398,2021-11-16 13:56:24+00:00,I’d snort cause I don’t bang and them things are the one pill that sucks if you eat it. I always eat my pills but the morphones are for sniffing.,1
399,2021-11-16 13:21:55+00:00,"He was hyperventilating and yelling he couldn't breathe when he was in the back of the squad car way before he was put on the ground (at his own request). If Chauvin had left him in the car, Floyd most likely would have died in the car. The fetanyl had a major part in his death.",8
400,2021-11-16 13:07:44+00:00,Can Never forget or forgive Joe Rogan for giving him a platform which likely lent credibility to him and his ilk. The tv wrestling villain/ apprentice was likely going to give him the medal of freedom along with the oxycotin fiend rush limp hog and the crackhead pillow guy.,8
401,2021-11-16 07:37:24+00:00,it all has to do with the fact that our meds and opiates are the same schedule.  So when the children in Frankfort write an anti pill mill bill to combat the oxycotin problem our meds get swept in them.  I used to have to go every six months for my refills i could just call my doctors office and they escribed them in.  now its law we have to see a provider every 3 months if we are on a C-II controlled substance.  so now with my doctor i have to see her every 3 months for a med check.  same doctor its just her hands are tied with the laws in this state.,1
402,2021-11-16 05:58:08+00:00,"A bueno, entonces que ponga heroina 🤨",8
403,2021-11-16 05:48:28+00:00,Heroina,2
404,2021-11-16 05:31:54+00:00,"As soon as I read, ""from several years clean"" I knew you were a badass mofo.  When you're wired for addiction anyone that has gone years is inspirational to me.  Not only have I worked in the field butI became addicted to fentynyl and morphine through battling pain and it was REALLY hard.  You have gone through a rough patch but don't let circumstances and a temporary lapse of judgment diminish your confidence in yourself.  You truly are an inspiration to those around you--im sure of it and it's still well deserved.  Get back to whatever works for you and keep on listening. You rock!",3
405,2021-11-16 01:10:24+00:00,"Why so? It already has valid and approved uses? Or because it's currently being misused and misapplied by criminal enterprises to cheat and stretch the illicit opiate market they already control?

People ODing on god-knows-what because they have no clue what it is they're using? People ODing because they got a different batch of whatever? Shit being mixed into with whatever else being randomly distributed to those who know no better?

Black markets have **ZERO QUALITY CONTROL** This is one of the biggest issues of an illegal drugs market. By it's very nature it is a black market, there is no quality control (ie NO inherent market pressures to preseuade supplies to provide *clean* goods)

Fentanyl is just a chemical, like any other. Diacetylemorphine, cocaine, MDMA, MDPV, etc... It's a chemical. In and of itself it's harmless, the problem is when it's dumped into who knows what by whatever bathroom chemist that is making whatever they think is one thing from whatever chemicals they can get their hands on.

**TLDR-** **Legalize it!** People OD because they don't know what they're buying and inadvertently do dirty shit. Nobody ODs on a dirty Natty Light 12pk (100yrs ago different story)",1
